sku,name,price
85083,Colado Heinz Banana 113 G,$114
803562,Pre Nan Ds200 400 G,$1.324
69044,Nan Comfort 400 G,$1.197
64824,Cn Pediátrico Vainilla 400 G,$1.080
86256,Cn Plus Pediátrico Sin Sabor 400 G,$1.143
85087,Colado Heinz De Pera 113 G,$114
29844,Nan Sin Lactosa 400 G,$1.689
859319,Tónico Capilar Nioxin Scalp Treatment N°5 100 Ml,$1.720
65800,Nutrilon Nenatal 400 G,$1.086
71264,Nan Optipro 3 800 G,$1.268
19542,Colado Heinz Zanahoria Y Naranja 113 G,$114
65796,Nutrilon Ar Lata 400 G,$757
45679,Nan Optipro 2 400 G,$815
85086,Colado Heinz Manzana 170 G,$169
88689,Nutrilon Premium 1 400 G,$874
85088,Colado Heinz Postre De Fruta 170 G,$169
65797,Nutrilon Sin Lactosa 400 G,$1.371
53494,Nan Optipro 1 400 G,$1.013
19540,Colado Heinz Manzana 113 G,$114
24725,Nan Antirreflujo 400 G,$951
65799,Nutrilon Ha 400 G,$952
78851,Pediasure Polvo 400 G,$1.246
57760,Nan Ha 400 G,$1.280
635518,Nutrilon Proexpert Comfort Omneo 400 G,$948
85079,Postre De Fruta Colado Heinz 113 G,$114
735258,Onna Bañito Vasco Kit Blanco,$6.960
735158,Bañito Onna Luxe Celeste,$1.520
735157,Bañito Onna Luxe Blanco,$1.520
735257,Bañito Onna Luxe Rosado,$1.520
67660,Shampoo Elvive Kids Naranja Mango 265 Ml,$336
735357,Bañito Onna Vasco Kit Celeste,$6.960
734960,Bañito Onna Luxe Gris,$1.520
734961,Bañito Onna Vasco Kit Gris,$6.960
91648,Loción Antimosquitos J&j 200 Ml,$451
14090,Aceite De Bebé Simond's 25 Ml,$304
31570,Talco J&j Clásico 200 G,$327
64944,Desodorante En Aerosol Paco 150 Ml,$278
735059,Bañito Onna Vasco Kit Rosado,$6.960
90479,Spray Para Peinar J&j Fuerza Y Vitamina 200 Ml,$317
91453,Body Splash Disney Cars 200 Ml,$402
419655,Perfume Mujercitas Julie Edt 50 Ml,$606
556669,Body Splash Pibe's 125 Ml,$240
14084,Talco De Bebé Simond'sclásico Talquera Recargable 100 G,$241
80977,Jabón En Barra Dove Baby Humectación Enriquecida 75 G,$69
30206,Acondicionador J&j Clásico 400 Ml,$388
41056,Aceite Simond's Emulsionado 360 Ml,$441
60357,Acondicionador J&j Fragancia Prolongada 200 Ml,$244
91282,Colonia Disney Cars Edt 200 Ml + Gel De Ducha 280 Ml,$520
318669,Fécula J&j 200 G,$364
91629,Perfume Disney Minnie Edt 100 Ml,$589
85779,Colonia My Little Danielle 90 Ml,$431
419053,Colonia Coqueterias 80 Ml,$421
14080,Acondicionador Simond's Neutro Baby 360 Ml,$428
27810,Shampoo J&j Clásico 750 Ml,$737
59152,Shampoo Suave Kids Frutilla 350 Ml,$235
523829,Perfume Hello Kitty Cup Cake Edt 60 Ml,$380
652342,Body Splash Pibe's Club Legend 125 Ml,$240
91220,Body Splash Princesita Sofia 200 Ml,$402
318458,Acondicionador J&j Manzanilla 200 Ml,$244
523428,Set Hello Kitty Sweet Summer Body Splash 200 Ml + Shower Gel280 Ml,$515
91626,Body Splash Disney Spiderman 200 Ml,$402
522628,Colonia Hello Kitty Body Splash Sweet Sunset200 Ml,$397
800663,Ampolla Crescina Tratamiento Completo Dama 1300 20 Unidades,$11.900
91623,Perfume Disney Mnnie Edt 60 Ml,$390
81946,Body Splash Minions 120 Ml,$545
780960,Sérum Fructis Stop Caída 30 Ml,$645
91217,Body Splash Frozen 200 Ml,$402
36464,Gel Fijador Fix Lavanda 120 G,$81
74449,Máscara L'oréal Professionnel Vitamino 250 Ml,$1.480
51926,Ampolla Mediplus Nutritiva Cereales 1 Unidad,$173
846041,Sérum Ogx Anti-quiebre Leche De Coco 118 Ml,$732
59590,Gel Fijador Fixed Azul 250 G,$117
460088,Crema Para Peinar Elvive Dream Long Liss 300 Ml,$453
316752,Pasta Modeladora L'oréal Professionnel Tecni Art Depolish 100 Ml,$499
780367,Máscara L'oréal Professionnel Metal Detox 250 Ml,$1.700
600366,Suplemento Ducray Anacaps Activ+ 30 Cápsulas,$2.110
552871,Cápsulas Elvive Reparación Total 5 3 Unidades,$488
88400,Fijador Elnett Laque Normal 200 Ml,$532
800659,Ampolla Crescina Transdérmica Dama 500 20 Unidades,$9.400
34556,Fijador Roby Normal 180 Ml,$279
68447,Gel Studio Line Mega 200 Ml,$397
49207,Tratamiento Fixed Reparador De Puntas 60 Ml,$290
689895,Crema Para Peinar Fructis 10 En 1 Rizos Poderos 300 Ml,$332
839909,Mascarilla De Tratamiento Pantene Pro-v Miracles Nutre Renueva Y Sella Puntas 300 Ml,$339
47717,Tratamiento Revitalizador Capilar Primicia 18 Ml,$78
47719,Fijador Primicia En Spray 20 Ml,$86
583400,Máscara De Keratina Ilicit Coco 350 Ml,$449
30454,Decolorante Issue 20 G,$147
793924,Aceite De Tratamiento Motas Uy 50 Ml,$714
803963,Máscara De Tratamiento Dove Poder De Las Plantas Nutrición + Geranio 190 Ml,$248
831612,Tratamiento Nocturno Elvive Hidra Rellenador Con ácido Hialurónico 200 Ml,$360
858221,Tratamiento Para El Cabello Issue Brillo Extremo 150 G,$186
57241,Fijador Roby Fuerte 180 Ml,$279
76855,Fijador Primicia Fuerte 470 Ml,$385
310945,Tratamiento Capilatis Orgánico 170 G,$476
784111,Máscara Wella Tratamiento Wellaplex Paso 3 100 Ml,$1.663
401933,Máscara Dove 1 Minuto Factor De Nutrición 60+ 300 G,$264
238319,Desenredante Primicia En Spray 120 Ml,$256
509018,Máscara Reparadora Lovebeauty And Planet Argán Y Lavanda 190 G,$118
768927,Botox Capilar Ilicit Cicamask 350 Ml,$390
30152,Tratamiento Pantene Hidro Intensiva Rizos Definidos 300 Ml,$339
631309,Tratamiento Bealm Post Lavado Recuperación Instantánea 250 Ml,$305
556669,Body Splash Pibe's 125 Ml,$240
309736,Pack Bebé & Co Colonia 120 Ml + Talquera 160 G,$582
91453,Body Splash Disney Cars 200 Ml,$402
14096,Set Simond's Golden Emulsión De Vaselina + Shampoo Clásico + Loción Golden,$778
91282,Colonia Disney Cars Edt 200 Ml + Gel De Ducha 280 Ml,$520
91629,Perfume Disney Minnie Edt 100 Ml,$589
523829,Perfume Hello Kitty Cup Cake Edt 60 Ml,$380
91220,Body Splash Princesita Sofia 200 Ml,$402
56340,Crema Para Peinar Biferdil Ultra Brillo 270 G,$374
826906,Máscara De Tratamiento Tresemmé Reparación Intra Capilar 300 Ml,$285
91626,Body Splash Disney Spiderman 200 Ml,$402
523428,Set Hello Kitty Sweet Summer Body Splash 200 Ml + Shower Gel280 Ml,$515
42436,Mascarilla De Tratamiento Pantene Pro-v Miracles Repara Protege Y Anti Frizz 300 Ml,$339
91217,Body Splash Frozen 200 Ml,$402
91623,Perfume Disney Mnnie Edt 60 Ml,$390
31844,Colonia Bebé&co Gotitas De Amor 120 Ml,$388
782713,Body Splash Disney Spiderman 200 Ml,$280
58153,Colonia Paco Explorer 30 Ml,$402
652343,Colonia Pibe's Club Legend 80 Ml,$387
8858,Colonia J&j Baby Fresca Caricia 200 Ml,$502
91620,Perfume Disney Princesa Aurora Edt 60 Ml,$528
371022,Colonia Pibes 80 Ml,$387
419557,Perfume Mujercitas Sophie Edt 50 Ml,$606
91454,Colonia Disney Frozen 200 Ml + Gel De Ducha 280 Ml,$520
91451,Body Splash Disney Dra. Juguetes 200 Ml,$402
782714,Colonia Disney Spiderman Edt 50 Ml,$368
91630,Perfume Disney Frozen Edt 30 Ml + Gel De Ducha 280 Ml,$535
556670,Colonia Pibe's Jungle 80 Ml,$387
91627,Perfume Disney Cars Edt 50 Ml,$368
523928,Colonia Hello Kitty Body Splash Sweet Breeze200 Ml,$397
91280,Perfume Disney Princesa Cenicienta Edt 60 Ml,$528
603791,Colonia Bebé & Co Gotitas De Ternura 120 Ml,$388
522628,Colonia Hello Kitty Body Splash Sweet Sunset200 Ml,$397
91621,Perfume Disney Princesa Blancanieves Edt 60 Ml,$528
419655,Perfume Mujercitas Julie Edt 50 Ml,$606
523628,Set Hello Kitty Breeze Body Splash 200 Ml + Shower Gel 280 Ml,$515
371221,Colonia Pibes Club 80 Ml,$387
22744,Colonia J&j Fresca Caricia 100 Ml,$374
612332,Gomita De Pelo Top Con Rayas 1 Unidad,$189
91218,Body Splash Toy Story 200 Ml,$402
556671,Body Splash Paco 125 Ml,$240
91455,Colonia Disney Toy Story 60 Ml + Gel De Ducha 280 Ml,$520
783493,Body Splash Disney Spiderman 200 Ml + Shower Gel 280 Ml,$520
91624,Body Splash Disney Minnie 200 Ml,$402
51129,Peine Fino Assy 2000,$816
569325,Gomitas De Pelo De Rulo Top Negras 3 Unidades,$139
59997,Red Para Cabello Solingen Castaño Oscuro 2 Unidades,$106
39080,Peine Suances Antipediculosis,$714
744997,Gomitas De Pelo Elásticas Top Varios Colores 10 Unidades,$152
72157,"Tijera De Peluquero 6"" Nail Mate Con Descanso",$478
612241,Vincha Top Con Orejas,$239
743809,Cepillo Top Rectangular,$459
342109,Gomitas De Pelo Top Mini 5 Unidades,$168
815411,Gorra Para Mechitas Con Nuca,$93
744901,Gomita De Pelo Top Con Tul 1 Unidad,$149
843415,Gomita De Pelo R&c Bicolor 1 Unidad,$111
612238,Gomitas Top Con Moño 2 Unidades,$149
612542,Gomita De Pelo Top Diseño Vaca 1 Unidad,$229
883491,Cepillo Unicornio Top,$389
744897,Gomita Top Con Orejas 1 Unidad,$169
743698,Set Peines Top 10 Piezas,$219
852815,Cepillo Revlon Mini Con Mango De Goma Para Viaje,$289
344810,Gomitas De Pelo Top Con Aplique 6 Unidades,$139
612539,Gomita De Pelo Top Diseño Cebra 1 Unidad,$229
566308,Cepillo Conair Redondo Chico Metal,$450
612235,Gomitas De Pelo Con Orejas 2 Unidades,$149
744799,Pinza Top Con Moña,$149
628509,Gomitas De Pelo Elástica Top Varios Colores 2 Unidades,$139
344308,Gorra De Baño Rabbit Para Niño,$279
787104,Gomitas De Pelo Top 3 Unidades,$169
745198,Vincha Deportiva Farma Fitness Básica 2 Unidades,$216
729855,Broche Oh Jacinta Gala,$880
68396,Set Peine Conair Y Cepillo De Viaje,$433
745101,Vincha Rabbit Con Moña Bebé,$189
825708,Gomitas De Pelo Top 3 Unidades,$169
14650,Red Para Cabello Solingen Negro 2 Unidades,$106
852714,Cepillo Para Cabello Revlon Rectangulár Con Cerdas Suaves,$499
87224,Cepillo Profesional Conair Cushion,$576
546739,Vincha Top Ancha Diferentes Colores,$259
729655,Broche Oh Jacinta Candela,$880
825608,Gomitas De Pelo Top Celestes Rosadas Y Camufladas 12 Unidades,$149
628207,Gomitas De Pelo Top Elásticas Colores 2 Unidades,$154
22616,Kit Tinta Koleston N°30 Castaño Oscuro,$545
30454,Decolorante Issue 20 G,$147
18008,Tinta Soft Color N°80 Rubio Claro,$489
18640,Tinta Garnier Nutrisse N°91 Jazmín,$419
455877,Kit Tinta Issue Sin Amoníaco N°10.1 Rubio Extra Claro Ceniza,$221
612536,Gomita De Pelo Top Básica 1 Unidad,$229
25963,Tinta Excellence Creme L'oréal N°9.1 Rubio Muy Claro Ceniza,$675
805978,Kit Tinta Koleston N°415 Castaño Impulso,$545
567900,Tinta Excellence Matizador Supreme N°8.12rubio Claro Cenizo/perla,$675
601899,Retocador De Raíz Garnier Nutrisse N°40 Colorante 20 G + Revelador 20 Ml,$109
43244,Henna Surya Castaño Oscuro 70 Ml,$891
869251,Tinta Excellene N°7 Rubio + Shampoo Colorvive 200 Ml,$699
44898,Tinta Excellence Creme N°6.7 Chocolate Puro,$675
60025,Tinta Garnier Nutrisse Cor Intensa N°4.15 Castaño Ceniza Caoba,$294
74368,Oxidante Calypso Cremoso 40 Volúmenes 100 Ml,$84
61793,Tinta Koleston Single N°80 Rubio Claro,$225
18007,Tinta Soft Color N°70 Rubio Natural,$489
12502,Henna Cleahenn Dorado 50 G,$397
65352,Tinta Casting Creme Gloss N°503 Golden Chocolate,$598
455578,Kit Tinta Issue Sin Amoníaco N°5 Castaño Claro,$221
18657,Tinta Garnier Nutrisse N°10 Ebano,$419
567793,Tinta Excellence Matizador Supreme N°6.12 Rubio Oscuro Cenizo Perla,$675
25958,Tinta Excellence Creme L'oréal N°5.1 Castaño Claro Ceniza,$675
22638,Kit Tinta Koleston N°80 Rubio Claro,$545
765521,Tinta Soft Color N°535 Castaño Arábica,$489
28261,Tinta Koleston Single N°466 Borgoña Intenso,$225
44363,Tinta Casting Creme Gloss N°535 Chocolate,$598
601895,Retocador De Raíz Garnier Nutrisse N°10 Colorante 20 G + Revelador 20 Ml,$109
869248,Tinta Excellene N°4 Castaño + Shampoo Colorvive 200 Ml,$699
60022,Tinta Garnier Nutrisse Cor Intensa N°3.0 Castaño Oscuro,$294
64947,Tinta Excellence Creme N°7.3 Rubio Dorado,$675
61790,Tinta Koleston Single N°50 Castaño Claro,$225
85235,Tinta Garnier Nutrisse Coloríssimo N°4462 Rojo Carmín,$419
18004,Tinta Soft Color N°40 Castaño Mediano,$489
79516,Kit Tinta Issue Keratin Color N°7.64 Rubio Rojizo Cobrizo,$198
435666,Tinta Issue Crazy Color Amarillo 47 G,$174
18654,Tinta Garnier Nutrisse N°50 Castaña,$419
631309,Tratamiento Bealm Post Lavado Recuperación Instantánea 250 Ml,$305
25955,Tinta Excellence Creme L'oréal N°7 Rubio,$675
765420,Tinta Soft Color N°10 Negro Expreso,$489
22634,Kit Tinta Koleston N°70 Rubio Mediano,$545
41799,Tinta Casting Creme Gloss N°600 Rubio Oscuro,$598
631412,Crema Corporal Bealm 24 Hs De Suavidad Para Pieles Maduras 500 Ml,$421
631411,Jabón Líquido Bealm Para Manos Lagom 200 Ml,$245
631209,Tratamiento Bealm Post Lavado Reconstrucción 250 Ml,$305
631409,Crema Bealm Manos Y Uñas Hidratación 150 Ml,$399
631113,Crema Corporal Bealm 24hs De Hidratación Para Pieles Resecas 500 Ml,$421
631112,Jabón Líquido Bealm Para Manos Lykke 200 Ml,$245
631110,Shampoo Bealm Restauración Completa 375 Ml,$382
554671,Crema Baylis & Harding De Manos Garden Green 50 G 3 Unidades,$743
631015,Crema Corporal Bealm Humectación Extrema Para Pieles Secas 500 Ml,$421
631109,Shampoo Bealm Brillo Extremo 375 Ml,$382
586864,Set Baylis & Harding Crema De Manos Signature Sweet Mandarin & Grapefruit 3 Unidades,$743
550244,Set Baylis & Harding Beauticology Llama Mini Stack2 Unidades,$1.163
550243,Set Baylis & Harding Royale Garden Manicure Rose 3 Unidades,$894
400472,Bolso Maternal Bebesit,$1.084
434665,Jabón Líquido Baylis & Harding Para Manos Poppy & Vainilla 500 Ml,$265
434968,Jabón Líquido Para Manos Baylis & Harding Sweet Mandarin 500 Ml,$265
586846,Set Baylis &harding The Fuzzy Duck Men's Hemp & Bergamot 4 Unidades,$1.051
586835,Set Baylis & Harding Boudoire Rose 2 Unidades,$743
830907,Bumper Dual/dual Bebedue Evo Black,$1.400
830916,Saco Bebédue Cadi Beige,$3.000
830711,Capazo Dual Bebedue Evo Dark Grey,$2.040
586847,Set Baylis & Harding Jojoba Vanilla & Almond 3 Unidades,$1.033
831009,Espejo Vigila Bebé Bebédue Retrovisor,$600
830808,Impermeable Universal Bebédue,$800
830809,Mosquitero Universal Bebédue,$520
831010,Colchóneta Protectora Bebédue Con Memory Foam,$1.120
586838,Set Baylis & Harding Hombre Citrus Lime Y Mint Small 3 Unidades,$766
831011,Porta Bebé Bebédue Mio Galaxy Black,$2.840
830710,Barrera Puerta Alcala Bebedue,$3.440
735259,Nido Onna Beide 4 En 1,$6.520
735358,Cuna Onna Somnia,$11.760
861221,Mochila Skip Hop Zorro,$1.790
861320,Mochila Skip Hop Perro,$1.790
734857,Nido Onna Gris 4 En 1,$6.520
460090,Bolsas Para Leche Materna Miu 15 Unidades,$360
566023,Mantita Rabbit Con Capucha,$679
861220,Mochila Skip Hop Cocodrilo,$1.790
855822,Mochila Skip Hop Narval,$1.790
855821,Mochila Skip Hop Unicornio,$1.790
855820,Mochila Skip Hop Koala,$1.790
692197,Set De 4 Bodies Gerber Helados Nena 12 Meses,$1.440
339700,Medias Unisex Akas Little Oneset 0 A 3 Meses 2 Unidad,$153
81470,Medias Cancan Nuby,$198
691697,Set De 2 Piezas Gerber Short Y Remera Cangrejo Talle 4,$1.040
688488,Set De 2 Rompers Gerber Ballena Varón Recién Nacido,$1.200
603609,Pantuflas Con Sonajero Storki Conejo,$830
688789,Set De 2 Rompers Gerber Ballena Varón 0 A 3 Meses,$1.200
85464,Mochila Storki Ratón,$1.090
692298,Set De 2 Piezas Gerber Short + Remera De Cangrejo 24 Meses,$1.040
658932,Mochila Con Arnés Infanti Monstruo Verde,$960
691797,Set De 2 Piezas Gerber Short Y Remera Cangrejo Talle 5,$1.040
687990,Set De 4 Bodies Gerber Sirena Nena 18 Meses,$1.240
688091,Set De 3 Piezas Gerber Loves Nena Recién Nacido,$1.000
520427,Acondicionador Head & Shoulders Manzana Fresh 300 Ml,$395
78563,Panty Sacks Bebé Blanca Talle 2,$249
293994,Manta Abrigada Storki Rosada,$1.290
846125,Acondicionador Ogx Leche De Coco 385 Ml,$665
691698,Set De 4 Bodies Gerber Helados Nena 18 Meses,$1.440
688588,Set De 2 Piezas Gerber Tractor Talle 4,$1.040
687590,Set De 3 Piezas Gerber Loves Nena 0 A 3 Meses,$1.000
603605,Trapito De Apego Storki Conejo,$890
734057,Acondicionador Biolage Hydrasource 280 Ml,$901
90985,Acondicionador Dove Super Factor Nutrición 60 Minutos 170 Ml,$204
74401,Acondicionador L'oréal Professionnel Absolut Repair 200 Ml,$969
74446,Acondicionador L'oréal Professionnel Vitamino 200 Ml,$1.140
42027,Bálsamo Biferdil Phytoplus Lino 200 Ml,$336
316252,Acondicionador L'oréal Professionnel Silver 200 Ml,$1.140
89840,Acondicionador Fructis Oil Repair Liso Coco 200 Ml,$150
279665,Acondicionador Herbal Essences Coconut Milk 400 Ml,$464
606804,Acondicionador Fructis Hair Food Sandia 300 Ml,$309
511022,Acondicionador Fructis Hair Food Aloe 300 Ml,$309
793124,Acondicionador Veganis Nutri Boost Sublim 400 Ml,$740
808869,Acondicionador Pantene Colágeno 510 Ml,$489
754408,Acondicioador Dove Hidraliso 400 Ml,$415
58180,Bálsamo Primicia Tratante 250 Ml,$236
600666,Acondicionador Head & Shoulders Fuerza De Raíz 300 Ml,$395
846036,Acondicionador Ogx Biotina & Colágeno 385 Ml,$665
37784,Acondicionador Pantene Brillo Extremo 750 Ml,$489
83857,Acondionador Engrosador Tío Nacho 415 Ml,$332
70910,Acondicionador Elvive óleo Extraordinario Nutrición 370 Ml,$454
784197,Acondicionador Wella Oil Reflection 200 Ml,$1.231
278362,Bálsamo Klorane Quinina 200 Ml,$848
805977,Acondicionador Ilicit Pepino Y Jengibre Kera-v Detox 350 Ml,$285
509021,Acondicionador Love Beauty & Planet Manteca Muru Muru Y Rosas 300 Ml,$139
835708,Acondicionador Pantene Nutrient Blends Frizz Control 235 Ml,$579
28482,Acondicionador Pantene Liso Extremo 750 Ml,$489
50911,Acondicionador Dove Reconstruccion Completa 400 Ml,$311
784098,Acondicionador Sebastian Penetraitt 250 Ml,$1.713
83509,Acondicionador Tío Nacho Herbal 415 Ml,$332
803862,Acondicionador Dove Poder De Las Plantas Fuerza + Bambú 300 Ml,$391
503002,acondicionador Tío Nacho Aloe Vera 415 Ml,$332
28314,Acondicionador Pantene Rizos Definidos 400 Ml,$386
330590,Mordillo Twistshake +1 Meses Celeste,$479
826512,Acondicionador Tresemmé Para Ondas Boho 500 Ml,$389
585328,Mordillo Twistshake Teether +1 Meses Blanco,$476
859119,Acondicionador Nioxin Revilatizing N°6 300 Ml,$1.456
68516,Acondicionador Pantene Hidratación Extrema 400 Ml,$386
829410,Mordillo True De Gel Con Sonajero Celeste +3 Meses,$381
829217,Mordillo Storki De Silicona Cohete,$790
86473,Bálsamo Klorane Lino 200 Ml,$848
460086,Acondicionador Elvive Dream Long Liss 200 Ml,$280
81729,Acondicionador Pantene 3mm Rizos Definidos 170 Ml,$345
294385,Acondicionador Elvive Dream Long 370 Ml,$454
846030,Caminador Polar B Con Actividades,$3.438
829218,Mordillo True De Gel Con Sonajero Rosado +3 Meses,$381
293996,Espejo Storki Con Sonajero Y Mordillo,$620
692506,Alfombra Carestino Plegable Aventura 177x195 Cm,$3.299
603520,Gimnasio Didáctico Carestino Amigos,$3.959
829131,Mordillo Storki De Silicona Tren,$790
829119,Mordillo True Para Alimento Con Tapa Verde +6 Meses,$572
781561,Porta Chupete Storki Apego Coco,$580
692504,Alfombra Carestino Plegable Bosque 177x195 Cm,$3.299
829219,Mordillo True De Gel Con Sonajero Verde +3 Meses,$381
293998,Pelota Stroki De Actividades Con Mordillo Azul,$790
829214,Mordillo True Para Alimento Con Tapa Celeste +6 Meses,$572
85473,Peluche Con Sonajero Storki Ratón,$1.090
603491,Alfombra Antigolpes Reversible Jungla 200x180 Cm,$3.739
638630,Mordillo Rabbit Verde,$219
293999,Pelota De Actividades Con Mordillo Rosa,$790
781563,Sonajero Storki Arcoíris,$540
615256,Mordillo Alimentador Boboduck Silicona,$599
829129,Mordillo Storki De Silicona átomo Rosado,$690
293993,Espejo Storki Con Sonajero Y Mordillo,$620
603525,Mecedora Carestino Verde Agua,$6.269
44774,Crema Para Peinar Elvive Reparación Total 5 250 Ml,$453
829113,Sonajero Baby Shark Estirado +3 Meses,$429
576966,Crema Para Peinar Pantene Bambú 300 Ml,$339
26583,Shampoo Capilatis Puro Rubio Iluminador 420 Ml,$567
784105,Shampoo Sebastian Trilliance 250 Ml,$1.650
765619,Kit Tinta Koleston N°53 Castaño Dorado,$545
456277,Kit Tinta Issue Sin Amoníaco N°1negro,$221
315252,Acondicionador Head & Shoulders Purificación Capilar 375 Ml,$395
88834,Pack Fructis Liso Shampoo 350 Ml + Acondicionador 200 Ml,$332
456077,Kit Tinta Issue Sin Amoníaco N°7 Rubio,$221
846032,Aceite Capilar Renovador Ogx Argán De Marruecos 100 Ml,$732
601899,Retocador De Raíz Garnier Nutrisse N°40 Colorante 20 G + Revelador 20 Ml,$109
582605,Shampoo Biferdil Anti Amarillo 295 Ml,$427
500696,Shampoo Batiste Seco Original 200 Ml,$665
85776,Acondicionador John Frieda Miraculous Recover 250 Ml,$526
780562,Shampoo En Barra Fructis Hair Food Aguacate Nutrición 60 G,$449
47070,Henna Cleahenn Extra Red 50 G,$397
61787,Tinta Koleston Single N°20 Negro,$225
68396,Set Peine Conair Y Cepillo De Viaje,$433
263735,Shampoo L'oréal Professionnel Blondifier Gloss 500 Ml,$1.690
380423,Shampoo Tío Nacho Ultra Hidratante 415 Ml + Acondicionador 415 Ml,$622
601905,Retocador De Raíz Garnier Nutrisse N°71 Colorante 20 G + Revelador 20 Ml,$109
41639,Shampoo Biferdil Ortiga Y Quina 295 Ml,$359
612542,Gomita De Pelo Top Diseño Vaca 1 Unidad,$229
25962,Tinta Excellence Creme L'oréal N°8.1 Rubio Claro Ceniza,$675
784199,Aceite Wella Reflection óleo 100 Ml,$2.301
503001,Shampoo Tío Nacho Aloe Vera415 Ml,$332
22635,Kit Tinta Koleston N°71 Rubio Cenizo Mediano,$545
68514,Shampoo Pantene Hidrataciónextrema 700 Ml,$529
342007,Gomitas De Pelo Top Colores Surtidas Finas,$117
28261,Tinta Koleston Single N°466 Borgoña Intenso,$225
300507,Tratamiento Tío Nacho Ultra Hidratante 200 G,$436
79957,Acondicionador Elvive Rizos 370 Ml,$454
16459,Acondicionador Capilatis Ortiga Anti-caída 410 Ml,$456
831612,Tratamiento Nocturno Elvive Hidra Rellenador Con ácido Hialurónico 200 Ml,$360
86527,Spray Magic Retouch Rubio Claro Medio 75 Ml,$662
846034,Aceite Capilar Reparador Ogx Argán De Marruecos 118 Ml,$732
846043,Shampoo Ogx Aceite De Argán De Marruecos 385 Ml,$665
84619,Pack Shampoo Pantene Restauración 400 Ml + Acondicionador 3mm 170 Ml,$614
868139,Acondicionador Herbal Essences Aloe Y Mango 250 Ml,$464
47729,Shampoo Ortiga Cardo 410 Ml,$456
287974,Shampoo Pantene Micelar 400 Ml,$422
26583,Shampoo Capilatis Puro Rubio Iluminador 420 Ml,$567
803966,Shampoo Dove Poder De Las Plantas Purificación + Jengibre 300 Ml,$391
9511024,Shampoo Fructis Hair Food,$309
511021,Acondicionador Fructis Hair Food Aguacate 300 Ml,$309
50887,Shampoo Dove Hidratación Intensa 400 Ml,$415
59214,Shampoo Biferdil Con Keratina 295 Ml,$656
313345,Shampoo Dove Sport Active+fresh 3en1 400 Ml,$373
68514,Shampoo Pantene Hidrataciónextrema 700 Ml,$529
590431,Shampoo Elvive óleo Extraordiario 370 Ml + Acondicionador 370 Ml + Cepillo,$678
34593,Shampoo Klorane Mango 200 Ml,$628
78020,Shampoo Dove óleo Nutrición 750 Ml + Acondicionador 400 Ml,$539
553251,Shampoo L'oréal Professionnel Pro Longer 300 Ml,$978
42431,Shampoo Pantene Restauración 400 Ml,$422
88834,Pack Fructis Liso Shampoo 350 Ml + Acondicionador 200 Ml,$332
432260,Shampoo Head & Shoulders Coconut 375 Ml,$462
617266,Shampoo Elvive Hidra Rellenador Con ácido Hialurónico 200 Ml,$280
666763,Set De Regalo Baylis & Harding Royale Garden Shampoo 50 Ml + Loción Corporal 100 Ml + Acondicionador 50 Ml,$1.955
507216,Shampoo Sólido Primicia Cabellos Normales 50 G,$299
784297,Shampoo Wella Motion Protect Color 250 Ml,$1.231
500696,Shampoo Batiste Seco Original 200 Ml,$665
780456,Shampoo Matrix Instacure Repair 300 Ml,$636
835908,Shampoo Pantene Nutrient Blends Volumen 270 Ml,$579
71295,Shampoo Aclarante Tío Nacho 415 Ml,$332
818035,Kiehl's Rice And Wheat Voluminizing Shampoo 250 Ml,$1.290
859317,Shampoo Nioxin Cleanser N°3 300 Ml,$1.249
16457,Shampoo Capilatis Ortiga Caspa 410 Ml,$456
380422,Shampoo Tío Nacho Aclarante 415 Ml + Acondicionador 415 Ml,$622
525531,Shampoo Sri Sri Ayurvédico Proteico 200 Ml,$489
46549,Shampoo Pantene Liso Extremo 400 Ml + Acondicionador 200 Ml,$379
68419,Shampoo Capilatis Keratina 350 Ml,$390
581106,Shampoo Pantene Bambú 200 Ml,$277
784105,Shampoo Sebastian Trilliance 250 Ml,$1.650
87364,Shampoo Seco Batiste Tropical 200 Ml,$665
651237,Shampoo Fructis Recarga Nutritiva 350 Ml + Acondicionador 200 Ml,$345
58482,Shampoo Primicia + Bálsamo Tratante 250 Cc,$435
70907,Shampoo Elvive óleo Extraordinario Nutrición Profunda 370 Ml,$454
780258,Shampoo L'oréal Professionnel Metal Detox 300 Ml,$1.330
733356,Shampoo Redken Reparación Total Extreme 300 Ml,$1.500
83856,Shampoo Anti-edad Tío Nacho 415 Ml,$332
91321,Barra Depilatoria Millefiori Facial Piel Normal 43 G,$259
24542,Bandas Depilatorias Depi Roll Faciales 8 Unidades,$251
552751,Afeitadora Gillette Venus Simply Mujer Sensitive 4 Unidades,$565
38399,Banda Depilatoria Depimiel Corporales 12 Unidades,$415
860822,Bandas Depilatorias Millefiori Corporal Care 12 Unidades,$265
77843,Kit Calypso Cera Depilatoria Roll On Natural 100 G + 6 Bandas Depilatorias,$208
73663,Crema Depilatoria Cerovello Rostro 40 G,$220
90200,Papel Depilatorio Corporal Depilíssima 20 Unidades,$143
510219,Papel Depilatorio Depilíssima 10unidades,$84
24539,Bandas Depilatorias Depi Roll Corporales 8 Unidades,$387
70213,Bandas Depilatorias Depilart 50 Unidades,$221
36188,Crema Depilatoria Depilart Rostro 30 G,$250
88852,Afeitadora Gillette Venus Tropical 3 Unidades,$448
47795,Cera Depilatoria Depilíssima Vegetal 110 G,$257
31958,Cera Roll On Depilart Miel 100 G,$162
77840,Bandas Depilatorias Calypso Facial Vegetal 12 Unidades,$121
68546,Afeitadora Recargable Gillette Venus Original 1 Unidad,$381
726053,Gillette Venus Sensitive Divine 2 Unidades,$556
86380,Crema Depilatoria Six Corporal 195 G,$475
565579,Banda Depilatoria Facial Dorothy Gray Para Piel Sensible 6 Unidades,$151
272346,Calentador Depi-roll Para Roll-on,$2.260
31953,Bandas Depilatorias Depilart Corporales Miel 20 Unidades,$262
253133,Crema Depilatoria Dorothy Gray Rostro Azuleno 30 G ,$306
77759,Bandas Depilatorias Depilart 100 Unidades,$378
81745,Aceite Calypso Post Depilatorio 80 Ml,$183
861520,Cera Depilatoria Millefiori En Perlas Soft 100 G,$216
84273,Bandas Depilatorias Dorothy Gray Corporales 6 Unidades,$239
28019,Afeitadora Xtreme3 Piel Delicada 1 Unidad,$97
77279,Afeitadora Bic Soleil Verde/celeste 2 Unidades,$296
38417,Cera Depilatoria Depimiel Roll On Clásica 100 G,$251
66547,Afeitadora Desechable Gillette Venus Simply3 2 Unidades,$293
66544,Cartuchos Para Afeitar Gillette Venus Original 2 Unidades,$454
39273,Cera Depilatoria Depimiel Roll On Suave 100 G,$251
861422,Cera Depilatoria Millefiori En Perlas Care 100 G,$216
552752,Afeitadora Gillette Venus Simply Mujer Sensitive 2 Unidades,$293
24543,Cera Depilatoria Depi Roll On Corporal Miel 100 G,$225
56343,Cera Depilatoria Depilíssima Rosa Mosqueta 110 G,$288
90201,Papel Depilatorio Corporal Depilíssima 50 Unidades,$247
73965,Cera Depilatoria Calypso Negra 110 G,$189
31717,Talco Pédico Xanapie Azul 105 G,$147
518025,Pinza De Depilar Nail Mate Cromada,$78
