sku,name,price
660669,Cepillo Alisador Punktal Pk-nv4916,$1.000
660803,Sandwichera Doble Punktal Pk-cr44 3 En 1 800w,$2.000
660797,Tostadora Eléctrica Punktal Pk-ai858 Inoxidable,$1.440
660667,Corta Pelo Punktal Pk-hc2016 Recargable,$1.560
660665,Secador De Pelo Punktal Pk-2200ion 2200w,$1.440
658672,Plancha A Vapor Philips Gc360/30 Steamer,$4.720
743091,Aire Acondicionado Enxuta Inverter Smart 12000 Btu,$24.000
658644,Afeitadora Philips S1121/41 Aquatouch,$2.760
743090,Aire Acondicionado Enxuta Aaenx222-12000 Btu,$18.240
743695,Aire Acondicionado Enxuta Aaenxi222s 18000 Btu Inverter Smart,$40.000
755410,Centrifugadora Enxuta Carga Superior 4.2 Kg,$5.240
724441,Horno De Emportrar Enxuta Heenxg5500ng A Gas Negro,$18.520
833909,Licuadora Cuori Gianna,$2.080
573953,Limpiador Para Heladeras Dr. Beckmann 250 Ml,$304
690299,Horno Eléctrico Enxuta Henx2335 Negro 34 L,$4.760
573951,Limpiador Para Hornos Dr. Beckmann 375 Ml,$304
573949,Limpiador De Electrodomésticos Dr. Beckmann 250 Ml,$304
690295,Lavarropas Enxuta Lenx25550 Con Carga Superior Semi-automático 5.5 Kg,$5.040
573952,Limpiador Para Lavadoras Dr. Beckmann 250 Ml,$304
573950,Limpiador De Cocinas Dr. Beckmann 250 Ml,$334
573947,Limpiador De Alfombras Dr. Beckmann 650 Ml,$508
573943,Jabón Mágico Dr. Beckmann 100 Ml,$190
862321,Detergente Magistral Pureza Activa 280 Ml,$125
724541,Lavarropas Enxuta Semi-automático 10 Kg,$5.920
77019,Detergente Cristal Lavavajilla Aloe 500 Ml,$81
830810,Combo Gama Planchita Elegance Coconut + Secador H Bora Lino,$4.434
792228,"Televisor Enxuta Smart Full Hd Ledenx1240s 40""",$10.640
23677,Desinfectante De Ambientes Y Elimina Olores En Aerosol Lysoform Aire De Montaña 360 Ml,$216
32967,Limpiador De Baño Lysoform Líquido 500 Ml,$258
621883,Cera Líquida Pisos Blem Porcelanato Incoloro 800 Ml,$381
91480,Limpia Vidrios Mr. Músculo 500 Cc,$222
91470,Repuesto Canasta Líquida Glade Mañana De Campo 50 Ml,$204
361515,Solución Cristal 4 L,$236
604896,Detergente Cif Ultra Core Limón Verde 750 Ml,$178
366415,Lustra Muebles Júpiter Original 360 Ml,$181
564179,Limpiador Líquido Multisuperficies Glade Campos De Lavanda 1.8 L,$188
457582,Lavandina Júpiter 1 L,$61
621782,Cera Líquida Pisos Cerámicos Blem Floral 450 Ml,$230
18397,Detergente Cristal Lavavajillas Aloe 1.25 L,$123
74912,Limpiador Bioclin Graseras Y Desagües 70 G,$275
621683,Limpiador Múltiples Pisos Blem Vainilla Y Lavanda 800 Ml,$249
70275,Limpiador Líquido Multisuperficies Glade Floral Perfection 900 Ml,$101
302720,Limpiador Fabuloso Fresco Amanecer Antibacterial 1 L,$98
88826,Limpiador Fabuloso Complete Blue 828 Ml,$128
619477,Limpiador Líquido Desinfectante De Superficies Lysoform Lavanda 900 Ml,$108
582403,Limpiador De Pisos Cif Fragancia Relajante 1.75 L,$161
70269,Repuesto Limpiador Líquido Mr. Músculo Cocina Antigrasa 500 Ml,$139
302625,Limpiador Fabuloso Alternativa Al Cloro 1 L,$98
70273,Repuesto Discos Adhesivos Pato Para Inodoro Marina 38 G,$215
456982,Repuesto Limpiador Júpiter 3 En 1 450 Ml,$89
582400,Limpiador De Pisos Cif Fragancia Armonizante 900 Ml,$93
658615,Planchita Philips Hp8325/10 Essential Care,$2.760
45187,Lustramuebles En Aerosol Blem Brillo Y Protección Madera Lavanda 360 Cc,$295
774942,Desinfectante En Aerosol Lysoform 420 Ml 2 Unidades,$370
660669,Cepillo Alisador Punktal Pk-nv4916,$1.000
451776,Repuesto Limpiador Lysoform Cítrico 420 Ml,$116
660665,Secador De Pelo Punktal Pk-2200ion 2200w,$1.440
660667,Corta Pelo Punktal Pk-hc2016 Recargable,$1.560
246924,Limpiador Júpiter Floral 950 Ml,$58
658672,Plancha A Vapor Philips Gc360/30 Steamer,$4.720
658644,Afeitadora Philips S1121/41 Aquatouch,$2.760
32968,Repuesto Limpiador De Baño Lysoform Líquido 450 Ml,$145
577580,Limpiador Cif Crema Original Multiuso 750 Ml,$153
830810,Combo Gama Planchita Elegance Coconut + Secador H Bora Lino,$4.434
80964,Lavavajillas Cristal Limón Verde 300 Ml,$92
811571,Planchita Gama Elegance Matcha Led Bvt,$3.525
821213,Masajeador Xiaomi Gum,$6.960
811572,Rizador Gama Avocado Bv C T New,$2.229
821300,Afeitadora Xiaomi Electric S700,$5.960
821303,Cortadora Pelo Xiaomi Hair Clipper,$1.960
821301,Secador De Pelo Xiaomi Ionic Hair Dryer H300,$2.160
821212,Secador De Pelo Xiaomi Water Ionic H500,$3.560
855213,Secador De Pelo Revlon Brilliance 2000w Iónico,$2.659
855113,Rizador Revlon Mix Ajustable 2 En 1,$3.640
854913,Cepillo Voluminizador Revlon One Step,$4.458
836516,Planchita Digital Profesional Evok Gr.a019-ys-538b,$4.390
853213,Pistola Masajeadora De Persecusión Homedics Therapy,$3.960
855013,Planchita Revlon Tecnología Nano Cobre,$3.517
836609,Máquina De Corte Profesional Evok Ev-hc-y400,$3.290
836517,Secador De Pelo Profesional Evok 3000,$4.990
836610,Máquina De Corte Evok Ev-hc-6000,$4.100
836409,Buclera Beauty Style Spirale,$1.536
836612,Planchita Evok Ys738-b-220,$4.250
836512,Lámpara Led Portátil Beauty Style 48w,$1.880
836411,Set Planchita Buclera Y Peine Profesional Beauty Style,$4.900
836412,Secador De Pelo Profesional Evok 2000 R8-b,$4.290
836413,Secador De Pelo Súper Mega Turbo Profesional Beauty Style Iónico 3900,$4.800
836415,Lámpara Led Digital Para Uñas Beauty Style,$2.630
836510,Cepillo Alisador Beauty Style Eléctrico,$1.630
836515,Planchita Evok A019-x820-220,$3.590
836611,Máquina De Corte Beauty Style 9700,$8.415
836613,Rasuradora Inalámbrica Beauty Style,$4.100
51736,Antitranspirante En Gel Gillette Clear Power Rush 82 G,$269
86565,Desodorante En Aerosol Legacy N°1 Rojo 150 Ml,$186
86566,Desodorante En Aerosol Legacy N°2 Azul 150 Ml,$186
836513,Máquina Corte Evok Ev-hc-1009,$3.900
86567,Desodorante En Aerosol Legacy N°3 Negro 150 Ml,$186
836410,Máquina Corte Evok Ev-hc-1003,$2.200
87983,Desodorante Desire Black Homme 150 Ml+ Bálsamo 100 Ml,$385
87984,Desodorante En Aerosol Urban Care Unlimited Deep Blue 158 Ml,$186
89038,Antitranspirante En Aerosol Urban Care Essential 158 Ml,$185
89585,Desodorante En Aerosol Axe Gold Wood Vanilla 150 Ml,$181
836518,Rizador De Cabello Beauty Style Inalámbrico Rosa,$4.086
90253,Desodoante En Gel Gillette Clear Cool Wave 82 G 2 Unidades,$447
836514,Planchita Beauty Style 2 En 1,$4.900
505507,Gel Gillette Hydra Aloe 82 G ,$283
90480,Desodorante En Aerosol Urban Care Extreme 158 Ml,$186
293793,Desodorante En Aerosol Axe Ice Chill Efecto Frío 152 Ml,$181
836414,Trimmer Beauty Style Nariz Y Orejas,$332
505509,Gel Gillette Hydra Vitamina E 82 G ,$283
836519,Rizador De Pelo Evok A019-htb4,$1.990
38362,Desodorante En Aerosol Colbert Pass 180 Ml,$288
401533,Desodorante En Aerosol Axe Ap Freestyle 152 Ml,$181
80716,Jabón En Barra Rexona Active 3 Unidades 125 G,$177
38807,Desodorante En Aerosol Colbert Noir 180 Ml,$311
32308,Antitranspirante En Aerosol Urban Care Dynamic Life 158 Ml,$186
86246,Desodorante En Aerosol Axe Bs Musk 150 Ml 2 Unidades,$244
72717,Desodorante En Aerosol Axe Musk 96 G,$181
65360,Desodorante En Aerosol Bi-ó Mineral Protección 5 Masculino 150 Ml,$174
72718,Desodorante En Aerosol Axe Apollo 96 G,$181
72712,Desodorante En Aerosol Axe Black 150 G,$181
72719,Antitranspirante En Aerosol Axe Apollo 90 G,$181
72720,Antitranspirante En Aerosol Axe Dark Temptation 90 G,$181
65359,Desodorante En Roll On Bi-ó Protección 5 Masculino 150 Ml,$199
75253,Desodorante En Aerosol Kevin Plateado 150 Ml,$311
69230,Antitranspirante En Gel Gillette Clear Gel Cool Wave 82 G,$269
69913,Antitranspirante En Aerosol Gillette Cool Wave 150 Ml,$211
15004,Antitranspirante En Gel Gillette Clear Men Artic Ice 82 G,$269
71607,Desodorante En Aerosol Bi-ó Black & White Masculino 150 Ml,$174
777051,Jabónen Barra Dove Men Care Clean C 90 G 4 Unidades,$239
782702,Antitranspirante En Barra Rexona Men Antibacterial 50 G,$244
782798,Antitranspirante En Barra Rexona Men Invisible 50 G,$244
69914,Antitranspirante En Aerosol Gillette Arctic Ice 150 Ml,$211
77103,Antitranspirante En Aerosol Gillette Training Day 150 Ml,$211
819640,Antitranspirante En Roll On Bí-o Men Magnesio Ultra Dry 50 Ml,$199
617786,Antitranspirante En Roll On Rexona Sensitive 50 Ml,$148
694001,Desodorante En Barra Rexona Xtracool 50 G 2 Unidades,$366
820693,Juego Fifa 23 Para Ps4,$3.960
835608,Consola Play Station 5 + Juego Horizon Forbidden West,$58.040
820694,Juego Fifa 23 Para Ps5,$4.760
819638,Desodorante En Aerosol Bi-o Men Magnesio Ultra Dry 150 Ml,$174
616358,Auriculares Sony Inalámbricos Para P5 P4 Pulse 3d,$9.240
605399,Silla Gamer Reclinable Negro,$7.499
614356,Juego Ps4 Grand Theft Auto V Premium Edition,$1.600
599873,Organizador De Cables Hasta 6 Negro,$99
612046,Parlante Jbl Flip 5 Azul,$6.320
599866,Auriculares Bluetooth Tws Blanco Tl1,$1.799
409950,Cargador Usb Doble Irago 7996,$99
715937,Fifa 22 Ps5,$4.000
599966,Micrófono Multifunción Rosa,$2.060
599871,Organizador De Cables Hasta 6 Blanco,$99
637325,Juego Fifa 22 Para Ps4,$4.000
616257,Control Inalámbrico Dualsense Ps5,$4.960
599867,Cargador Inalámbrico Magnetico A41,$1.299
616357,Cámara Hd Ps5,$4.360
77011,Perfumador De Ropa Conejo Relax 250 Ml,$228
605398,Silla Gamer Reclinable Negro Con Blanco,$7.499
785494,Suavizante Comfort Concentrado Cuidado Esencial 1 L,$311
18380,Suavizante Conejo Caricias 450 Ml,$79
614354,Juego Ps4 Crash Bandicoot 4 Its About Time,$3.560
82276,Perfumador Para Ropa Brisa De Primavera 250 Ml,$152
77009,Suavizante Conejo Relax 5 L,$468
43148,Suavizante Vivere Regular Clásico 900 Ml,$133
780359,Auriculares Jbl Gamer Quantum 100,$3.120
599872,Organizador De Cables Hasta 6 Verde,$99
785395,Suavizante Comfort Concentrado Cuidado Intensivo Fiber 1 L,$311
91087,Suavizante Downy Floral 800 Ml,$159
90218,Repuesto Suavizante Querubín 3 L,$334
18376,Suavizante Conejo Amor 900 Ml,$137
90175,Repuesto Suavizante Querubín 900 Cc,$114
77010,Perfumador De Ropa Conejo Amor 250 Ml,$228
814182,Barra De Sonido Xion 2.1 4000w,$3.200
785396,Suavizante Comfort Concentrado Cuidado Intensivo Hydra 1 L,$311
77006,Suavizante De Ropa Conejo Amor 5 L,$468
18379,Suavizante Conejo Amor 450 Ml,$79
691197,Jabón Líquido Para Ropa Skip Diluible 500 Ml 2 Unidades,$884
77023,Jabón Líquido Para Ropa Conejo Relax 3 L,$603
335207,Jabón Líquido Para Ropa Conejo Relax 800 Ml,$152
778154,Jabón En Polvo Para Ropa Skip Ph Balance 600 G,$137
783695,Jabón Líquido Para Ropa Dreft New Born 1.36 L,$638
799650,Suavizante Comfort Concentrado Cuidado Essencial 500 Ml,$185
27250,Jabón Para Ropa Bull Dog 200 G,$79
250631,Jabón Líquido Para Ropa Skip Esence Comfort 3 L,$593
90203,Jabón En Polvo Querubín 800 G,$123
461489,jabón Líquido Para Ropa Nevex Concentrado Para Diluir 500 Ml,$421
90185,Jabón Líquido Para Ropa Mas Bebé 830 Ml,$175
85862,Jabón En Polvo Conejo Fresh 3 Kg,$594
626105,Jabón Líquido Para Ropa Nevex Diluible 2 Unidades,$758
90186,Jabón Líquido Para Ropa Mas Bebé 1.83 L,$310
70770,Repuesto Jabón Líquido Para Ropa Nevex 3 L,$490
85869,Jabón Líquido Para Ropa Persil Regular 830 Ml,$229
361115,Suavizante Downy Suave Y Gentil 800 Ml,$159
575157,Suavizante Comfort Concentrado Detox 450 Ml,$80
731254,Jabón Líquido Querubín 900 Ml,$147
778155,Jabón En Polvo Para Ropa Skip Ph Balance 2.5 Kg,$520
335205,Jabón Líquido Para Ropa Conejo Fresh 800 Ml,$152
19206,Jabón En Polvo Para Ropa Nevex Clásico 800 G,$179
361316,Jabón Líquido Para Ropa Nevex Clásico 800 Ml,$170
425454,Jabón Líquido Para Ropa Persil 830 Ml,$366
348212,Jabón Líquido Para Ropa Skip Regular 800 Ml,$208
250633,Jabón Líquido Para Ropa Skip Regular 3 L,$593
500890,Jabón Líquido Para Ropa Skip Diluible 500 Ml,$491
420253,Jabón Líquido Para Ropa Persil 3 L,$757
791621,Jabón Líquido Skip Bio Enzimas 400 Ml,$76
43144,Jabón En Polvo Para Ropa Nevex Clásico 3 Kg,$514
90202,Jabón Líquido Querubín Repuesto 800 Ml,$20
87374,Jabón Líquido Para Ropa Nevex Matic 3l + 800 Ml,$490
573444,Cuna Para Dormir Cry Babies,$2.000
572131,Trivia Prohibido Royal,$690
90205,Repuesto Jabón Líquido Querubín 3 L,$340
571614,Dominó En La Selva,$259
483552,Código Secreto Super Royal,$570
572225,Kit Cocina Masa Royal,$799
573309,Alfombra Para Jugar De 70x90 Cm Con 2 Piezas 7 Cm,$1.520
400532,Guitarra De Madera Hape Roja,$4.676
400434,Camión Tonka Metálico Chico,$1.199
400537,Set De Comida Pizza Hape De Madera,$1.694
330716,Kit Infantozzi Vaporizador Con Crayolones,$837
330727,Kit Infantozzi Pinta Tu Libro De Arte,$893
330728,Kit Infantozzi Divertite Con Arena Mágica,$893
330679,Masa Royal Colgante,$260
330710,Divertite Infantozzi Crea Tu Tia­tere,$390
330709,Divertite Infantozzi Pinta Con Tus Manos,$390
330698,Mi Primera Huerta Infantozzi 3 Macetas,$655
679082,Set De Playa De Silicona Bigjigs Coral,$1.320
755511,Camión Volcador Didáctico Multifunción Top Bright,$2.030
799752,Juego Golazo Chau Pantallas,$490
840414,Monopatín Bigjigs Fucsia,$4.000
755508,Jenga De Animales Con Tarjetas Y Dado,$1.229
755911,Proyector De Sistema Solar Didáctico,$2.260
755614,Puzzle De Madera Con Auto De Bomberos,$749
847618,Bloques Magnéticos 36 Piezas,$1.062
755510,Bloques Letras Y Números Top Bright Madera 100 Unidades,$2.190
840515,Tren Bigjigs Actividades Del Bosque En Madera,$2.760
755412,Juego De Pizza De Madera Con Toppings,$1.590
755512,Juego De Pesca 16 Piezas,$1.190
755519,Puzzle De Madera Con Auto De Policía,$749
755309,Juego De Pesca 26 Piezas,$1.439
678693,Tejo Bigjigs Con Puntuación,$2.080
755809,Juego De Pasteleria,$1.579
678692,Sudoku De Madera Bigjigs,$1.720
755209,Juego De Parrilla De Madera,$1.590
755324,Puzzle De Madera Top Bright Autobús Escolar,$749
840417,Silla Bigjigs La Vaca,$3.400
755326,Puzzle De Madera Top Bright Barco A Vapor,$749
755810,Kit De Excavación Tiranosaurio Rex,$1.470
755325,Puzzle De Madera Top Bright Helicóptero,$749
840411,Silla Bigjigs La Oveja,$3.400
338626,Servilletas Elite Para Mesa Blanco 200 Unidades,$178
769827,Servilleta Cocktail Elite 200 Unidades,$130
594927,Papel Higiénico Higienol Max Hoja Simple 100 M 8 Rollos,$486
13027,Pañuelos Elite Faciales 75 Unidades,$71
816816,Toallas De Papel Novagigante Doble Hoja 100 M,$325
425453,Servilletas Elite Cocktail Blanca 50 Unidades,$41
366315,Servilletas Elite Diseño Decorativo 20 Unidades,$94
795735,Papel Higiénico Higienol Sin Fin 60 M 8 Rollos,$237
338632,Servilletas Sussex Nova Extra Mesa Blanca 200 Unidades,$157
559875,Servilletas Elite Blancas 50 Unidades,$56
13015,Papel Higiénico Elite Ultra Blanco 30 Metros 4 Unidades,$152
476216,Papel Higiénico Be Eco Bambú Triple Hoja 22 M 4 Rollos,$156
816815,Rollo De Cocina Nova Extra 360 Paños 3 Rollos,$223
68367,Papel Higiénico Higienol Premium Doble Hoja 30 M 8 Rollos,$229
717137,Rollo De Cocina Cameratta 200 Hojas 1 Rollo,$77
413655,Papel Higiénico Higienol Premium 30 M 4 Rollos,$152
816715,Rollo De Cocina Elite Deco 200 Paños 2 Unidades,$163
86538,Rollo De Cocina Elite Ultra 2 Unidades,$123
13023,Pañuelos Descartables Elite 6 Unidades,$106
578086,Papel Higiénico Elite Ultra Doble Hoja 50 M 4 Rollos,$255
70850,Papel Higiénico Húmedo Fresh 80 Unidades,$213
79458,Pañuelos Descartables Elite Antivirales 6 Unidades,$128
330407,Rollo De Cocina Cameratta 55 Hojas 2 Rollos,$53
330398,Servilletas Cameratta 50 Unidades,$34
734358,Papel Higiénico Elite Ultra Compact 16 Rollos,$503
295096,Toallas Elite Maxwipe 50 Paños,$178
822305,Papel Higiénico Húmedo Wetclean 80 Unidades,$202
90598,Pañuelos Elite Pocket 1 Unidad,$24
572131,Trivia Prohibido Royal,$690
571614,Dominó En La Selva,$259
483552,Código Secreto Super Royal,$570
77568,Papel Higiénico Elite Húmedo 40 Unidades,$151
769427,Rollo De Cocina Nova Extra 3 Unidades 180 Paños,$133
572225,Kit Cocina Masa Royal,$799
330395,Papel Higiénico Cameratta Hoja Simple 60 M 4 Rollos,$77
38601,Pañuelos Elite Faciales Premium Cubo 60 Unidades,$113
573309,Alfombra Para Jugar De 70x90 Cm Con 2 Piezas 7 Cm,$1.520
476316,Pañuelos Desechables Be Eco Bambú 10 Unidades 10 Paquetes,$81
330399,Papel Higiénico Cameratta Doble Hoja 30 M 4 Rollos,$85
13028,Pañuelos Elite Faciales 100 Unidades,$113
330710,Divertite Infantozzi Crea Tu Tia­tere,$390
400434,Camión Tonka Metálico Chico,$1.199
400537,Set De Comida Pizza Hape De Madera,$1.694
679082,Set De Playa De Silicona Bigjigs Coral,$1.320
330727,Kit Infantozzi Pinta Tu Libro De Arte,$893
330716,Kit Infantozzi Vaporizador Con Crayolones,$837
799752,Juego Golazo Chau Pantallas,$490
330709,Divertite Infantozzi Pinta Con Tus Manos,$390
400532,Guitarra De Madera Hape Roja,$4.676
840414,Monopatín Bigjigs Fucsia,$4.000
330679,Masa Royal Colgante,$260
330728,Kit Infantozzi Divertite Con Arena Mágica,$893
755508,Jenga De Animales Con Tarjetas Y Dado,$1.229
755510,Bloques Letras Y Números Top Bright Madera 100 Unidades,$2.190
330698,Mi Primera Huerta Infantozzi 3 Macetas,$655
755412,Juego De Pizza De Madera Con Toppings,$1.590
755309,Juego De Pesca 26 Piezas,$1.439
755911,Proyector De Sistema Solar Didáctico,$2.260
678693,Tejo Bigjigs Con Puntuación,$2.080
755810,Kit De Excavación Tiranosaurio Rex,$1.470
755809,Juego De Pasteleria,$1.579
755512,Juego De Pesca 16 Piezas,$1.190
755209,Juego De Parrilla De Madera,$1.590
840417,Silla Bigjigs La Vaca,$3.400
678692,Sudoku De Madera Bigjigs,$1.720
840411,Silla Bigjigs La Oveja,$3.400
678882,Set De Playa De Silicona Bigjigs Verde,$1.320
679188,Set De Veterinaria Bigjigs,$1.440
678885,Set De Playa De Silicona Bigjigs Celeste,$1.400
840611,Silla Bigjigs El Cerdo,$3.400
840418,Pista Bigjigs Tren De Las Hadas,$3.200
840513,Monopatín Bigjigs Azul,$4.000
840512,Pack De 9 Vehículos Bigjigs,$2.040
678982,Set De Playa De Silicona Bigjigs Violeta,$1.320
840422,Jenga Bigjigs De La Jungla,$2.160
536533,Pan Jasmine Sin Gluten Tradicional Rodaja 350 G,$306
65659,Caramelos Cavendish Limón 200 G,$201
579686,Splenda Tinkerbell 200 G ,$399
19515,Chocolate M&m Mini Tubo 35.2 G,$64
778255,Té Canarias Negro Hebras 90 G,$71
12289,Batón Garoto De Chocolate Blanco,$18
791521,Chocolate Nestle Classic Amendoim 150 G,$194
314153,Chocolate Nestle Tabletasgalak 90 G,$128
517925,Té Canarias Negro Limón 10 Saquitos,$68
842409,Barra Nutsbar Coco 25 G,$44
19514,Chocolates M&m Peanut 40 G,$64
19857,Té Rojo 10 Saquitos La Selva,$69
14530,Guaco Cabral 20 G,$81
55625,Pasas De Uva Bib's 40 G,$41
21384,Té Equinacea Botica Del Señor 10 Saquitos,$96
36003,Chocolate Toblerone Leche 100 G,$197
493373,Funda Fanta Naranja 1 L 6 Unidades,$861
33644,Caramelos Sugus Masticales 150 G,$96
46245,Galletas Lulu Chocolate Y Dulce De Leche 115 G,$64
734559,Premezcla Deli For Life Pizza 340 G,$194
85984,Bombones Mella Rellenos Cereza 190 G,$264
604898,Endulzante Splenda Stevia Sobres 120 Unidades,$620
76789,Galletas Oreo 117 G,$79
708141,Funda Salus Frutte Naranja Sin Gas 600 Cc 6 Unidades,$366
90671,Té Verde Canarias 10 Saquitos,$68
864426,Chips De Papa Y Boniato Emigrante Sin Sal 75 G,$101
68556,Endulzante Tevias Polvo 50 Bastónes,$288
69832,Tableta De Chocolate Con Almendras Haas 0% 70 G,$131
88962,Galletas Nature Valley Oats & Honey 42 G,$69
13900,Palo Azul Botica Del Señor 75 G,$169
859820,Galletas Paulinas Clásicas Sin Harina 140 G,$110
76605,Yerba Baldo 1 Kg,$187
77451,Agua Saborizada Salus Cero Naranja 600 Cc,$63
562776,Endulzante Veracruz Naturevia Gotero 30 Ml,$277
529132,Mix Emigrante Nuéz + Almendras + Castañas + Maní 80 G,$85
80309,Té Cabral Carqueja 20 G,$81
483743,Cereal Vitalisimo Muesli Frutos Secos 450 G,$351
90661,Chocolate Milka Castana 55 G ,$81
712930,Monster Mango Loco 473 Ml,$99
605398,Silla Gamer Reclinable Negro Con Blanco,$7.499
605399,Silla Gamer Reclinable Negro,$7.499
85728,Té Manzanilla Con Miel Cabral 10 Saquitos,$88
862020,Funda Powerade Mountain Blast 600 Cc 6 Unidades,$270
662662,Jugo Cepita Fresh Pomelo 250 Cc,$28
825561,Powerade Naranja 600 Cc,$45
662661,Jugo Cepita Fresh Naranja 250 Cc,$28
838109,Powerade Mountain Blast 600 Cc,$45
499176,Funda Vitale Agua Con Gas 1.75l 4 Unidades,$134
573033,Funda Monster 473 Ml 6 Unidades,$593
504097,Bebida Silk De Coco Azucarada 946 Ml,$226
637125,Ades Manzana 1 L,$115
85096,Bidón Agua Salus 6.25 L,$138
430060,Powerade Manzana 500 Ml,$45
71219,Agua Salus Sin Gas 1 L,$70
501290,Funda Salus Con Gas 1.5 L 6 Unidades,$430
19784,Refresco Sprite 600 Cc,$63
77453,Agua Saborizada Salus Pomelo 600 Cc,$63
19779,Coca Cola 600 Cc,$63
77448,Agua Saborizada Salus Manzana Sin Gas 600 Cc,$63
493365,Funda Coca Cola Sin Azúcar 600 Ml 12 Unidades,$750
708140,Funda Salus Frutte Sin Azúcar Naranja 600 Cc 6 Unidades,$378
19540,Colado Heinz Manzana 113 G,$114
501291,Funda Salus Sin Gas 1.5 L 6 Unidades,$410
708132,Funda Agua Salus Saboriza Frutte Limónada 1.5 L 6 Unidades,$635
429660,Powerade Mountain Blast 995 Ml,$75
561876,Monster Zero Ultra 473 Ml,$99
632311,Salus Frutte Limónada Sin Azúcar 600 Cc,$63
499177,Funda Vitale Agua Sin Gas 1.75l 4 Unidades,$134
20626,Agua Salus Con Gas 600 Cc,$59
19780,Coca Cola Light 600 Cc,$63
41036,Coca Cola Zero 600 Ml,$63
708138,Funda Salus Frutte Manzana Sin Gas 600 Cc 6 Unidades,$366
77450,Agua Saborizada Salus Naranja Sin Gas 600 Cc,$63
493361,Funda Coca Cola Light 600 Cc 12 Unidades,$750
573032,Funda Monster Zero Ultra 473 Ml 6 Unidades,$593
84078,Schweppes Pomelo Sin Azúcar 500 Cc,$63
499877,Funda Salus Agua Sin Gas 2.25 L 6 Unidades,$442
20627,Agua Salus Sin Gas 600 Cc,$59
493375,Funda Aquarius Manzana Cero 1.5 L 6 Unidades,$578
420555,Jugo Citric De Frutas 250 Cc,$61
872866,Tableta Jumbo Garoto Crocante 80 G,$113
76628,Agua Vitale Con Gas 625 Ml,$47
19781,Refresco Sprite Zero 600 Cc,$63
872770,Tableta Jumbo Garoto Semi Amargo 80 G,$113
869549,Chocolate Kit Kat Conejito 87 G 3 Unidades,$159
869548,Huevo De Pascuas Garoto Opereta N°15 207 G,$399
869546,Huevo De Pascuas Garoto Batón Colors N°15 160 G,$399
763916,Huevo De Pascuas Nestlé Classic N°15 185 G,$299
860129,Chocolates Nestle Alpino 195 G,$401
760711,Conejo Kit Kat De Chocolate 29 G,$65
41673,Chocolate Milka Leger Almendra 45 G,$96
19515,Chocolate M&m Mini Tubo 35.2 G,$64
85496,Tableta Garoto Leche 100 G,$113
23500,Alfajor Oreo Triple 55 G,$48
678182,Alfajor La Paz Sin Gluten Chocolate Negro 80 G,$69
71798,Nestle After Eight Classic 200 G,$464
90249,Rocklets 40 G,$35
579491,Tableta De Chocolate Con Menta Haas 0% Azúcar 150 G,$244
55625,Pasas De Uva Bib's 40 G,$41
524130,Tableta Haas Chocolate Blanco 55 G,$85
19511,Barra M&m Snickers 45 G,$66
76163,Bombonera Garoto Surtida 300 G,$215
40260,Maní Con Chocolate Bib's 40 G,$41
23713,Alfajor Pepitos Triple 57 G,$48
525431,Tableta Haas Chocolate Leche 55 G,$85
63971,Chocante Bib's Con Chocolate 40 G,$41
19514,Chocolates M&m Peanut 40 G,$64
505004,Galletas Bon O Bon 95 G,$93
19513,Chocolate M&m Plain 52 G,$64
65046,Barra Twix 45 G,$63
525532,Tableta Haas Chocolate Semiamargo 55 G,$85
35061,Maní Con Chocolate Haas 70 G,$74
678181,Alfajor La Paz Sin Gluten Chocolate Blanco 80 G,$69
524129,Tableta Haas Con Almendras 55 G,$85
86176,Tableta De Chocolate Con Leche Haas 0% 20 G,$63
83816,Chocolate Haas Tableta 0% Blanco 70 G,$131
66872,Maní Con Chocolate Haas Con Leche 70 G,$74
780359,Auriculares Jbl Gamer Quantum 100,$3.120
329680,Alfajor Triple Terrabusi Torta 70 G,$48
485250,Lacta Bombonera 250 G,$172
814182,Barra De Sonido Xion 2.1 4000w,$3.200
612046,Parlante Jbl Flip 5 Azul,$6.320
38740,Chocolate Milka Leger Almendra 100 G,$151
30745,Obleas Bon O Bon Chocolate Blanco 30 G,$27
66873,Pasas Con Chocolate Haas 70 G,$87
80309,Té Cabral Carqueja 20 G,$81
599866,Auriculares Bluetooth Tws Blanco Tl1,$1.799
599872,Organizador De Cables Hasta 6 Verde,$99
599873,Organizador De Cables Hasta 6 Negro,$99
599867,Cargador Inalámbrico Magnetico A41,$1.299
599966,Micrófono Multifunción Rosa,$2.060
76606,Yerba Baldo 500 G,$100
48780,Té Malva Cabral 10 Saquitos,$79
599871,Organizador De Cables Hasta 6 Blanco,$99
34778,La Selva En Forma 10 Saquitos,$76
293885,Hierbas Relajantes Canarias 10 Saquitos,$68
562876,Endulzante Veracruz Naturevia 500 Pastillas,$760
85727,Té Manzanilla Con Menta Cabral 10 Saquitos,$88
13965,Manzanilla Cabral 10 Saquitos,$79
18067,Boldo La Selva 20 G,$90
21392,Té Verónica Botica Del Señor 25 Saquitos,$198
45560,Yerba Canarias 1 Kg,$190
30738,Miel Botica Del Señor 500 G,$245
13481,Carqueja 10 Saquitos La Selva,$67
27281,Sucralight 50 Sobres,$242
517925,Té Canarias Negro Limón 10 Saquitos,$68
7030,Verónica Botica Del Señor 35 G,$217
32562,Yerba Carnicera Botica Del Señor 25 G,$95
85724,Té Guaco Con Miel Cabral 10 Saquitos,$88
68556,Endulzante Tevias Polvo 50 Bastónes,$288
13519,Mixto La Selva 10 Saquitos,$67
17504,Yerba Carnicera La Selva 20 G,$90
79394,Té De Moringa Botica Del Señor 25 Saquitos,$198
21388,Té Manzanilla Botica Del Señor 10 Saquitos,$96
23869,Equinacea Botica Del Señor 40 G,$217
778354,Té Canarias Negro Cúrcuma-canela 10 Unidades,$68
32558,Té Eucaliptus En Hebras Botica Del Señor 15 G,$95
76625,Té Canarias Tilo 20 Sobres,$115
21384,Té Equinacea Botica Del Señor 10 Saquitos,$96
12012,Té De Tilo La Selva 10 Saquitos,$67
238023,Yerba Canarias Té Verde Y Jengibre 1 Kg,$210
85685,Té Antigripal Cabral 10 Saquitos,$88
13479,Manzanilla La Selva 10 Saquitos,$67
517625,Té Canarias Negro Frutos Rojos 10 Saquitos,$68
17014,Dulces Sueños La Selva 10 Saquitos,$76
820693,Juego Fifa 23 Para Ps4,$3.960
820694,Juego Fifa 23 Para Ps5,$4.760
21881,Sucralight Polvo 120 G,$418
617271,Endulzante Splenda Stevia Tinkerbell 180 G,$399
835608,Consola Play Station 5 + Juego Horizon Forbidden West,$58.040
715937,Fifa 22 Ps5,$4.000
39486,Té Quebra Pedra Cabral 30 G,$157
32555,Barba De Choclo Botica Del Señor 25 G,$101
616358,Auriculares Sony Inalámbricos Para P5 P4 Pulse 3d,$9.240
616257,Control Inalámbrico Dualsense Ps5,$4.960
637325,Juego Fifa 22 Para Ps4,$4.000
616357,Cámara Hd Ps5,$4.360
614354,Juego Ps4 Crash Bandicoot 4 Its About Time,$3.560
29924,Yerba Cabral Silueta Ideal 500 G,$135
736767,Microfibras Filgo Liner 038 Colores Surtidos 10 Unidades,$224
76619,Yerba Canarias Serena 250 G,$62
869550,Antifaz De Semillas Del Duende Frío-calor,$362
872566,Smart Watch Argom Skeiwatch S50,$3.229
872565,Banda Smart Watch Argom Skeiwatch B20 Negro Y Rosa,$2.659
