sku,name,price
60011,Crema Bagovit A Facial Uvb/uva 50 G,$1.109
51802,Crema Eucerin Ph5 75 G,$1.077
786701,Crema Isdin A.g.e. Reverse Night 50 G,$5.761
57994,Hidratante Facial Dermaglós Piel Seca 70 G,$901
817975,Kiehl's Powerfull-strength Dark Circle Reducing Vitamin C Eye Sérum 15 Ml,$3.000
29609,Crema Avene Nutritiva Compensadora 50 Ml,$2.789
86712,Crema Isdin Isdin Ceutics Flavo-c 30 Ml,$4.693
817947,Kiehl's Vital Skin-strengthening Hyaluronic Acid Super Sérum 30 Ml,$3.120
801660,Crema Para Labios Fillerina 12 Grado 4 15 Ml,$4.500
516625,Sérum Isispharma Neotone 30 Ml,$1.985
818012,Kiehl's Body Fuel All In One Wash 250 Ml,$1.690
295587,Sérum Eucerin Hyaluron Filler Ef Peeling 30 Ml,$3.582
859621,La Roche Posay Sérum Pure C + Sérum Hyalu B5 15 Ml,$3.800
326272,Sérum Isispharma Neotone 30 Ml,$2.805
89406,Crema Eucerin Hyaluron Filler + Elastic Noche 50 Ml,$3.358
21925,Crema La Roche Posay Lipikar Pain Surgras 150 G,$985
770127,Sérum Vichy Liftactiv Specialist B3 30 Ml,$3.990
49838,Crema Avene Hydrance Optimale Uv Riche 40 Ml,$2.248
582599,Sérum Vichy Liftactiv ácido Hialurónico Epidermic Filler 30 Ml,$3.990
801568,Gel De Ojos Y Párpados Fillerina 12 Grado 3 15 Ml,$6.200
65486,Loción Avene Micellar 200 Ml,$1.497
817930,Kiehl's Cucumber Herbal Conditioning Cleanser 150 Ml,$1.900
71792,Crema Vichy Liftactiv Supreme Piel Seca 50 Ml,$3.066
817968,Kiehl's Daily Reviving Concentrate 15 Ml,$2.300
818000,Kiehl's Buttermask For Lips 10 G,$1.500
89327,Crema Neovadiol Rose 65+ 50 Ml,$3.160
608816,Mineral 89 Probiotic Vichy 30 Ml,$2.550
90658,Crema La Roche Posay Hyalu B5 40 Ml,$3.990
502795,Sérum La Roche Posay Retinol B3 30 Ml,$3.990
277362,Crema Eucerin Hyaluron Filler Día Fps30 50 Ml,$3.358
845610,Bálsamo La Roche Posay Lipikar Eco 200 Ml,$1.525
325370,Crema Eucerin Anti-pigment Noche 50 Ml,$3.358
15855,Crema Dermur Effective Action 30 Ml,$979
550844,Crema Dermaglós Hidrosoluble 100 G,$916
40786,Contorno De Ojos Eucerin Hyaluron Filler 15 Ml,$2.542
15497,Leche Desmaquillante Avene 200 Ml,$1.677
89496,Loción Cerave Limpiadora E Hidratante 473 Ml,$1.020
801565,Gel Para Cuello Y Escote Fillerina 12 Grado 4 30 Ml,$6.900
70141,Crema Facial Dermaglós Mixta A Grasa Fps30 50 G,$709
767927,Sérum Vichy Liftactive Vitamin C 20 Ml,$2.279
60427,Contorno De Ojos La Roche Posay Redermic Hyalu C 15 Ml,$3.425
854813,Exfoliante Natura Siberica Facial 150 Ml,$895
801861,Gel De Ojos Y Párpados Fillerina 12 Grado 5 15 Ml,$7.800
58325,Crema La Roche Posay Effaclar M 40 Ml,$2.550
533533,Espuma De Limpieza Eucerin Dermato Clean Micelar 150 Ml,$1.459
817932,Kiehl's Rare Earth Deep Pore Daily Cleanser 150 Ml,$1.900
493260,Agua Micelar Vichy Piel Mixta Grasa 200 Ml,$1.785
42643,Emulsión De Limpieza Dermur 150 Ml,$790
817925,Kiehl's Caléndula Deep Cleansing Foaming Face Wash 230 Ml,$2.290
47630,Aceite De Ducha Eucerin Ph5 200 Ml,$941
818007,Kiehl's Men Facial Fuel Energizing Cleanser 250 Ml,$1.640
10830,Desmaquillante Vichy Pureté Thermale 3 En 1 200 Ml,$1.970
729254,Limpiador Facial Anti-rugosidades Cerave 236 Ml,$825
84927,Loción Micellar Avene Cleanance 400 Ml,$1.865
41357,Crema Eucerin Facial Antienrojecimiento 50 Ml,$2.448
817933,Kiehl's Ultra Facial Cleanser 150 Ml,$1.890
434664,Tónico Isispharma Aquaruboril 250 Ml,$1.385
302321,Agua Termal La Roche Posay 300 Ml,$2.000
63744,Gel Dermur Espuma Purificante 150 Ml,$908
76856,Agua Micellar Eucerin 3 En 1 200 Ml,$1.397
73766,Gel Vichy Purete Thermal Nettovant 200 Ml,$1.970
23012,Tónico Vichy Normaderm Astringente 200 Ml,$1.800
817936,Kiehl's Caléndula Herbal-extract Alcohol-free Toner 250 Ml,$2.620
493160,Agua Micelar Vichy Piel Sensible 200 Ml,$1.785
88916,Gel Limpiador Eucerin Dermopure Oil Control 200 Ml,$1.024
523328,Gel De Limpieza La Roche Posay Effaclar Duo+ Clean 400 Ml,$1.900
10834,Agua Termal Vichy Mineralizante Brumisateur 150 G,$1.400
818008,Kiehl's Facial Fuel Energizing Scrub 100 Ml,$1.530
817926,Kiehl's Caléndula Herbal-extract Alcohol-free Toner 125 Ml,$1.640
729354,Crema Limpiadora Cerave Espuma Hidratante 236 Ml,$725
42644,Emulsión De Limpieza Dermur 250 Ml,$1.147
37555,Leche De Limpieza Dermaglós 200 Ml,$955
85048,Gel De Limpieza La Roche Posay Effaclar Gel Pieles Grasas 400 Ml,$1.900
502795,Sérum La Roche Posay Retinol B3 30 Ml,$3.990
510223,Fortalecedor De Uñas Isdin Si Nails Varnish 2.5 Ml,$2.916
817317,Desmaquillarte Dermaglós De Ojos 100 Ml,$608
817978,Kiehl'snightly Refiningmicro-peel Concentrate 30 Ml,$3.600
80165,Espuma De Limpieza Avene Matificante 150 Ml,$1.654
613952,Gel Exfoliante Avene 75 Ml,$1.556
41658,Solución Miscellaire La Roche Posay Physiologique 200 Ml,$2.200
817937,Kiehl's Ultra Facial Toner 250 Ml,$1.400
550844,Crema Dermaglós Hidrosoluble 100 G,$916
75261,Crema Eucerin Aquaporin Active Piel Normal A Mixta 50 Ml,$1.725
73792,Mousse Vichy Purete Thermale 150 Ml,$1.840
29609,Crema Avene Nutritiva Compensadora 50 Ml,$2.789
80423,Shampoo Vichy Dercos Anticaspa Cabello Seco 200 Ml,$1.325
880776,Bagovit Reafirmante Efecto Tensor 350 G,$871
595630,Ampollas Isdin Pigment Expert & Night Peel 20 Unidades,$6.039
11309,Loción Avene Limpieza Pieles Intolerantes 200 Ml,$1.788
16974,Crema Dermur Effective Párpados 20 Ml,$1.575
800663,Ampolla Crescina Tratamiento Completo Dama 1300 20 Unidades,$11.900
800656,Shampoo Crescina Re-crecimiento Caballero 200 Ml,$1.600
82408,Ampollas Vichy Dercos Aminexil Para Mujer 12 Unidades,$4.990
800657,Ampolla Crescina Tratamiento Completo Caballero 200 20 Unidades,$5.900
43239,Leche La Roche Posay Lipikar Con Válvula 400 Ml,$2.300
800660,Ampolla Crescina Tratamiento Completo Dama 500 20 Unidades,$8.900
54355,Crema Dermur Azuleno 60 Ml,$941
49837,Protector Solar Avene Spray Niños Fps50+ 200 Ml,$2.025
800659,Ampolla Crescina Transdérmica Dama 500 20 Unidades,$9.400
800658,Ampolla Crescina Transdérmica Caballero 500 20 Unidades,$9.400
800662,Ampolla Crescina Transdérmica Caballero 1300 20 Unidades,$12.300
800758,Ampolla Crescina Transdérmica Caballero 200 20 Unidades,$5.900
801563,Crema De Día Fillerina 12 Grado 3 50 Ml,$4.500
57809,Tratamiento La Roche Posay Substiane (+) Ojos 15 Ml,$3.200
801763,Crema De Noche Fillerina 12 Grado 5 50 Ml,$6.200
800759,Ampolla Crescina Transdérmica Dama 200 20 Unidades,$5.900
91612,Concentrado Isispharma Geneskin C Premium 10 Ml,$3.355
65028,Actipur Crema A.i. Dorado 30 Ml,$1.580
68574,Shampoo Eucerin Dermocapillaire Revitalizante 250 Ml,$1.087
306924,Crema Isispharma Sensylia 40 Ml,$1.810
800760,Ampolla Crescina Tratamiento Completo Dama 200 20 Unidades,$5.900
493260,Agua Micelar Vichy Piel Mixta Grasa 200 Ml,$1.785
800961,Ampolla Crescina Tratamiento Completo Caballero 500 20 Unidades,$8.900
859620,La Roche Posay Aqua Gel Hyalu B5 50 Ml + Sérum Hyalu B5 15 Ml,$4.100
326373,Gel Isispharma Neotone 150 Ml,$1.625
818480,Shampoo Vichy Dercos Anti-caspa Cabello Seco 390 Ml,$1.900
801061,Ampolla Crescina Transdérmica Caballero 1300 20 Unidades,$11.900
801060,Ampolla Crescina Transdérmica Dama 1300 Ml,$12.300
512122,Protector Solar Isis Pharma Uveblock Mineral Color Fps50 40 G,$1.535
35810,Autobronceante Avene Naranja 100 Ml,$1.605
861420,Protector Solar La Roche Posay Rostro Anthelios Ka+ Fps50 50ml,$2.300
70305,Crema Pigmentclar Soin Joun Fps30 40 Ml,$3.780
785194,Protector Solar Vichy Capital Soleil Uv Age Teint Light Fps50 40 Ml,$1.875
35451,Protector Solar Dermaglós Fps30 250 Ml,$851
58896,Protector Solar Vichy Capital Soleil Toque Seco Fps50+ 50 Ml,$1.875
76602,Protector Solar Isispharma Uveblock Fluido Invisible Fps50 40 Ml,$1.425
35804,Protector Solar Avene Leche Fps50+ 100 Ml,$1.777
812371,Protector Solar La Roche Posay Anthelios Uv Mune 400 Hidratante Fps50+ 50 Ml,$2.050
46269,Protector Solar Eucerin Sun Spray Niños Fps50 200 Ml,$1.850
726553,Fluido Avene Sport Fps50+ 100 Ml,$1.759
822302,Protector Solar Vichy Capital Soleil Spray Fps30+ 200 Ml,$950
46265,Protector Solar Eucerin Sun Facial Piel Seca Y Sensible Fps50 50 Ml,$1.950
86708,Crema Isdin Eryfotona Ak-nmsc Fluid Fps99 50 Ml,$3.846
13001,Protector Solar Dermaglós Crema Fps65 90 G,$926
43620,Protector Solar Dermur Infantil Fps30 150 Ml,$875
54812,Protector Solar Vichy Capital Soleil Toque Seco Fps30 50 Ml,$1.875
558578,Protector Solar Eucerin Sun Corporal Loción Toque Seco Fps50 200 Ml,$1.850
66637,Protector Solar Umbrella Plus Spray Fps50+ 120 G,$1.573
84556,Protector Solar La Roche Posay Anthelios Toque Limpio Color Fps50+ 50 Ml,$2.050
627106,Protector Solar Eucerin Toque Seco Tono Medio Fps50 50 Ml,$1.950
67134,Protector Solar Dermur Spray Fps30 180 Ml,$1.234
818378,Protector Solar La Roche Posay Anthelios Eco Fps50+ 250 Ml,$2.350
80573,Protector Solar Vichy Ideal Soleil Facial Anti Manchas Fps50+ 50 Ml,$1.875
91398,Protector Solar La Roche Posay Anthelios Bruma Invisible Fps50+ 75 Ml,$1.680
328676,Protector Solar Umbrella Urban Fps50+ 50 G,$1.975
603612,Protector Solar Vichy Uv Age Fps50 40 Ml,$1.875
512123,Protector Solar Isispharma Uveblock Spray Fps50 200 Ml,$1.770
35452,Protector Solar Dermaglós Fps40 250 Ml,$881
54695,Protector Solar Dermur Fps30+ 250 Ml,$1.306
46271,Protector Solar Eucerin Sun Crema Con Color Fps50 50 Ml,$2.060
86710,Protector Solar Facial Isdin Fusion Water Fps50+ 50 Ml,$2.626
398628,Protector Solar Dermaglós Fps30 380 Ml,$906
811971,Protector Solar La Roche Posay Anthelios Uv Mune 400 Hidratante Fps50+ 50 Ml,$2.050
614957,Protector Solar Medclinical Fps30 500 G,$1.089
822303,Protector Solar Vichy Capital Soleil Kids Water Resistant Spray Fps50+ 200 Ml,$950
74114,Protector Solar Eucerin Sun Toque Seco Fps50 50 Ml,$1.950
614858,Protector Solar Medclinical Fps60 500 G,$1.245
20505,Autobronceante Vichy Idéal Soleil Rostro 100 Ml,$1.900
795539,Protector Solar Anthelios La Roche Posay Pigment Correct Fps50+ 50 Ml,$2.100
603795,Set Perfume Play Vibrant Edt 50 Ml + Gel De Ducha 100 Ml,$481
9535933,Protector Solar Anthelios Mineral One 30 Ml,$1.820
767321,Perfume Adolfo Dominguez Terracota Musk Edp 120 Ml,$2.635
603792,Perfume Desire Grey For Men Edt 50 Ml + Desodorante En Aerosol 150 Ml,$934
361715,Perfume Hugo Boss The Scent Absolute For Him Edp 100 Ml,$6.510
50180,Perfume Carolina Herrera 212 Vip Women Edp 50 Ml,$5.090
81490,Perfume Live París Femme Edt 50 Ml,$566
588117,Perfume Armani My Way Edp 90 Ml,$6.876
967186,Perfume Polo Red Edt,$2.398
605599,Perfume Armani Code Man Edp 60 Ml,$5.072
619078,Perfume Armani Terra Di Gioia Femme Edp 100 Ml,$5.548
566312,Perfume Si Passione Intense Femme Edp 50 Ml,$4.167
605699,Perfume Armani Code Man Edp 30 Ml,$2.980
566310,Perfume Si Passione Intense Femme Edp 100 Ml,$5.055
605698,Perfume Armani Code Man Edp 110 Ml,$6.288
566311,Perfume Si Passione Intense Femme Edp 30 Ml,$2.781
40928,Perfume Paco Rabanne Black Xs Men Edt 50 Ml,$3.880
619080,Perfume Armani Terra Di Gioia Femme Edp 50 Ml,$4.260
619079,Perfume Armani Terra Di Gioia Femme Edp 30 Ml,$3.064
578884,Perfume Emporio Armani Stronger With You Freeze He Edt 100 Ml,$3.236
578885,Perfume Emporio Armani Stronger With You Freeze He Edt 50 Ml,$2.504
588115,Perfume Armani My Way Edp 30 Ml,$3.364
588116,Perfume Armani My Way Edp 50 Ml,$5.288
25857,Perfume Cacharel Amor Amor Edt 50 Ml,$3.790
836909,Own Wonder Peony Eau De Parfum 50 Ml,$794
674176,Perfume Carolina Herrera Bad Boy Man Edt 50 Ml,$4.850
14024,Perfume Ralph Lauren Femme Edt 30 Ml,$1.848
667362,Perfume Armani New Si Intense Femme Edp 30 Ml,$3.968
674276,Perfume Carolina Herrera Very Good Girl Edp 30 Ml,$4.096
674277,Perfume Carolina Herrera Very Good Girl Edp 50 Ml,$5.981
674576,Perfume Carolina Herrera Bad Boy Man Edt 100 Ml,$6.465
689088,Perfume Azzaro Sport Edt 100 Ml Edición Limitada,$2.080
67633,Perfume Armani Si Edp 50 Ml,$5.292
67634,Perfume Armani Si Edp 100 Ml,$6.876
666670,Perfume Armani New Si Intense Femme Edp 50 Ml,$5.556
666964,Perfume Armani New Si Intense Femme Edp 100 Ml,$7.212
737466,Perfume Valentino Born In Roma Yellow Donna Edp 30 Ml,$3.640
652440,Perfume Casapueblo Vip Shine For Her Edt 100 Ml,$780
566024,Perfume Mistral Ocean Vibes Edt 50 Ml + Bálsamo 100 G,$688
737565,Perfume Valentino Born In Roma Yellow Donna Edp 50 Ml,$5.180
737666,Perfume Valentino Voce Viva Edp 50 Ml,$5.180
830207,Gel Crema L'oréal Revitalift Con ácido Hialurónico Antibrillo 50 Ml,$1.319
818019,Kiehls Men Oil Elim 24h No Shin Gel 75 Ml,$1.680
818016,Kiehl's Age Defender Power Sérum For Men 75 Ml,$2.840
818015,Kiehl's Men Age Defender Eye Repair 14 Ml,$2.040
615059,Crema Payot Roselift Collagene Nuit 50 Ml,$4.290
818013,Kiehl's Age Defender Cream Moisturizer 50 Ml,$3.000
328383,Crema Lancôme Rénergie Multi-lift Ultra Fps15 50 Ml,$5.650
817989,Kiehl's Ultra Light Daily Uv Defense Facial Sunscreen Spf50+ 30 Ml,$1.960
817950,Kiehl's Vital Skin-strengthening Hyaluronic Acid Super Sérum 100 Ml,$7.520
817946,Kiehl's Retinol Skin-renewing Daily Micro-dose Sérum 50 Ml,$5.350
615056,Sérum Payot L'authentique Potenciador 50 Ml,$6.990
501594,Crema Hidratante Pamela Grantskinfood Piel Seca 200 Ml,$345
47913,Crema Lancôme Genifique Active Jeunesse 50 Ml,$5.140
870660,Crema Cicatricure Anti-age Fps50 50 G,$1.049
46250,Crema Matías González Germinal 50 Cc,$2.070
81385,Crema Con Color Cicatricure Beauty Care 50 G,$779
824408,Contorno De Ojos Varens Beaute 15 Ml,$775
46188,Crema Revitalift Stimulisft Día 50 Ml,$1.269
605603,Crema Lancôme Genifique New Eye Cream N°15 Ml,$3.780
89467,Crema Nivea Face Antiarrugas + Reafirmante +45 Años 50 Ml,$856
314545,Crema L'oréal Revitalift ácido Hialurónico Noche 50 Ml,$1.319
676577,Gel De Día Nivea Rose Care 50 Ml,$778
601887,Sérum Express Aclara Garnier 30 Ml,$852
817943,Kiehl's Clearly Corrective Dark Spot Corrector 50 Ml,$4.590
824308,Crema Varens Beaute Facial Piel Radiante 40 Ml,$775
65040,Crema Lancôme Absolue Bx Nuit 75 Ml,$12.535
58119,Crema L'oréal Age Perfect Nutrición Intensa Noche 50 Ml,$1.689
865632,Sérum Isdin Flavo-c Forte 5.3 Ml,$4.763
79973,Crema L'oréal Hidra Total 5 Arrugas +45 Años 50 Ml,$1.049
654550,Gel Revitalift ácido Hialurónico 150 Ml,$519
435665,Crema Cicatricure Gold Lift Noche 50 G,$1.403
295089,Crema L'oréal Revitalift Día Fps30 50 Ml,$1.269
785295,Crema De Ojos L'oréal Age Perfect Cell Renewal Creme Yeux 15 Ml,$1.299
856816,Aceite Facial Cryosmetics Día 30 Ml,$2.100
818019,Kiehls Men Oil Elim 24h No Shin Gel 75 Ml,$1.680
818015,Kiehl's Men Age Defender Eye Repair 14 Ml,$2.040
54355,Crema Dermur Azuleno 60 Ml,$941
767321,Perfume Adolfo Dominguez Terracota Musk Edp 120 Ml,$2.635
291378,Crema Lancôme Absolue Rich 60 Ml,$11.535
987932,Labial Vogue Líquido Colorissimo,$335
37555,Leche De Limpieza Dermaglós 200 Ml,$955
89174,Concentrado Matías González Enriquecido Acido Hialurónico 15 Cc,$1.231
588317,Pure Shots Yves Saint Laurent Uv Defender 30 Ml,$3.125
418453,Esmalte New Color N°6.10 12 Ml,$69
817965,Kiehl's Skin Rescuer Daily Hydrator 75 Ml,$2.730
427759,Labial Maybelline Super Stay Ink Crayon N°05 Live On The Edge,$615
46271,Protector Solar Eucerin Sun Crema Con Color Fps50 50 Ml,$2.060
631410,Sérum Lancôme Genifique Sensitive 20 Ml,$4.330
15497,Leche Desmaquillante Avene 200 Ml,$1.677
778854,Contorno De Ojos Lancôme Genifique Light Pearl Eyes 20 Ml,$4.300
89043,Jabón En Barra Vichy Normaderm 70 G,$450
259233,Labial New Color Matte N°01 Cocoa,$247
536635,Ampollas Isdin Instant Flash Efecto Lifting 5 Unidades,$2.975
38087,Quita Esmalte Babaria 200 Ml,$256
50699,Desmaquillante Bifásico Nivea Ojos 125 Ml,$489
510424,Labial Yves Saint Laurent Rouge Pur Couture The Slim N°11,$2.485
880776,Bagovit Reafirmante Efecto Tensor 350 G,$871
873973,Cofre Fillerina 12 Grado 5 + Crema De Día 50 Ml,$10.200
73558,Esmalte Vogue Fantastic Caricia 10 Ml,$105
11137,Perfume Lancôme Poême Femme Edp 30 Ml,$3.808
46249,Crema Matías González De Caviar 50 Ml,$2.676
91429,Labial Maybelline Super Stay Matte Ink N°15 Lover,$799
59624,Perfume Rue Pergolese Night Edp 50 Ml,$1.700
853724,Sombra Physicians Melt-allic Precious Purple,$489
824307,Crema Varens Beaute Tratamiento Facial Nutritivo 40 Ml,$775
86712,Crema Isdin Isdin Ceutics Flavo-c 30 Ml,$4.693
825213,Labial Maybelline Super Stay Vinyl Ink N°20 Coy,$829
42940,Máscara Oro Matías González Anti-arrugas 50 Cc,$1.532
318365,Esmalte Base Coat New Color Reparadora Con Queratina 9 Ml,$125
71215,Perfume Rock By Shakira Women Edt 80 Ml,$1.670
79589,Tónico Biotherm Biosource Lotion Adoucissante Piel Sensible 200 Ml,$1.815
9617804,Brillo Maybelline Lifter Gloss,$695
310740,Esmalte Carey Ciruela 9 Ml,$77
78162,Toallitas Desmaquillantes Neutrógena Night Calming 25 Unidades,$352
57713,Perfume Isa Edp 100 Ml,$1.377
818019,Kiehls Men Oil Elim 24h No Shin Gel 75 Ml,$1.680
818016,Kiehl's Age Defender Power Sérum For Men 75 Ml,$2.840
57804,Tratamiento La Roche Posay Substiane (+) Uv 40 Ml,$4.300
818015,Kiehl's Men Age Defender Eye Repair 14 Ml,$2.040
818013,Kiehl's Age Defender Cream Moisturizer 50 Ml,$3.000
328383,Crema Lancôme Rénergie Multi-lift Ultra Fps15 50 Ml,$5.650
46188,Crema Revitalift Stimulisft Día 50 Ml,$1.269
51484,Crema La Roche Posay Kerium Ds 40 Ml,$1.715
89436,Crema Collistar Biorevitalizante 50 Ml,$3.540
603594,Crema Facial Cicatricure Age Care Aclarante 50 Ml,$549
35325,Perfume Armani Code Donna Femme Edp 50 Ml,$4.672
356616,Máscara Purederm Shiny & Soft Foot Peeling,$530
781761,Sérum Cicatricure Gold Lift 27 Ml,$1.399
824409,Tratamiento Facial Varens Beaute Hidratante 40 Ml,$775
817929,Kiehl's Rare Earth Deep Pore Daily Cleanser 75 Ml,$1.310
817951,Kiehl's Ultra Facial Cream 50 Ml,$2.300
65810,Bb Cream Biotherm Source Peau Fonce 30 Ml,$2.310
449573,Mascarilla Nivea Arcilla 3 En 1 150 Ml,$489
50699,Desmaquillante Bifásico Nivea Ojos 125 Ml,$489
840310,Protector Solar L'oréal Uv Defender Fluido Claro Fps50+ 40 G,$848
866835,Neutrógena Hydroboost Facial Fps25 40g,$918
80518,Crema Matías González Caviar Contorno De Ojos 15 Cc,$1.916
527432,Crema Sri Sri Hidratante Rosas Y Aloe 150 G,$590
401131,Gel Collistar Fango Anticelulítico 400 Ml,$3.350
603594,Crema Facial Cicatricure Age Care Aclarante 50 Ml,$549
82875,Loción Clinique Clarifying Lotion 2 400 Ml,$2.300
578985,Máscara Purederm Vegan Green Tea Mud 1 Unidad,$210
90231,Máscara Purederm Black Gel 1 Unidad,$273
772034,Parches Ojos Iroha Nature Biodegradable 2 Unidades,$195
618598,Agua Micelar Neutrógena Hydroboost 400 Ml,$739
89462,Crema L'oréal Age Perfect Rosy Tone 48 G,$1.689
91271,Gel Cosrx Limpiador Facial 150 Ml,$1.050
817925,Kiehl's Caléndula Deep Cleansing Foaming Face Wash 230 Ml,$2.290
817947,Kiehl's Vital Skin-strengthening Hyaluronic Acid Super Sérum 30 Ml,$3.120
384022,Exfoliante Veganis Pera Silvestre 500 Ml,$580
291379,Crema Contorno De Ojos Lancôme Absolue 20 Ml,$8.010
771827,Calcetines Pies Y Uñas Iroha Nature Durazno 1 Par,$415
304321,Crema Payot Anti-edad Global Suprúme Jeunesse Día 50 Ml,$5.450
435665,Crema Cicatricure Gold Lift Noche 50 G,$1.403
675976,Leche Y Tónico Micelar Nivea Rose Care 200 Ml,$597
42230,Gel Anti-edad Matías González Con Colágeno 50 Ml,$953
42938,Emulsión Humectante Matías González 140 Cc,$711
314548,Crema L'oréal Revitalift Día ácido Hialulronico 50 Ml,$1.319
347812,Máscara Hortensia Waffle Maple 1 Unidad,$250
824311,Contorno De Ojos Mathias Gonzalez Avena 20 Ml,$1.080
618598,Agua Micelar Neutrógena Hydroboost 400 Ml,$739
65039,Crema Lancôme Absolue Bx Fps15 50 Ml,$10.800
68963,Exfoliante De Rostro Six Puntos Negros 110 G,$255
82877,Loción Clinique Clarifying Lotion 3 400 Ml,$2.300
90685,Esponja Hortensia Konjac Arcilla Verde,$360
530732,Agua Micellar Garnier Rosas 400 Ml,$450
527533,Gel De Limpieza Sri Sri Facial Rosas 100 G,$359
863426,Limpiador Facial Biotherm Cera Repair Foam Cleanser 150 Ml,$1.890
303221,Loción Payot Tonique Reveil 200 Ml,$1.130
90495,Esponja Hortensia Konjac Roja,$360
31276,Desmaquillante De Ojos Bifásico Lancôme Bi-facil 125 Ml,$2.025
429861,Gel Payot Gommag Douce Framboise 50 Ml,$1.800
89440,Desmaquillante Collistar Bi-face 200 Ml,$1.400
42950,Crema De Limpieza Matías González Anti-edad 50 Ml,$719
362715,Concentrado Clinique Id Active Cartridge Concentrate For Fatigue 10 Ml,$1.200
605497,Leche De Limpieza Pamela Grant Skinfood 200 Ml,$464
280765,Agua Micelar Neutrógena 200 Ml,$434
41096,Exfoliante Neutrógena Deep Clean 100 G,$543
818018,Kiehl's Men's Oil Eliminator Deep Cleansing Exfoliating Face Wash 200 Ml,$1.860
42238,Loción Tónica Matías González De Hamamelis 200 Ml,$656
588620,Agua Micellar Purederm Cleansing 250 Ml,$301
31271,Tónico Hidratante Lancôme Tonique Douceur 200 Ml,$2.025
269537,Espuma De Limpieza Matías González De Arandanos 160 Ml,$754
801260,Agua Micelar Neutrógena Hydroboost 200 Ml,$434
70219,Gel L'oréal Hidra Total 5 Equilibrante 150 Ml,$639
42779,Limpiador Lancôme Pure Rituel Confort Mousse 125 Ml,$2.225
82875,Loción Clinique Clarifying Lotion 2 400 Ml,$2.300
83870,Desmaquillante Clinique Take The Day Off 125 Ml,$1.650
362515,Loción Clinique Id Dramatically Differentmoisturizing Lotion+ 10 Ml,$2.150
618599,Agua Micelar Neutrógena Hydroboost Bifásica 200 Ml,$488
60202,Gel Exfoliante Six Para Manos 110 G,$190
38212,Toallitas Desmaquillantes Neutrógena 25 Unidades,$352
536834,Esponja Hortensia Konjac Limpieza Corporal,$416
967186,Perfume Polo Red Edt,$2.398
309739,Agua Micelar Bifásica Garnier Skin Active 400 Ml,$481
86922,Perfume Legacy N°3 Black Edt 50 Ml + Desodorante 150 Ml,$950
90496,Esponja Hortensia Konjac Blanca,$360
32582,Jabón Neutrógena Deep Clean 80 G,$150
527632,Gel Sri Sri Limpiador Facial Pepino Y Limón 100 G,$288
82872,Loción Clinique Clarifying Lotion 1 200 Ml,$2.300
854021,Gel Limpieza Facial Natura Siberica C Berrica 145 Ml,$1.142
90167,Agua Micelar L'oréal Dermo Expertise Bifásica 200 Ml,$539
90047,Espuma De Afeitar Urban Care 149 G + Bálsamo After Shave 100 G,$400
88422,Perfume Azzaro Wanted Man Edt 50 Ml,$4.420
90242,Espuma De Afeitar Urban Care Unlimited Deep Blue 149 G + Bálsamo 100 G,$400
90241,After Shave Urban Care Unlimited Deep Blue 75 Ml + Espuma De Afeitar 149 G,$467
266037,Perfume Jean Paul Gaultier Le Male Men Edt 125 Ml,$5.405
87520,Set Perfume Casapueblo 24hrs Green Edt 100 Ml + Gel De Ducha 100 Ml,$758
90244,Espuma De Afeitar Urban Care Extreme 149 G + Bálsamo After Shave 100 G,$400
603792,Perfume Desire Grey For Men Edt 50 Ml + Desodorante En Aerosol 150 Ml,$934
603795,Set Perfume Play Vibrant Edt 50 Ml + Gel De Ducha 100 Ml,$481
285579,Perfume Abercrombie & Fitch First Instinct Men Edt 30 Ml,$1.175
505510,Perfume Issey Miyake L'eau D'issey Igo 80 Ml,$8.600
566024,Perfume Mistral Ocean Vibes Edt 50 Ml + Bálsamo 100 G,$688
285768,Perfume Abercrombie & Fitch First Instinct Men Edt 50 Ml,$1.600
639128,Perfume Ralph Lauren Ralph's Club Edp 30 Ml,$2.695
782472,Perfume Azzaro Chrome Man Edp 100 Ml,$3.245
767721,Cofre Yves Saint Laurent Libre Edp 90 Ml + Mini Máscara + Mini Labial,$5.888
785596,Cofre Acqua Di Gio Edt 50 Ml + Gel + Crema 75 Ml,$3.672
566019,Set Man Private Brave Edt 50 Ml + Desodorante 150 Ml,$539
538933,Perfume Le Jean Paul Gautier Beau Man Edt 125 Ml,$5.680
566021,Set Man Private Wild Edt 50 Ml + Desodorante 150 Ml,$539
619386,Perfume Azzaro The Most Wanted Intense Man Edp 100 Ml,$6.600
822201,Perfume Azzaro The Most Wanted Edp 50 Ml,$5.320
674176,Perfume Carolina Herrera Bad Boy Man Edt 50 Ml,$4.850
822301,Perfume Azzaro The Most Wanted Edp 100 Ml,$7.050
652240,Perfume Make It Fun Random Man Edt 45 Ml,$355
674576,Perfume Carolina Herrera Bad Boy Man Edt 100 Ml,$6.465
652344,Perfume Casapueblo Vip Shine For Him Edt 100 Ml,$893
236619,Set Perfume Casapueblo Navy Blue Edt 100 Ml + Gel De Ducha 100 Ml,$826
689088,Perfume Azzaro Sport Edt 100 Ml Edición Limitada,$2.080
503507,Perfume Giorgio Armani Acqua Di Gio Profondo Man Edp 40 Ml,$2.936
835208,Set Carolina Herrera Bad Boy Edt 100 Ml + Minitalla 10 Ml + Shower Gel 100 Ml,$6.460
578884,Perfume Emporio Armani Stronger With You Freeze He Edt 100 Ml,$3.236
605599,Perfume Armani Code Man Edp 60 Ml,$5.072
605698,Perfume Armani Code Man Edp 110 Ml,$6.288
652040,Perfume Make It Fun Euphoric Man Edt 45 Ml,$355
605699,Perfume Armani Code Man Edp 30 Ml,$2.980
43897,Base En Crema Max Factor Miracle Touch N°060 Sand,$909
673875,Pack Perfume Carolina Herrera 212 Vip Men Edt 100 Ml + Gel De Ducha 100 Ml,$5.645
376720,Delineador De Ojos Idi N°04 White,$290
825306,Base Yves Saint Laurent All Hours Foundation N°mw9 Medium Warm 25 Ml,$3.675
372320,Perfume Giorgio Armani Code Absolu Man Edp 110 Ml,$6.160
507918,Labial Vogue Super Fantastic Vanidosa,$209
85739,Base Lancôme Teint Idole Ultra Wear Fps15 N°06 30 Ml,$3.495
54767,Corrector Fit Me N°25 Medium,$649
292977,Labial Max Factor Lipfinity Velvet Matte N°045 Posh Pink,$700
328272,Polvo Maybelline Fit Me Matte+poreless N°312 Golden,$705
88959,Sombra Idi Hd Professional N°21 Smoke Brown,$369
864025,Base Vogue Essential Avellana 25 Ml,$250
824607,Iluminador Lancôme Teint Idole Stick N°03,$3.105
824415,Iluminador Lancôme Teint Idole Stick N°01,$3.105
574354,Labial Wet N Wild Megalast N°1432 Strawberry,$329
73202,Máscara De Pestañas Maybelline Lash Sensational Washable Very Black,$1.059
602793,Sombra Individual Vogue Carioca,$230
49353,Delineador De Ojos L'oréal Infallible N°591 Carbón Black,$1.080
862221,Bronzer L'oréal Infallible 24h Soft Matte N°400 Tan,$939
323863,Labial Maybelline Color Sensational Made For N°370 All Spice For Me,$525
89318,Delineador De Ojos Idi Gel Negro,$674
83321,Base Cremosa New Color Brunette 30 Ml,$406
507919,Labial Vogue Super Fantastic Matte Elegante,$209
43899,Base En Crema Max Factor Miracle Touch N°075 Golden,$850
323268,Labial Maybelline Color Sensational Made For N°379 All Fuchsia For Me,$525
46809,Máscara De Pestañas Lancôme Hypnose Drama N°01,$2.120
89914,Base Baolishi Con Atomizador N°4,$295
825119,Polvo Compacto Maybelline Fit Me Ultimate Powder N°235 Pure Beige Medium,$849
82855,Polvo Compacto Clinique Stay-matte Sheer Pressed Powder N°03 Stay Beige,$2.450
34224,Labial Mentovap Manteca De Cacao,$159
619390,Labial Idi Ultra Hd N°29 So Ruby,$287
