sku,nombre,precio
784495,Libro Paw Patrol Rompecabezas Cuartel Cachorro,$430
339700,Medias Unisex Akas Little Oneset 0 A 3 Meses 2 Unidad,$153
800754,Sonajero Akas Elefante Crochet Con Aro Rosa,$675
287058,Lapiceras Diferentes Colores,$5
603493,Cochecito Carestino Ferro Accesorios Mora,$29.699
723441,Témpera Acrilex 2012 12 Colores 15 Ml,$199
757710,Libro A Jugar Con Perezosos Y Flamencos,$199
613249,Peluche Elefante Rosa O Celeste,$486
587421,Cuerda Evolution De Saltar Regulable,$201
619073,Crema Biotherm Cera Repair 50 Ml,$2.500
800752,Peluche Tiracuerdas Akas Animales Zorro,$837
35444,Guantes Cirugía Estéril N°7 1 Par,$36
616881,Inflable Para Niños Sunnylife Cocodrilo,$1.290
36752,Desodorante En Barra Old Spice Vip 50 G,$199
400531,Guitarra De Madera Hape Azul,$5.285
35445,Guantes Cirugía Estéril N°8 1 Par,$36
590222,Carro Organizador Con Estantes Y Ruedas Blanco,$2.490
563380,Set 3 Piezas Spiderman Bamboo,$249
888098,Aranuri Matías González 30 Comprimidos,$966
37946,Desodorante En Aerosol Desire Black For Men 150 Ml,$203
616865,Inflable Circular Sunnylife Wild Xl,$1.390
36464,Gel Fijador Fix Lavanda 120 G,$81
615059,Crema Payot Roselift Collagene Nuit 50 Ml,$4.290
635518,Nutrilon Proexpert Comfort Omneo 400 G,$948
289876,Desodorante En Crema Etiquet Hombre 60 G,$123
757624,Libro En El Campo Block Para Pintar,$219
800652,Peluche Akas Con Música Y Luz Rosa,$936
723439,Marcadores Luxor Truco Divertido 8 Unidades,$169
563978,Limpiador Líquido Multisuperficies Glade Bosques De Pino Botella 900 Ml,$101
36468,gel Fijador Fix Natural 120 G,$81
681884,Libro Isadora Moon Y Los Vestidos Mágicos (m4),$580
31597,Vimax Masticable 50 Mg 4 Comprimidos,$456
650337,Vasos De Almacenaje Suavinex 10 Unidades,$1.334
361015,Royal Art&craft Almohadon Flores,$368
724341,Set Escritura Princesas 6 Piezas,$130
652340,Gomita De Pelo Top Naranja / Violeta 1 Unidad,$219
681601,Libro Tiempo De Perdón,$990
757518,Libro Sabores Para Compartir,$1.590
612949,Base Cicatricure Gold Medium 30 Ml,$1.030
32631,Desodorante En Roll On Nivea Sensitive Protect Men 50 Ml,$149
798951,Vaso De Aprendizaje Nuk First Choice Con Control De Temperatura +6 Meses Rosa 150 Ml,$800
659290,Licuadora Bosch Mmbh6p6b Vitaboost 1600w,$19.960
616863,Inflable Circular Sunnylife Paradiso Xl,$1.390
654556,Gomitas De Pelo Top Elásticas Bts 5 Unidades,$169
324771,Sérum La Roche Posay Pure Vitamin C 1030 Ml,$2.793
799252,Vaso Nuk Active Cup + 12 Meses Niña,$890
273646,Vo2 Energy Gel Sabor Banana 30 G,$59
756710,Libro Tierra,$1.690
612946,Base Cicatricure Gold Bronce 30 Ml,$515
688488,Set De 2 Rompers Gerber Ballena Varón Recién Nacido,$1.200
846024,Guantes Musculacion Dojo Negro Talle S,$552
800753,Sonajero Akas Elefante Crochet Con Aro Celeste,$675
330757,Colchóneta De Agua Bestway,$3.476
587516,Cuerda Evolution De Saltar De Crossfit,$784
36470,Gel Fijador Fix Natural 220 G,$153
780373,Peluche Tiracuerdas Animales Coloridos,$837
667968,Pack Crema Cicatricure Antiedad 60 G + Contorno 15 G + Beauty50 G,$931
608816,Mineral 89 Probiotic Vichy 30 Ml,$1.785
239922,Cubo Rubik's,$890
563278,Planchita Gama Elegance Led 4d Marula 220v,$4.035
613548,Lonita Chau Pantallas Profesiones,$1.390
238421,Solución De Clorhexidina 250 Ml,$388
678185,Galleta La Paz Sin Gluten Naranja Sin Azúcar 150 G,$153
757112,Libro Unicornios De Colores,$119
573282,Cartuchera Cry Babies Doble,$600
681600,Libro Nunca,$1.490
652543,Vincha Top Ancha Verde,$259
613549,Chau Pantallas Pequeños Cazadores,$650
654954,Scrunchies Top Bts 2 Unidades,$199
658616,Planchita Philips Hp8401/40 Essential Care Mini,$1.600
687387,Libro Conspiracion,$850
295987,Antitranspirante En Aerosol Rexona Men Clinical Clean 110 Ml,$138
647942,Vaso Sorbito Suavinex Mostaza +18 Meses 340 Ml,$920
36937,Antitranspirante En Roll On Rexona Men V8 50 Ml,$148
654953,Scrunchie Top 1 Unidad,$199
675976,Leche Y Tónico Micelar Nivea Rose Care 200 Ml,$597
777051,Jabónen Barra Dove Men Care Clean C 90 G 4 Unidades,$239
815223,Plancha A Vapor Xion Inalámbrica 2200w,$2.040
888099,Bimune Matías González 60 Comprimidos,$1.390
273247,Barra Proteica Vo2 Whey Bar Sabor Chocolate 30 G,$59
795935,Crema L'oréal Age Perfect Cell Renewal Night 50 Ml,$1.659
603519,Mochila Carestino Porta Bebé Gris Negro,$2.499
652542,Vincha Top Ancha Fucsia,$259
28348,Carnitina Edatir 120 Cápsulas,$1.460
798851,Vaso De Aprendizaje Nuk First Choice Con Control De Temperatura +6 Meses Verde 150 Ml,$800
588119,Crema Biotherm Blue Therapy Red Algae Nuit 50 Ml,$4.960
631810,Estante Para Microondas Negro,$1.790
699618,Marcadores Happy Paper Acuarela 12 Unidades,$229
687287,Libro Bajo La Piel De Mamá,$450
699716,Lunchera Happy Paper Paintura,$559
801162,Crema Facial Antiedad Neutrógena Fps22 100 G,$600
800850,Peluche Tiracuerdas Akas Animales Rino,$837
681984,Libro Sin Contenidos No Hay Marketing Digital,$990
616867,Colchoneta Inflable Arcoíris,$2.990
31516,Carbo Complex 1 Kg,$623
782702,Antitranspirante En Barra Rexona Men Antibacterial 50 G,$183
588118,Crema Biotherm Blue Therapy Red Algae 50 Ml,$4.690
613347,Titeres De Animales,$272
800653,Peluche Tiracuerdas Akas Animales Oso,$837
784994,Desodorante En Roll On Nivea Men Deep 50 Ml,$149
678692,Sudoku De Madera Bigjigs,$1.720
781265,Set Pote Bichitos 3 Unidades,$142
603494,Cochecito Carestino Ferro Accesorios Gris Claro,$29.699
603534,Butaca Carestino Denver 360º Isofix Grupo 0-1-2-3,$15.289
603513,Butaca Carestino Denver 360º Isofix Rojo Grupo 0-1-2-3,$15.289
757109,Libro Animales Fantásticos: Maravillas Natural,$1.290
33800,Mulsi D3 800 Mg 30 Comprimidos,$293
567284,Desodorante En Aerosol Dove Men Clinical 110 Ml,$155
855820,Mochila Skip Hop Koala,$1.790
781260,Set Potes Arcoíris 3 Unidades,$142
781279,Set Pote Unicornio 3 Unidades,$142
654952,Ondulines Top Azul 11 Unidades,$149
590422,Carro Organizador Con Estantes Y Ruedas Rosa,$2.490
607001,Gel Terapéutico Apel Rodilla Talle Especial,$1.050
885896,Maxomega Matías González 30 Cápsulas 3 Mg,$710
32308,Antitranspirante En Aerosol Urban Care Dynamic Life 158 Ml,$186
659292,Licuadora Bosch Mmbv622m Vitamaxx 1000w,$26.360
678281,Alfajor La Paz Sin Gluten Coco 80 G,$69
723438,Crayolas Acrilex 12 Colores,$75
28347,Carnitina Edatir 60 Cápsulas,$872
28346,Carnitina Edatir 30 Cápsulas,$499
648241,Vaso Suavinex Learning Mostaza +6 Meses 200 Ml,$782
34781,Maxfast 50mg 4 Comprimidos,$498
765724,Jarra Eléctrica Allied De Vidrio,$1.320
34227,Antitranspirante En Aerosol Urban Care For Men 170 Ml,$186
885894,Colágeno Hidrolizado Matías González 90 Comprimidos,$1.050
782798,Antitranspirante En Barra Rexona Men Invisible 50 G,$183
619072,Máscara Biotherm Life Plankton 75 Ml,$3.970
400533,Set De Comida Creps Hape De Madera,$1.532
296318,Perfume Benetton Rose Femme Edt 50 Ml,$1.180
681489,Libro El Club De Los Psicópatas,$990
603514,Coche Carestino City V2 Morado,$10.999
330173,Set De Chupetes Dr. Brown's Etapa 1 Zorro + Mapache 0 A 6 Meses,$794
612948,Base Cicatricure Gold Light 30 Ml,$1.030
780372,Sonajero Elefante Akas De Crochet Con Aro,$675
31682,Inhalocámara Aeromed Con Máscara,$376
31231,Equipo De Suero Microgotero,$65
35446,Guantes Cirugía Estéril N°8 1/2 1 Par,$36
569706,Agua Micelar L'oréal Revitalift ácido Hialurónico 200 Ml,$499
699621,Mochila Happy Paper Violeta Con Colores,$1.389
400536,Barco Pirata Con Juego Didáctico Hape De Madera,$2.508
648242,Vaso First Suavinex Mostaza +4 Meses 150 Ml,$874
757627,Libro Vamos A Dibujar,$249
36939,Antitranspirante En Barra Rexona Men V8 50 G,$183
800654,Sonajero Colgante Akas Con Cascabel Rino,$504
756610,Libro La Menstruación Es Genial,$580
662460,Colgante Músical Arcoiris Storki,$1.300
776648,Colonia Paco Surf 60 Ml,$530
654555,Gomitas Top Bts 6 Unidades,$199
656550,Butaca Para Auto Carestino Berlín Rojo Grupo 1-2-3,$8.359
652441,Gomitas De Pelo Top Diferentes Colores 3 Unidades,$249
14403,Perfume Miracle Femme Edp 30 Ml,$3.169
32737,Curitas Band-aid Transparentes 40 Unidades,$224
36872,Equipo De Suero Macrogotero,$55
681599,Libro Diario De Greg 1: Un Renacuajo,$520
87871,Mulsi D3 5000 30 Comprimidos,$470
654453,Gomitas Top Bts 5 Unidades,$199
757623,Libro Dinosaurios De Colores,$119
88998,Elefante Dos Colores 25 Cm,$637
757521,Libro Vecinos,$790
885895,Colágeno Hidrolizado Matías González 150 gr,$678
658622,Recortador Philips Mg3730/15 Multigroom Series 3000,$2.040
662458,Cubo De Actividades Storki Rosado,$1.390
616868,Inflable Sunnyllife Bff Colchóneta Xl,$3.690
32868,Guantes Cirugía Estéril N°7 1/2 1 Par,$36
400544,Piscina Inflable Bestway 1000 L,$1.440
681598,Libro The Crazy Haacks High School Primer Trimestre Top,$580
87870,Mulsi D3 15 Ml,$584
606999,Gel Terapéutico Apel Frío-calor Para Hombro,$1.000
678381,Galleta Cracker La Paz Mix De Semillas Sin Gluten 180 G,$153
783795,Apego Hudson Bebé Pato,$630
