sku,nombre,precio
238421,Solución De Clorhexidina 250 Ml,$388
433563,Royal Juego Ludo Y Dama,$490
81946,Body Splash Minions 120 Ml,$545
330441,Bowl Twistshake +6 Meses Gris,$996
51811,Gel De Ducha Nivea Vitality Fresh Para Hombre 250 Ml,$196
81843,Toallitas Desmaquillantes Youngirl Ojos 20 Unidades,$87
342608,Gomitas De Pelo Top 2 Unidades Surtidas,$139
330057,Herramientas Para El Jardín Pala + Tridente Flores Rojas,$886
287058,Lapiceras Diferentes Colores,$5
329799,Pala De Playa Minions,$640
22582,Llave De 3 Vías,$54
652340,Gomita De Pelo Top Naranja / Violeta 1 Unidad,$219
91638,Set Colonia Disney Spiderman + Gel De Ducha,$680
86246,Desodorante En Aerosol Axe Bs Musk 150 Ml 2 Unidades,$272
80646,Desodorante En Aerosol Obao Ice 150 Ml,$209
330316,Alitas Salvavidas Barbie,$360
82552,Maltodextrina Polvo 500 G,$370
501995,Juego Didacta Puzzles Granja,$375
651840,Pinzas De Colores 2 Unidades,$219
650337,Vasos De Almacenaje Suavinex 10 Unidades,$1.334
361015,Royal Art&craft Almohadon Flores,$368
647942,Vaso Sorbito Suavinex Mostaza +18 Meses 340 Ml,$920
284269,Vaso De Aprendizaje First Essencial Varón 180 Ml,$390
483550,Batalla Naval Super Royal,$570
330757,Colchóneta De Agua Bestway,$3.476
89128,Libro My Little Pony - Sueña,$720
617265,Crema De Tratamiento Elvive Hidra Rellenador Con ácido Hialurónico 300 Ml,$435
273047,Crayolas Acrilex 9806 Neón Jumbo 6 Colores,$175
67095,Desodorante En Aerosol Old Spice Fresh 152 Ml,$248
651644,Gomitas De Pelo Multicolors 12 Unidades,$149
329986,Naves Star Wars Hot Wheels,$586
330582,Babero Twistshake +4 Meses Beige Y Gris 2 Unidades,$1.087
563978,Limpiador Líquido Multisuperficies Glade Bosques De Pino Botella 900 Ml,$101
651648,Pinza Rosa 1 Unidad,$139
433364,Juego Royal Generala,$400
330328,Traje De Baño Fisher Price Con Flotador Para Varón,$1.560
90515,Lysoform Desinfectante De Ambientes Y Elimina Olores Original 275 G + Limpiador De Baño Antibacterial Crema 450 Ml,$293
501799,Desodorante En Barra Speed Stick 0% Aluminio Carbón 76 G,$240
11006,Bolsa De Hielo Tetyss N° 24,$731
480739,Juego De Caja Royal Burako,$1.090
85506,Juguete Art&craft Royal Almohadón Búho,$290
91483,Lustramuebles En Aerosol Blem Acero Inoxidable Y Metal Limón 360 Cc,$335
651646,Pinza Grande Rosa 1 Unidad,$139
85510,Trivia Royal Juvenil,$850
329999,Figura Coleccionable Cavani Psg,$761
330465,Cuchara Twistshake +4 Meses Gris 2 Unidades,$498
659108,Aire Acondicionado Futura Asw-h18c4/forr1 18000 Btu,$32.240
433462,Juego Royal Club De Los Detectives,$525
419053,Colonia Coqueterias 80 Ml,$421
330697,Mi Primera Huerta Infantozzi 1 Maceta,$393
330060,Set De Mini Herramientas Para El Jardín 7 Unidades,$2.200
25241,Gorra Quirúrgica,$13
330085,Sonajero Lucky Baby Twist & Turn,$426
309740,Agua Micelar Garnier Pure Active 400 Ml,$397
11623,Bolsa De Hielo Tetyss N° 20,$627
651842,Scrunchies Con Estampado 3 Unidades,$249
400531,Guitarra De Madera Hape Azul,$5.285
88658,Cartuchera Trolls Lata Con Ventana,$210
330471,Cubiertos Twistshake De Aprendizaje +6 Meses Gris,$679
450171,Gel Glantz Desinfectante Para Manos 250 Ml,$104
71168,Protector Solar Six Fps30 180 G,$568
86566,Desodorante En Aerosol Legacy N°2 Azul 150 Ml,$186
25682,Antitranspirante En Aerosol Rexona Men Sensitive 90 G,$195
80716,Jabón En Barra Rexona Active 3 Unidades 125 G,$177
89257,Vaso Nuk Magic Cup 230 Ml,$1.140
68359,Vaso True Animals Con Pico Vertedor +6 Meses,$699
80644,Desodorante En Aerosol Obao Black Masculino 150 Ml,$209
501794,Jabón Líquido Facial Asepxia Carbón 200 Ml,$333
658960,Coche Terrain Infanti Negro,$6.280
90715,Suplemento Whey Protein Vainilla 2.27 Kg,$7.690
483553,Juego Generala Mini Royal,$151
329992,Bolso Bandolera Minnie,$965
27658,Leuco Transpore 2.5x9.1 Cm,$175
90008,Mordillo Llaves Akas,$49
22778,Pote Estéril Bioset,$40
892524,Sérum Vichy Edición Limitada Mineral 89 75 Ml,$2.700
573309,Alfombra Para Jugar De 70x90 Cm Con 2 Piezas 7 Cm,$1.520
82253,Jarabe De Agave Prana 330 Ml,$307
86567,Desodorante En Aerosol Legacy N°3 Negro 150 Ml,$186
273646,Vo2 Energy Gel Sabor Banana 30 G,$59
274448,Trapito De Apego Storki Con Porta Chupete Perro,$890
67092,Desodorante En Aerosol Old Spice Body New Sport 152 Ml,$248
90717,Nutrex Lipo-6 Carnitine 120 Cápsulas,$2.490
297692,Máquina De Afeitar Gama Gsh860 220v,$2.229
660175,Sandwichera Peabody Negra,$1.600
80652,Desodorante En Barra Obao Ice Masculino 50 G,$209
329995,Figura Coleccionable Suárez Barcelona,$761
501895,Mascarilla Asepxia Carbón Peel Off 30 G,$363
80647,Desodorante En Aerosol Obao Oceanic Masculino 150 Ml,$209
433361,Juego Royal Banco Inmobiliario,$622
330296,Inflable Bestway Cisne,$2.520
90641,Libro Manual De Cocina Crandon,$1.690
24564,Protector Solar Hawaiian Tropic Spray Aceite Fps15 240 Ml,$921
66171,Libro Gaturro 10 - Gaturro Superhéroe,$450
51795,Leuco Transpore 5 Cm X 9.1 M,$353
330053,Vasos Verónica 310 Ml 6 Unidades,$418
480640,Dominó En Lata Royal,$690
330435,Plancha Click Mat + Plato Twistshake +6 Meses Gris,$2.979
329951,Henry Monstruito Playset Casa Fisher Price,$2.284
273247,Barra Proteica Vo2 Whey Bar Sabor Chocolate 30 G,$59
432761,Juego Hasbro Pastelazo,$1.649
65359,Desodorante En Roll On Bi-ó Protección 5 Masculino 150 Ml,$147
651744,Gomitas De Pelo Colors 4 Unidades,$249
48308,Antitranspirante En Roll On Dove Men Cuidado Total 50 Ml,$170
87524,Juego Royal Memoria En La Granja,$260
483548,Puzzle Royal Mapa Uruguay 200 Piezas,$470
651645,Gomitas Prints 8 Unidades,$149
648241,Vaso Suavinex Learning Mostaza +6 Meses 200 Ml,$782
329844,Inflable Bestway Isla De Sandia,$1.927
330753,Alitas Salvavida Bestway Amarillo 3 A 6 Años,$110
310739,Peluche Apego Storki Oveja Rosa,$990
330318,Alitas Salvavidas Hot Wheels,$360
651943,Sapitos Colors 4 Unidades,$149
330059,Set De Herramientas Para El Jardín 4 Unidades,$720
330297,Inflable Bestway Diseño Emoji,$2.320
472907,Clue Road Trip,$1.390
658985,Coche Infanti Royal Baby Gris,$8.080
550854,Peluche Troll Tiny Diamond,$599
603498,Cochecito Carestino City Travel Accesorios Beige,$16.059
658976,Coche Infanti Travel System Pompeya Gris,$10.200
480538,Banco Inmobiliario Junior Royal,$699
84193,Libro Las Valkirias - Debolsillo,$520
648242,Vaso First Suavinex Mostaza +4 Meses 150 Ml,$874
11484,Apósitos Tegaderm 10x12 Cm 3 Unidades,$290
66114,Libro La Confesión De Micaela,$530
85737,Vaso Soy Luna 260 Ml,$86
330464,Cuchara Twistshake +4 Meses Violeta 2 Unidades,$498
433367,Juego Royal Torres De Madera,$400
48425,Antitranspirante En Crema Rexona Clinical Men Clean 48 G,$371
432762,Juego De Mesa Royal Ajedréz,$579
88492,Libro Música De Vampyros,$530
659015,Butaca Para Auto Infanti I-giro 360 Grey,$11.760
48304,Antitranspirante En Aerosol Dove Men Extra Fresh 150 Ml,$218
239922,Cubo Rubik's,$890
65360,Desodorante En Aerosol Bi-ó Mineral Protección 5 Masculino 150 Ml,$183
445874,Peluche Nena 4 Modelos 65 Cm,$1.212
330056,Herramientas Para Jardín Pala + Tridente + Transplantador,$1.947
504302,Corta Barba Gama Clipper Gt527 Sport 220v,$1.257
48750,Jeringa Descartable 50/60 Cc,$69
480645,Juego De Caja Royal Psiquis,$790
651942,Pinza Verde 1 Unidad,$139
272952,Vo2 Energy Gel Frutos Rojos 30 G,$59
48303,Antitranspirante En Aerosol Dove Man Protección Total 150 Ml,$218
359715,Plato Térmico Snow Bear Bloom & Bliss,$790
330442,Bowl Twistshake +6 Meses Negro,$996
85627,Masa Acrilex Kimeleka 180 G,$130
12434,Jeringa Bd 1cc 30 G 5/16,$233
331891,Agua Micelar Pond's Original 300 Ml,$416
310737,Cubo De Actividades Storki Celeste,$1.390
81573,Planchita Gama Starlight Li Argán Bvt,$6.847
280765,Agua Micelar Neutrógena 200 Ml,$434
659009,Butaca Para Auto Infanti Maya Onyx,$7.840
