sku,nombre,precio
74044,Gel Terapéutico Apel Frío-calor Tendón De Aquiles,$650
562276,Brocha Nickak Para Corrector,$228
72718,Desodorante En Aerosol Axe Apollo 96 G,$180
38807,Desodorante En Aerosol Colbert Noir 180 Ml,$311
562576,Brocha Nickak Ojos Tbpk22,$682
35061,Maní Con Chocolate Haas 70 G,$74
79052,Aguja Mariposa N°21,$51
25048,Desodorante En Barra Speed Stick Fresh 60 G,$244
27462,Creatina Monohidrato Edatir 120 G,$760
342117,Lima De Uñas Top Glass,$89
72719,Antitranspirante En Aerosol Axe Apollo 90 G,$180
36872,Equipo De Suero Macrogotero,$55
51736,Antitranspirante En Gel Gillette Clear Power Rush 82 G,$269
619275,Simple Barra Original 16 G,$87
35445,Guantes Cirugía Estéril N°8 1 Par,$36
846116,Bote Inflable Sunnylife Mini Vice,$1.990
812373,Desodorante En Aerosol Nike Ultra Green 200 Ml,$255
859118,Tónico Capilar Nioxin Scalp Treatment N°6 100 Ml,$1.824
91523,Pincel Corrector,$212
501596,Crema Hidratante Pamela Grant Skinfood Piel Mixta 200 Ml,$358
780258,Shampoo L'oréal Professionnel Metal Detox 300 Ml,$1.130
70859,Algodón Nube 40 G,$62
782793,Uñas Adhesivas Kiss Impress Serendipity Kiss 30 Piezas,$842
32868,Guantes Cirugía Estéril N°7 1/2 1 Par,$36
616963,Pistola De Agua Sunnylife Tiburón,$790
36468,gel Fijador Fix Natural 120 G,$81
616883,Inflable Para Niños Sunnylife Shell Con Glitter,$1.290
74041,Gel Terapéutico Apel Frío-calor Muñeca,$700
75345,Carnitina Plus B5 60 Cápsulas,$872
692506,Alfombra Carestino Plegable Aventura 177x195 Cm,$3.299
603604,Bolsa Térmica De Semillas Frical,$285
846031,Juguete Polar B Martillo De Madera,$864
891123,Esmalte Sally Hansen Good Kind Pure Pinky Clay,$580
618576,Block Chau Pantallas Juegos Clásicos,$550
891221,Esmalte Sally Hansen Good Kind Pure Soothing Slate,$580
75343,Carnitina Plus B5 120 Cápsulas,$1.460
723438,Crayolas Acrilex 12 Colores,$75
825914,Gimnasio Búho Akas Colores Pasteles,$2.250
618577,Block Chau Pantallas Mágico,$650
45681,Talis 20 Mg 10 Comprimidos Masticables,$997
834616,Set 2 Desodorantes En Aerosol Old Spice V·i·p 150 Ml + Gillette Prestobarba3,$421
509030,Máscara Reparadora Love Beauty & Planet Aceite De Coco Y Ylang 190 Ml,$271
735259,Nido Onna Beide 4 En 1,$6.520
75076,Asiento De Polifón,$692
783795,Apego Hudson Bebé Pato,$630
69230,Antitranspirante En Gel Gillette Clear Gel Cool Wave 82 G,$269
36470,Gel Fijador Fix Natural 220 G,$153
562377,Brocha Nickak Cejas,$228
891122,Esmalte Sally Hansen Good Kind Pure Peony Origin,$580
624097,Juego Royal Kit De Química,$830
35444,Guantes Cirugía Estéril N°7 1 Par,$36
616868,Inflable Sunnyllife Bff Colchóneta Xl,$3.690
27658,Leuco Transpore 2.5x9.1 Cm,$175
30871,Tijera Para Uñas Nail Mate Acero Inoxidable,$276
632214,Agua Salus Saboriza Frutte Naranja1.5 L,$106
616880,Inflable Para Bebés Con Techo Tiburón,$1.990
536133,Galletitas Jasmine Sin Azúcar Castañas Y Almendras 150 G,$143
22582,Llave De 3 Vías,$54
699621,Mochila Happy Paper Violeta Con Colores,$1.389
70861,Algodón Nube 140 G,$186
46145,Desodorante En Aerosol Speed Stick Waterproof 91 G,$195
631810,Estante Para Microondas Negro,$1.790
829117,Mordillo True Para Alimento Con Tapa Rosado +6 Meses,$572
699618,Marcadores Happy Paper Acuarela 12 Unidades,$229
291077,Pote Mix Tropical 120 G,$153
791924,Crema Neutrogena Body Hidrata Y Suaviza 200 Ml,$129
618572,Block Chau Pantallas Animales,$650
36939,Antitranspirante En Barra Rexona Men V8 50 G,$201
75904,Antitranspirante En Aerosol Old Spice Olor Blocker 150 Ml,$199
71607,Desodorante En Aerosol Bi-ó Black & White Masculino 150 Ml,$179
31597,Vimax Masticable 50 Mg 4 Comprimidos,$456
662359,Cubo De Actividades Storki Azul,$1.390
846132,Parlante Para Playa Sunnylife Candy Pin,$3.290
37946,Desodorante En Aerosol Desire Black For Men 150 Ml,$203
613548,Lonita Chau Pantallas Profesiones,$1.390
28346,Carnitina Edatir 30 Cápsulas,$499
846035,Polar B Estación Triángulo Con Juegos,$1.250
63859,Pastillas Mentos Tutti Frutti,$29
613249,Peluche Elefante Rosa O Celeste,$486
51053,Desodorante En Roll On Nivea Black & White Power 50 Ml,$122
846038,Puzzle De Madera Polar B Con Encastre Animales,$954
74215,Moringa Botica Del Señor 30 G,$194
74043,Gel Terapéutico Apel Frío-calor Rodilla,$800
892131,Cofre Giorgio Armani Acqua Di Gio Homme + Desodorante + Body Lotion,$5.028
312840,Protectores Diarios Ladysoft Multiadapt 60 Unidades,$236
846070,Parlante Para Playa Sunnylife Le Med,$3.290
891222,Esmalte Sally Hansen Good Kind Pure Sweet Berrie,$580
618575,Block Chau Pantallas Juegos,$650
662458,Cubo De Actividades Storki Rosado,$1.390
45540,Desodorante En Aerosol Nivea Silver Protect 150 Ml,$161
15004,Antitranspirante En Gel Gillette Clear Men Artic Ice 82 G,$269
44344,Antitranspirante En Roll On Rexona Men Invisible 50 Ml,$122
846028,Caminador De Madera Polar B Elefante,$2.790
616884,Inflable Para Niños Noodle Tiburón,$750
36937,Antitranspirante En Roll On Rexona Men V8 50 Ml,$122
70823,Suplemento Redushake Vainilla 500 G,$1.149
890099,Delineador De Ojos Idi Negro Jet Star,$600
36752,Desodorante En Barra Old Spice Vip 50 G,$253
800753,Sonajero Akas Elefante Crochet Con Aro Celeste,$675
72712,Desodorante En Aerosol Axe Black 150 G,$180
865834,Banco Multifunción,$13.095
52502,Protein Power Sylab Dulce De Leche 900 G,$1.680
846012,Muñeco Phi Phi Stitch 40 Cm,$2.426
34227,Antitranspirante En Aerosol Urban Care For Men 170 Ml,$186
846213,Tabla Inflable Sunnylife Rainbow Ombre,$2.090
32737,Curitas Band-aid Transparentes 40 Unidades,$213
30852,Lima De Uñas Curva Nail Mate Zebra,$90
846050,Inflable Sunnylife Basketball Neón Citrus,$2.890
48303,Antitranspirante En Aerosol Dove Man Protección Total 150 Ml,$175
562076,Brocha Nickak Buffer ángulo,$568
31682,Inhalocámara Aeromed Con Máscara,$376
891321,Esmalte Sally Hansen Good Kind Pure Top Coat,$580
72157,"Tijera De Peluquero 6"" Nail Mate Con Descanso",$478
846051,Inflable Sunnylife Fútbol Neón Citrus,$1.990
57074,Alcohol En Gel Sensual Beauty Strawberry 29 Ml,$69
74040,Gel Terapéutico Apel Frío-calor Modelo Gemelo,$700
78374,Redushake Chocolate 500 G,$1.149
74787,Cortacallos Nail Mate Metal Inoxidable,$225
731755,Desodoante En Aerosol Rexona Men V8 250 Ml,$195
12900,Desodorante En Barra Old Spice Pure Sport 50 G,$253
617799,Antitranspirante En Roll On Dove Men Invisible Dry 50 G,$170
891121,Esmalte Sally Hansen Good Kind Pure Fruity Papaya,$580
612330,Esponja De Baño Calm Celeste,$149
349113,Aplicador De Pestañas Kiss,$468
36464,Gel Fijador Fix Lavanda 120 G,$81
510123,Perfume Yves Saint Laurent Libre Woman Edp 90 Ml,$7.357
75253,Desodorante En Aerosol Kevin Plateado 150 Ml,$311
44342,Antitranspirante En Aerosol Rexona Men Invisible 90 G,$160
29609,Crema Avene Nutritiva Compensadora 50 Ml,$2.789
618578,Block Chau Pantallas Mundos,$650
68519,Leuco Matopat Fixopore S 10x6 Cm 3 Unidades,$151
699716,Lunchera Happy Paper Paintura,$559
846052,Inflable Sunnylife Red Volley Ball Neón,$2.990
533233,Crema Eucerin Elasticity Día Fps30 50 Ml,$3.320
72720,Antitranspirante En Aerosol Axe Dark Temptation 90 G,$180
616881,Inflable Para Niños Sunnylife Cocodrilo,$1.290
79564,Jabón Con Clorexhidina 2% 1 L,$881
75148,Anillo Gelform Gel Tamaño M,$235
846053,Jenga Gigante Sunnylife Madera Sorbet Dip,$2.990
613549,Chau Pantallas Pequeños Cazadores,$650
590222,Carro Organizador Con Estantes Y Ruedas Blanco,$2.490
798855,Vaso Para Cerveza Stanley Polar 473 Ml,$1.929
616964,Tabla De Surf Inflable Sunnylife Palmera,$1.890
32631,Desodorante En Roll On Nivea Sensitive Protect Men 50 Ml,$122
846058,Tabla Surf Sunnylife Inflable Mini Vice,$2.090
75146,Almohadilla Plantar Gelform S/o Max Confort,$472
661056,Piscina Bestway Redonda 2306 L,$39.640
826206,Afeitadora Gama Gsh987 Sport Wetdry 220v,$2.634
30291,Loción Corporal Nivea Express Hydration 400 Ml,$324
58180,Bálsamo Primicia Tratante 250 Ml,$236
90069,Shampoo Pantene Restauración 400 Ml + Acondicionador 200 Ml,$422
75144,Almoadilla Plantar Gelform Alto Impacto Con Oliva Grande,$472
28348,Carnitina Edatir 120 Cápsulas,$1.460
72717,Desodorante En Aerosol Axe Musk 96 G,$180
52505,Protein Power Sabor Chocolate 900 G,$1.680
846026,Cubos Encastrables Polar B,$1.350
744003,Espejo Top Rectangular,$849
616965,Tabla De Surf Inflable Sunnylife Tiburón,$1.890
652342,Body Splash Pibe's Club Legend 125 Ml,$240
834612,Pack Gillette Clear Cool Wave 82 G2 Unidades + Prestobarba3,$447
74973,Petaca Aily Portafolio Completa,$3.496
846030,Caminador Polar B Con Actividades,$3.438
75147,Anillo Gelform Gel Tamaño G,$235
777051,Jabónen Barra Dove Men Care Clean C 90 G 4 Unidades,$239
617798,Antitranspirante En Barra Dove Men Extra Fresh 50 G,$233
800652,Peluche Akas Con Música Y Luz Rosa,$936
870962,Uñas Adhesivas Impress Redy Or Not 87388 30 Unidades,$843
734857,Nido Onna Gris 4 En 1,$6.520
27478,Whey Protein Sylab Chocolate 800 G,$1.540
616460,Suplemento Atlhetica Hiper Mass Vainilla 3.2 Kg,$2.345
31231,Equipo De Suero Microgotero,$65
562476,Bocha Nickak Kabuki Con Tapa Tbpk21,$682
779358,Uñas Impress Kiss Cáncer Colección Zodiac,$650
52506,Bcaa 1400 Mg 60 Cápsulas,$584
616865,Inflable Circular Sunnylife Wild Xl,$1.390
25241,Gorra Quirúrgica,$13
35446,Guantes Cirugía Estéril N°8 1/2 1 Par,$36
27467,Sylab Mass Sabor Vainilla 1.2 Kg,$1.610
47609,Maltox 500 G,$753
68520,Matopat Bandas 10x25 Cm,$59
640533,Uñas Adhesivas Top Con Pegamento Distintos Colores 24 Piezas,$489
800754,Sonajero Akas Elefante Crochet Con Aro Rosa,$675
821199,Extensiones De Pestañas Kiss Falscara Overnighter Kfnb01ca,$775
57076,Alcohol En Gel Sensual Beauty Cucumber Melón 30 Ml,$69
661054,Piscina Bestway Redonda Con Filtros10250 L,$21.920
69913,Antitranspirante En Aerosol Gillette Cool Wave 150 Ml,$211
616863,Inflable Circular Sunnylife Paradiso Xl,$1.390
892524,Sérum Vichy Edición Limitada Mineral 89 75 Ml,$2.700
28347,Carnitina Edatir 60 Cápsulas,$872
891422,Gel Antisarro Pato Purific Marina 500 Ml,$252
355217,Pestañas Postizas Kiss Looks So Natural Lash Prett,$453
32308,Antitranspirante En Aerosol Urban Care Dynamic Life 158 Ml,$186
846033,Juguete Polar B Set De Herramientas,$1.134
806465,Desodorante En Barra Dove Cuidado Total 50 G 2 Unidades,$436
846072,Piscina Inflable Sunnylife Summer,$3.490
616867,Colchoneta Inflable Arcoíris,$2.990
826111,Juego De Playa Akas Perro Coral Con Accesorios,$414
36938,Antitranspirante En Aerosol Rexona Men V8 90 G,$160
616886,Inflable Para Niños Sunnylife Tiburón,$1.290
