sku,nombre,precio
,,
603991,Trapito De Apego Storki Oso Azul,$890
561175,Chlorella 100 G,$446
21386,Té Hiperico Botica Del Señor 10 Saquitos,$96
624299,Pistola Energy De Calor 2000 W,$933
483743,Cereal Vitalisimo Muesli Frutos Secos 450 G,$351
68521,Parche Matopat Ocular 6,$35
618593,Libro Harry Potter Y Legado Maldito,$790
85328,Delineador De Labios Lancôme Le Lip Liner N°132,$1.620
16831,Pasta De Dientes Colgate Junior Barbie 100 G,$202
91625,Perfume Disney Spiderman Edt 50 Ml,$368
658692,Freidora De Aire Philips Hd9218/71,$10.240
401131,Gel Collistar Fango Anticelulítico 400 Ml,$3.350
76163,Bombonera Garoto Surtida 300 G,$239
736066,Esponja Rabbit De Baño Para Niños,$205
601880,Antitranspirante En Barra Dove Men Sport 50 G,$233
237919,Libro Más Allá Del Invierno - Debolsillo,$620
586841,Set De Jabónes Baylis & Harding The Fuzzy Duck Costwold Floral 3 Unidades,$659
42832,Barra Nutry Cereal Con Castaña 22 G,$26
586845,Set Baylis & Harding Signature Men's Black Ginseng 3 Unidades,$1.413
60362,Gevral Soy 400 G,$1.319
678684,Corta Pelo Gama Clipper Titanium T827 220v,$1.337
791522,Chocolate Nestle Classic Milk 150 G,$155
86176,Tableta De Chocolate Con Leche Haas 0% 20 G,$63
287092,Ondulines Detalle Flúo,$19
42489,Inhalocámara Sume Con Válvula Y Máscara Adulto,$433
660157,Licuadora Peabody 800w Rojo,$3.560
80725,Jabón En Barra Dove Original 90 G 6 Unidades,$339
65817,Toallitas Q-soft Desmaquillantes 25 Unidades,$244
658718,Experimidor Eléctrico Philips Hr2738-00 Daily Collection,$1.800
23323,Carqueja Botica Del Señor 15 G,$95
768928,Bruma Capilar Ilicit Cicamist 200 Ml,$440
659965,Cocina Philco Cphdh6413s Acero Inoxidable,$24.760
840310,Protector Solar L'oréal Uv Defender Fluido Claro Fps50+ 40 G,$1.119
574756,Piscina Bestway Redonda 14970 L,$26.720
62533,Desodorante En Crema Sleep For Men 80 G,$165
286985,Cuadro Diseño Flechas,$399
91622,Perfume Disney Frozen Edt 100 Ml,$589
866433,Libro El Mundo Mágico De Isadora Moon,$690
557973,Mordillo/cepillo De Dientes Akas Silicona Con Forma De Banana,$234
65046,Barra Twix 45 G,$63
60202,Gel Exfoliante Six Para Manos 110 G,$190
45760,Jeringa Descartable Modern 5 Cc 1 Unidad,$22
625604,Barra De Cereales Quaker Con Frutilla 23 G,$39
30854,Lima De Uñas Jer-emi Grande,$12
40839,Cepillo De Dientes Butler 396 Supreme Con Limpiador De Lengua,$138
572448,Puzzle Crocodile Creek 48 Piezas Museo Ciencias,$812
658622,Recortador Philips Mg3730/15 Multigroom Series 3000,$2.040
76601,Protector Solar Isispharma Uveblock Color Fps50 40 Ml,$927
90476,Esmalte Vogue Efecto Gel Equilibrio 14 Ml,$219
811173,Brillo Labial Maybelline Lifter Gloss N°019 Gold,$739
590422,Carro Organizador Con Estantes Y Ruedas Rosa,$2.490
19762,Coca Cola 1.5 L,$149
580504,Pinzas Diferentes Colores 4 Unidades,$139
660872,Aspiradora Punktal Pk-8208 1600w,$2.880
867451,Mancuerna Hexagonal Engomada 8 Kg,$2.660
347712,Máscara Hortensia Waffle Blueberry 1 Unidad,$250
571623,Juego Royal Magia 100 Trucos,$599
89254,Desodorante En Aerosol Nivea Fresh Ice For Men 150 Ml,$161
272952,Vo2 Energy Gel Frutos Rojos 30 G,$59
826906,Máscara De Tratamiento Tresemmé Reparación Intra Capilar 300 Ml,$290
846613,Tampones Kotex Digital Super 12 Unidades,$323
829133,Vaso True Totty Con Asas Violeta +6 Meses 275 Ml,$543
780960,Sérum Fructis Stop Caída 30 Ml,$684
603591,Protector Solar La Roche Posay Anthelios Uv Daily Anti-age Con Color Fps50 50 Ml,$2.100
855820,Mochila Skip Hop Koala,$1.790
647950,Mamadera Suavinex Zero Zero 180 Ml,$1.380
654953,Scrunchie Top 1 Unidad,$199
21399,Té Serenidad Botica Del Señor 10 Saquitos,$96
432762,Juego De Mesa Royal Ajedréz,$579
86242,Crema Bagóvit Flex 100 Ml,$764
67095,Desodorante En Aerosol Old Spice Fresh 152 Ml,$199
52768,Taural 300 Mg 10 Comprimidos,$409
574856,Piscina Bestway Redonda 16015 L,$26.520
569323,Gomitas De Pelo Finas Top Negras 6 Unidades,$108
662458,Cubo De Actividades Storki Rosado,$1.390
41036,Coca Cola Zero 600 Ml,$63
286570,Bolsa De Residuos Júpiter Negra 70x100 Cm,$179
658680,Tostadora Philips Hd2590/00,$1.960
68684,Cepillo De Dientes Colgate Slim Soft Base 2 Unidades,$435
658616,Planchita Philips Hp8401/40 Essential Care Mini,$1.600
79898,Pasta De Dientes Colgate Smile Minions 6+ Años 75 Ml,$157
659938,Enxuta Ventilador De Pie Vpenx916w 140cm Blanco,$2.793
572136,Puzzle 60 Piezas Royal Hombre Arana,$235
641336,Corta Pelo Gama Clipper Gm566 24 Piezas 220v,$1.743
88900,Suplemento Usn Amino Leanfruit Fusion 160 G,$2.280
851412,Dispensador Para Fórmula De Bebé Rabbit,$229
787003,Gomitas De Pelo Top 2 Unidades,$219
312642,Suplemento Ena Ripped Max 60 Comprimidos,$1.590
86545,Galletas Oreo Milkshake De Frutilla 117 G,$86
536833,Protector Solar La Roche Posay Anthelios Mineral One N°3 Tan Fps50 30 Ml,$2.050
67716,Antitranspirante En Barra Dove Men Barra Invisible Dry 50 G,$233
660082,Aspiradora Ciclónica Enxuta Aenxc182000ng 2000w,$3.960
72019,Galletas Maria Sin Gluten 400 G,$257
866036,Mancuerna Hexagonal Engomada 10 Kg,$3.322
751404,Toallitas Desmaquillantes Nivea Rose Care 25 Unidades,$336
86228,Libro Guía Visual Del Mundo Pokemon,$790
872866,Tableta Jumbo Garoto Crocante 80 G,$90
840311,Protector Solar L'oreal Uv Defender Fluido Medio Fps50 40 G,$1.119
90491,Polvo Ebroderm Dérmico Siliconado 120 G,$296
55774,Protectores Diarios Ladysoft Clásicos 20 Unidades,$70
73649,Tinta Issue Crazy Colors Light Blue 47 G,$189
483550,Batalla Naval Super Royal,$570
74070,Polvo Compacto Lancôme Belle De Teint N°06,$2.154
815234,Recortadora De Barba Xion Inalámbrica,$920
647339,Acondicionador Fructis Recarga Nutritiva 350 Ml,$299
86611,Multivitaminico Corpore 30 Cápsulas,$1.407
863424,Perfume Valentino Born In Roma Coral Fantasy Uomo Edp 100 Ml,$5.581
598246,Galletitas 9 De Oro Chips Colores 120 G,$61
812370,Afeitadora Gama Gsh855 Sport,$1.985
63657,Tableta Cadbury Almendras 72 G,$111
846024,Guantes Musculacion Dojo Negro Talle S,$690
619273,Simple Vitalidad 60 Unidades,$612
593527,Pack Jabón En Barra Asepxia Exfoliante 2 Unidades,$121
771730,Mascarilla Facial Aloe Vera 1 Unidad,$360
852624,Vogue Esmalte Efecto Gel Sentir 14 Ml,$219
601902,Desodorante En Aerosol Speed Stick X5 Active 91 G,$195
821801,Libro Sufrir En El Silencio,$850
572447,Puzzle Crocodile Creek 48 Piezas Museo Ciencias,$812
562377,Brocha Nickak Cejas,$228
572134,Trivia Adivina Royal,$820
60011,Crema Bagóvit A Facial Uvb/uva 50 G,$1.157
480538,Banco Inmobiliario Junior Royal,$699
87523,Set Perfume Casapueblo 24hrs Blue Edt 100 Ml + Gel De Ducha 100 Ml,$725
550854,Peluche Troll Tiny Diamond,$599
823925,Labial Lancôme Absolu Rouge Cream N°366,$2.335
86110,Galletas Diet Fibra Sin Azúcar 250 G,$196
550345,Libro La Inteligencia Emocional - Debolsillo,$590
480645,Juego De Caja Royal Psiquis,$790
24564,Protector Solar Hawaiian Tropic Spray Aceite Fps15 240 Ml,$921
849313,Libro Diverlibros - Transportes,$219
60938,Aguja Mariposa N°23,$51
557379,Mordillo Silicona Akas Jirafa,$324
80979,Jabón Líquido Dove Baby Humectacion Enriquecida 180 Ml,$264
90288,Jabón En Barra Dove Men+care Extra Fresh 90 G,$75
565378,Repelente Off Naranja 300 Ml,$514
573282,Cartuchera Cry Babies Doble,$600
90237,Desodorante En Barra Old Spice Fresh 50 G 2 Unidades,$421
65359,Desodorante En Roll On Bi-ó Protección 5 Masculino 150 Ml,$209
867638,Mancuerna Hexagonal Engomada 6 Kg,$1.993
18335,Guantes Crivea Mediano,$138
296318,Perfume Benetton Rose Femme Edt 50 Ml,$1.180
448475,Lapicera Con Aplique De Tuna 2 Unidades,$49
35061,Maní Con Chocolate Haas 70 G,$74
822302,Protector Solar Vichy Capital Soleil Spray Fps30+ 200 Ml,$950
45761,Jeringa Descartable Modern 10 Cc 1 Unidad,$27
827306,Crema Biotherm Amber Algae Revit Facial Día 50 Ml,$4.690
510421,Labial Yves Saint Laurent Rouge Pur Couture The Slim N°30,$2.485
575761,Cepillo De Dientes Naturbrush De Bamboo Adulto Verde,$199
84611,Violín De Plástico,$327
74156,Toallitas Desmaquillantes Youngirl 25 Unidades,$174
580502,Gomitas Finas Top Diferentes Colores,$163
63053,Elecar Solución Oral 120 Ml,$1.032
783898,Shampoo Wella Blonde Recharge 250 Ml,$1.085
20985,Jugo Conaprole Nectar Durazno 250 Ml,$37
78162,Toallitas Desmaquillantes Neutrógena Night Calming 25 Unidades,$334
69658,Perfume Carolina Herrera 212 Vip Rosé Women Edp 50 Ml,$5.090
39081,Peine Suances Triple Barrera,$529
240423,Perfume Daniel Cassin Mia Fantasy Edt 50 Ml,$605
10461,Cepillo Interdental Butler Interproximal 1614,$201
890009,Perfume Ralph Lauren Ralph's Club Perfum 100 Ml,$7.225
632117,Agua Salus Saboriza Frutte Limónada 1.5 L,$106
603608,Oso Tejido Chocolate Storki 40 Cm,$990
287012,Bandeja Cuadrada Calada,$499
301085,Labial Yves Saint Laurent Rouge Pur Couture N°13 Le Orange,$1.894
652543,Vincha Top Ancha Verde,$259
501799,Desodorante En Barra Speed Stick 0% Aluminio Carbón 76 G,$240
571507,Lotto Toy Story Royal,$345
641436,Libro Didáctico Cola Animales,$522
525330,Alcohol En Gel Disney 40 G,$97
445874,Peluche Nena 4 Modelos 65 Cm,$1.212
652441,Gomitas De Pelo Top Diferentes Colores 3 Unidades,$249
341804,Set Esponjas Calm Mesh Para Baño 3 Unidades,$249
273247,Barra Proteica Vo2 Whey Bar Sabor Chocolate 30 G,$59
572437,Puzzle Crocodile Creek 72 Piezas Animales Marinos,$812
472907,Clue Road Trip,$1.390
30739,Edulcorante Sucralight 300 Tabletas Con Dosificador,$612
67910,Crema Goicoechea Para Piel Sensible 400 Ml,$373
47719,Fijador Primicia En Spray 20 Ml,$90
501802,Desodorante En Aerosol Speed Stick 0% Carbón 91 G,$195
63062,Caño Para Nebulizador,$133
286984,Cuadro Diseño Elefante,$399
67512,Pasta De Dientes Colgate Triple Acción 90 G 3 Unidades,$361
20990,Jugo Conaprole Naranja Y Zanahoria Con Vitamina A C Y E 250 Ml,$37
480739,Juego De Caja Royal Burako,$1.090
80486,Hisradin 10 Comprimidos,$316
565278,Repelente Off Extra Duración 300 Ml,$759
91452,Body Splash Mickey 200 Ml,$402
65360,Desodorante En Aerosol Bi-ó Mineral Protección 5 Masculino 150 Ml,$179
51956,Vaso True Totty Con Asas 275 Ml,$519
51938,Mamadera True Decorada 250 Ml,$372
636928,Ades Tropical 200 Ml,$35
63875,Gomitas Haribo Melocotones 100 G,$109
77451,Agua Saborizada Salus Cero Naranja 600 Cc,$63
849215,Libro Disney Red - Dejar Salir Al Panda,$119
693601,Bowl De Silicona Hortensia Para Preparaciones Cosméticas,$150
660668,Planchita Punktal Pk-325bw Tourmalina,$1.600
659108,Aire Acondicionado Futura Asw-h18c4/forr1 18000 Btu,$32.240
853730,Pañales Pampers Confort Sec Xxg 52 Unidades,$1.227
36938,Antitranspirante En Aerosol Rexona Men V8 90 G,$160
850414,Bowl Rabbit 3 Divisiones Con Tapa Y Ventosa,$529
825123,Labial Maybelline Super Stay Matte Ink Birthay Guest Of Honor,$799
29075,Mesacron 500 Mg 100 Comprimidos,$7.623
19515,Chocolate M&m Mini Tubo 35.2 G,$64
824323,Labial Yves Saint Lauren The Slim Velvet N°21 Radical,$1.491
13749,Anafil 120 Mg 20 Comprimidos,$521
65771,Desodorante En Aerosol Nivea Stress Protect 150 Ml,$161
330057,Herramientas Para El Jardín Pala + Tridente Flores Rojas,$886
660817,Multiprocesadora Punktal Pk-mp12 Inox 1000w,$5.160
287780,Aromatizador Vidrio Mandarina Y Limón,$299
505509,Gel Gillette Hydra Vitamina E 82 G ,$283
571807,Carrera A La Cima Hombre Araña,$299
432761,Juego Hasbro Pastelazo,$1.649
90717,Nutrex Lipo-6 Carnitine 120 Cápsulas,$2.490
287781,Aromatizador Vidrio Sensual Night,$299
658704,Exprimidor Eléctrico Philips Hr1855-70,$6.989
502694,Libro Harry Potter Y El Cáliz De Fuego,$790
480640,Dominó En Lata Royal,$690
86247,Desodorante En Aerosol Axe Bs Marine 150 Ml 2 Unidades,$272
64642,Discos Herméticos Mam 3 Unidades,$49
45759,Jeringa Descartable Modern 3 Cc 1 Unidad,$13
42328,Guantes Cirugía Estéril N° 6 1/2 1 Par,$36
660652,Aspiradora Allied Aqua Al-aq80 Sin Bolsa,$4.720
79257,Nebulizador Omron Ne-c801,$3.358
236419,Calienta Mamadera Nevi,$1.520
330060,Set De Mini Herramientas Para El Jardín 7 Unidades,$2.200
652542,Vincha Top Ancha Fucsia,$259
284071,Mamadera First Essencial Silicona Tetina Anatómica 120 Ml,$250
443871,Venda Coban Beige 7.5 Cm X 2 M,$390
757312,Libro Fleur Mi Desesperada Decisión,$790
654955,Vincha Top 1 Unidad,$189
651943,Sapitos Colors 4 Unidades,$149
603606,Perrito De Apego Storki Con Porta Chupete,$630
90455,Labial Maybelline Super Stay Matte Ink N°65 Seductress Virgo,$839
660175,Sandwichera Peabody Negra,$1.640
287037,Mopa Chica,$599
91456,Perfume Disney Frozen Edt 60 Ml + Gel De Ducha 280 Ml,$585
802061,Suavinex Chupete Sx Pro Gold Azul 0 A 6 Meses,$610
29087,Espuma De Afeitar Biotherm Homme Rasage Peau Sensible 200 Ml,$890
14403,Perfume Miracle Femme Edp 30 Ml,$4.225
509032,Shampoo Lovebeauty And Planet Aceite De Argán Y Lavanda 300 Ml,$315
890010,Perfume Ralph Lauren Ralph's Club Perfum 50 Ml,$5.865
611935,Libro Historias De Sicarios En Uruguay,$850
801260,Agua Micelar Neutrógena Hydroboost 200 Ml,$413
89164,L-carnitina Líquida 2400 Mg,$2.590
273646,Vo2 Energy Gel Sabor Banana 30 G,$59
286986,Cuadro Diseno Home,$399
286982,Cuadro Diseño Ananá Welcome,$399
42487,Inhalocámara Sume Con Válvula Y Máscara Lactante,$433
572127,Ludo Plástico Toy Story,$470
433563,Royal Juego Ludo Y Dama,$490
603609,Pantuflas Con Sonajero Storki Conejo,$830
563278,Planchita Gama Elegance Led 4d Marula 220v,$4.035
819940,Protección Solar Biotherm Waterlover Crema Fps50 50 Ml,$2.035
87959,Gel Primicia Modelador Efecto Mojado 90 G,$449
660871,Batidora Con Bowl Punktal 3.2 L,$2.600
505507,Gel Gillette Hydra Aloe 82 G ,$283
546639,Set Baylis & Harding Royale Garden Rose Poppy & Vanilla Manos 500 Ml 2 Unidades,$743
572449,Puzzle Crocodile Creek 48 Piezas Arriba/abajo Transporte,$812
90480,Desodorante En Aerosol Urban Care Extreme 158 Ml,$186
847616,Sombra De Ojos Idi N°25 Chic Velvet,$321
688488,Set De 2 Rompers Gerber Ballena Varón Recién Nacido,$1.200
660100,Procesadora De Alimentos Enxuta Sdaenxpa8942 1.5 L,$3.400
90153,Libro Caos Nadie Puede Decirte Quién Sos,$890
692197,Set De 4 Bodies Gerber Helados Nena 12 Meses,$1.440
51811,Gel De Ducha Nivea Vitality Fresh Para Hombre 250 Ml,$161
330059,Set De Herramientas Para El Jardín 4 Unidades,$720
557173,Avena Con Cacao Montesol 350 G,$133
65658,Caramelos Cavendish Menta Suave 200 G,$201
31683,Crema Corporal Nivea Nutritiva Extra Seca 400 Ml,$324
42488,Kit Inhalocámara Sume Pediátrica,$433
33800,Mulsi D3 800 Mg 30 Comprimidos,$303
70294,Enjuague Bucal Colgate Plax Fresh Mint 1 L,$499
830911,Coche Bebédue Up Urban Gris,$13.600
708135,Funda Agua Salus Saboriza Frutte Naranja 1.5 L 6 Unidades,$635
885498,Perfume Yves Saint Laurent Y Intense Edp 100 Ml,$6.133
455277,Super Acondicionador Dove 1 Minuto Factor Nutrición 80+ 170 Ml,$217
330085,Sonajero Lucky Baby Twist & Turn,$426
501995,Juego Didacta Puzzles Granja,$375
660156,Licuadora Peabody 800w Blanco,$3.560
864224,Barra De Cereales D3 Castañas Y Chocolate,$59
89023,Chocolate Milka Oreo Blanco 55 G,$81
88092,Maní Con Chocolate Hass 0% Azúcar 70 G,$113
603992,Juguete De Actividades Storki Oso,$855
86113,Galletas Gullon Wafer De Chocolate Sin Azúcar 60 G,$76
67092,Desodorante En Aerosol Old Spice Body New Sport 152 Ml,$199
25849,Esmalte Colorama Tentación 8 Ml,$139
18321,Llanten Cabral 20 G,$81
279866,Base Max Factor Facefinity Lasting Performance N°111 Deep Beige,$700
571608,Juguete Marvel Avengers 40 Cm,$1.399
890008,Cofre Ralph Lauren Ralph's Club 100 Ml + Minitalla 10 Ml,$6.142
543035,Uroprev 30 Cápsulas,$832
705027,Libro Richard Read Espalda Con Espalda,$850
825520,Gomitas De Pelo Top Finas Varios Colores 24 Unidades,$189
598249,Galletitas De Zapallo Paseo Vegetal 150 G,$48
579491,Tableta De Chocolate Con Menta Haas 0% Azúcar 150 G,$220
662359,Cubo De Actividades Storki Azul,$1.390
660155,Batidora Orbital Peabody 1000w Silver,$9.160
312643,Suplement Ena Whey Isolado True Made Vainilla 453 G,$1.690
330152,Cepillo Novica Multiuso,$119
557878,Mordillo Mitón Akas Con Punta Silicona,$320
580501,Gomitas Top Diferentes Colores,$112
74068,Polvo Compacto Lancôme Belle De Teint N°04 Belle De Miel,$2.376
512124,Protector Solar Isispharma Uveblock Mineral Sin Color Fps50 40 G,$998
36003,Chocolate Toblerone Leche 100 G,$197
744002,Cepillos Top Ovalado Colors,$519
71040,Crema H2o Body Anticelulitis 350 Ml,$541
778759,Plenovit Ods 50 G 4 Láminas,$505
590424,Aspiradora Robot Ielectric Naranja,$10.190
830914,Coche Bebédue Up Urban Beige,$13.600
286983,Cuadro Diseño Bicicleta,$299
19511,Barra M&m Snickers 45 G,$66
660032,Lavarropas Enxuta Lenx765dw Automático 6 Kg Digital Blanco,$13.800
433462,Juego Royal Club De Los Detectives,$525
659928,Caloventilador Enxuta Cvenx92 2000w,$1.840
309933,Delineador De Ojos Maybelline Tattoo Liner Deep Onyx,$539
236918,Yerba Canarias Té Rojo Y Centella 500 G,$113
30180,B1 Ion 100 Mg 20 Comprimidos,$285
571809,Juego Royal Contrareloj Junior,$649
342005,Broche Top Para Cabello Moño,$139
63816,Chocolate Garoto Tableta Blanco 100 G,$120
483041,Dolosedol C Soluble 1 Sobre,$55
705323,Libro Buscadores De Reliquias Y La Receta Robada,$530
572126,Ludo Plástico Royal Hombre Arana,$470
856032,Portacepillo Rabbit Niños,$329
652340,Gomita De Pelo Top Naranja / Violeta 1 Unidad,$219
778255,Té Canarias Negro Hebras 90 G,$71
59284,Plenomax 20 Mg 10 Comprimidos,$1.015
572441,Puzzle Crocodile Creek 36 Piezas Dino,$812
483553,Juego Generala Mini Royal,$151
302311,Jabonera Calm Anatómica,$129
78335,Cepillos Interprox Nano 6unidades,$613
678381,Galleta Cracker La Paz Mix De Semillas Sin Gluten 180 G,$153
802163,Mamadera Suavinex Gold Azul +3 Meses 270 Ml,$940
603517,Cochecito Carestino City Travel Accesorios Negro,$16.059
853818,Labial Wet N Wild Gloss Crushed Diamonds,$299
22351,Elecar Solución Oral 250 Ml,$1.342
572131,Trivia Prohibido Royal,$690
60537,Mulsi D3 2000 U.i. 30 Comprimidos,$400
87923,Gel Primicia Modelador Fijacion Extra Fuerte 90 G,$449
819939,Protector Solar Biotherm Facial Waterlover Fpsps30 200 Ml,$2.035
658679,Tostadora Philips Hd2581-00 Daily Collection,$1.600
91317,Pañales Para Adultos Cotidian Pants Medianos 18 Unidades,$910
90253,Desodorante En Gel Gillette Clear Cool Wave 82 G 2 Unidades,$447
342110,Gomitas De Pelo Top Surtidas 12 Unidades,$124
807064,Agua Micelar Garnier Express Aclara 400 Ml,$475
19784,Refresco Sprite 600 Cc,$63
660092,Cafetera Eléctrica Enxuta Sdaenxc215 1.5 L,$1.040
823909,Delineador De Ojos Lancôme Le Stylo Waterproof N°03,$1.660
29089,Antitranspirante En Aerosol Biotherm Homme Day Control 150 Ml,$1.400
355615,Uñas Adhesivas Kiss Diseño Frances Nude Chasmere,$781
507818,Labial Vogue Super Fantastic Matte Auténtica,$219
892131,Cofre Giorgio Armani Aqcua Di Gio Homme,$5.028
443870,Venda Coban Blanco 7.5 Cm X 2 M,$390
824310,Leche Desmaquillante Biotherm Biosource Ps 400 Ml,$2.035
90250,Saladix Calabresa 100 G,$70
818025,Kiehl's Ultimate Razor Burn & Bump Relief 75 Ml,$1.640
69415,Alicate De Uñas Profesional Nail Mate Con Resorte,$1.073
323464,Vogue Esmalte Fantastic Terra 10 Ml,$109
69832,Tableta De Chocolate Con Almendras Haas 0% 70 G,$131
623894,Chupete Nuk De Silicona Signature Varón Talle 2 2 Unidades,$570
297692,Máquina De Afeitar Gama Gsh860 220v,$2.229
658717,Mixer Philips Hr2624/80,$4.000
281765,Perfume Kenzo L'eau Kenzo Homme Man Edt 100 Ml,$4.544
708132,Funda Agua Salus Saboriza Frutte Limónada 1.5 L 6 Unidades,$635
804863,Suero Capilar Primicia 30 Ml,$268
330053,Vasos Verónica 310 Ml 6 Unidades,$418
573288,Mini Train Set 4 Piezas,$960
330056,Herramientas Para Jardín Pala + Tridente + Transplantador,$1.947
586837,Set Baylis & Harding Men's Lime & Mint Shower Duo,$1.076
344608,Esponja Calm Mesh,$139
400637,Suplemento Whey Isolado True Made Cookies & Cream 930 G,$2.690
312343,Prana Spirulina Orgánica 80 G,$600
329992,Bolso Bandolera Minnie,$965
502398,Libro Harry Potter Y Las Reliquias De La Muerte,$790
885500,Perfume Yves Saint Laurent Y Intense Edp Edp 60 Ml,$5.304
613952,Gel Exfoliante Avene 75 Ml,$1.556
339700,Medias Unisex Akas Little Oneset 0 A 3 Meses 2 Unidad,$153
45762,Jeringa Descartable Modern 20 Cc 1 Unidad,$33
83816,Chocolate Haas Tableta 0% Blanco 70 G,$131
773233,Pop Bamboo Sweet And Salty 80 G,$135
283968,Chupete First Essential Fun Silicona Talle 2 Varón,$190
35284,Coca Cola Light 2.25 L,$183
603797,Te Orgánico Classic Breakfast Campoclaro 42.5 G,$265
433361,Juego Royal Banco Inmobiliario,$622
310743,Sundown Naturals B12 200 Cápsulas,$1.390
660154,Cafetera Express Peabody Rojo,$10.360
792436,Cepillo De Dientes Balene Suave Aguamarina 1 Unidad,$970
