sku,name,price
660805,Cafetera Eléctrica Punktal Express Pk-c103 2-4 Tazas Roja,2780
65598,Trayenta Duo 2.5 /850 Mg 60 Comprimidos,2776
721937,Colágeno Corpore Pro Articol 360 300 G,2762
721938,Colágeno Corpore Pro Sport 10 300 G,2762
817984,Kiehl's Avocado Nourishing Hyration Mask 100 G,2752
817984,Kiehl's Avocado Nourishing Hyration Mask 100 G,2752
817984,Kiehl's Avocado Nourishing Hyration Mask 100 G,2752
817986,Kiehl's Ultra Facial Overnight Hydrating Face Mask 100 G,2747
59117,Diamicron Mr 60 Mg 30 Comprimidos,2745
830916,Saco Bebédue Cadi Beige,2744
659897,Mancuernas Acolchónadasreebok Rojas 2 Kg 2 Unidades,2744
77509,Base Compacta Lancôme Teint Idole 24h N°04 Beige Nature,2736
614570,Pista En Ocho Bigjigs,2734
817928,Kiehl's Midnight Recovery Cleansing Oil 175 Ml,2730
72399,Faja Body Care Lumbar De 28 Cm Talle M,2726
817982,Kiehl's Caléndula Petal Infused Calming Mask 100 Ml,2712
370721,Protector Solar Biotherm Waterlover Sun Mist Fps30 200 Ml,2700
14056,Crema La Roche Posay Hydraphase Uv Intense Riche 50 Ml,2700
892524,Sérum Vichy Edición Limitada Mineral 89 75 Ml,2700
