sku,name,price
721938,Colágeno Corpore Pro Sport 10 300 G,2762
721937,Colágeno Corpore Pro Articol 360 300 G,2762
817986,Kiehl's Ultra Facial Overnight Hydrating Face Mask 100 G,2746
817987,Kiehl's Cranberry Seed Masque 100 G,2746
817987,Kiehl's Cranberry Seed Masque 100 G,2746
659897,Mancuernas Acolchónadasreebok Rojas 2 Kg 2 Unidades,2744
830916,Saco Bebédue Cadi Beige,2744
73848,Base Hidrisage Lumed Fluida Oscuro Fps50 40 G,2741
77509,Base Compacta Lancôme Teint Idole 24h N°04 Beige Nature,2736
614570,Pista En Ocho Bigjigs,2734
72399,Faja Body Care Lumbar De 28 Cm Talle M,2726
42369,Perfume Biotherm Eau Pure Edt 100 Ml,2700
370721,Protector Solar Biotherm Waterlover Sun Mist Fps30 200 Ml,2700
42369,Perfume Biotherm Eau Pure Edt 100 Ml,2700
76319,Perfume Biotherm Eau Edt 100 Ml,2700
