sku,name,price
659840,Caminador Reebok Eléctrico Plegable Jet200,58631
835608,Consola Play Station 5 + Juego Horizon Forbidden West,55864
661056,Piscina Bestway Redonda 2306 L,38154
656519,Coche Travel System Carestino Deluxe V2 Beige,35530
659108,Aire Acondicionado Futura Asw-h18c4/forr1 18000 Btu,31031
659108,Aire Acondicionado Futura Asw-h18c4/forr1 18000 Btu,31031
603515,Cochecito Carestino London Gris,28623
603494,Cochecito Carestino Ferro Accesorios Gris Claro,28215
659292,Licuadora Bosch Mmbv622m Vitamaxx 1000w,24104
659292,Licuadora Bosch Mmbv622m Vitamaxx 1000w,24104
659965,Cocina Philco Cphdh6413s Acero Inoxidable,23832
659965,Cocina Philco Cphdh6413s Acero Inoxidable,23832
656544,Coche Travel System Carestino Kiev Rojo,22990
657222,Lavavajillas Haitech Sin Conexión De Agua,22000
657222,Lavavajillas Haitech Sin Conexión De Agua,22000
657222,Lavavajillas Haitech Sin Conexión De Agua,22000
815220,Coche Travel System Joie Litetrax 4 Coal,21945
603511,Butaca Para Auto Isofix Carestino Sidney Rojo Grupo 0-1-2-3,21945
656534,Coche Carestino Travel System Midway Negro,21213
661054,Piscina Bestway Redonda Con Filtros10250 L,21098
658242,Cochecito Maclaren Volo Black,20226
658243,Cochecito Maclaren Volo Marmalade,20226
659290,Licuadora Bosch Mmbh6p6b Vitaboost 1600w,18252
659290,Licuadora Bosch Mmbh6p6b Vitaboost 1600w,18252
692498,Butaca Para Auto Carestino Vancouver Isofix Gris Grupo 0/1/2/3,16720
603517,Cochecito Carestino City Travel Accesorios Negro,16059
603498,Cochecito Carestino City Travel Accesorios Beige,15257
603516,Cochecito Travel System Carestino City Gris Melange,15257
603535,Butaca Carestino Montreal Isofix Gris Grupo 0-1-2-3,14630
603535,Butaca Carestino Montreal Isofix Gris Grupo 0-1-2-3,14630
17723,Mirena 1 Dispositivo,14562
17723,Mirena 1 Dispositivo,14562
871265,Bicicleta Kova Tibet Hombre Rodado 27.5 Negro,14375
871166,Bicicleta Kova Tibet Dama Rodad 27.5 Negro,14375
871166,Bicicleta Kova Tibet Dama Rodad 27.5 Negro,14375
660032,Lavarropas Enxuta Lenx765dw Automático 6 Kg Digital Blanco,13283
660032,Lavarropas Enxuta Lenx765dw Automático 6 Kg Digital Blanco,13283
65040,Crema Lancôme Absolue Bx Nuit 75 Ml,12535
830911,Coche Bebédue Up Urban Gris,12436
830914,Coche Bebédue Up Urban Beige,12436
656489,Practicuna Carestino Genova Gris,12099
656489,Practicuna Carestino Genova Gris,12099
656552,Butaca Para Auto Carestino Isofix Tokio Gris Grupo 1-2-3,11704
656484,Practicuna Carestino Marsella Beige,11439
656484,Practicuna Carestino Marsella Beige,11439
603526,Silla De Comer Carestino Neo Gris Claro,11329
656465,Silla De Comer Carestino Neo Rosa,11329
656465,Silla De Comer Carestino Neo Rosa,11329
735358,Cuna Onna Somnia,11319
735358,Cuna Onna Somnia,11319
603527,Silla De Comer Carestino Luxury Aguamarina,10999
603536,Silla De Comer Carestino Luxury Morada,10999
603527,Silla De Comer Carestino Luxury Aguamarina,10999
603527,Silla De Comer Carestino Luxury Aguamarina,10999
603528,Silla De Comer Carestino Luxury Gris Claro,10999
603528,Silla De Comer Carestino Luxury Gris Claro,10999
603536,Silla De Comer Carestino Luxury Morada,10999
815129,Coche Travel System Joie Muze Dark Pewter,10973
659015,Butaca Para Auto Infanti I-giro 360 Grey,10937
659015,Butaca Para Auto Infanti I-giro 360 Grey,10937
831107,Coche Bebédue Akro City Light Grey,10534
603489,Cochecito Carestino City V2 Con Accesorios Gris,10450
90926,Silla Higiénica Con Ruedas,10418
656478,Practicuna Carestino Venecia Aguamarina,10229
656478,Practicuna Carestino Venecia Aguamarina,10229
656480,Practicuna Carestino Venecia Rosa,10229
656480,Practicuna Carestino Venecia Rosa,10229
656478,Practicuna Carestino Venecia Aguamarina,10229
881777,Masajeador D3 Inalámbrico WMS,10000
881777,Masajeador D3 Inalámbrico WMS,10000
658976,Coche Infanti Travel System Pompeya Gris,9972
658976,Coche Infanti Travel System Pompeya Gris,9972
656466,Carestino Silla De Comer Estocolmo Aguamarina,9899
656466,Carestino Silla De Comer Estocolmo Aguamarina,9899
603537,Silla De Comer Carestino Estocolmo Gris,9899
656466,Carestino Silla De Comer Estocolmo Aguamarina,9899
656466,Carestino Silla De Comer Estocolmo Aguamarina,9899
590424,Aspiradora Robot Ielectric Naranja,9681
590424,Aspiradora Robot Ielectric Naranja,9681
658692,Freidora De Aire Philips Hd9218/71,9510
658692,Freidora De Aire Philips Hd9218/71,9510
599665,Plataforma Vibratoria Oscilante,9491
660154,Cafetera Express Peabody Rojo,9474
660154,Cafetera Express Peabody Rojo,9474
656555,Butaca Para Auto Carestino Moscú Isofix Grupo 1-2-3 Rojo,9405
603540,Butaca Carestino Moscú Isofix Púrpura Grupo 1-2-3,9405
603533,Butaca Carestino Moscu Isofix Grisgrupo 0-1-2-3,9405
603533,Butaca Carestino Moscu Isofix Grisgrupo 0-1-2-3,9405
780362,Barra De Sonido Jbl Jblsb120blk,9240
780362,Barra De Sonido Jbl Jblsb120blk,9240
291380,Recarga Lancôme Absolue Rich Cream N°60 Ml,9190
831207,Coche Bebédue Nik Grey,9035
556871,Perfume Issey Miyake L'eau D'issey Rose & Rose 90 Ml,8930
616358,Auriculares Sony Inalámbricos Para P5 P4 Pulse 3d,8894
11515,Ursofálk 250 Mg 100 Cápsulas,8801
11515,Ursofálk 250 Mg 100 Cápsulas,8801
306932,Perfume Issey Miyake L'eau D'issey Pure Petal Nectar 90 Ml,8800
658963,Coche Travel System Infanti Terrain Gris,8742
658962,Coche Travel System Infanti Terrain Negro,8742
658963,Coche Travel System Infanti Terrain Gris,8742
658962,Coche Travel System Infanti Terrain Negro,8742
801664,Tratamiento Completo Fillerina 12 Grado 4 30 Ml 2 Unidades,8600
660155,Batidora Orbital Peabody 1000w Silver,8377
660155,Batidora Orbital Peabody 1000w Silver,8377
556774,Perfume Issey Miyake L'eau D'issey Wood & Wood 100 Ml,7990
656550,Butaca Para Auto Carestino Berlín Rojo Grupo 1-2-3,7942
603500,Mecedora Electrónica Carestino Verde Agua,7919
603499,Mecedora Electrónica Carestino Gris,7919
603499,Mecedora Electrónica Carestino Gris,7919
603500,Mecedora Electrónica Carestino Verde Agua,7919
82335,Implanton Nxt 68 Mg,7878
82335,Implanton Nxt 68 Mg,7878
743190,Batidora Daewoo Planetaria Negro 650w,7791
659006,Booster Infanti Premium Isofix Negro,7718
659006,Booster Infanti Premium Isofix Negro,7718
656477,Practicuna Carestino Viena Verde Agua,7699
656475,Practicunacarestino Viena Rosa,7699
656477,Practicuna Carestino Viena Verde Agua,7699
656475,Practicunacarestino Viena Rosa,7699
765919,Booster Infanti Premium Isofix Rojo,7645
765919,Booster Infanti Premium Isofix Rojo,7645
765919,Booster Infanti Premium Isofix Rojo,7645
29075,Mesacron 500 Mg 100 Comprimidos,7623
842009,Mecedora Badabulle Alta Compacta Moonligh,7508
841509,Mecedora Badabulle Alta Ultracompacta Candy,7508
658985,Coche Infanti Royal Baby Gris,7499
658985,Coche Infanti Royal Baby Gris,7499
830909,Cámara Bebédue De Vigilancia Con Wifi,7354
14007,Neotigason 25 Mg 30 Cápsulas,7314
81073,Perfume Carolina Herrera Good Girl Women Edp 80 Ml,7299
659009,Butaca Para Auto Infanti Maya Onyx,7279
659009,Butaca Para Auto Infanti Maya Onyx,7279
659009,Butaca Para Auto Infanti Maya Onyx,7279
791015,Silla De Comer Baby Trend Alta Hojitas Con Rueditas,7277
890009,Perfume Ralph Lauren Ralph's Club Perfum 100 Ml,7225
890009,Perfume Ralph Lauren Ralph's Club Perfum 100 Ml,7225
890009,Perfume Ralph Lauren Ralph's Club Perfum 100 Ml,7225
656563,Butaca Para Auto Carestino Verona Grupo 1-2-3 Gris,7210
656563,Butaca Para Auto Carestino Verona Grupo 1-2-3 Gris,7210
656563,Butaca Para Auto Carestino Verona Grupo 1-2-3 Gris,7210
72114,Perfume Yves Saint Laurent Black Opium Femme Edp 90 Ml,7095
598141,Depiladora Gama Ipl Licia,6845
734961,Bañito Onna Vasco Kit Gris,6699
735258,Onna Bañito Vasco Kit Blanco,6699
734961,Bañito Onna Vasco Kit Gris,6699
735258,Onna Bañito Vasco Kit Blanco,6699
735258,Onna Bañito Vasco Kit Blanco,6699
735059,Bañito Onna Vasco Kit Rosado,6699
735357,Bañito Onna Vasco Kit Celeste,6699
656456,Silla De Comer Carestino Río Aguamarina,6599
656453,Silla De Comer Carestino Río Rosa,6599
656456,Silla De Comer Carestino Río Aguamarina,6599
656457,Silla De Comer Carestino Río Azul,6599
656455,Silla De Comer Carestino Río Gris,6599
656457,Silla De Comer Carestino Río Azul,6599
656453,Silla De Comer Carestino Río Rosa,6599
689598,Silla De Comer Infanti Nordic Meal Turquesa,6584
689598,Silla De Comer Infanti Nordic Meal Turquesa,6584
84034,Perfume Yves Saint Laurent Mon París Edp 90 Ml,6570
782168,Perfume Giorgio Armani Aqua Di Gio Refillable Edp 125 Ml,6545
81573,Planchita Gama Starlight Li Argán Bvt,6505
874068,Cofre Fillerina 12 Grado 3 + Crema De Día 50 Ml,6500
674576,Perfume Carolina Herrera Bad Boy Man Edt 100 Ml,6465
806768,Perfume Carolina Herrera Very Good Girl Glam Edp 50 Ml,6360
806464,Perfume Polo Blue Edp 125 Ml,6358
736378,Freidora De Aire Ufesa Af3500,6328
661060,Piscina Bestway Redonda Inflable 5377 L,6314
661060,Piscina Bestway Redonda Inflable 5377 L,6314
892130,Perfume Armani New Code Edt 125 Ml,6278
892130,Perfume Armani New Code Edt 125 Ml,6278
892130,Perfume Armani New Code Edt 125 Ml,6278
735259,Nido Onna Beide 4 En 1,6276
734857,Nido Onna Gris 4 En 1,6276
603502,Mecedora Carestino Gris,6269
603525,Mecedora Carestino Verde Agua,6269
603525,Mecedora Carestino Verde Agua,6269
603502,Mecedora Carestino Gris,6269
90914,Cojín De Gel 46 X 41 Cm,6264
659019,Booster Joie Elevate Two Tone Black,6255
659019,Booster Joie Elevate Two Tone Black,6255
782470,Perfume Carolina Herrera Bad Boy Cobalt Edp 100m,6235
660163,Air Fryer Peabody Digital Negra,6182
660163,Air Fryer Peabody Digital Negra,6182
660163,Air Fryer Peabody Digital Negra,6182
817950,Kiehl's Vital Skin-strengthening Hyaluronic Acid Super Sérum 100 Ml,6165
298302,Planchita Gama Starlight Dig Iht 4d Tsubaki,6120
612046,Parlante Jbl Flip 5 Azul,6083
737770,Perfume Valentino Voce Viva Intense Edp 50 Ml,6048
23593,Perfume Polo Men Edt 118 Ml,6035
874674,Perfume Carolina Herrera Good Girl Blush Edp 50 Ml,5981
5591677,"Combo de Belleza - Cabello, Piel y Uñas",5924
673477,Perfume Paco Rabanne Phantom Man Edt 100 Ml,5900
441969,Crema Clinique Smart Clinical Multidimension Revolumize 50 Ml,5900
801762,Crema De Noche Fillerina 12 Grado 4 50 Ml,5900
800657,Ampolla Crescina Tratamiento Completo Caballero 200 20 Unidades,5900
49592,Perfume Giorgio Armani Aqcua Di Gioia 100 Ml,5895
890010,Perfume Ralph Lauren Ralph's Club Perfum 50 Ml,5865
890010,Perfume Ralph Lauren Ralph's Club Perfum 50 Ml,5865
890010,Perfume Ralph Lauren Ralph's Club Perfum 50 Ml,5865
658704,Exprimidor Eléctrico Philips Hr1855-70,5852
658704,Exprimidor Eléctrico Philips Hr1855-70,5852
867540,Mancuerna Hexagonal Engomada 18 Kg,5818
867540,Mancuerna Hexagonal Engomada 18 Kg,5818
658960,Coche Terrain Infanti Negro,5816
658960,Coche Terrain Infanti Negro,5816
658960,Coche Terrain Infanti Negro,5816
50938,Spiriva Respimat Solución 0.226 Mg / 1 Ml,5804
50938,Spiriva Respimat Solución 0.226 Mg / 1 Ml,5804
67633,Perfume Giorgio Armani Si Edp 50 Ml,5623
89507,Perfume Sí Passione Giorgio Armani Femme Edp 50 Ml,5623
77343,Sérum Fluido Biotherm Blue Therapy Reno 50 Ml,5565
77343,Sérum Fluido Biotherm Blue Therapy Reno 50 Ml,5565
588226,Perfume Yves Saint Laurent Mon París Intensement Edp 50 Ml,5558
863324,Perfume Valentino Born In Roma Coral Fantasy Donna Edp 50 Ml,5504
659330,Tostadora Bosch Tat6a803 Comfortline,5451
304321,Crema Payot Anti-edad Global Suprúme Jeunesse Día 50 Ml,5450
304421,Crema Payot Anti-edad Suprúme Jeunesse Noche 50 Ml,5450
780759,Parlante Jbl Bt Flip 5 Negro,5390
825513,Planchita Gama Cp14 Dual Plate 4d 220v,5311
503294,Perfume Polo Deep Blue Man Edp 75 Ml,5278
31229,Spiriva 18 Mcg 30 Dosis,5236
31229,Spiriva 18 Mcg 30 Dosis,5236
68791,Crema Biotherm Blue Therapy Nuit Spb 50 Ml,5210
75121,Planchita Gama Cp1 Nova Digital 4d Iht,5196
81713,Spiolto Respimat 4 Ml,5089
255734,Cleaning Brush Gama Ultrasonic Pro,5043
621982,Perfume Dior Homme Edt 50 Ml,5020
510428,Sérum Pure Shots Yves Saint Laurent Night Reboot 30 Ml,4900
510221,Sérum Pure Shots Yves Saint Laurent Lines Away 30 Ml,4900
801661,Crema Para Labios Fillerina 12 Grado 5 15 Ml,4900
801562,Crema Para El Contorno De Ojos Fillerina 12 Grado 5 15 Ml,4900
743390,Extractor De Jugo Daewoo Je4217 800w,4865
15119,Flixotide 50 Mcg 120 Dosis,4862
765722,Coche Infanti Adventure Stroller Azul,4792
765722,Coche Infanti Adventure Stroller Azul,4792
766019,Coche Infanti Adventure Stroller Gris,4792
616257,Control Inalámbrico Dualsense Ps5,4774
557474,Perfume Polo Red Edp 75 Ml,4769
658196,Colchón Candide Impermeable 60x120x10 Cm,4761
423853,Perfume Nina Rouge Edt 80 Ml,4758
743801,Sérum Yves Saint Laurent Pure Shots Eye Reboot Concentrate 20 Ml,4730
660817,Multiprocesadora Punktal Pk-mp12 Inox 1000w,4719
83936,Crema Biotherm Blue Therapy Multi-defender Piel Normal A Mixta Fps25 50 Ml,4690
90161,Crema Biotherm Blue Therapy Red Algae Uplift 50 Ml,4690
90161,Crema Biotherm Blue Therapy Red Algae Uplift 50 Ml,4690
83936,Crema Biotherm Blue Therapy Multi-defender Piel Normal A Mixta Fps25 50 Ml,4690
827306,Crema Biotherm Amber Algae Revit Facial Día 50 Ml,4690
836514,Planchita Beauty Style 2 En 1,4655
836514,Planchita Beauty Style 2 En 1,4655
603522,Gimnasio Didáctico Carestino Multifuncion Mi Jardín,4619
603522,Gimnasio Didáctico Carestino Multifuncion Mi Jardín,4619
75730,Perfume Paco Rabanne Olympéa Women Edp 50 Ml,4588
820694,Juego Fifa 23 Para Ps5,4582
820694,Juego Fifa 23 Para Ps5,4582
281765,Perfume Kenzo L'eau Kenzo Homme Man Edt 100 Ml,4544
602187,Mixer Con Batidor Y Picador Philips,4536
887798,Neovadiol Vichy Post-meno Noche 50 Ml,4515
887798,Neovadiol Vichy Post-meno Noche 50 Ml,4515
876072,Kiehl's Set Anti Age Nighttime,4502
876072,Kiehl's Set Anti Age Nighttime,4502
818379,Sérum Biotherm Blue Retinol Night Concentrado 30 Ml,4500
786801,Crema Isdin Contorno De Ojos Vital Eyes 15 G,4483
40945,Perfume Giorgio Armani Code Edt 125 Ml,4431
88893,Perfume Cacharel Yes I Am Femme Edp 50 Ml,4390
815112,Batidora Xion Planetaria 1000w Blanca,4389
815215,Batidora Xion Planetaria Negra 1000w,4389
658672,Plancha A Vapor Philips Gc360/30 Steamer,4389
751801,Crema Vichy Neovadiol Peri-menopausia Pieles Secas 50 Ml,4380
752102,Crema Vichy Neovadiol Peri-menopausia Noche 50 Ml,4380
85713,Perfume Paco Rabanne Lady Million Privé Women Edp 50 Ml,4335
590529,Perfume Nina Rose Nina Ricci Edt 50 Ml,4330
660652,Aspiradora Allied Aqua Al-aq80 Sin Bolsa,4316
660652,Aspiradora Allied Aqua Al-aq80 Sin Bolsa,4316
9673478,Perfume Paco Rabanne Phantom Man Edt,4310
9673478,Perfume Paco Rabanne Phantom Man Edt,4310
9673478,Perfume Paco Rabanne Phantom Man Edt,4310
324567,Sérum Tratamiento Biotherm Life Plankton Elixir 50 Ml,4300
615059,Crema Payot Roselift Collagene Nuit 50 Ml,4290
14403,Perfume Miracle Femme Edp 30 Ml,4225
616357,Cámara Hd Ps5,4197
75119,Secador De Pelo Gama Leggero Ion 4d 220v,4196
255833,Masajeador Facial Gama Ultrasónico,4196
30903,Contorno De Ojos Lancôme Renergie Yeux 15 Ml,4190
66064,Crema Biotherm Celluli Eraser 200 Ml,4165
66064,Crema Biotherm Celluli Eraser 200 Ml,4165
66064,Crema Biotherm Celluli Eraser 200 Ml,4165
452979,Planchita Gama X-wide Digital Kera-shine 220v,4158
892129,Perfume Armani New Code Edt 75 Ml,4076
892129,Perfume Armani New Code Edt 75 Ml,4076
892129,Perfume Armani New Code Edt 75 Ml,4076
833908,Butaca Para Auto Babyauto Konar Roja/gris,4061
834110,Butaca Para Auto Alva Babyauto Negra 9 A 36 Kg,4061
791315,Butaca Para Auto Babyauto Konar Negro Y Gris,4061
833908,Butaca Para Auto Babyauto Konar Roja/gris,4061
65915,Crema Eucerin Volume Filler Día Piel Normal A Mixta 50 Ml,4042
817948,Kiehl's Vital Skin-strengthening Hyaluronic Acid Super Sérum 50 Ml,4009
602082,Suplemento Whey Protein Isolate Power Frutilla 930 G,4005
765819,Booster Infanti Race Con Respaldo Desmontable,3988
765721,Booster Infanti Race Con Respaldo Desmontable Rojo,3988
765721,Booster Infanti Race Con Respaldo Desmontable Rojo,3988
90923,Cojín De Gel Theraback,3984
44658,Perfume Paco Rabanne One Million Edt 50 Ml,3974
603520,Gimnasio Didáctico Carestino Amigos,3959
817960,Kiehl's Super Multi-corrective Anti-aging Cream 75 Ml,3935
817961,Kiehl's Super Multi-corrective Cream Fps30 50 Ml,3935
797737,Sérum Anti-pigment Ultra Light 30 Ml,3886
40928,Perfume Paco Rabanne Black Xs Men Edt 50 Ml,3880
637325,Juego Fifa 22 Para Ps4,3850
715937,Fifa 22 Ps5,3850
639128,Perfume Ralph Lauren Ralph's Club Edp 30 Ml,3850
563278,Planchita Gama Elegance Led 4d Marula 220v,3834
9538334,Perfume Armani Ocean Di Gioia Edp Femme,3830
619079,Perfume Giorgio Armani Terra Di Gioia Femme Edp 30 Ml,3830
80949,Tensiómetro Gama Hl Bp 1304 Bat,3827
820693,Juego Fifa 23 Para Ps4,3812
605599,Perfume Giorgio Armani Code Man Edp 60 Ml,3804
599662,Estimulador Facial Y Corporal De Ondas,3791
25857,Perfume Cacharel Amor Amor Edt 50 Ml,3790
499277,Termómetro Frontal Infrarrojo,3781
790313,Extractor De Leche Eléctrico Snow Bear Digital,3760
790313,Extractor De Leche Eléctrico Snow Bear Digital,3760
88899,Suplemento Usn Whey Protein Chocolate 908 G,3750
88899,Suplemento Usn Whey Protein Chocolate 908 G,3750
603491,Alfombra Antigolpes Reversible Jungla 200x180 Cm,3739
510127,Perfume Yves Saint Laurent Libre Woman Edp 30 Ml,3734
867839,Booster Swiss Armor 3 En 1,3731
55525,Perfume Trésor Midnight Rose Femme Edp 50 Ml,3705
859920,Tensiómetro Digital De Muñeeca Hem-6124,3698
616868,Inflable Sunnyllife Bff Colchóneta Xl,3690
616868,Inflable Sunnyllife Bff Colchóneta Xl,3690
825112,Base Yves Saint Laurent All Hours Foundation N°mn8 Medium Neutral 25 Ml,3675
630309,Base Yves Saint Laurent Touche Eclat Le Teint N°bd50 Warm Honey 25 Ml,3675
825107,Base Yves Saint Laurent All Hours Foundation N°ln8 Night Neutral 25 Ml,3675
630010,Base Yves Saint Laurent Touche Eclat Le Teint N°b30 Almond 25 Ml,3675
630112,Base Yves Saint Laurent Touche Eclat Le Teint N°bd40 Warm Sand 25 Ml,3675
815212,Afeitadora Xionprofesional De Terminación,3658
658647,Depiladora Eléctrica Philips Bre700/00 Satinelle Advanced,3658
658717,Mixer Philips Hr2624/80,3658
658717,Mixer Philips Hr2624/80,3658
658647,Depiladora Eléctrica Philips Bre700/00 Satinelle Advanced,3658
815212,Afeitadora Xionprofesional De Terminación,3658
743392,Salad Maker Daewoo 200w,3658
603496,Bañito Plegable Carestino Con Soporte Celeste,3629
603496,Bañito Plegable Carestino Con Soporte Celeste,3629
660082,Aspiradora Ciclónica Enxuta Aenxc182000ng 2000w,3622
886896,Freidora De Aire Cuori Modelo Creta 5 L,3622
660082,Aspiradora Ciclónica Enxuta Aenxc182000ng 2000w,3622
659338,Cafetera De Goteo Bosch Tka3a034 Compactclass Roja,3622
892224,Perfume Armani Code Le Parfum Man 50 Ml,3617
892224,Perfume Armani Code Le Parfum Man 50 Ml,3617
892224,Perfume Armani Code Le Parfum Man 50 Ml,3617
400331,Suplemento Atlhetica Protein Premium Vainilla 1800 G,3590
400331,Suplemento Atlhetica Protein Premium Vainilla 1800 G,3590
603501,Silla De Comer Carestino Osaka Booster Verde,3519
603529,Silla De Comer Carestino Osaka Booster Gris,3519
603531,Silla De Comer Carestino Osaka Booster Rosa,3519
603501,Silla De Comer Carestino Osaka Booster Verde,3519
791014,Horno Eléctrico Allied Al-eo21 Silver 23 L,3504
642944,Cámara Web Argom Full Hd Con Micrófono,3499
642944,Cámara Web Argom Full Hd Con Micrófono,3499
74973,Petaca Aily Portafolio Completa,3496
85274,Base Lancôme Teint Idole Ultra Wear Fps15 N°055 30 Ml,3495
306936,Fluido Isdin Ultra Active Unify Color Fps9 50 Ml,3493
817944,Kiehl's Retinol Skin-renewing Daily Micro-dose Sérum 30 Ml,3484
817942,Kiehl's Powerfull-strength Vitamin C Sérum 50 Ml,3443
614354,Juego Ps4 Crash Bandicoot 4 Its About Time,3427
23340,Perfume Ralph Lauren Polo Blue Edt 40 Ml,3425
76786,Contorno De Ojos La Roche Posay Redermic R 15 Ml,3425
67184,Perfume Ralph Lauren Polo Red Edt 40 Ml,3425
599761,Exfoliador Microdiamond Mantra Aqua,3411
599669,Exfoliador Microdiamond Mantra Rosado,3411
90935,Bastón Canadiense Reforzado Regulable,3390
780361,Auriculares Jbl Bt Tws Wave 100 Negro,3388
780360,Auriculares Jbl Bt Tws Wave 100 Marfil,3388
780360,Auriculares Jbl Bt Tws Wave 100 Marfil,3388
780361,Auriculares Jbl Bt Tws Wave 100 Negro,3388
865967,Disco Olímpico Profesional Negro 10 Kg,3375
79257,Nebulizador Omron Ne-c801,3358
811571,Planchita Gama Elegance Matcha Led Bvt,3349
866036,Mancuerna Hexagonal Engomada 10 Kg,3322
887896,Hyalu B5 La Roche Posay Sérum De Ojos 15 Ml,3300
887896,Hyalu B5 La Roche Posay Sérum De Ojos 15 Ml,3300
692504,Alfombra Carestino Plegable Bosque 177x195 Cm,3299
692504,Alfombra Carestino Plegable Bosque 177x195 Cm,3299
692506,Alfombra Carestino Plegable Aventura 177x195 Cm,3299
692506,Alfombra Carestino Plegable Aventura 177x195 Cm,3299
692504,Alfombra Carestino Plegable Bosque 177x195 Cm,3299
817939,Kiehl's Caléndula Herbal-extract Alcohol-free Toner 500 Ml,3296
619076,Perfume Lancôme Idole Aura Femme Edp 25 Ml,3295
361915,Sérum Physiolift Avene 30 Ml,3294
840411,Silla Bigjigs La Oveja,3273
79341,Afeitadora Gama Gsh900,3272
298300,Secador De Pelo Gama Diva 4d Kera-shine 220v,3272
660156,Licuadora Peabody 800w Blanco,3256
660157,Licuadora Peabody 800w Rojo,3256
660156,Licuadora Peabody 800w Blanco,3256
602188,Afeitadora Con Corta Patillas Philips,3256
867838,Booster Swiss Armor 2 En 1,3256
602188,Afeitadora Con Corta Patillas Philips,3256
660157,Licuadora Peabody 800w Rojo,3256
86128,Jardiance 10 Mg 30 Comprimidos,3239
799850,Juego Nba 2k22 Ps4,3234
799850,Juego Nba 2k22 Ps4,3234
90952,Andador De Aluminio Regulable 2 Barras,3219
660651,Freidora Sin Aceite Allied Al-afps50 3.5 L,3219
660651,Freidora Sin Aceite Allied Al-afps50 3.5 L,3219
537233,Bálsamo Biotherm Life Plankton Sensitive Balm 50 Ml,3200
817958,Kiehl's Super Multi-corrective Anti-aging Cream 50 Ml,3197
256333,Masajeador Led Ultrasonico Gama,3195
571621,Laboratorio De Mecánica Fórmula 1,3190
459383,Almohadilla Térmica Lumbar 220v,3190
91610,Crema Isispharma Geneskin Lift 50 Ml,3180
430360,Crema Payot Blue Techni Liss Nuit 50 Ml,3180
430160,Crema Payot Blue Techni Liss Jour 50 Ml,3180
867447,Pesas Rusas Kettlebells Azul 10 Kg,3159
238419,Extractor De Leche Nevi Eléctrico,3150
238419,Extractor De Leche Nevi Eléctrico,3150
58804,Sérum La Roche Posay Hydraphase Intense 30 Ml,3150
815118,Procesador De Alimentos Xion 800w,3146
892125,Perfume Armani New Code Edt 50 Ml,3145
892125,Perfume Armani New Code Edt 50 Ml,3145
892125,Perfume Armani New Code Edt 50 Ml,3145
817994,Kiehl's Creme De Corps Body Moisturizer 500 Ml,3132
652341,Suplemento Platinum 100% Whey Isolate Chocolate 930 G,3122
652540,Suplemento Platinum 100% Whey Isolate Vainilla 930 G,3122
652540,Suplemento Platinum 100% Whey Isolate Vainilla 930 G,3122
652341,Suplemento Platinum 100% Whey Isolate Chocolate 930 G,3122
660100,Procesadora De Alimentos Enxuta Sdaenxpa8942 1.5 L,3110
660100,Procesadora De Alimentos Enxuta Sdaenxpa8942 1.5 L,3110
824607,Iluminador Lancôme Teint Idole Stick N°03,3105
301148,Crema Hidratante Yves Saint Laurent Top Secrets Instant Moisture Glow Tr 40 Ml,3100
814182,Barra De Sonido Xion 2.1 4000w,3080
824314,Base Lancôme Teint Idole Ultra Wear & Glow N°425c 30 Ml,3070
824413,Base Lancôme Teint Idole Ultra Wear & Glow N°325c 30 Ml,3070
785596,Cofre Acqua Di Gio Edt 50 Ml + Gel + Crema 75 Ml,3060
817957,Kiehl's Ultra Facial Oil-free Lotion 125 Ml,3050
812471,Corta Pelo Gama Clipper Multifunción T923,3041
45448,Tiras Accu-chek Performa 50 Unidades,3040
611525,Tiras Accu-chek Guide 50 Unidades,3040
45448,Tiras Accu-chek Performa 50 Unidades,3040
45448,Tiras Accu-chek Performa 50 Unidades,3040
589922,Sérum Avene A-oxitive 30 Ml,3035
892133,Kiehl's Ultimate Shave Collection Gift Set,3025
892133,Kiehl's Ultimate Shave Collection Gift Set,3025
892133,Kiehl's Ultimate Shave Collection Gift Set,3025
892133,Kiehl's Ultimate Shave Collection Gift Set,3025
780359,Auriculares Jbl Gamer Quantum 100,3003
780359,Auriculares Jbl Gamer Quantum 100,3003
616867,Colchoneta Inflable Arcoíris,2990
559775,Leche La Roche Posay Lipikar Urea 5% 400 Ml,2990
616867,Colchoneta Inflable Arcoíris,2990
459382,Almohadilla Térmica Grande 220v,2990
41357,Crema Eucerin Facial Antienrojecimiento 50 Ml,2967
817985,Kiehl's Ginger Leaf & Hibiscus Firming Overnight Masque 100 G,2951
817945,Kiehl's Hydro-plumping Re-texturizing Sérum Concentrate 50 Ml,2951
817941,Kiehl's Clearly Corrective Dark Spot Corrector 30 Ml,2951
817978,Kiehl'snightly Refiningmicro-peel Concentrate 30 Ml,2951
11958,Inhalador Flixotide Osp 250 Mg 60 Dosis,2930
11958,Inhalador Flixotide Osp 250 Mg 60 Dosis,2930
816014,Licuadora Xion 650w Vaso Acero,2926
658608,Depiladora Eléctrica Philips Satinelle Essential Bre275/00,2926
658608,Depiladora Eléctrica Philips Satinelle Essential Bre275/00,2926
658608,Depiladora Eléctrica Philips Satinelle Essential Bre275/00,2926
510223,Fortalecedor De Uñas Isdin Si Nails Varnish 2.5 Ml,2916
658634,Cepillo Alisador Philips Stylecare Essential Bhh880/00,2890
886897,Exprimidor Oster Chrome Blanco,2890
602387,Recortador Philips Mg5730/15 Multigroom Series 5000,2890
602387,Recortador Philips Mg5730/15 Multigroom Series 5000,2890
602387,Recortador Philips Mg5730/15 Multigroom Series 5000,2890
84816,Afeitadora Gama Gsh895 220v,2888
887797,Toleriane La Roche Posay Rosaliac Spf30 50 Ml,2870
892132,Kiehl's Set Facial Fuel Daily Energizing Moisture Treatment For Men,2861
876071,Kiehl's Set The Ultimate Kiehl's,2861
892132,Kiehl's Set Facial Fuel Daily Energizing Moisture Treatment For Men,2861
459485,Almohadilla Térmica Cervical 220v,2850
326474,Crema Corporal Isispharma Neotone Body 100 Ml,2825
817984,Kiehl's Avocado Nourishing Hyration Mask 100 G,2820
817984,Kiehl's Avocado Nourishing Hyration Mask 100 G,2820
817984,Kiehl's Avocado Nourishing Hyration Mask 100 G,2820
326472,Crema Isispharma Neotone Prevent Fps50+ 30 Ml,2805
659938,Enxuta Ventilador De Pie Vpenx916w 140cm Blanco,2793
659938,Enxuta Ventilador De Pie Vpenx916w 140cm Blanco,2793
660805,Cafetera Eléctrica Punktal Express Pk-c103 2-4 Tazas Roja,2780
817982,Kiehl's Caléndula Petal Infused Calming Mask 100 Ml,2779
65598,Trayenta Duo 2.5 /850 Mg 60 Comprimidos,2776
