sku,name,price
90039,Contorno De Ojos Hidrisage Yeux 20 G,$2.186
89658,Mascarilla Hortensia De Manos Violeta 1 Par,$186
83936,Crema Biotherm Blue Therapy Multi-defender Piel Normal A Mixta Fps25 50 Ml,$4.690
306223,Tratamiento Biotherm Aqua Pure Super Concentrates Hidratante 50 Ml,$1.800
306423,Tratamiento Biotherm Aqua Bounce Super Concentrates Hidratante 50 Ml,$1.800
309653,Crema Biotherm Life Plankton Eye 15ml,$2.820
83934,Crema Biotherm Blue Therapy Cream-in-oil 50 Ml,$3.188
306323,Tratamiento Biotherm Aqua Glow Super Concentrates Hidratante 50 Ml,$1.800
90161,Crema Biotherm Blue Therapy Red Algae Uplift 50 Ml,$4.690
501794,Jabón Líquido Facial Asepxia Carbón 200 Ml,$333
90727,Sérum Biotherm Aquasource Concentrate 50 Ml,$3.520
501895,Mascarilla Asepxia Carbón Peel Off 30 G,$363
370420,Sérum Onérique Les Jolies Perles 30 Ml,$4.990
325184,Toallitas Desmaquillantes Nivea Micellair Expert 25 Unidades,$336
426263,Jabón En Barra Asepxia Bicarbonato 100 G,$182
501694,Gel Exfoliante Asepxia Con Carbón 120 G,$415
778455,Crema Biotherm Aquasource Cica Nutri 50 Ml,$2.675
778454,Gel Hidratante Biotherm Aquasource Hyalurónico Plump 50 Ml,$2.675
619072,Máscara Biotherm Life Plankton 75 Ml,$3.970
619073,Crema Biotherm Cera Repair 50 Ml,$3.125
749900,Gel Asepxia Gen Limpiador Micelar 200 Ml,$399
615057,Sérum Payot Roselift Collagene Concentre 30 Ml,$4.290
537233,Bálsamo Biotherm Life Plankton Sensitive Balm 50 Ml,$3.200
731354,Crema Garnier Express Aclara Media 40 G,$539
731454,Crema Garnier Express Aclara Clara 40 G,$539
749799,Gel Asepxia Gen Hidratante Matificante 50 G,$479
89884,Mascarilla Labios Hortensia Pink Mask 20 Unidades,$1.850
750299,Gel Asepxia Gen Limpiador Micelar 200 Ml,$399
797538,Máscara Purederm Vegan Hojas De Té 1 Unidad,$285
751404,Toallitas Desmaquillantes Nivea Rose Care 25 Unidades,$336
807064,Agua Micelar Garnier Express Aclara 400 Ml,$450
593527,Pack Jabón En Barra Asepxia Exfoliante 2 Unidades,$121
588118,Crema Biotherm Blue Therapy Red Algae 50 Ml,$4.690
797537,Máscara Purederm Real Petal Mg: Gel Lavanda 1 Unidad,$273
795935,Crema L'oréal Age Perfect Cell Renewal Night 50 Ml,$1.499
578986,Toallitas Desmaquillantes Purederm Veganas Biodegradables 30 Unidades,$315
797637,Máscara Purederm Para Ojeras Ilumindora 30 Unidades,$273
588119,Crema Biotherm Blue Therapy Red Algae Nuit 50 Ml,$4.960
667968,Pack Crema Cicatricure Antiedad 60 G + Contorno 15 G + Beauty50 G,$931
274452,Hidratante La Roche Posay Toleriane Sensitive Riche 40 Ml,$2.870
90171,Crema Dermur Novaskin Renew 60 Ml,$2.106
77511,Crema Isispharma Secalia A.h.a 200 Ml,$1.855
58864,Gel De Limpieza Biotherm Homme T-pur Anti Oil & Wet Nettoyant 125 Ml,$1.600
86385,Crema Avene Physiolift 30 Ml,$3.258
89037,Gel La Roche Posay Cicaplast B5 40 Ml,$1.240
845610,Bálsamo La Roche Posay Lipikar Eco 200 Ml,$1.525
817999,Kiehl's Lip Balm N°1 15 Ml,$700
324667,Contorno De Labios Dermur Effective No-code 15 Ml,$1.575
16974,Crema Dermur Effective Párpados 20 Ml,$1.575
619778,Sérum La Roche Posay Effaclar Duo (+) 30 Ml,$2.900
801566,Gel Para Cuello Y Escote Fillerina 12 Grado 5 30 Ml,$7.800
57138,Crema La Roche Posay Redermic R 30 Ml,$4.625
70305,Crema Pigmentclar Soin Joun Fps30 40 Ml,$3.780
801862,Gel Para Labios Fillerina 12 Grado 3 15 Ml,$3.900
60515,Crema Avene Antirojeces Forte 30 Ml,$2.014
82667,Crema Isispharma Ruboril Expert M 40 Ml,$2.100
817958,Kiehl's Super Multi-corrective Anti-aging Cream 50 Ml,$3.900
817987,Kiehl's Cranberry Seed Masque 100 G,$3.350
834808,Máscara Dermur Carbón Peelderm 30 G,$610
88850,Gel Isispharma Teen Derm Alpha Pure 30 Ml,$1.755
878278,Crema Contorno De Ojos Dermaglós Volumen + Estructura 15 G,$1.650
306926,Desmaquillante Isispharma Sensylia Gelee 200 Ml,$1.720
91612,Concentrado Isispharma Geneskin C Premium 10 Ml,$3.355
422753,Sérum Anti-edad Isdin Flavo-c Melatonin 10 Ampollas,$3.647
537633,Crema Avene Dermabsolu Color 40 Ml,$3.747
11485,Agua Termal Avene 150 Ml,$1.114
38243,Crema Eucerin Hyaluron Filler Día 50 Ml,$3.436
760811,Aqua Gel La Roche Posey Hyalu B5 Fps30 50 Ml,$4.300
45657,Crema Dermur Vitia 30 Ml,$1.359
801563,Crema De Día Fillerina 12 Grado 3 50 Ml,$4.500
54373,Crema Dermur Ea 55 Ml,$643
60425,Crema La Roche Posay Redermic Hyaluron C Piel Sensible 40 Ml,$4.725
69238,Contorno De Ojos Avene Calmante 10 Ml,$1.388
801763,Crema De Noche Fillerina 12 Grado 5 50 Ml,$6.200
76543,Crema Isispharma Neotone Radiance Fps50 30 Ml,$2.805
817954,Kiehl's Ultra Facial Moisturizer Fps30 125 Ml,$4.200
426263,Jabón En Barra Asepxia Bicarbonato 100 G,$182
325184,Toallitas Desmaquillantes Nivea Micellair Expert 25 Unidades,$336
817984,Kiehl's Avocado Nourishing Hyration Mask 100 G,$3.440
82199,Fluido Hidratante Dermur Renacer 60 Ml,$846
501694,Gel Exfoliante Asepxia Con Carbón 120 G,$415
501794,Jabón Líquido Facial Asepxia Carbón 200 Ml,$333
832107,Sérum Eucerin Dermopure Triple Efecto 40 Ml,$2.142
501895,Mascarilla Asepxia Carbón Peel Off 30 G,$363
749900,Gel Asepxia Gen Limpiador Micelar 200 Ml,$399
90377,Exfoliante Neutrógena Acné Proofing 100 Ml,$585
90698,Jabón En Barra Asepxia Carbón 100 G,$182
87534,Crema Dermur Dermadn 60 Ml,$2.228
750299,Gel Asepxia Gen Limpiador Micelar 200 Ml,$399
751404,Toallitas Desmaquillantes Nivea Rose Care 25 Unidades,$336
578986,Toallitas Desmaquillantes Purederm Veganas Biodegradables 30 Unidades,$315
593527,Pack Jabón En Barra Asepxia Exfoliante 2 Unidades,$121
807064,Agua Micelar Garnier Express Aclara 400 Ml,$450
58864,Gel De Limpieza Biotherm Homme T-pur Anti Oil & Wet Nettoyant 125 Ml,$1.600
763616,Agua Micelar Pond's Detox 300 Ml,$416
763518,Agua Micelar Pond's Aloe 300 Ml,$208
556974,Limpiador Facial Pond's Fruity Naranja 200 Ml,$392
58193,Exfoliante Facial Matías González Anti-edad 50 Ml,$766
67776,Gel Secante Asepxia Emergencia Transparente 28 G,$342
675976,Leche Y Tónico Micelar Nivea Rose Care 200 Ml,$597
67904,Jabón Asepxia Exfoliante 100 G,$161
78162,Toallitas Desmaquillantes Neutrógena Night Calming 25 Unidades,$352
69662,Jabón Asepxia Azufre 100 G,$161
72621,Gel Exfoliante Biotherm Source Nettotant 150 Ml,$1.815
78373,Desmaquillante De Ojos Biotherm Biocils Waterproof 100 Ml,$1.320
817925,Kiehl's Caléndula Deep Cleansing Foaming Face Wash 230 Ml,$2.290
79589,Tónico Biotherm Biosource Lotion Adoucissante Piel Sensible 200 Ml,$1.815
817928,Kiehl's Midnight Recovery Cleansing Oil 175 Ml,$2.730
79588,Agua Micellar Biotherm Biosource 200 Ml,$1.810
817927,Kiehl's Midnight Recovery Botanical Cleansing Oil 85 Ml,$1.530
79590,Tónico Biotherm Biosource Lotion Tonifiante Piel Normal A Mixta 200 Ml,$1.815
817929,Kiehl's Rare Earth Deep Pore Daily Cleanser 75 Ml,$1.310
817932,Kiehl's Rare Earth Deep Pore Daily Cleanser 150 Ml,$1.900
817931,Kiehl's Blue Herbal Gel Cleanser 150 Ml,$2.080
370420,Sérum Onérique Les Jolies Perles 30 Ml,$4.990
818008,Kiehl's Facial Fuel Energizing Scrub 100 Ml,$1.530
817930,Kiehl's Cucumber Herbal Conditioning Cleanser 150 Ml,$1.900
817933,Kiehl's Ultra Facial Cleanser 150 Ml,$1.890
818007,Kiehl's Men Facial Fuel Energizing Cleanser 250 Ml,$1.640
824310,Leche Desmaquillante Biotherm Biosource Ps 400 Ml,$2.035
824309,Aceite Desmaquillante Limipador Biotherm Bios Renew Oil 200 Ml,$1.026
731354,Crema Garnier Express Aclara Media 40 G,$539
731454,Crema Garnier Express Aclara Clara 40 G,$539
818010,Kiehls Men Eye Fuel 15 Ml,$1.450
510428,Sérum Pure Shots Yves Saint Laurent Night Reboot 30 Ml,$4.900
785295,Crema De Ojos L'oréal Age Perfect Cell Renewal Creme Yeux 15 Ml,$1.299
65571,Crema L'oréal Revitalift Laser X3 Día 50 Ml,$1.849
874371,Cofre Biotherm Blue Therapy Red,$4.690
596135,Pack L'oréal Revitalift ácido Hialurónico Día 50 Ml + Sérum 30 Ml,$1.889
874373,Cofre Biotherm Cera Repair,$3.125
874372,Cofre Biotherm Blue Therapy Blue Pro-retinol Multi-correct,$3.745
817941,Kiehl's Clearly Corrective Dark Spot Corrector 30 Ml,$3.600
874377,Cofre Lancôme Sérum Genifique 50 Ml + Crema Renergie Nuit Multi-lift 15 Ml + Genifique Eye Creme 5 Ml + Genifique Creme 15 Ml,$5.040
874381,Cofre Biotherm Life Plankton,$4.300
874469,Cofre Biotherm Aquasource,$2.675
53685,Gel Matías González Afirmante 220 Ml,$700
510221,Sérum Pure Shots Yves Saint Laurent Lines Away 30 Ml,$4.900
783794,Crema Cicatricure Anti-edad Tricure 50 G,$966
269337,Afirmante Corporal Matías González No+ Flacidéz 200 Ml,$1.337
805470,Crema Hidratante Facial L'oréal Age Perfect Día 50 Ml,$1.269
42239,Lifting Natural Matías González Boto Herbal 50 Ml,$1.757
465894,Sérum Cosrx Triple Hyaluronic Moisture Ampoule 40 Ml,$2.500
304621,Cc Cream Payot Filtro N°2 40 Ml,$1.760
304321,Crema Payot Anti-edad Global Suprúme Jeunesse Día 50 Ml,$5.450
619978,Roller Gym Facial Hortensia Duo Skin,$2.500
603596,Crema Facial Cicatricure Age Care Reafirmante 50 Ml,$549
430360,Crema Payot Blue Techni Liss Nuit 50 Ml,$3.180
88524,Crema Antimanchas Cicatricure 50 G,$1.039
429661,Gel De Ojos Collistar Idro-attiva Eye Hydro-gel Ice 14 Ml,$1.800
876070,Kiehl's Set Daily Hydrating Duo,$3.190
80518,Crema Matías González Caviar Contorno De Ojos 15 Cc,$1.916
401131,Gel Collistar Fango Anticelulítico 400 Ml,$3.350
66064,Crema Biotherm Celluli Eraser 200 Ml,$4.165
303921,Crema Payot Glacée Hydra 24+ 50 Ml,$2.620
301148,Crema Hidratante Yves Saint Laurent Top Secrets Instant Moisture Glow Tr 40 Ml,$3.100
272546,Contorno De Ojos Cicatricure Blur & Filler 15 Ml,$904
510426,Crema Yves Saint Laurent Pure Shot Perfect Plumper 50 Ml,$5.400
817943,Kiehl's Clearly Corrective Dark Spot Corrector 50 Ml,$4.590
817932,Kiehl's Rare Earth Deep Pore Daily Cleanser 150 Ml,$1.900
346108,Gel Matías González Concentrado Vitamina C 20 Cc,$1.295
795936,Sérum Revitalift ácido Hialurónico Eye 20 Ml,$1.399
817925,Kiehl's Caléndula Deep Cleansing Foaming Face Wash 230 Ml,$2.290
854813,Exfoliante Natura Siberica Facial 150 Ml,$895
15497,Leche Desmaquillante Avene 200 Ml,$1.677
818007,Kiehl's Men Facial Fuel Energizing Cleanser 250 Ml,$1.640
58325,Crema La Roche Posay Effaclar M 40 Ml,$2.550
89496,Loción Cerave Limpiadora E Hidratante 473 Ml,$1.020
533533,Espuma De Limpieza Eucerin Dermato Clean Micelar 150 Ml,$1.459
493260,Agua Micelar Vichy Piel Mixta Grasa 200 Ml,$1.785
47630,Aceite De Ducha Eucerin Ph5 200 Ml,$941
84927,Loción Micellar Avene Cleanance 400 Ml,$1.865
42643,Emulsión De Limpieza Dermur 150 Ml,$790
76856,Agua Micellar Eucerin 3 En 1 200 Ml,$1.397
434664,Tónico Isispharma Aquaruboril 250 Ml,$1.385
41357,Crema Eucerin Facial Antienrojecimiento 50 Ml,$2.448
817933,Kiehl's Ultra Facial Cleanser 150 Ml,$1.890
10830,Desmaquillante Vichy Pureté Thermale 3 En 1 200 Ml,$1.970
729254,Limpiador Facial Anti-rugosidades Cerave 236 Ml,$825
302321,Agua Termal La Roche Posay 300 Ml,$2.000
818008,Kiehl's Facial Fuel Energizing Scrub 100 Ml,$1.530
63744,Gel Dermur Espuma Purificante 150 Ml,$908
23012,Tónico Vichy Normaderm Astringente 200 Ml,$1.800
73766,Gel Vichy Purete Thermal Nettovant 200 Ml,$1.970
817936,Kiehl's Caléndula Herbal-extract Alcohol-free Toner 250 Ml,$2.620
10834,Agua Termal Vichy Mineralizante Brumisateur 150 G,$1.400
817926,Kiehl's Caléndula Herbal-extract Alcohol-free Toner 125 Ml,$1.640
523328,Gel De Limpieza La Roche Posay Effaclar Duo+ Clean 400 Ml,$1.900
88916,Gel Limpiador Eucerin Dermopure Oil Control 200 Ml,$1.024
817317,Desmaquillarte Dermaglós De Ojos 100 Ml,$608
85048,Gel De Limpieza La Roche Posay Effaclar Gel Pieles Grasas 400 Ml,$1.900
42644,Emulsión De Limpieza Dermur 250 Ml,$1.147
817978,Kiehl'snightly Refiningmicro-peel Concentrate 30 Ml,$3.600
41658,Solución Miscellaire La Roche Posay Physiologique 200 Ml,$2.200
80165,Espuma De Limpieza Avene Matificante 150 Ml,$1.654
493160,Agua Micelar Vichy Piel Sensible 200 Ml,$1.785
729354,Crema Limpiadora Cerave Espuma Hidratante 236 Ml,$725
817937,Kiehl's Ultra Facial Toner 250 Ml,$1.400
73792,Mousse Vichy Purete Thermale 150 Ml,$1.840
37555,Leche De Limpieza Dermaglós 200 Ml,$955
613952,Gel Exfoliante Avene 75 Ml,$1.556
285579,Perfume Abercrombie & Fitch First Instinct Men Edt 30 Ml,$1.175
50180,Perfume Carolina Herrera 212 Vip Women Edp 50 Ml,$5.090
762412,Set María Riccetto Silky Musk Fragrance Mist 200 Ml + Crema Corporal 200 Ml,$940
86920,Perfume Legacy Nº1 Edt 50 Ml + Desodorante En Aerosol 150 Ml,$950
782797,Perfume Paco Rabanne Invictus Edt 200 Ml,$7.395
361715,Perfume Hugo Boss The Scent Absolute For Him Edp 100 Ml,$6.510
689288,Perfume Diesel Sound Of The Brave Men Edt 75 Ml,$5.160
505508,Perfume Issey Miyake L'eau D'issey Igo Edt 100 Ml,$7.990
824507,Perfume Yves Saint Laurent Y Reno Man Edt 40 Ml,$2.536
837909,Perfume Casapueblo Flow For Her Edt 100 Ml,$780
90239,Perfume Brooksfield Natural Edt 50 Ml,$930
835016,Set Paco Rabanne Phantom Man Edt 100 Ml + Desodorante 150 Ml,$5.875
737468,Perfume Valentino Born In Roma Uomo Edt 100 Ml,$5.252
532734,Perfume Adolfo Dominguez Gardenia Musk Edt 120 Ml,$2.510
76704,Perfume Gres Cabotine Edt 100 Ml,$2.490
467594,Perfume Cacharel Yes I Am Purple Edp 50 Ml,$4.390
590324,Perfume Hugo Boss Alive Edp 30 Ml,$3.218
67826,Colonia Colbert Noir 30 Cc + Desodorante 150 Cc,$976
785596,Cofre Acqua Di Gio Edt 50 Ml + Gel + Crema 75 Ml,$3.672
55753,Perfume Antonio Banderas The Golden Secret Men Edt 50 Ml,$1.276
369020,Perfume Mandarina Duck Let's Travel To París Woman Edt 100 Ml,$1.340
67632,Perfume Armani Si Edp 30 Ml,$3.792
833307,Perfume Benetton Man We Are Tribeedp 90 Ml,$1.730
549943,Perfume Quartz Blossom Femme Edp 30 Ml,$999
592826,Perfume Kenzo Flower By Kenzo Edt 50 Ml,$5.990
69872,Perfume Real Time Femenina Joyus Edt 100 Ml,$699
70979,Perfume Quartz Pour Homme Edt 50 Ml,$1.880
467194,Perfume Lancôme La Vie Est Belle New Intensement Edp 30 Ml,$3.084
375923,Perfume Lady Million Empire Edp 50 Ml,$4.476
806865,Perfume Carolina Herrera Good Girl Edp 30 Ml,$3.890
40928,Perfume Paco Rabanne Black Xs Men Edt 50 Ml,$3.880
85713,Perfume Paco Rabanne Lady Million Privé Women Edp 50 Ml,$4.335
285576,Perfume Abercrombie & Fitch First Instinct Women Edp 100 Ml,$2.500
25857,Perfume Cacharel Amor Amor Edt 50 Ml,$3.790
89448,Perfume V&l Agua Vitalidad Salvaje N°1 150 Ml,$935
325368,Perfume Benetton Together Femenina Edt 80 Ml,$1.575
79412,Perfume Sacre Black Edt 55 Ml,$573
737565,Perfume Valentino Born In Roma Yellow Donna Edp 50 Ml,$5.180
588224,Perfume Yves Saint Laurent Libre Intense Edp 50 Ml,$5.700
566001,Perfume Desire Beautiful Femme Edt 50 Ml,$824
83934,Crema Biotherm Blue Therapy Cream-in-oil 50 Ml,$3.188
818011,Kiehls Men Facial Fuel Eye De-puffer 5 G,$2.170
83936,Crema Biotherm Blue Therapy Multi-defender Piel Normal A Mixta Fps25 50 Ml,$4.690
818019,Kiehls Men Oil Elim 24h No Shin Gel 75 Ml,$1.680
818009,Kiehl's Men Facial Fuel Moisturizer Treatment 75 Ml,$1.680
306223,Tratamiento Biotherm Aqua Pure Super Concentrates Hidratante 50 Ml,$1.800
818016,Kiehl's Age Defender Power Sérum For Men 75 Ml,$2.840
90039,Contorno De Ojos Hidrisage Yeux 20 G,$2.186
306323,Tratamiento Biotherm Aqua Glow Super Concentrates Hidratante 50 Ml,$1.800
306423,Tratamiento Biotherm Aqua Bounce Super Concentrates Hidratante 50 Ml,$1.800
90161,Crema Biotherm Blue Therapy Red Algae Uplift 50 Ml,$4.690
90727,Sérum Biotherm Aquasource Concentrate 50 Ml,$3.520
309653,Crema Biotherm Life Plankton Eye 15ml,$2.820
818015,Kiehl's Men Age Defender Eye Repair 14 Ml,$2.040
778454,Gel Hidratante Biotherm Aquasource Hyalurónico Plump 50 Ml,$2.675
346108,Gel Matías González Concentrado Vitamina C 20 Cc,$1.295
783794,Crema Cicatricure Anti-edad Tricure 50 G,$966
778455,Crema Biotherm Aquasource Cica Nutri 50 Ml,$2.675
537233,Bálsamo Biotherm Life Plankton Sensitive Balm 50 Ml,$3.200
619073,Crema Biotherm Cera Repair 50 Ml,$3.125
619072,Máscara Biotherm Life Plankton 75 Ml,$3.970
749799,Gel Asepxia Gen Hidratante Matificante 50 G,$479
588118,Crema Biotherm Blue Therapy Red Algae 50 Ml,$4.690
588119,Crema Biotherm Blue Therapy Red Algae Nuit 50 Ml,$4.960
818013,Kiehl's Age Defender Cream Moisturizer 50 Ml,$3.000
795936,Sérum Revitalift ácido Hialurónico Eye 20 Ml,$1.399
795935,Crema L'oréal Age Perfect Cell Renewal Night 50 Ml,$1.499
366616,Cofre Crema L'oréal Revitalift ácido Hialurónico Día 50 Ml + Noche 50 Ml,$1.729
805470,Crema Hidratante Facial L'oréal Age Perfect Día 50 Ml,$1.269
615059,Crema Payot Roselift Collagene Nuit 50 Ml,$4.290
667968,Pack Crema Cicatricure Antiedad 60 G + Contorno 15 G + Beauty50 G,$931
612946,Base Cicatricure Gold Bronce 30 Ml,$515
612948,Base Cicatricure Gold Light 30 Ml,$1.030
612949,Base Cicatricure Gold Medium 30 Ml,$1.030
818011,Kiehls Men Facial Fuel Eye De-puffer 5 G,$2.170
801162,Crema Facial Antiedad Neutrógena Fps22 100 G,$600
818010,Kiehls Men Eye Fuel 15 Ml,$1.450
805367,Crema Hidratante Facial L'oréal Age Perfect Noche 50 Ml,$1.269
66457,Contorno De Ojos Biotherm Blue Therapy 15ml,$3.355
818019,Kiehls Men Oil Elim 24h No Shin Gel 75 Ml,$1.680
818015,Kiehl's Men Age Defender Eye Repair 14 Ml,$2.040
366616,Cofre Crema L'oréal Revitalift ácido Hialurónico Día 50 Ml + Noche 50 Ml,$1.729
68791,Crema Biotherm Blue Therapy Nuit Spb 50 Ml,$5.210
370420,Sérum Onérique Les Jolies Perles 30 Ml,$4.990
426263,Jabón En Barra Asepxia Bicarbonato 100 G,$182
65810,Bb Cream Biotherm Source Peau Fonce 30 Ml,$2.310
501694,Gel Exfoliante Asepxia Con Carbón 120 G,$415
501794,Jabón Líquido Facial Asepxia Carbón 200 Ml,$333
501895,Mascarilla Asepxia Carbón Peel Off 30 G,$363
556974,Limpiador Facial Pond's Fruity Naranja 200 Ml,$392
759510,Séruml'oréal Age Perfect Skin Midnight 30 Ml,$1.699
731354,Crema Garnier Express Aclara Media 40 G,$539
731454,Crema Garnier Express Aclara Clara 40 G,$539
749900,Gel Asepxia Gen Limpiador Micelar 200 Ml,$399
749799,Gel Asepxia Gen Hidratante Matificante 50 G,$479
750299,Gel Asepxia Gen Limpiador Micelar 200 Ml,$399
89884,Mascarilla Labios Hortensia Pink Mask 20 Unidades,$1.850
71849,Tratamiento Biotherm Bálsamo Labial Hidratante 13 Ml,$990
797537,Máscara Purederm Real Petal Mg: Gel Lavanda 1 Unidad,$273
593527,Pack Jabón En Barra Asepxia Exfoliante 2 Unidades,$121
797538,Máscara Purederm Vegan Hojas De Té 1 Unidad,$285
797637,Máscara Purederm Para Ojeras Ilumindora 30 Unidades,$273
83995,Loción Pamela Grant Ultra Skin Clean Bifásico 100 Ml,$242
771830,Mascarilla En Crema Facial Iroha Nature Confidence 1 Unidad,$336
556872,Gel Hidratante Pond's Fruity Naranja 110 G,$279
67776,Gel Secante Asepxia Emergencia Transparente 28 G,$342
655750,Sérum Cicatricure Vitamina C 30 Ml,$1.099
691497,Sérum Purederm Hyaluronic Acid 60 Ml,$973
693603,Máscara Hortensia V-line Lifting De Silicona 1 Unidad,$599
675977,Bruma Nivea Rose Care 150 Ml,$597
676577,Gel De Día Nivea Rose Care 50 Ml,$778
693801,Máscaras Hortensia Comprimidas 100 Unidades,$699
831407,Pack L'oréal Age Perfect Colágeno Día 70 Ml + Noche 70 Ml,$1.328
54355,Crema Dermur Azuleno 60 Ml,$941
817969,Kiehls Midnight Recovery Concentrat 50ml,$4.900
77609,Bandas Purederm Para Puntos Negros 6 Unidades,$535
874168,Sérum L'oréal Revitalift Ojos 20 Ml + Crema De Día 50 Ml,$1.889
536635,Ampollas Isdin Instant Flash Efecto Lifting 5 Unidades,$2.975
987932,Labial Vogue Líquido Colorissimo,$335
9535933,Protector Solar Anthelios Mineral One 30 Ml,$1.820
35810,Autobronceante Avene Naranja 100 Ml,$1.605
510424,Labial Yves Saint Laurent Rouge Pur Couture The Slim N°11,$2.485
536833,Protector Solar La Roche Posay Anthelios Mineral One N°3 Tan Fps50 30 Ml,$2.050
603591,Protector Solar La Roche Posay Anthelios Uv Daily Anti-age Con Color Fps50 50 Ml,$2.100
58896,Protector Solar Vichy Capital Soleil Toque Seco Fps50+ 50 Ml,$1.875
785194,Protector Solar Vichy Capital Soleil Uv Age Teint Light Fps50 40 Ml,$1.875
35451,Protector Solar Dermaglós Fps30 250 Ml,$851
76602,Protector Solar Isispharma Uveblock Fluido Invisible Fps50 40 Ml,$1.425
329678,Protector Solar Umbrella Perfect Skin Tono Oscuro Fps50+ 50 G,$1.975
822302,Protector Solar Vichy Capital Soleil Spray Fps30+ 200 Ml,$950
558578,Protector Solar Eucerin Sun Corporal Loción Toque Seco Fps50 200 Ml,$1.850
627006,Protector Solar Eucerin Antipigmento Fps50+ 50 Ml,$1.990
46269,Protector Solar Eucerin Sun Spray Niños Fps50 200 Ml,$1.850
512124,Protector Solar Isispharma Uveblock Mineral Sin Color Fps50 40 G,$1.535
86708,Crema Isdin Eryfotona Ak-nmsc Fluid Fps99 50 Ml,$3.846
46265,Protector Solar Eucerin Sun Facial Piel Seca Y Sensible Fps50 50 Ml,$1.950
13001,Protector Solar Dermaglós Crema Fps65 90 G,$926
422354,Protector Solar Isdin Fusion Watercolor Fps50 50 Ml,$2.626
620879,Protector Solar La Roche Posay Anthelios Dermo-pediatrics Bruma Invisible Fps50+ 125 Ml,$2.250
54812,Protector Solar Vichy Capital Soleil Toque Seco Fps30 50 Ml,$1.875
43620,Protector Solar Dermur Infantil Fps30 150 Ml,$875
812170,Protector Solar La Roche Posayanthelios Uv Mune 400 Fluido 50+ 50 Ml,$2.050
84556,Protector Solar La Roche Posay Anthelios Toque Limpio Color Fps50+ 50 Ml,$2.050
67134,Protector Solar Dermur Spray Fps30 180 Ml,$1.234
861420,Protector Solar La Roche Posay Rostro Anthelios Ka+ Fps50 50ml,$2.300
66637,Protector Solar Umbrella Plus Spray Fps50+ 120 G,$1.573
91398,Protector Solar La Roche Posay Anthelios Bruma Invisible Fps50+ 75 Ml,$1.680
542135,Protector Solar La Roche Posay Anthelios Shaka Spray Fps30 200 Ml,$2.250
603612,Protector Solar Vichy Uv Age Fps50 40 Ml,$1.875
825006,Protector Solar Dermaglós Bebés Fps65 120 G,$950
795538,Protector Solar La Roche Posay Anthelios Pigment Correct Tono Medio Fps50+ 50 Ml,$2.100
35452,Protector Solar Dermaglós Fps40 250 Ml,$881
54695,Protector Solar Dermur Fps30+ 250 Ml,$1.306
80573,Protector Solar Vichy Ideal Soleil Facial Anti Manchas Fps50+ 50 Ml,$1.875
726553,Fluido Avene Sport Fps50+ 100 Ml,$1.759
502795,Sérum La Roche Posay Retinol B3 30 Ml,$3.990
536433,Protector Solar La Roche Posay Anthelios Mineral One N°4 Brown Fps50 30 Ml,$2.050
566781,Protector Solar Umbrella Fps50 60 G,$1.010
46271,Protector Solar Eucerin Sun Crema Con Color Fps50 50 Ml,$2.060
20505,Autobronceante Vichy Idéal Soleil Rostro 100 Ml,$1.900
16974,Crema Dermur Effective Párpados 20 Ml,$1.575
822303,Protector Solar Vichy Capital Soleil Kids Water Resistant Spray Fps50+ 200 Ml,$950
11309,Loción Avene Limpieza Pieles Intolerantes 200 Ml,$1.788
550844,Crema Dermaglós Hidrosoluble 100 G,$916
89496,Loción Cerave Limpiadora E Hidratante 473 Ml,$1.020
80423,Shampoo Vichy Dercos Anticaspa Cabello Seco 200 Ml,$1.325
75261,Crema Eucerin Aquaporin Active Piel Normal A Mixta 50 Ml,$1.725
54355,Crema Dermur Azuleno 60 Ml,$941
82408,Ampollas Vichy Dercos Aminexil Para Mujer 12 Unidades,$4.990
801563,Crema De Día Fillerina 12 Grado 3 50 Ml,$4.500
91612,Concentrado Isispharma Geneskin C Premium 10 Ml,$3.355
595630,Ampollas Isdin Pigment Expert & Night Peel 20 Unidades,$6.039
801763,Crema De Noche Fillerina 12 Grado 5 50 Ml,$6.200
800656,Shampoo Crescina Re-crecimiento Caballero 200 Ml,$1.600
43239,Leche La Roche Posay Lipikar Con Válvula 400 Ml,$2.300
613953,Crema Cerave Smoothing 340 G,$1.050
49837,Protector Solar Avene Spray Niños Fps50+ 200 Ml,$2.025
65028,Actipur Crema A.i. Dorado 30 Ml,$1.580
29609,Crema Avene Nutritiva Compensadora 50 Ml,$2.789
306924,Crema Isispharma Sensylia 40 Ml,$1.810
70305,Crema Pigmentclar Soin Joun Fps30 40 Ml,$3.780
493260,Agua Micelar Vichy Piel Mixta Grasa 200 Ml,$1.785
57809,Tratamiento La Roche Posay Substiane (+) Ojos 15 Ml,$3.200
533533,Espuma De Limpieza Eucerin Dermato Clean Micelar 150 Ml,$1.459
10834,Agua Termal Vichy Mineralizante Brumisateur 150 G,$1.400
68574,Shampoo Eucerin Dermocapillaire Revitalizante 250 Ml,$1.087
818480,Shampoo Vichy Dercos Anti-caspa Cabello Seco 390 Ml,$1.900
326373,Gel Isispharma Neotone 150 Ml,$1.625
398628,Protector Solar Dermaglós Fps30 380 Ml,$906
880776,Crema Bagóvit Reafirmante Efecto Tensor 350 G,$871
859620,Cofre La Roche Posay Aqua Gel Hyalu B5 50 Ml + Sérum Hyalu B5 15 Ml,$4.100
35452,Protector Solar Dermaglós Fps40 250 Ml,$881
46271,Protector Solar Eucerin Sun Crema Con Color Fps50 50 Ml,$2.060
548843,Protector Solar Dermaglós Niños Fps50 180 Ml,$834
78383,Aceite Eucerin Anti-estrías 125 Ml,$1.551
87512,Crema Dermur Kimullen 60 Ml,$2.091
612855,Crema Eucerin Ph5 Advanced Repair 450 Ml,$2.238
15855,Crema Dermur Effective Action 30 Ml,$979
760812,Sérum Vichy Neovadiol Peri & Post-menopausia Meno 5 30 Ml,$2.793
89369,Crema Dermur Be Tense 60 Ml,$1.960
603792,Perfume Desire Grey For Men Edt 50 Ml + Desodorante En Aerosol 150 Ml,$934
46191,Perfume Carolina Herrera 212 Sexy Man Edt 30 Ml,$2.780
785596,Cofre Acqua Di Gio Edt 50 Ml + Gel + Crema 75 Ml,$3.672
87539,Perfume Carolina Herrera 212 Vip Men Black Edt 100 Ml,$5.925
89485,Perfume V&l Agua Frescor Extremo N°2 150 Ml,$935
46675,Perfume Antonio Banderas Seduction In Black Men Edt 50 Ml,$1.215
90240,Perfume Urban Care Pack Unlimited Deep Blue Edt 75 Ml + Desodorante 150 Ml,$654
605600,Perfume Yves Saint Laurent Y Eau Fraiche Man Edt 100 Ml,$5.252
633413,Perfume Dior Sauvage Elixir 60 Ml,$9.400
782168,Perfume Armani Aqua Di Gio Refillable Edp 125 Ml,$6.160
309633,Perfume Hugo Boss Bottled Infinite Man Edp 100 Ml,$6.360
377521,Perfume Carolina Herrera Bad Boy Edt 100 Ml,$5.934
66892,Perfume Paco Rabanne Invictus Men Edt 50 Ml,$3.975
23511,Perfume Azzaro Pour Homme Edt 100 Ml,$5.710
76058,Perfume Dior Sauvageman Edt 60 Ml,$5.240
81503,Perfume Play Intense Man Edt 50 Ml,$532
87519,Set Perfume Casapueblo 24hrs Charm Edt 100 Ml + Gel De Ducha 100 Ml,$758
557287,Perfume Polo Red Man Edp 125 Ml,$5.208
673478,Perfume Paco Rabanne Phantom Man Edt 50 Ml,$4.310
90224,Perfume Benetton Colors Man Green Edt 60 Ml,$1.065
605012,Perfume Dieselspirit Of The Brave Man Edt 50 Ml,$4.390
783293,Perfume V&l N°7 Frescor Mediterráneo Men Edt 150 Ml,$935
88421,Perfume Azzaro Wanted Man Edt 100 Ml,$5.860
23336,Perfume Ralph Lauren Polo Blue Edt 75 Ml,$3.497
285780,Perfume Hollister Fest Vibes For Him Edt 30 Ml,$550
64747,Perfume Ulric De Varens For Men Edt 100 Ml,$1.700
40055,Perfume Desire Black For Men Edt 50 Ml + Desodorante Edt 50 Ml,$934
