sku,name,price
865441,Tostadora Cuori Tostino Plus (o),$1.600
658615,Planchita Philips Hp8325/10 Essential Care,$2.760
660147,Jarra Eléctrica Peabody Roja,$3.640
660149,Sandwichera 5 En 1 Peabody Blanca,$3.200
660153,Cafetera Express Peabody Negro,$8.440
660811,Freidora De Aceite Punktal Pk-fr105 2.5 L,$2.840
659940,Enxuta Ventilador De Pie Vpenx920w 170cm Blanco,$3.192
659315,Picadora De Carne Bosch Muz5fw1 Para Batidora Robot Mum5,$4.320
660669,Cepillo Alisador Punktal Pk-nv4916,$1.000
659943,Enxuta Anafe De Empotrar Aenx5546 Inox,$9.320
659937,Enxuta Ventilador De Pie Vpenx916n 140cm Negro,$2.793
660847,Jarra Eléctrica Punktal De Plástico Pk-3325jp Roja 1.7 L,$1.080
660797,Tostadora Eléctrica Punktal Pk-ai858 Inoxidable,$1.440
660813,Licuadora Punktal Pk-li287 520w,$1.600
660803,Sandwichera Doble Punktal Pk-cr44 3 En 1 800w,$2.000
660780,Enfriador De Vinos Punktal Pk-ev8l 8 Botellas,$7.880
660667,Corta Pelo Punktal Pk-hc2016 Recargable,$1.560
743090,Aire Acondicionado Enxuta Aaenx222-12000 Btu,$18.240
743695,Aire Acondicionado Enxuta Aaenxi222s 18000 Btu Inverter Smart,$40.000
743091,Aire Acondicionado Enxuta Inverter Smart 12000 Btu,$24.000
690299,Horno Eléctrico Enxuta Henx2335 Negro 34 L,$4.760
658672,Plancha A Vapor Philips Gc360/30 Steamer,$4.720
658644,Afeitadora Philips S1121/41 Aquatouch,$2.760
660665,Secador De Pelo Punktal Pk-2200ion 2200w,$1.440
690295,Lavarropas Enxuta Lenx25550 Con Carga Superior Semi-automático 5.5 Kg,$5.040
833909,Licuadora Cuori Gianna,$2.080
755410,Centrifugadora Enxuta Carga Superior 4.2 Kg,$5.240
724541,Lavarropas Enxuta Semi-automático 10 Kg,$5.920
724441,Horno De Emportrar Enxuta Heenxg5500ng A Gas Negro,$18.520
830810,Combo Gama Planchita Elegance Coconut + Secador H Bora Lino,$4.434
792228,"Televisor Enxuta Smart Full Hd Ledenx1240s 40""",$10.640
813980,Planchita Gama Elegance St Keration Bv,$3.079
813981,Secador De Pelo Gama Salon Pro Pink-diva,$2.855
813979,Planchita Gama Dual Plates Digital Cp14,$4.430
500698,Pilas Duracell Lithium Dl 123/3 Vlts 1 Unidad,$512
493373,Funda Fanta Naranja 1 L 6 Unidades,$861
660831,Picadora De Alimentos Punktal Pk-12300 750w,$2.040
457382,Lavandina Júpiter 2 L,$113
792628,Aros Chiaramo Cascada Rosa,$785
302625,Limpiador Fabuloso Alternativa Al Cloro 1 L,$98
837610,Botella Stanley Flip Classic 500 Ml Edición Especial,$2.219
498710,Tableta Garoto Jumbo Crocante 90 G,$113
295096,Toallas Elite Maxwipe 50 Paños,$178
785395,Suavizante Comfort Concentrado Cuidado Intensivo Fiber 1 L,$311
825561,Powerade Naranja 600 Cc,$45
35997,Chocolate Mila Leger De Leche 45 G,$96
85724,Té Guaco Con Miel Cabral 10 Saquitos,$88
743190,Batidora Daewoo Planetaria Negro 650w,$8.520
565986,Vaso Con Sorbito Helado,$469
91087,Suavizante Downy Floral 800 Ml,$159
849019,Libro Aventuras En La Gran Ciudad Paw Patrol,$90
453576,Libro Ollas,$1.431
80964,Lavavajillas Cristal Limón Verde 300 Ml,$92
75053,Barra De Cereales Cereal Mix Yogur Frutilla 26 G,$37
660152,Cafetera Peabody Con Filtro,$3.720
813777,Batidora Vertical Cuori Presto Plus,$2.160
860025,Caramelos Mentos Limón Flowpack 6 Unidades 16 G,$18
286575,Bolsa De Residuos Júpiter Verde 70x100 Cm,$225
839409,Libro El Horizonte,$801
815231,Panificadora Xion,$4.640
573948,Limpia Cafetera Dr. Beckmann 6 Unidades,$255
38601,Pañuelos Elite Faciales Premium Cubo 60 Unidades,$113
849416,Libro Disney Toy Story 4 - Hecho Para Jugar,$108
616965,Tabla De Surf Inflable Sunnylife Tiburón,$1.890
498874,Bolsas De Residuo Unisold Negra 50x62 Cm 10 Unidades,$40
25880,Cedro Santo Botica Del Señor 40 G,$150
77018,Detergente Cristal Lavavajilla Limón 500 Ml,$81
881677,Repuesto D3 Para Masajeador Inalámbrico Wms,$1.200
881777,Masajeador D3 Inalámbrico WMS,$10.000
821209,Aspiradora Xiaomi Mi Robot Vacuum Mop 2,$16.360
660651,Freidora Sin Aceite Allied Al-afps50 3.5 L,$3.500
624299,Pistola Energy De Calor 2000 W,$933
813777,Batidora Vertical Cuori Presto Plus,$2.160
85726,Té Jengibre Con Miel Cabral 10 Saquitos,$90
660149,Sandwichera 5 En 1 Peabody Blanca,$3.200
660663,Radio De Bolsillo Allied Al-ra32 Am-fm,$800
660153,Cafetera Express Peabody Negro,$8.440
865441,Tostadora Cuori Tostino Plus (o),$1.600
660152,Cafetera Peabody Con Filtro,$3.720
660147,Jarra Eléctrica Peabody Roja,$3.640
836514,Planchita Beauty Style 2 En 1,$4.900
659940,Enxuta Ventilador De Pie Vpenx920w 170cm Blanco,$3.192
659315,Picadora De Carne Bosch Muz5fw1 Para Batidora Robot Mum5,$4.320
660847,Jarra Eléctrica Punktal De Plástico Pk-3325jp Roja 1.7 L,$1.080
659943,Enxuta Anafe De Empotrar Aenx5546 Inox,$9.320
659937,Enxuta Ventilador De Pie Vpenx916n 140cm Negro,$2.793
755209,Juego De Parrilla De Madera,$1.590
660803,Sandwichera Doble Punktal Pk-cr44 3 En 1 800w,$2.000
660811,Freidora De Aceite Punktal Pk-fr105 2.5 L,$2.840
660813,Licuadora Punktal Pk-li287 520w,$1.600
743091,Aire Acondicionado Enxuta Inverter Smart 12000 Btu,$24.000
660780,Enfriador De Vinos Punktal Pk-ev8l 8 Botellas,$7.880
743090,Aire Acondicionado Enxuta Aaenx222-12000 Btu,$18.240
743695,Aire Acondicionado Enxuta Aaenxi222s 18000 Btu Inverter Smart,$40.000
660797,Tostadora Eléctrica Punktal Pk-ai858 Inoxidable,$1.440
833909,Licuadora Cuori Gianna,$2.080
755410,Centrifugadora Enxuta Carga Superior 4.2 Kg,$5.240
312340,Chocolate Kit Kat 4 Finger Dark,$68
724441,Horno De Emportrar Enxuta Heenxg5500ng A Gas Negro,$18.520
690299,Horno Eléctrico Enxuta Henx2335 Negro 34 L,$4.760
724541,Lavarropas Enxuta Semi-automático 10 Kg,$5.920
792228,"Televisor Enxuta Smart Full Hd Ledenx1240s 40""",$10.640
690295,Lavarropas Enxuta Lenx25550 Con Carga Superior Semi-automático 5.5 Kg,$5.040
690335,Picadora De Carne Punktal Pk-498 2 Velocidades 1400w,$4.360
782693,Sierra Circular Black & White 185 Mm,$3.990
791721,"Televisor Philips Led Smart Hd 32"" Sin Bordes",$14.400
841410,Aspiradora Black & White Bajo Ruido 30 L 1000w,$5.699
846067,Robot De Cocina Boj,$74.040
782794,Inflador Cargador Black & White Recargable,$2.780
841412,Limpia Vidrios Black & White A Batería 15w 1 L,$1.890
835608,Consola Play Station 5 + Juego Horizon Forbidden West,$58.040
690322,Freidora Sin Aceite Punktal Pk-190 3.2 L,$4.320
820693,Juego Fifa 23 Para Ps4,$3.960
820694,Juego Fifa 23 Para Ps5,$4.760
599873,Organizador De Cables Hasta 6 Negro,$99
605399,Silla Gamer Reclinable Negro,$7.499
614356,Juego Ps4 Grand Theft Auto V Premium Edition,$1.600
616358,Auriculares Sony Inalámbricos Para P5 P4 Pulse 3d,$9.240
612046,Parlante Jbl Flip 5 Azul,$6.320
599866,Auriculares Bluetooth Tws Blanco Tl1,$1.799
409950,Cargador Usb Doble Irago 7996,$99
599966,Micrófono Multifunción Rosa,$2.060
715937,Fifa 22 Ps5,$4.000
599871,Organizador De Cables Hasta 6 Blanco,$99
599867,Cargador Inalámbrico Magnetico A41,$1.299
616357,Cámara Hd Ps5,$4.360
616257,Control Inalámbrico Dualsense Ps5,$4.960
605398,Silla Gamer Reclinable Negro Con Blanco,$7.499
637325,Juego Fifa 22 Para Ps4,$4.000
614354,Juego Ps4 Crash Bandicoot 4 Its About Time,$3.560
599872,Organizador De Cables Hasta 6 Verde,$99
814182,Barra De Sonido Xion 2.1 4000w,$3.200
70014,Aromatizante De Ambientes Automático Glade Aceites Naturales Vainilla + Recarga 21 Ml,$388
780359,Auriculares Jbl Gamer Quantum 100,$3.120
331288,Aparato Aromatizante De Ambientes Júpiter + Repuesto Aroma Relax 300 Ml,$730
325081,Desodorante De Ambiente Júpiter Limón 300 Ml,$169
36926,Aromatizante De Ambientes Glade Toque Lavanda Portátil 9 G,$234
70018,Aromatizante De Ambientes Automático Glade Lavanda Y Vainilla + Repuesto 175 G,$599
90690,Aromatizador De Ambientes Suances Green Tea 250 Ml,$154
91466,Repuesto Aromatizante De Ambientes Automático Glade Placer Real Y Frutos Rojos 175 G,$309
79401,Repuesto Aromatizante De Ambientes Automático Glade Limón Refrescante 175 G,$309
91482,Aromatizante De Ambientes Glade Mini Gel Hogar Limón Refrescante 70 G,$102
76638,Repuesto Aromatizante De Ambientes Glade Aceites Naturales Vainilla 21 Ml,$363
246624,Desodorante De Ambientes Júpiter Lavanda 360 Ml,$98
533833,Repuesto Aromatizante De Ambientes Automático Glade Lavanda Y Vainilla 170 Ml,$194
309833,Recarga Desodorante De Ambientes Automático Glade Lavanda + Vainilla 175 G 2 Unidades,$450
352415,Desinfectante De Ambientes Y Elimina Olores En Aerosol Lysoform Aire De Montaña 495 Ml,$260
45193,Repuesto Desodorante De Ambientes Glade Toque Seco Lavanda 9 G 1 Unidad,$184
91468,Desodorante De Ambientes En Aerosol Glade Placer Floral Y Frutos Rojos 275 Ml,$113
90208,Recarga Perfumador Harpers Aerosol Limón 220 Ml,$169
90691,Aromatizante De Ambientes Suances Melón Y Sandia 250 Ml,$140
566587,Aromatizante De Ambientes En Aerosol Glade Floral Perfection 360 Ml,$113
325182,Desodorante De Ambiente Júpiter Lavanda 300 Ml,$169
16945,Desodorante De Ambientes Glade Campos De Lavanda 420 Ml,$113
91477,Repuesto Aromatizante De Ambientes Glade Aceites Naturales Limón Refrescante 21 Ml,$319
90514,Desodorante De Ambientes Glade Aerosol Limón Y Lavanda 360 Ml 2 Unidades,$199
566681,Repuesto Aromatizante De Ambientes Automático Glade Flores Tropicales Y Coco 175 G,$309
79402,Repuesto Aromatizante De Ambientes Automático Lysoform 175 G,$384
70268,Repuesto Aromatizante De Ambientes Automático Glade Lavanda Y Vainilla 175 G,$309
70267,Repuesto Aromatizante De Ambientes Automático Glade Manzana Y Canela 175 G,$309
16946,Aromatizante De Ambientes Glade Jazmín En Aerosol 360 Ml,$113
325268,Desodorante De Ambiente Júpiter Relax 300 Ml,$169
91458,Repuesto Aromatizante De Ambientes Automático Glade Caricias De Algodón 175 G,$309
577580,Limpiador Cif Crema Original Multiuso 750 Ml,$153
79400,Aromatizante De Ambientes En Aerosol Glade Limón Refrescante 360 Ml,$113
88521,Aromatizante De Ambientes En Gel Glade Cono Lavanda 170 G,$160
533733,Repuesto Aromatizante Automático Glade Limón 110 G,$194
49865,Insecticida En Aerosol Raid Max Sin Olor 360 Cc,$215
91468,Desodorante De Ambientes En Aerosol Glade Placer Floral Y Frutos Rojos 275 Ml,$113
563978,Limpiador Líquido Multisuperficies Glade Bosques De Pino Botella 900 Ml,$101
246424,Desodorante De Ambientes Júpiter Bebé 360 Cc,$98
88525,Aromatizante De Ambientes En Gel Glade Cono Caricias De Algodón 170 G,$160
74912,Limpiador Bioclin Graseras Y Desagües 70 G,$275
84793,Discos Adhesivos Para Inodoro Pato Marina Aplicador + Repuesto 38 G,$284
330406,Pala Limpow Plástica Vertical Con Cabo,$48
476926,Desinfectante En Aerosol Odex Bebé 360 Ml,$135
330153,Cepillo Novica Varremesa,$166
15765,Desinfectante De Ambientes Y Elimina Olores En Aerosol Lysoform Original 360 Cc,$216
309832,Discos Adhesivos Para Inodoro Pato Floral Aplicador + Repuesto 12 G,$160
451776,Repuesto Limpiador Lysoform Cítrico 420 Ml,$116
91461,Insecticida Raid Mata Hormigas En Aerosol 390 Cc,$354
26943,Desinfectante De Ambientes Y Elimina Olores En Aerosol Lysoform Bebé 360 Ml,$216
862322,Repuesto Júpiter Insecticida Líquido 45 Noches,$211
302628,Limpiador Fabuloso Tulipanes Y Kiwi 1 L,$98
552953,Paño De Piso Duramás Extra Grande 55x65 Cm,$93
70850,Papel Higiénico Húmedo Fresh 80 Unidades,$213
608815,Limpiador Cif Ultra Brillo Anti Polvo 400 Ml,$228
80965,Lavavajilla Cristal Verde 300 Ml,$92
13023,Pañuelos Descartables Elite 6 Unidades,$106
577576,Limpiador Cif Antigrasa Biodegradable 450 Ml,$122
49637,Insecticida En Aerosol Raid Mata Moscas Y Mosquitos Sin Olor 360 Cc,$320
246724,Limpiador Júpiter Lavanda 950 Ml,$58
88826,Limpiador Fabuloso Complete Blue 828 Ml,$128
90691,Aromatizante De Ambientes Suances Melón Y Sandia 250 Ml,$140
330131,Repuesto Mopa Novica Algodón,$264
246424,Desodorante De Ambientes Júpiter Bebé 360 Cc,$98
330150,Pala Novica Colectora Canguro,$664
442169,Detergente Nevex Ultra Antigrasa Limón 500 Ml,$95
77568,Papel Higiénico Elite Húmedo 40 Unidades,$151
603599,Toallitas Desinfectantes Fabuloso 40 Unidades,$156
70275,Limpiador Líquido Multisuperficies Glade Floral Perfection 900 Ml,$101
77568,Papel Higiénico Elite Húmedo 40 Unidades,$151
621882,Limpiador De Pisos Plastificados Y Flotantes Blem Original 400 Ml,$166
38601,Pañuelos Elite Faciales Premium Cubo 60 Unidades,$113
850616,Set Hogui Cepillo Y Pala,$249
302624,Limpiador Fabuloso Lavanda Antibacterial 1 L,$98
79458,Pañuelos Descartables Elite Antivirales 6 Unidades,$128
330147,Cepillo Novica Sanitario,$138
366315,Servilletas Elite Diseño Decorativo 20 Unidades,$94
366315,Servilletas Elite Diseño Decorativo 20 Unidades,$94
18396,Detergente Cristal Lavavajillas Limón 1.25 L,$123
338626,Servilletas Elite Para Mesa Blanco 200 Unidades,$178
13028,Pañuelos Elite Faciales 100 Unidades,$113
330399,Papel Higiénico Cameratta Doble Hoja 30 M 4 Rollos,$85
578086,Papel Higiénico Elite Ultra Doble Hoja 50 M 4 Rollos,$255
13023,Pañuelos Descartables Elite 6 Unidades,$106
795735,Papel Higiénico Higienol Sin Fin 60 M 8 Rollos,$237
330395,Papel Higiénico Cameratta Hoja Simple 60 M 4 Rollos,$77
816815,Rollo De Cocina Nova Extra 360 Paños 3 Rollos,$223
769827,Servilleta Cocktail Elite 200 Unidades,$130
79458,Pañuelos Descartables Elite Antivirales 6 Unidades,$128
734358,Papel Higiénico Elite Ultra Compact 16 Rollos,$503
70850,Papel Higiénico Húmedo Fresh 80 Unidades,$213
86538,Rollo De Cocina Elite Ultra 2 Unidades,$123
816816,Toallas De Papel Novagigante Doble Hoja 100 M,$325
413655,Papel Higiénico Higienol Premium 30 M 4 Rollos,$152
717137,Rollo De Cocina Cameratta 200 Hojas 1 Rollo,$77
68367,Papel Higiénico Higienol Premium Doble Hoja 30 M 8 Rollos,$229
425453,Servilletas Elite Cocktail Blanca 50 Unidades,$41
330407,Rollo De Cocina Cameratta 55 Hojas 2 Rollos,$53
295096,Toallas Elite Maxwipe 50 Paños,$178
338632,Servilletas Sussex Nova Extra Mesa Blanca 200 Unidades,$157
13027,Pañuelos Elite Faciales 75 Unidades,$71
559875,Servilletas Elite Blancas 50 Unidades,$56
822305,Papel Higiénico Húmedo Wetclean 80 Unidades,$202
330398,Servilletas Cameratta 50 Unidades,$34
816715,Rollo De Cocina Elite Deco 200 Paños 2 Unidades,$163
769427,Rollo De Cocina Nova Extra 3 Unidades 180 Paños,$133
13015,Papel Higiénico Elite Ultra Blanco 30 Metros 4 Unidades,$152
451776,Repuesto Limpiador Lysoform Cítrico 420 Ml,$116
476316,Pañuelos Desechables Be Eco Bambú 10 Unidades 10 Paquetes,$81
90598,Pañuelos Elite Pocket 1 Unidad,$24
80965,Lavavajilla Cristal Verde 300 Ml,$92
442169,Detergente Nevex Ultra Antigrasa Limón 500 Ml,$95
476216,Papel Higiénico Be Eco Bambú Triple Hoja 22 M 4 Rollos,$156
594927,Papel Higiénico Higienol Max Hoja Simple 100 M 8 Rollos,$486
26943,Desinfectante De Ambientes Y Elimina Olores En Aerosol Lysoform Bebé 360 Ml,$216
246924,Limpiador Júpiter Floral 950 Ml,$58
77018,Detergente Cristal Lavavajilla Limón 500 Ml,$81
85856,Pulidor Cristal En Crema Clásico 500 Ml,$152
43140,Detergente Nevex Cristalino Limón 1.250 L,$123
91484,Bloque Para Mochila De Inodoro Pato 40 G 2 Unidades,$262
604896,Detergente Cif Ultra Core Limón Verde 750 Ml,$178
621783,Cera Líquida Pisos Cerámicos Blem Incoloro 800 Ml,$381
582403,Limpiador De Pisos Cif Fragancia Relajante 1.75 L,$161
577580,Limpiador Cif Crema Original Multiuso 750 Ml,$153
91470,Repuesto Canasta Líquida Glade Mañana De Campo 50 Ml,$204
582400,Limpiador De Pisos Cif Fragancia Armonizante 900 Ml,$93
18397,Detergente Cristal Lavavajillas Aloe 1.25 L,$123
365715,Desodorante De Ambientes Júpiter Alfombra Y Tapizado 275 Ml,$128
70277,Limpiador Líquido Multisuperficies Glade Harmony 900 Ml,$101
88905,Detergente Concentrado Cif Active Gel Limón Verde 500 Ml,$136
84793,Discos Adhesivos Para Inodoro Pato Marina Aplicador + Repuesto 38 G,$284
306931,Limpiador Fabuloso Lavanda Antibacterial 2 L,$181
619577,Limpiador Líquido Desinfectante De Superficies Lysoform Bosque De Pinos 900 Ml,$96
45185,Lustramuebles En Aerosol Blem Brillo Y Protección Madera Original 360 Cc,$295
302627,Limpiador Fabuloso Mar Fresco Antibacterial 1 L,$98
91485,Limpiador Adhesivo Lysoform Cítrico 30 G,$118
457182,Repuesto Limpiador Júpiter 3 En 1 Con Gatillo 450 Ml,$131
621882,Limpiador De Pisos Plastificados Y Flotantes Blem Original 400 Ml,$166
577576,Limpiador Cif Antigrasa Biodegradable 450 Ml,$122
451976,Limpiador Líquido Desinfectante Concentrado Para Pisos Lysoform Lavanda 420 Ml,$116
295885,Desinfectante En Aerosol Lysoform Original 285 Ml,$169
91474,Limpiador Mr. Músculo Naranja 500 Ml,$247
563978,Limpiador Líquido Multisuperficies Glade Bosques De Pino Botella 900 Ml,$101
608814,Limpiadro Cif Ultra Brillo Anti Polvo 380 Ml,$153
84728,Limpiador En Crema Lysoform Antibacterial Baño 450 Ml,$172
577581,Limpiador Líquido Cif Vidrios Biodegradable 450 Ml,$115
572131,Trivia Prohibido Royal,$690
573947,Limpiador De Alfombras Dr. Beckmann 650 Ml,$508
32967,Limpiador De Baño Lysoform Líquido 500 Ml,$258
573309,Alfombra Para Jugar De 70x90 Cm Con 2 Piezas 7 Cm,$1.520
77019,Detergente Cristal Lavavajilla Aloe 500 Ml,$81
573444,Cuna Para Dormir Cry Babies,$2.000
365816,Silicona Júpiter En Aerosol 360 Ml,$160
571614,Dominó En La Selva,$259
572225,Kit Cocina Masa Royal,$799
582401,Limpiador De Pisos Cif Fragancia Purificante 900 Ml,$93
483552,Código Secreto Super Royal,$570
400537,Set De Comida Pizza Hape De Madera,$1.694
400434,Camión Tonka Metálico Chico,$1.199
400532,Guitarra De Madera Hape Roja,$4.676
330727,Kit Infantozzi Pinta Tu Libro De Arte,$893
330710,Divertite Infantozzi Crea Tu Tia­tere,$390
799752,Juego Golazo Chau Pantallas,$490
330716,Kit Infantozzi Vaporizador Con Crayolones,$837
330679,Masa Royal Colgante,$260
330728,Kit Infantozzi Divertite Con Arena Mágica,$893
330709,Divertite Infantozzi Pinta Con Tus Manos,$390
330698,Mi Primera Huerta Infantozzi 3 Macetas,$655
755511,Camión Volcador Didáctico Multifunción Top Bright,$2.030
840414,Monopatín Bigjigs Fucsia,$4.000
679082,Set De Playa De Silicona Bigjigs Coral,$1.320
755508,Jenga De Animales Con Tarjetas Y Dado,$1.229
755614,Puzzle De Madera Con Auto De Bomberos,$749
847618,Bloques Magnéticos 36 Piezas,$1.062
755911,Proyector De Sistema Solar Didáctico,$2.260
755510,Bloques Letras Y Números Top Bright Madera 100 Unidades,$2.190
755512,Juego De Pesca 16 Piezas,$1.190
755809,Juego De Pasteleria,$1.579
840515,Tren Bigjigs Actividades Del Bosque En Madera,$2.760
755309,Juego De Pesca 26 Piezas,$1.439
678692,Sudoku De Madera Bigjigs,$1.720
755209,Juego De Parrilla De Madera,$1.590
755519,Puzzle De Madera Con Auto De Policía,$749
678693,Tejo Bigjigs Con Puntuación,$2.080
755412,Juego De Pizza De Madera Con Toppings,$1.590
330406,Pala Limpow Plástica Vertical Con Cabo,$48
755810,Kit De Excavación Tiranosaurio Rex,$1.470
840417,Silla Bigjigs La Vaca,$3.400
840411,Silla Bigjigs La Oveja,$3.400
755326,Puzzle De Madera Top Bright Barco A Vapor,$749
755324,Puzzle De Madera Top Bright Autobús Escolar,$749
755325,Puzzle De Madera Top Bright Helicóptero,$749
334895,Cepillo La Gauchita Planchita,$110
335017,Pala Plastica La Gauchita,$67
498876,Bolsas De Residuo Unisold Verde 50x62 Cm 30 Unidades,$111
498879,Bolsas De Residuo Unisold Negra 70x105 Cm 10 Unidades,$137
330125,Cepillo Novica Betta Jeans,$101
330122,Escoba Novica Varry 1000,$351
330145,Palo Extensible Novica,$297
330157,Escoba Novica Uso Externo,$396
330148,Cepillo Novica Para Zapatos,$287
457682,Bolsas Júpiter Para Perro 3 Unidades,$78
335007,Escobillon La Gauchita Nogal,$372
750300,Esponja De Aluminio Júpiter 6 Unidades,$42
332500,Fibra Go! Verde Multiuso X 2,$59
286573,Bolsa De Residuos Júpiter Azul 70x100 Cm,$225
552853,Bolsa Para Residuos Herradura 50x56 Cm 30 Unidades,$94
334997,Escoba La Gauchita Rincones,$301
330131,Repuesto Mopa Novica Algodón,$264
749999,Soporte Esponja Júpiter Rulo 2 Repuestos,$116
330149,Sopapa Novica Turbo,$203
18335,Guantes Crivea Mediano,$138
498877,Bolsas De Residuo Unisold Negra 50x62 Cm 30 Unidades,$111
552953,Paño De Piso Duramás Extra Grande 55x65 Cm,$93
330143,Escoba Novica Fácil,$302
498874,Bolsas De Residuo Unisold Negra 50x62 Cm 10 Unidades,$40
286570,Bolsa De Residuos Júpiter Negra 70x100 Cm,$179
330152,Cepillo Novica Multiuso,$119
87242,Bolsas De Residuos Júpiter Citronella 50x60 Cm 10 Unidades,$108
335011,Esponja Plumol De Nylon Suave,$55
332496,Esponja La Gauchita Multiuso,$39
334600,Cepillo La Gauchita Wc Con Deposito,$245
552861,Fregon Absorbente Duramás Multiuso 38x40 Cm,$33
286574,Bolsa De Residuos Júpiter Verde 50x55 Cm,$108
330153,Cepillo Novica Varremesa,$166
330139,Escoba Novica Bola,$922
850514,Cepillo Con Dispensador De Jabón Hogui Farma Hogar,$139
573444,Cuna Para Dormir Cry Babies,$2.000
755511,Camión Volcador Didáctico Multifunción Top Bright,$2.030
847618,Bloques Magnéticos 36 Piezas,$1.062
573309,Alfombra Para Jugar De 70x90 Cm Con 2 Piezas 7 Cm,$1.520
755614,Puzzle De Madera Con Auto De Bomberos,$749
755519,Puzzle De Madera Con Auto De Policía,$749
755324,Puzzle De Madera Top Bright Autobús Escolar,$749
840515,Tren Bigjigs Actividades Del Bosque En Madera,$2.760
755326,Puzzle De Madera Top Bright Barco A Vapor,$749
755325,Puzzle De Madera Top Bright Helicóptero,$749
18336,Guantes Crivea Grandes,$138
332597,Guantes Plumol Multiuso S-pequeno,$76
552855,Rejilla De Hilo Duramás Blanca 40x40 Cm,$47
840510,Formas Sensoriales Bigjigs Naturales,$3.120
750199,Fibra Júpiter De Limpieza 3 Unidades,$59
678691,Set De Playa De Silicona Bigjigs Rosado,$1.320
679482,Set De Playa De Silicona Bigjigs Amarillo,$1.320
679187,Set De Médicos Bigjigs,$1.960
678687,Mi Primer Banco De Martillo Bigjigs,$1.480
840423,Letras Magnéticas Bigjigs Mayúsculas,$1.240
755709,Juguete Tortuga Didáctico De Madera Top Bright Con Martillo,$1.850
840509,Cubo Didáctico Bigjigs De Madera,$4.000
840610,Guitarra Bigjigs Azul Estrellas,$2.040
755310,Cubo De Actividades 5 En 1,$1.630
755409,Autobús Con Formas Geométricas,$2.700
846124,Juguete Polar B Tren Apilable,$1.530
846042,Juguete Polar B Xilofón Oso Polar,$954
678694,Juego Tetris Bigjigs,$640
846118,Pizarra Polar B Didáctica Con ábaco,$1.602
846026,Cubos Encastrables Polar B,$1.350
603991,Trapito De Apego Storki Oso Azul,$890
846035,Polar B Estación Triángulo Con Juegos,$1.250
846113,Polar B Erizo Con Rueda De Encastre,$1.386
846056,Juguete Polar B Tiracuerda Elefante,$522
846048,Cubo Interactivo Polar B Con Sensor,$1.188
846044,Juguete Tiracuerda Polar B Fila De Animales,$936
846128,Engranaje Didáctico Polar B Giratorio De Madera,$918
536533,Pan Jasmine Sin Gluten Tradicional Rodaja 350 G,$306
846038,Puzzle De Madera Polar B Con Encastre Animales,$954
846119,Balde Con Bloques De Madera Polar B 60 Piezas,$1.062
662258,Peluche Storki Ballena Azul Con Vibracion,$830
678983,Bicicleta Andador Bigjigs Celeste,$2.040
846031,Juguete Polar B Martillo De Madera,$864
603992,Juguete De Actividades Storki Oso,$855
846115,Juguete Deslizador Polar B Autos,$1.602
778255,Té Canarias Negro Hebras 90 G,$71
65659,Caramelos Cavendish Limón 200 G,$201
791521,Chocolate Nestle Classic Amendoim 150 G,$194
19515,Chocolate M&m Mini Tubo 35.2 G,$64
12289,Batón Garoto De Chocolate Blanco,$18
314153,Chocolate Nestle Tabletasgalak 90 G,$128
579686,Splenda Tinkerbell 200 G ,$399
493373,Funda Fanta Naranja 1 L 6 Unidades,$861
517925,Té Canarias Negro Limón 10 Saquitos,$68
21384,Té Equinacea Botica Del Señor 10 Saquitos,$96
842409,Barra Nutsbar Coco 25 G,$44
19514,Chocolates M&m Peanut 40 G,$64
19857,Té Rojo 10 Saquitos La Selva,$69
604898,Endulzante Splenda Stevia Sobres 120 Unidades,$620
46245,Galletas Lulu Chocolate Y Dulce De Leche 115 G,$64
55625,Pasas De Uva Bib's 40 G,$41
14530,Guaco Cabral 20 G,$81
36003,Chocolate Toblerone Leche 100 G,$197
734559,Premezcla Deli For Life Pizza 340 G,$194
33644,Caramelos Sugus Masticales 150 G,$96
76789,Galletas Oreo 117 G,$79
85984,Bombones Mella Rellenos Cereza 190 G,$264
90671,Té Verde Canarias 10 Saquitos,$68
708141,Funda Salus Frutte Naranja Sin Gas 600 Cc 6 Unidades,$366
68556,Endulzante Tevias Polvo 50 Bastónes,$288
76605,Yerba Baldo 1 Kg,$187
864426,Chips De Papa Y Boniato Emigrante Sin Sal 75 G,$101
69832,Tableta De Chocolate Con Almendras Haas 0% 70 G,$131
88962,Galletas Nature Valley Oats & Honey 42 G,$69
13900,Palo Azul Botica Del Señor 75 G,$169
77451,Agua Saborizada Salus Cero Naranja 600 Cc,$63
859820,Galletas Paulinas Clásicas Sin Harina 140 G,$110
483743,Cereal Vitalisimo Muesli Frutos Secos 450 G,$351
80309,Té Cabral Carqueja 20 G,$81
562776,Endulzante Veracruz Naturevia Gotero 30 Ml,$277
825561,Powerade Naranja 600 Cc,$45
712930,Monster Mango Loco 473 Ml,$99
529132,Mix Emigrante Nuéz + Almendras + Castañas + Maní 80 G,$85
430862,Schweppes Citrus Sin Azúcar 500 Cc,$63
90661,Chocolate Milka Castana 55 G ,$81
19780,Coca Cola Light 600 Cc,$63
81020,Jugo Bc Multifruta 200 Ml,$32
499876,Funda Salus Agua Con Gas 2.25 L 6 Unidades,$442
85728,Té Manzanilla Con Miel Cabral 10 Saquitos,$88
708141,Funda Salus Frutte Naranja Sin Gas 600 Cc 6 Unidades,$366
20630,Agua Salus Con Gas 2.25 L,$74
429660,Powerade Mountain Blast 995 Ml,$75
19540,Colado Heinz Manzana 113 G,$114
493373,Funda Fanta Naranja 1 L 6 Unidades,$861
662661,Jugo Cepita Fresh Naranja 250 Cc,$28
20992,Jugo Conaprole De Manzana 250 Ml,$37
20994,Leche Chocolatada Colet 250 Ml,$42
77454,Agua Saborizada Salus Cero Pomelo 600 Cc,$63
41036,Coca Cola Zero 600 Ml,$63
708138,Funda Salus Frutte Manzana Sin Gas 600 Cc 6 Unidades,$366
77450,Agua Saborizada Salus Naranja Sin Gas 600 Cc,$63
708133,Funda Agua Salus Saboriza Frutte Manzana 1.5 L 6 Unidades,$635
561876,Monster Zero Ultra 473 Ml,$99
20627,Agua Salus Sin Gas 600 Cc,$59
493368,Funda Fanta Naranja 500 Ml 12 Unidades,$750
708128,Funda Salus Frutte Naranja Sin Azúcar1.5 L 6 Unidades,$635
499877,Funda Salus Agua Sin Gas 2.25 L 6 Unidades,$442
76628,Agua Vitale Con Gas 625 Ml,$47
712930,Monster Mango Loco 473 Ml,$99
632311,Salus Frutte Limónada Sin Azúcar 600 Cc,$63
84078,Schweppes Pomelo Sin Azúcar 500 Cc,$63
20986,Jugo Conaprole Naranja 250 Ml,$37
493361,Funda Coca Cola Light 600 Cc 12 Unidades,$750
77451,Agua Saborizada Salus Cero Naranja 600 Cc,$63
632113,Agua Salus Saboriza Frutte Manzana Verde 1.5 L,$106
19781,Refresco Sprite Zero 600 Cc,$63
