sku,name,price
573948,Limpia Cafetera Dr. Beckmann 6 Unidades,$255
847812,Repelente Para Mosquitos Off! Extra Duración Aerosol 290 Ml,$759
847012,Repelente Para Mosquitos Off! Family Aerosol 290 Ml,$547
846912,Tabletas Antimosquitos Fuyi 12 Unididades,$103
573952,Limpiador Para Lavadoras Dr. Beckmann 250 Ml,$304
573950,Limpiador De Cocinas Dr. Beckmann 250 Ml,$334
862322,Repuesto Júpiter Insecticida Líquido 45 Noches,$211
366315,Servilletas Elite Diseño Decorativo 20 Unidades,$94
862321,Detergente Magistral Pureza Activa 280 Ml,$125
862521,Kit Antimosquitos Jupiter Líquido 45 Noches,$486
79458,Pañuelos Descartables Elite Antivirales 6 Unidades,$128
330127,Lampazo Novica Pequeño,$266
578086,Papel Higiénico Elite Ultra Doble Hoja 50 M 4 Rollos,$255
54882,Aparato Eléctrico Insecticida Raid Líquido + Repuesto 45 Noches 32.9 Ml,$337
246424,Desodorante De Ambientes Júpiter Bebé 360 Cc,$98
302624,Limpiador Fabuloso Lavanda Antibacterial 1 L,$98
330147,Cepillo Novica Sanitario,$138
476216,Papel Higiénico Be Eco Bambú Triple Hoja 22 M 4 Rollos,$156
45193,Repuesto Desodorante De Ambientes Glade Toque Seco Lavanda 9 G 1 Unidad,$184
18396,Detergente Cristal Lavavajillas Limón 1.25 L,$123
608815,Limpiador Cif Ultra Brillo Anti Polvo 400 Ml,$228
77019,Detergente Cristal Lavavajilla Aloe 500 Ml,$81
330123,Cepillo Novica Largo Alcance Para Platos,$117
457582,Lavandina Júpiter 1 L,$61
49865,Insecticida En Aerosol Raid Max Sin Olor 360 Cc,$215
90691,Aromatizante De Ambientes Suances Melón Y Sandia 250 Ml,$140
862322,Repuesto Júpiter Insecticida Líquido 45 Noches,$211
330144,Escoba Novica Ideal Esquinas,$360
862521,Kit Antimosquitos Jupiter Líquido 45 Noches,$486
859821,Tabletas Antimosquitos Raid 12 Unidades,$184
846912,Tabletas Antimosquitos Fuyi 12 Unididades,$103
91484,Bloque Para Mochila De Inodoro Pato 40 G 2 Unidades,$262
54665,Aparato Insecticida Raid Contra Mosquitos + Tabletas 4 Unidades,$400
79401,Repuesto Aromatizante De Ambientes Automático Glade Limón Refrescante 175 G,$309
361515,Solución Cristal 4 L,$236
18335,Guantes Crivea Mediano,$138
54882,Aparato Eléctrico Insecticida Raid Líquido + Repuesto 45 Noches 32.9 Ml,$337
246625,Insecticida Júpiter Tax Moscas Y Mosquitos 360 Ml,$142
76784,Tabletas Termoevaporables Júpiter 30 Unidades,$134
16953,Insecticida En Gel Raid Mata Polillas 2 Unidades,$287
74840,Bastón Repelente Júpiter 4 Unidades,$184
76785,Insecticida Júpiter Aparato Vaporizador,$220
74922,Vela De Jardín Júpiter Citronella,$236
91461,Insecticida Raid Mata Hormigas En Aerosol 390 Cc,$354
532733,Aerosol Raid Azul Mata Moscas Y Mosquitos 360 Ml,$252
60228,Tabletas Raid Contra Mosquitos 24 Unidades,$343
49618,Repuesto Aparato Insecticida Raid Líquido 45 Noches 32.9 Ml,$337
14110,Paradicloro Benceno 186 G,$183
91465,Insecticida En Aerosol Raid Extermina Cucarachas 257 G,$191
573953,Limpiador Para Heladeras Dr. Beckmann 250 Ml,$304
74839,Insecticida Júpiter Mata Todo 400 Cc,$179
573951,Limpiador Para Hornos Dr. Beckmann 375 Ml,$304
88839,Insecticida Júpiter Aerosol Moscas Y Mosquitos 400 Cc,$196
76782,Espiral Júpiter Tradicional 10 Unidades,$84
49637,Insecticida En Aerosol Raid Mata Moscas Y Mosquitos Sin Olor 360 Cc,$320
573947,Limpiador De Alfombras Dr. Beckmann 650 Ml,$508
573943,Jabón Mágico Dr. Beckmann 100 Ml,$190
573952,Limpiador Para Lavadoras Dr. Beckmann 250 Ml,$304
573949,Limpiador De Electrodomésticos Dr. Beckmann 250 Ml,$304
91472,Insecticida En Espiral Raid Repele Mosquitos Country Fresh 12 Unidades,$161
573950,Limpiador De Cocinas Dr. Beckmann 250 Ml,$334
862321,Detergente Magistral Pureza Activa 280 Ml,$125
91460,Insecticida En Aerosol Raid Mata Pulgas Y Garrapatas 390 Cc,$347
25359,Insecticida Fuyi Aerosol Mata Moscas Y Mosquitos 360 Cc,$149
77019,Detergente Cristal Lavavajilla Aloe 500 Ml,$81
621883,Cera Líquida Pisos Blem Porcelanato Incoloro 800 Ml,$381
32967,Limpiador De Baño Lysoform Líquido 500 Ml,$258
91470,Repuesto Canasta Líquida Glade Mañana De Campo 50 Ml,$204
91480,Limpia Vidrios Mr. Músculo 500 Cc,$222
604896,Detergente Cif Ultra Core Limón Verde 750 Ml,$178
23677,Desinfectante De Ambientes Y Elimina Olores En Aerosol Lysoform Aire De Montaña 360 Ml,$216
366415,Lustra Muebles Júpiter Original 360 Ml,$181
361515,Solución Cristal 4 L,$236
564179,Limpiador Líquido Multisuperficies Glade Campos De Lavanda 1.8 L,$188
457582,Lavandina Júpiter 1 L,$61
621782,Cera Líquida Pisos Cerámicos Blem Floral 450 Ml,$230
18397,Detergente Cristal Lavavajillas Aloe 1.25 L,$123
621683,Limpiador Múltiples Pisos Blem Vainilla Y Lavanda 800 Ml,$249
70275,Limpiador Líquido Multisuperficies Glade Floral Perfection 900 Ml,$101
74912,Limpiador Bioclin Graseras Y Desagües 70 G,$275
88826,Limpiador Fabuloso Complete Blue 828 Ml,$128
302720,Limpiador Fabuloso Fresco Amanecer Antibacterial 1 L,$98
774942,Desinfectante En Aerosol Lysoform 420 Ml 2 Unidades,$370
302625,Limpiador Fabuloso Alternativa Al Cloro 1 L,$98
619477,Limpiador Líquido Desinfectante De Superficies Lysoform Lavanda 900 Ml,$96
70269,Repuesto Limpiador Líquido Mr. Músculo Cocina Antigrasa 500 Ml,$139
582400,Limpiador De Pisos Cif Fragancia Armonizante 900 Ml,$93
456982,Repuesto Limpiador Júpiter 3 En 1 450 Ml,$89
70273,Repuesto Discos Adhesivos Pato Para Inodoro Marina 38 G,$215
45187,Lustramuebles En Aerosol Blem Brillo Y Protección Madera Lavanda 360 Cc,$295
577580,Limpiador Cif Crema Original Multiuso 750 Ml,$153
246924,Limpiador Júpiter Floral 950 Ml,$58
881677,Repuesto D3 Para Masajeador Inalámbrico Wms,$1.200
582403,Limpiador De Pisos Cif Fragancia Relajante 1.75 L,$161
660651,Freidora Sin Aceite Allied Al-afps50 3.5 L,$3.500
451776,Repuesto Limpiador Lysoform Cítrico 420 Ml,$116
881777,Masajeador D3 Inalámbrico WMS,$10.000
80964,Lavavajillas Cristal Limón Verde 300 Ml,$92
865441,Tostadora Cuori Tostino Plus (o),$1.600
32968,Repuesto Limpiador De Baño Lysoform Líquido 450 Ml,$145
821209,Aspiradora Xiaomi Mi Robot Vacuum Mop 2,$16.360
660149,Sandwichera 5 En 1 Peabody Blanca,$3.200
862422,Secador De Pelo Cuori Biondo 1200w,$1.000
813777,Batidora Vertical Cuori Presto Plus,$2.160
624299,Pistola Energy De Calor 2000 W,$933
659315,Picadora De Carne Bosch Muz5fw1 Para Batidora Robot Mum5,$4.320
660153,Cafetera Express Peabody Negro,$8.440
660663,Radio De Bolsillo Allied Al-ra32 Am-fm,$800
660152,Cafetera Peabody Con Filtro,$3.720
660147,Jarra Eléctrica Peabody Roja,$3.640
658615,Planchita Philips Hp8325/10 Essential Care,$2.760
659943,Enxuta Anafe De Empotrar Aenx5546 Inox,$9.320
659940,Enxuta Ventilador De Pie Vpenx920w 170cm Blanco,$3.192
659937,Enxuta Ventilador De Pie Vpenx916n 140cm Negro,$2.793
660811,Freidora De Aceite Punktal Pk-fr105 2.5 L,$2.840
660803,Sandwichera Doble Punktal Pk-cr44 3 En 1 800w,$2.000
660847,Jarra Eléctrica Punktal De Plástico Pk-3325jp Roja 1.7 L,$1.080
660813,Licuadora Punktal Pk-li287 520w,$1.600
660667,Corta Pelo Punktal Pk-hc2016 Recargable,$1.560
660797,Tostadora Eléctrica Punktal Pk-ai858 Inoxidable,$1.440
743695,Aire Acondicionado Enxuta Aaenxi222s 18000 Btu Inverter Smart,$40.000
660665,Secador De Pelo Punktal Pk-2200ion 2200w,$1.440
660669,Cepillo Alisador Punktal Pk-nv4916,$1.000
660780,Enfriador De Vinos Punktal Pk-ev8l 8 Botellas,$7.880
743091,Aire Acondicionado Enxuta Inverter Smart 12000 Btu,$24.000
658672,Plancha A Vapor Philips Gc360/30 Steamer,$4.720
658644,Afeitadora Philips S1121/41 Aquatouch,$2.760
833909,Licuadora Cuori Gianna,$2.080
743090,Aire Acondicionado Enxuta Aaenx222-12000 Btu,$18.240
850514,Cepillo Con Dispensador De Jabón Hogui Farma Hogar,$139
724441,Horno De Emportrar Enxuta Heenxg5500ng A Gas Negro,$18.520
690295,Lavarropas Enxuta Lenx25550 Con Carga Superior Semi-automático 5.5 Kg,$5.040
755410,Centrifugadora Enxuta Carga Superior 4.2 Kg,$5.240
792228,"Televisor Enxuta Smart Full Hd Ledenx1240s 40""",$10.640
724541,Lavarropas Enxuta Semi-automático 10 Kg,$5.920
690299,Horno Eléctrico Enxuta Henx2335 Negro 34 L,$4.760
830810,Combo Gama Planchita Elegance Coconut + Secador H Bora Lino,$4.434
332498,Fibra Go Plateada Extra Fuerte,$56
552701,Bolsa Para Residuos Unisold Rosa 50x62 Cm 30 Unidades,$111
749901,Bolsas Herméticas Júpiter Grandes 10 Unidades,$185
334897,Esponja Go! Cuadros Clasica,$36
330135,Lampazo Novica Vai E Vem Mediano,$308
18337,Guantes Crivea Extra Grandes,$138
286571,Bolsa De Residuos Júpiter Azul 50x55 Cm,$108
330153,Cepillo Novica Varremesa,$166
335016,Mop De Algodon Lg Sin Cabo,$204
330132,Balde Novica Con Escurridor 14 L,$581
498878,Bolsas De Residuo Unisold Verde 50x62 Cm 10 Unidades,$40
330397,Escoba Limpow Magnífica,$99
18334,Guantes Crivea Pequeño,$138
330147,Cepillo Novica Sanitario,$138
335012,Esponja Plumol De Nylon Dorada,$55
87243,Bolsas De Residuos Júpiter Limón 50x60 Cm 10 Unidades,$108
330150,Pala Novica Colectora Canguro,$664
330144,Escoba Novica Ideal Esquinas,$360
498875,Bolsas De Residuo Unisold Verde 70x105 Cm 10 Unidades,$137
552951,Bolsa De Residuos Herradura Jardín Y Edificio 85x105x10 Cm 10 Unidades,$142
330128,Cepillo Novica Esquinas Para Azulejos,$95
330124,Cepillo Novica Esfregona,$165
334550,Cepillo La Gauchita Lava Autos,$185
750300,Esponja De Aluminio Júpiter 6 Unidades,$42
457183,Bolsas Júpiter Para Perro 2 Unidades + Dispensador,$110
332997,Pasacera Turbo La Gauchita,$135
330159,Escoba Novica Angular Pequeña,$318
335004,Escoba La Gauchita Barremax Multipiso,$316
750199,Fibra Júpiter De Limpieza 3 Unidades,$59
335721,Esponja Plumol Acero 15 Grs,$31
330155,Sopapa Novica Sanitaria Grande,$745
286575,Bolsa De Residuos Júpiter Verde 70x100 Cm,$225
330140,Escoba Novica Piso Delicado,$700
749902,Bolsas Herméticas Júpiter Medianas 15 Unidades,$155
335095,Esponja Plumol De Nylon Plateada,$55
91458,Repuesto Aromatizante De Ambientes Automático Glade Caricias De Algodón 175 G,$309
79401,Repuesto Aromatizante De Ambientes Automático Glade Limón Refrescante 175 G,$309
330137,Escoba Novica Max,$364
286572,Bolsa De Residuos Júpiter Negra 50x55 Cm,$82
334895,Cepillo La Gauchita Planchita,$110
330406,Pala Limpow Plástica Vertical Con Cabo,$48
16946,Aromatizante De Ambientes Glade Jazmín En Aerosol 360 Ml,$113
90514,Desodorante De Ambientes Glade Aerosol Limón Y Lavanda 360 Ml 2 Unidades,$199
88521,Aromatizante De Ambientes En Gel Glade Cono Lavanda 170 G,$160
70268,Repuesto Aromatizante De Ambientes Automático Glade Lavanda Y Vainilla 175 G,$309
36926,Aromatizante De Ambientes Glade Toque Lavanda Portátil 9 G,$234
566587,Aromatizante De Ambientes En Aerosol Glade Floral Perfection 360 Ml,$113
246624,Desodorante De Ambientes Júpiter Lavanda 360 Ml,$98
91482,Aromatizante De Ambientes Glade Mini Gel Hogar Limón Refrescante 70 G,$102
70014,Aromatizante De Ambientes Automático Glade Aceites Naturales Vainilla + Recarga 21 Ml,$388
331288,Aparato Aromatizante De Ambientes Júpiter + Repuesto Aroma Relax 300 Ml,$730
91468,Desodorante De Ambientes En Aerosol Glade Placer Floral Y Frutos Rojos 275 Ml,$113
533733,Repuesto Aromatizante Automático Glade Limón 110 G,$194
90690,Aromatizador De Ambientes Suances Green Tea 250 Ml,$154
325081,Desodorante De Ambiente Júpiter Limón 300 Ml,$169
70018,Aromatizante De Ambientes Automático Glade Lavanda Y Vainilla + Repuesto 175 G,$599
309833,Recarga Desodorante De Ambientes Automático Glade Lavanda + Vainilla 175 G 2 Unidades,$450
45193,Repuesto Desodorante De Ambientes Glade Toque Seco Lavanda 9 G 1 Unidad,$184
566681,Repuesto Aromatizante De Ambientes Automático Glade Flores Tropicales Y Coco 175 G,$309
90691,Aromatizante De Ambientes Suances Melón Y Sandia 250 Ml,$140
88525,Aromatizante De Ambientes En Gel Glade Cono Caricias De Algodón 170 G,$160
79402,Repuesto Aromatizante De Ambientes Automático Lysoform 175 G,$384
352415,Desinfectante De Ambientes Y Elimina Olores En Aerosol Lysoform Aire De Montaña 495 Ml,$260
246424,Desodorante De Ambientes Júpiter Bebé 360 Cc,$98
70267,Repuesto Aromatizante De Ambientes Automático Glade Manzana Y Canela 175 G,$309
90208,Recarga Perfumador Harpers Aerosol Limón 220 Ml,$169
91477,Repuesto Aromatizante De Ambientes Glade Aceites Naturales Limón Refrescante 21 Ml,$319
325182,Desodorante De Ambiente Júpiter Lavanda 300 Ml,$194
79400,Aromatizante De Ambientes En Aerosol Glade Limón Refrescante 360 Ml,$113
533833,Repuesto Aromatizante De Ambientes Automático Glade Lavanda Y Vainilla 170 Ml,$194
91466,Repuesto Aromatizante De Ambientes Automático Glade Placer Real Y Frutos Rojos 175 G,$309
16945,Desodorante De Ambientes Glade Campos De Lavanda 420 Ml,$113
325268,Desodorante De Ambiente Júpiter Relax 300 Ml,$169
76638,Repuesto Aromatizante De Ambientes Glade Aceites Naturales Vainilla 21 Ml,$363
820693,Juego Fifa 23 Para Ps4,$3.960
835608,Consola Play Station 5 + Juego Horizon Forbidden West,$58.040
820694,Juego Fifa 23 Para Ps5,$4.760
614356,Juego Ps4 Grand Theft Auto V Premium Edition,$1.600
616358,Auriculares Sony Inalámbricos Para P5 P4 Pulse 3d,$9.240
573309,Alfombra Para Jugar De 70x90 Cm Con 2 Piezas 7 Cm,$1.520
715937,Fifa 22 Ps5,$4.000
637325,Juego Fifa 22 Para Ps4,$4.000
614354,Juego Ps4 Crash Bandicoot 4 Its About Time,$3.560
616257,Control Inalámbrico Dualsense Ps5,$4.960
573444,Cuna Para Dormir Cry Babies,$2.000
616357,Cámara Hd Ps5,$4.360
847618,Bloques Magnéticos 36 Piezas,$1.062
755511,Camión Volcador Didáctico Multifunción Top Bright,$2.030
755614,Puzzle De Madera Con Auto De Bomberos,$749
755519,Puzzle De Madera Con Auto De Policía,$749
840515,Tren Bigjigs Actividades Del Bosque En Madera,$2.760
755326,Puzzle De Madera Top Bright Barco A Vapor,$749
755325,Puzzle De Madera Top Bright Helicóptero,$749
755324,Puzzle De Madera Top Bright Autobús Escolar,$749
678691,Set De Playa De Silicona Bigjigs Rosado,$1.320
679482,Set De Playa De Silicona Bigjigs Amarillo,$1.320
840423,Letras Magnéticas Bigjigs Mayúsculas,$1.240
678687,Mi Primer Banco De Martillo Bigjigs,$1.480
840610,Guitarra Bigjigs Azul Estrellas,$2.040
679187,Set De Médicos Bigjigs,$1.960
840510,Formas Sensoriales Bigjigs Naturales,$3.120
840509,Cubo Didáctico Bigjigs De Madera,$4.000
755709,Juguete Tortuga Didáctico De Madera Top Bright Con Martillo,$1.850
755310,Cubo De Actividades 5 En 1,$1.630
755409,Autobús Con Formas Geométricas,$2.700
846035,Polar B Estación Triángulo Con Juegos,$1.250
846042,Juguete Polar B Xilofón Oso Polar,$954
846118,Pizarra Polar B Didáctica Con ábaco,$1.602
678694,Juego Tetris Bigjigs,$640
846124,Juguete Polar B Tren Apilable,$1.530
603991,Trapito De Apego Storki Oso Azul,$890
846026,Cubos Encastrables Polar B,$1.350
846056,Juguete Polar B Tiracuerda Elefante,$522
846048,Cubo Interactivo Polar B Con Sensor,$1.188
846044,Juguete Tiracuerda Polar B Fila De Animales,$936
846038,Puzzle De Madera Polar B Con Encastre Animales,$954
678983,Bicicleta Andador Bigjigs Celeste,$2.040
846119,Balde Con Bloques De Madera Polar B 60 Piezas,$1.062
881677,Repuesto D3 Para Masajeador Inalámbrico Wms,$1.200
881777,Masajeador D3 Inalámbrico WMS,$10.000
821209,Aspiradora Xiaomi Mi Robot Vacuum Mop 2,$16.360
624299,Pistola Energy De Calor 2000 W,$933
660651,Freidora Sin Aceite Allied Al-afps50 3.5 L,$3.500
813777,Batidora Vertical Cuori Presto Plus,$2.160
660663,Radio De Bolsillo Allied Al-ra32 Am-fm,$800
603992,Juguete De Actividades Storki Oso,$855
865441,Tostadora Cuori Tostino Plus (o),$1.600
846031,Juguete Polar B Martillo De Madera,$864
660153,Cafetera Express Peabody Negro,$8.440
660152,Cafetera Peabody Con Filtro,$3.720
660149,Sandwichera 5 En 1 Peabody Blanca,$3.200
660147,Jarra Eléctrica Peabody Roja,$3.640
846115,Juguete Deslizador Polar B Autos,$1.602
659315,Picadora De Carne Bosch Muz5fw1 Para Batidora Robot Mum5,$4.320
659940,Enxuta Ventilador De Pie Vpenx920w 170cm Blanco,$3.192
659943,Enxuta Anafe De Empotrar Aenx5546 Inox,$9.320
659937,Enxuta Ventilador De Pie Vpenx916n 140cm Negro,$2.793
660847,Jarra Eléctrica Punktal De Plástico Pk-3325jp Roja 1.7 L,$1.080
660813,Licuadora Punktal Pk-li287 520w,$1.600
660811,Freidora De Aceite Punktal Pk-fr105 2.5 L,$2.840
846113,Polar B Erizo Con Rueda De Encastre,$1.386
662258,Peluche Storki Ballena Azul Con Vibracion,$830
846128,Engranaje Didáctico Polar B Giratorio De Madera,$918
660803,Sandwichera Doble Punktal Pk-cr44 3 En 1 800w,$2.000
660797,Tostadora Eléctrica Punktal Pk-ai858 Inoxidable,$1.440
660780,Enfriador De Vinos Punktal Pk-ev8l 8 Botellas,$7.880
743091,Aire Acondicionado Enxuta Inverter Smart 12000 Btu,$24.000
743695,Aire Acondicionado Enxuta Aaenxi222s 18000 Btu Inverter Smart,$40.000
743090,Aire Acondicionado Enxuta Aaenx222-12000 Btu,$18.240
755410,Centrifugadora Enxuta Carga Superior 4.2 Kg,$5.240
833909,Licuadora Cuori Gianna,$2.080
724441,Horno De Emportrar Enxuta Heenxg5500ng A Gas Negro,$18.520
690299,Horno Eléctrico Enxuta Henx2335 Negro 34 L,$4.760
690295,Lavarropas Enxuta Lenx25550 Con Carga Superior Semi-automático 5.5 Kg,$5.040
724541,Lavarropas Enxuta Semi-automático 10 Kg,$5.920
792228,"Televisor Enxuta Smart Full Hd Ledenx1240s 40""",$10.640
846067,Robot De Cocina Boj,$74.040
690335,Picadora De Carne Punktal Pk-498 2 Velocidades 1400w,$4.360
782794,Inflador Cargador Black & White Recargable,$2.780
841410,Aspiradora Black & White Bajo Ruido 30 L 1000w,$5.699
841412,Limpia Vidrios Black & White A Batería 15w 1 L,$1.890
690322,Freidora Sin Aceite Punktal Pk-190 3.2 L,$4.320
782693,Sierra Circular Black & White 185 Mm,$3.990
791721,"Televisor Philips Led Smart Hd 32"" Sin Bordes",$14.400
536533,Pan Jasmine Sin Gluten Tradicional Rodaja 350 G,$306
65659,Caramelos Cavendish Limón 200 G,$201
19514,Chocolates M&m Peanut 40 G,$64
778255,Té Canarias Negro Hebras 90 G,$71
19515,Chocolate M&m Mini Tubo 35.2 G,$64
12289,Batón Garoto De Chocolate Blanco,$18
579686,Splenda Tinkerbell 200 G ,$399
314153,Chocolate Nestle Tabletasgalak 90 G,$128
791521,Chocolate Nestle Classic Amendoim 150 G,$194
842409,Barra Nutsbar Coco 25 G,$44
517925,Té Canarias Negro Limón 10 Saquitos,$68
14530,Guaco Cabral 20 G,$81
21384,Té Equinacea Botica Del Señor 10 Saquitos,$96
19857,Té Rojo 10 Saquitos La Selva,$69
36003,Chocolate Toblerone Leche 100 G,$197
493373,Funda Fanta Naranja 1 L 6 Unidades,$861
734559,Premezcla Deli For Life Pizza 340 G,$194
55625,Pasas De Uva Bib's 40 G,$41
46245,Galletas Lulu Chocolate Y Dulce De Leche 115 G,$64
33644,Caramelos Sugus Masticales 150 G,$96
604898,Endulzante Splenda Stevia Sobres 120 Unidades,$620
76789,Galletas Oreo 117 G,$79
85984,Bombones Mella Rellenos Cereza 190 G,$264
68556,Endulzante Tevias Polvo 50 Bastónes,$288
69832,Tableta De Chocolate Con Almendras Haas 0% 70 G,$131
864426,Chips De Papa Y Boniato Emigrante Sin Sal 75 G,$101
90671,Té Verde Canarias 10 Saquitos,$68
708141,Funda Salus Frutte Naranja Sin Gas 600 Cc 6 Unidades,$366
80309,Té Cabral Carqueja 20 G,$81
13900,Palo Azul Botica Del Señor 75 G,$169
88962,Galletas Nature Valley Oats & Honey 42 G,$69
859820,Galletas Paulinas Clásicas Sin Harina 140 G,$110
77451,Agua Saborizada Salus Cero Naranja 600 Cc,$63
76605,Yerba Baldo 1 Kg,$187
662662,Jugo Cepita Fresh Pomelo 250 Cc,$28
483743,Cereal Vitalisimo Muesli Frutos Secos 450 G,$351
562776,Endulzante Veracruz Naturevia Gotero 30 Ml,$277
529132,Mix Emigrante Nuéz + Almendras + Castañas + Maní 80 G,$85
90661,Chocolate Milka Castana 55 G ,$81
662661,Jugo Cepita Fresh Naranja 250 Cc,$28
85728,Té Manzanilla Con Miel Cabral 10 Saquitos,$88
825561,Powerade Naranja 600 Cc,$45
504097,Bebida Silk De Coco Azucarada 946 Ml,$226
862020,Funda Powerade Mountain Blast 600 Cc 6 Unidades,$270
712930,Monster Mango Loco 473 Ml,$99
637125,Ades Manzana 1 L,$115
838109,Powerade Mountain Blast 600 Cc,$45
499176,Funda Vitale Agua Con Gas 1.75l 4 Unidades,$134
573033,Funda Monster 473 Ml 6 Unidades,$593
85096,Bidón Agua Salus 6.25 L,$138
501290,Funda Salus Con Gas 1.5 L 6 Unidades,$430
493365,Funda Coca Cola Sin Azúcar 600 Ml 12 Unidades,$750
430060,Powerade Manzana 500 Ml,$45
19540,Colado Heinz Manzana 113 G,$114
71219,Agua Salus Sin Gas 1 L,$70
77453,Agua Saborizada Salus Pomelo 600 Cc,$63
708140,Funda Salus Frutte Sin Azúcar Naranja 600 Cc 6 Unidades,$378
19784,Refresco Sprite 600 Cc,$63
19779,Coca Cola 600 Cc,$63
499177,Funda Vitale Agua Sin Gas 1.75l 4 Unidades,$134
77448,Agua Saborizada Salus Manzana Sin Gas 600 Cc,$63
501291,Funda Salus Sin Gas 1.5 L 6 Unidades,$410
708132,Funda Agua Salus Saboriza Frutte Limónada 1.5 L 6 Unidades,$635
632311,Salus Frutte Limónada Sin Azúcar 600 Cc,$63
429660,Powerade Mountain Blast 995 Ml,$75
561876,Monster Zero Ultra 473 Ml,$99
20626,Agua Salus Con Gas 600 Cc,$59
77450,Agua Saborizada Salus Naranja Sin Gas 600 Cc,$63
41036,Coca Cola Zero 600 Ml,$63
493361,Funda Coca Cola Light 600 Cc 12 Unidades,$750
19780,Coca Cola Light 600 Cc,$63
84078,Schweppes Pomelo Sin Azúcar 500 Cc,$63
708138,Funda Salus Frutte Manzana Sin Gas 600 Cc 6 Unidades,$366
573032,Funda Monster Zero Ultra 473 Ml 6 Unidades,$593
499877,Funda Salus Agua Sin Gas 2.25 L 6 Unidades,$442
20627,Agua Salus Sin Gas 600 Cc,$59
420555,Jugo Citric De Frutas 250 Cc,$61
493375,Funda Aquarius Manzana Cero 1.5 L 6 Unidades,$578
820693,Juego Fifa 23 Para Ps4,$3.960
76628,Agua Vitale Con Gas 625 Ml,$47
820694,Juego Fifa 23 Para Ps5,$4.760
19781,Refresco Sprite Zero 600 Cc,$63
835608,Consola Play Station 5 + Juego Horizon Forbidden West,$58.040
616358,Auriculares Sony Inalámbricos Para P5 P4 Pulse 3d,$9.240
599873,Organizador De Cables Hasta 6 Negro,$99
599867,Cargador Inalámbrico Magnetico A41,$1.299
599872,Organizador De Cables Hasta 6 Verde,$99
599871,Organizador De Cables Hasta 6 Blanco,$99
715937,Fifa 22 Ps5,$4.000
614356,Juego Ps4 Grand Theft Auto V Premium Edition,$1.600
605399,Silla Gamer Reclinable Negro,$7.499
616257,Control Inalámbrico Dualsense Ps5,$4.960
599873,Organizador De Cables Hasta 6 Negro,$99
599966,Micrófono Multifunción Rosa,$2.060
599866,Auriculares Bluetooth Tws Blanco Tl1,$1.799
612046,Parlante Jbl Flip 5 Azul,$6.320
637325,Juego Fifa 22 Para Ps4,$4.000
616357,Cámara Hd Ps5,$4.360
614354,Juego Ps4 Crash Bandicoot 4 Its About Time,$3.560
409950,Cargador Usb Doble Irago 7996,$99
599966,Micrófono Multifunción Rosa,$2.060
599871,Organizador De Cables Hasta 6 Blanco,$99
605398,Silla Gamer Reclinable Negro Con Blanco,$7.499
612046,Parlante Jbl Flip 5 Azul,$6.320
658615,Planchita Philips Hp8325/10 Essential Care,$2.760
599867,Cargador Inalámbrico Magnetico A41,$1.299
660669,Cepillo Alisador Punktal Pk-nv4916,$1.000
660667,Corta Pelo Punktal Pk-hc2016 Recargable,$1.560
660665,Secador De Pelo Punktal Pk-2200ion 2200w,$1.440
599872,Organizador De Cables Hasta 6 Verde,$99
658672,Plancha A Vapor Philips Gc360/30 Steamer,$4.720
780359,Auriculares Jbl Gamer Quantum 100,$3.120
780359,Auriculares Jbl Gamer Quantum 100,$3.120
658644,Afeitadora Philips S1121/41 Aquatouch,$2.760
830810,Combo Gama Planchita Elegance Coconut + Secador H Bora Lino,$4.434
814182,Barra De Sonido Xion 2.1 4000w,$3.200
814182,Barra De Sonido Xion 2.1 4000w,$3.200
821213,Masajeador Xiaomi Gum,$6.960
599866,Auriculares Bluetooth Tws Blanco Tl1,$1.799
821300,Afeitadora Xiaomi Electric S700,$5.960
821212,Secador De Pelo Xiaomi Water Ionic H500,$3.560
811572,Rizador Gama Avocado Bv C T New,$2.229
821301,Secador De Pelo Xiaomi Ionic Hair Dryer H300,$2.160
821303,Cortadora Pelo Xiaomi Hair Clipper,$1.960
855213,Secador De Pelo Revlon Brilliance 2000w Iónico,$2.659
811571,Planchita Gama Elegance Matcha Led Bvt,$3.525
854913,Cepillo Voluminizador Revlon One Step,$4.458
836609,Máquina De Corte Profesional Evok Ev-hc-y400,$3.290
855113,Rizador Revlon Mix Ajustable 2 En 1,$3.640
855013,Planchita Revlon Tecnología Nano Cobre,$3.517
836516,Planchita Digital Profesional Evok Gr.a019-ys-538b,$4.390
836610,Máquina De Corte Evok Ev-hc-6000,$4.100
853213,Pistola Masajeadora De Persecusión Homedics Therapy,$3.960
836517,Secador De Pelo Profesional Evok 3000,$4.990
836612,Planchita Evok Ys738-b-220,$4.250
836409,Buclera Beauty Style Spirale,$1.536
836411,Set Planchita Buclera Y Peine Profesional Beauty Style,$4.900
836412,Secador De Pelo Profesional Evok 2000 R8-b,$4.290
836413,Secador De Pelo Súper Mega Turbo Profesional Beauty Style Iónico 3900,$4.800
836510,Cepillo Alisador Beauty Style Eléctrico,$1.630
836415,Lámpara Led Digital Para Uñas Beauty Style,$2.630
836613,Rasuradora Inalámbrica Beauty Style,$4.100
836518,Rizador De Cabello Beauty Style Inalámbrico Rosa,$4.086
836512,Lámpara Led Portátil Beauty Style 48w,$1.880
836611,Máquina De Corte Beauty Style 9700,$8.415
836515,Planchita Evok A019-x820-220,$3.590
836513,Máquina Corte Evok Ev-hc-1009,$3.900
80309,Té Cabral Carqueja 20 G,$81
836514,Planchita Beauty Style 2 En 1,$4.900
605399,Silla Gamer Reclinable Negro,$7.499
836414,Trimmer Beauty Style Nariz Y Orejas,$332
836519,Rizador De Pelo Evok A019-htb4,$1.990
836410,Máquina Corte Evok Ev-hc-1003,$2.200
605398,Silla Gamer Reclinable Negro Con Blanco,$7.499
48780,Té Malva Cabral 10 Saquitos,$79
76606,Yerba Baldo 500 G,$100
34778,La Selva En Forma 10 Saquitos,$76
85727,Té Manzanilla Con Menta Cabral 10 Saquitos,$88
562876,Endulzante Veracruz Naturevia 500 Pastillas,$760
18067,Boldo La Selva 20 G,$90
13965,Manzanilla Cabral 10 Saquitos,$79
293885,Hierbas Relajantes Canarias 10 Saquitos,$68
21392,Té Verónica Botica Del Señor 25 Saquitos,$198
30738,Miel Botica Del Señor 500 G,$245
27281,Sucralight 50 Sobres,$242
517925,Té Canarias Negro Limón 10 Saquitos,$68
17504,Yerba Carnicera La Selva 20 G,$90
32562,Yerba Carnicera Botica Del Señor 25 G,$95
45560,Yerba Canarias 1 Kg,$190
7030,Verónica Botica Del Señor 35 G,$217
13481,Carqueja 10 Saquitos La Selva,$67
68556,Endulzante Tevias Polvo 50 Bastónes,$288
85724,Té Guaco Con Miel Cabral 10 Saquitos,$88
13519,Mixto La Selva 10 Saquitos,$67
79394,Té De Moringa Botica Del Señor 25 Saquitos,$198
778354,Té Canarias Negro Cúrcuma-canela 10 Unidades,$68
32558,Té Eucaliptus En Hebras Botica Del Señor 15 G,$95
21388,Té Manzanilla Botica Del Señor 10 Saquitos,$96
85685,Té Antigripal Cabral 10 Saquitos,$88
