sku,name,price
330583,Mordillo Twistshake Frío +2 Meses Rosa,$479
585328,Mordillo Twistshake Teether +1 Meses Blanco,$476
691997,Set De 3 Piezas Gerber Vestido Ballena Nena 12 Meses,$920
691998,Set De 3 Piezas Gerber Vestido Ballena Nena 18 Meses,$920
329902,Capelina Para Nena Iplay Con Flores 9 A 18 Meses,$568
329943,Capelina Para Nena Iplay Con Formas 2 A 4 Años,$736
830711,Capazo Dual Bebedue Evo Dark Grey,$2.040
830907,Bumper Dual/dual Bebedue Evo Black,$1.400
329894,Licra Para El Agua Manga Larga Iplay Fucsia 3 Años,$892
830916,Saco Bebédue Cadi Beige,$3.000
329878,Short De Baño Para Varón Iplay Celeste Con Tortugas 6 A 12 Meses,$812
329873,Short De Baño Para Varon Iplay Safari 6 Meses,$1.007
830808,Impermeable Universal Bebédue,$800
329874,Short De Baño Para Varon Iplay Tiburónes 6 Meses,$1.007
831009,Espejo Vigila Bebé Bebédue Retrovisor,$600
830809,Mosquitero Universal Bebédue,$520
329900,Remera De Licra Para El Agua Manga Corta Iplay 24 Meses,$682
831010,Colchóneta Protectora Bebédue Con Memory Foam,$1.120
329879,Short De Baño Para Varón Iplay Gris Con Rayas 0 A 6 Meses,$812
329891,Licra Para El Agua Manga Larga Iplay Fucsia 6 Meses,$892
831011,Porta Bebé Bebédue Mio Galaxy Black,$2.840
830710,Barrera Puerta Alcala Bebedue,$3.440
867839,Booster Swiss Armor 3 En 1,$4.080
830711,Capazo Dual Bebedue Evo Dark Grey,$2.040
830915,Coche Bebedue Nik Light Blue,$9.880
830909,Cámara Bebédue De Vigilancia Con Wifi,$7.640
831007,Coche Bebedue Akro City Air Rojo,$11.520
830908,Coche Gemelar Bebedue Evo 0+ Dark Grey,$15.640
831007,Coche Bebedue Akro City Air Rojo,$11.520
830908,Coche Gemelar Bebedue Evo 0+ Dark Grey,$15.640
830914,Coche Bebédue Up Urban Beige,$13.600
831207,Coche Bebédue Nik Grey,$9.880
830712,Coche Bebédue Akro City Air Blue,$11.520
830911,Coche Bebédue Up Urban Gris,$13.600
603533,Butaca Carestino Moscu Isofix Grisgrupo 0-1-2-3,$9.899
603517,Cochecito Carestino City Travel Accesorios Negro,$16.059
603512,Coche Travel System Carestino Ferro Verde,$29.699
765919,Booster Infanti Premium Isofix Rojo,$8.360
603493,Cochecito Carestino Ferro Accesorios Mora,$29.699
843909,Booster Swiss Armor Con Isofix,$4.000
603534,Butaca Carestino Denver 360º Isofix Grupo 0-1-2-3,$15.289
766019,Coche Infanti Adventure Stroller Gris,$5.240
692498,Butaca Para Auto Carestino Vancouver Isofix Gris Grupo 0/1/2/3,$17.599
603513,Butaca Carestino Denver 360º Isofix Rojo Grupo 0-1-2-3,$15.289
603494,Cochecito Carestino Ferro Accesorios Gris Claro,$29.699
785094,Mochila Storki Porta Bebé Con Asiento,$1.650
791114,Butaca Para Auto Biuco Taz 360 Gris,$14.400
656550,Butaca Para Auto Carestino Berlín Rojo Grupo 1-2-3,$8.359
603489,Cochecito Carestino City V2 Con Accesorios Gris,$10.999
603514,Coche Carestino City V2 Morado,$10.999
780960,Sérum Fructis Stop Caída 30 Ml,$645
800663,Ampolla Crescina Tratamiento Completo Dama 1300 20 Unidades,$11.900
36464,Gel Fijador Fix Lavanda 120 G,$81
51926,Ampolla Mediplus Nutritiva Cereales 1 Unidad,$173
74449,Máscara L'oréal Professionnel Vitamino 250 Ml,$1.480
59590,Gel Fijador Fixed Azul 250 G,$117
316752,Pasta Modeladora L'oréal Professionnel Tecni Art Depolish 100 Ml,$499
846041,Sérum Ogx Anti-quiebre Leche De Coco 118 Ml,$732
460088,Crema Para Peinar Elvive Dream Long Liss 300 Ml,$453
552871,Cápsulas Elvive Reparación Total 5 3 Unidades,$488
600366,Suplemento Ducray Anacaps Activ+ 30 Cápsulas,$2.110
780367,Máscara L'oréal Professionnel Metal Detox 250 Ml,$1.700
34556,Fijador Roby Normal 180 Ml,$279
839909,Mascarilla De Tratamiento Pantene Pro-v Miracles Nutre Renueva Y Sella Puntas 300 Ml,$339
800659,Ampolla Crescina Transdérmica Dama 500 20 Unidades,$9.400
49207,Tratamiento Fixed Reparador De Puntas 60 Ml,$290
47719,Fijador Primicia En Spray 20 Ml,$86
88400,Fijador Elnett Laque Normal 200 Ml,$532
68447,Gel Studio Line Mega 200 Ml,$397
583400,Máscara De Keratina Ilicit Coco 350 Ml,$449
689895,Crema Para Peinar Fructis 10 En 1 Rizos Poderos 300 Ml,$332
30454,Decolorante Issue 20 G,$147
793924,Aceite De Tratamiento Motas Uy 50 Ml,$714
803963,Máscara De Tratamiento Dove Poder De Las Plantas Nutrición + Geranio 190 Ml,$248
47717,Tratamiento Revitalizador Capilar Primicia 18 Ml,$78
831612,Tratamiento Nocturno Elvive Hidra Rellenador Con ácido Hialurónico 200 Ml,$360
858221,Tratamiento Para El Cabello Issue Brillo Extremo 150 G,$186
57241,Fijador Roby Fuerte 180 Ml,$279
238319,Desenredante Primicia En Spray 120 Ml,$256
310945,Tratamiento Capilatis Orgánico 170 G,$476
76855,Fijador Primicia Fuerte 470 Ml,$385
401933,Máscara Dove 1 Minuto Factor De Nutrición 60+ 300 G,$264
631309,Tratamiento Bealm Post Lavado Recuperación Instantánea 250 Ml,$305
784111,Máscara Wella Tratamiento Wellaplex Paso 3 100 Ml,$1.663
30152,Tratamiento Pantene Hidro Intensiva Rizos Definidos 300 Ml,$339
509018,Máscara Reparadora Lovebeauty And Planet Argán Y Lavanda 190 G,$118
768927,Botox Capilar Ilicit Cicamask 350 Ml,$390
42436,Mascarilla De Tratamiento Pantene Pro-v Miracles Repara Protege Y Anti Frizz 300 Ml,$339
826906,Máscara De Tratamiento Tresemmé Reparación Intra Capilar 300 Ml,$285
51941,Mamadera True Con Asas 300 Ml,$519
801361,Mamadera Nuk First Choice Con Tetina Silicona Control Temperatura Azul 300 Ml,$780
56340,Crema Para Peinar Biferdil Ultra Brillo 270 G,$374
51935,Mamadera True Decorada 125 Ml,$346
773033,Mamadera True Con Asas Tetina De Silicona+6 Meses 250 Ml,$361
311049,Mamadera First Essencial Niña 120 Ml,$250
647948,Mamadera Fisiológica Suavinex Silicona Azul +3 Meses 270 Ml,$1.012
647954,Mamadera Fisiológica Suavinex Silicona Beige +0 Meses 150 Ml,$920
283867,Mamadera First Essential Rosado Talle 2 240 Ml,$300
802164,Mamadera Suavinex Gold Rosa +3 Meses 270 Ml,$940
801362,Mamadera Nuk First Choice Tetina Silicona Control Temperatura Rosa 300 Ml,$780
51936,Mamadera True Lisa Anatómica 250 Ml,$346
550645,Mamadera Lillo Recién Nacido Latex Rosa 50 Ml,$300
603292,Mamadera Nuk First Choice Mickey Mouse 300 Ml,$890
802165,Mamadera Suavinex Sx Pro Gold Rosa +0 150 Ml,$893
68095,Mamadera True Toma Solito 250 Ml,$514
51939,Mamadera True Decorada Red 250 Ml,$346
647946,Mamadera Fisiológica Suavinex Silicona Gris +0 Meses 150 Ml,$920
802063,Mamadera Suavinex Sx Pro Gold Verde +0 Meses 150 Ml,$893
603295,Mamadera Nuk First Choice Minnie Mouse 300 Ml,$890
51934,Mamadera True Lisa 150 Ml,$278
550646,Mamadera Lillo Recién Nacido Latex Azul 50 Ml,$300
773032,Mamadera True Tetina Red Silicona 250 Ml,$328
284167,Mamadera First Essential Varón Talle 2 240 Ml,$300
236419,Calienta Mamadera Nevi,$1.520
648342,Mamadera Anatómica Suavinex Silicona Naranja +3 Meses 270 Ml,$1.012
585328,Mordillo Twistshake Teether +1 Meses Blanco,$476
647950,Mamadera Suavinex Zero Zero 180 Ml,$1.380
802163,Mamadera Suavinex Gold Azul +3 Meses 270 Ml,$940
51938,Mamadera True Decorada 250 Ml,$372
51956,Vaso True Totty Con Asas 275 Ml,$519
284071,Mamadera First Essencial Silicona Tetina Anatómica 120 Ml,$250
850522,Chupetenuk For Nature Látex 2 Unidades 6 A 18 Meses,$700
802561,Mamadera Nuk First Choice Tetina De Silicona Con Control Temperatura Gris 300 Ml,$780
850521,Chupete Nuk For Nature Látex 0 A 6 Meses 2 Unidades,$700
585331,Vaso De Aprendizaje Twistshake Mini Cup +4 Meses Pastel Violeta 230 Ml,$800
51947,Chupete True Aireado Anatómico +6 Meses,$278
802262,Suavinex Chupete Sx Pro Gold Rosa +18 Meses,$610
482841,Chupete Nuk Silicona Happy Days Niña Talle 2 2 Unidades,$570
648245,Chupete Anatómico Suavinex Silicona Verde 0 A 6 Meses,$598
801464,Suavinex Chupete Sx Pro Gold Rose 6 A 18 Meses,$610
799862,Chupete Nuk Látex Star Surtido Talle 3 Niña 2 Unidades,$570
68363,Cadena Y Chupete True Animales 6+ Meses,$579
648061,Chupete Anatómico Suavinex Silicona Beige 0 A 6 Meses 2 Unidades,$966
56177,Chupete True Anatómico Con Diseño +6 Meses,$310
283967,Chupete First Essential Silicona Varón Talle 1,$190
648051,Chupete Fisiológico Suavinex Silicona Silicona Gris +18 Meses 2 Unidades,$966
90668,Chupete Nuk Silicona Día Y Noche Talle 1 2 Unidades,$600
773034,Chupete True Silicona Con Tapa 0 A 6 Meses,$366
51966,Porta Chupete True,$341
90605,Chupete Nuk Silicona Happy Days Niña Talle 3 2 Unidades,$570
555365,Tetina Látex Nuk 0 A 6 Meses 2 Unidades,$380
648547,Chupete Suavinex Fisiológico Silicona Beige 6 A 18 Meses 2 Unidades,$966
448274,Clip Rabbit De Chupete,$138
51949,Chupete True Suave Anatómico +6 Meses,$276
498706,Chupete Nuk Látex Happy Kids Talle 1 2 Unidades,$570
86286,Chupete True Anatómico +6 Meses,$346
648537,Chupete Anatómico Suavinex Silicona Verde 6 A 18 Meses 2 Unidades,$966
81462,Portachupete Adoleta Akas Ovalada,$94
51945,Tetina True Silicona Redonda Boca Ancha 1 Unidad,$203
647953,Chupete Fisiológico Suavinex Silicona Gris 0 A 6 Meses 2 Unidades,$966
648343,Chupete Suavinex Anatómico Silicona Gris 0 A 6 Meses,$552
802061,Suavinex Chupete Sx Pro Gold Azul 0 A 6 Meses,$610
72161,Tetina Nuk First Choice Silicona Talle 1,$250
648062,Chupete Anatómico Suavinex Silicona Azul 0 A 6 Meses 2 Unidades,$966
283968,Chupete First Essential Fun Silicona Talle 2 Varón,$190
801462,Chupete Suavinex Sx Pro Gold Rosado 0 A 6 Meses,$610
648052,Chupete Anatómico Suavinex Silicona Rosado +18 Meses 2 Unidades,$966
90669,Chupete Nuk Genius Silicona Celeste Talle 0 2 Unidades,$690
623894,Chupete Nuk De Silicona Signature Varón Talle 2 2 Unidades,$570
603293,Chupete Nuk Silicona Mickey Mouse 6 A 18 Meses,$680
51967,Cadena De Chupete True,$293
550244,Set Baylis & Harding Beauticology Llama Mini Stack2 Unidades,$1.163
586847,Set Baylis & Harding Jojoba Vanilla & Almond 3 Unidades,$1.033
586835,Set Baylis & Harding Boudoire Rose 2 Unidades,$743
434968,Jabón Líquido Para Manos Baylis & Harding Sweet Mandarin 500 Ml,$265
586838,Set Baylis & Harding Hombre Citrus Lime Y Mint Small 3 Unidades,$766
554671,Crema Baylis & Harding De Manos Garden Green 50 G 3 Unidades,$743
586846,Set Baylis &harding The Fuzzy Duck Men's Hemp & Bergamot 4 Unidades,$1.051
434665,Jabón Líquido Baylis & Harding Para Manos Poppy & Vainilla 500 Ml,$265
586864,Set Baylis & Harding Crema De Manos Signature Sweet Mandarin & Grapefruit 3 Unidades,$743
726853,Tampones Ob Medio 24 Unidades,$347
550243,Set Baylis & Harding Royale Garden Manicure Rose 3 Unidades,$894
32631,Desodorante En Roll On Nivea Sensitive Protect Men 50 Ml,$120
274247,Cepillo Interdental Gum 650 Soft Picks Avanced 18 Unidades,$320
90635,Tinta Garnier Nutrisse N°110 Negro Magnético,$419
345208,Pastillero Oval Safy Diferentes Colores,$139
81745,Aceite Calypso Post Depilatorio 80 Ml,$183
549942,Antitranspirante En Aerosol Secret Powder Protect 150 Ml,$188
325969,Toallitas Húmedas Readysec 50 Unidades,$195
313041,Kit Kativa Alisado Brasileño,$1.090
41295,Repuesto Jabón Líquido Ecume Cítrico 980 Ml,$222
631209,Tratamiento Bealm Post Lavado Reconstrucción 250 Ml,$305
566585,Afeitadora Gillette Skinguard Sensitive 4 Unidades,$1.617
314748,Shampoo Pantene Miracle Fuerza Y Reconstrucción 270 Ml,$422
586841,Set De Jabónes Baylis & Harding The Fuzzy Duck Costwold Floral 3 Unidades,$659
9577476,Tinta Ilicit,$283
88834,Pack Fructis Liso Shampoo 350 Ml + Acondicionador 200 Ml,$332
16915,Cotonetes J&j 150 Unidades,$186
87393,Repelente Livopen Aerosol Protección Total 165 Ml,$262
818010,Kiehls Men Eye Fuel 15 Ml,$1.450
631112,Jabón Líquido Bealm Para Manos Lykke 200 Ml,$245
69999,Jabón En Barra Astral Protex Plata 125 G 4 Unidades,$188
49760,Decolorante Issue Semillas De Lino 30 G,$175
80650,Desodorante En Barra Obao Black Masculino 50 G,$200
18646,Tinta Garnier Nutrisse N°70 Almendra,$419
844221,Muñequeras Dojo Azules,$690
51811,Gel De Ducha Nivea Vitality Fresh Para Hombre 250 Ml,$167
565996,Crema Barber Shop De Afeitar 150 G,$395
846114,Acondicionador Ogx Aceite De Argán De Marruecos 385 Ml,$665
77104,Gel Para Afeitar Gillette Mach3 Complete Defense Extra Comfort 72 Ml,$256
31604,Shampoo Ducray Anaphase 200 Ml,$871
753006,Bálsamo Labial Blistex Classic Lip Balm Fps15 4.25 G,$191
69593,Pañales Para Adultos Plenitud Protect Talle Extra Grande 32 Unidades,$1.539
294009,Cepillo De Dientes Vitis Encías 1 Unidad,$511
10710,Crema De Afeitar Selby 50 G,$139
72157,"Tijera De Peluquero 6"" Nail Mate Con Descanso",$478
87372,Cepillo Colgate Slim Soft Black 3 Unidades,$528
826507,Acondicionador Tresemmé Liso Efecto Botox 500 Ml,$389
503894,Mousse Tresemmé Extra Firme 200 Ml,$294
589021,Jabón Líquido Palmolive Cerezo Y Rosa 800 Ml,$281
60205,Desodorante En Crema Sleep Piel Sensible 80 G,$195
90985,Acondicionador Dove Super Factor Nutrición 60 Minutos 170 Ml,$204
734057,Acondicionador Biolage Hydrasource 280 Ml,$901
520427,Acondicionador Head & Shoulders Manzana Fresh 300 Ml,$395
74401,Acondicionador L'oréal Professionnel Absolut Repair 200 Ml,$969
42027,Bálsamo Biferdil Phytoplus Lino 200 Ml,$336
279665,Acondicionador Herbal Essences Coconut Milk 400 Ml,$464
74446,Acondicionador L'oréal Professionnel Vitamino 200 Ml,$1.140
846125,Acondicionador Ogx Leche De Coco 385 Ml,$665
316252,Acondicionador L'oréal Professionnel Silver 200 Ml,$1.140
89840,Acondicionador Fructis Oil Repair Liso Coco 200 Ml,$150
511022,Acondicionador Fructis Hair Food Aloe 300 Ml,$309
606804,Acondicionador Fructis Hair Food Sandia 300 Ml,$309
754408,Acondicioador Dove Hidraliso 400 Ml,$415
846036,Acondicionador Ogx Biotina & Colágeno 385 Ml,$665
808869,Acondicionador Pantene Colágeno 510 Ml,$489
58180,Bálsamo Primicia Tratante 250 Ml,$236
37784,Acondicionador Pantene Brillo Extremo 750 Ml,$489
793124,Acondicionador Veganis Nutri Boost Sublim 400 Ml,$740
83857,Acondionador Engrosador Tío Nacho 415 Ml,$332
278362,Bálsamo Klorane Quinina 200 Ml,$848
70910,Acondicionador Elvive óleo Extraordinario Nutrición 370 Ml,$454
509021,Acondicionador Love Beauty & Planet Manteca Muru Muru Y Rosas 300 Ml,$139
600666,Acondicionador Head & Shoulders Fuerza De Raíz 300 Ml,$395
835708,Acondicionador Pantene Nutrient Blends Frizz Control 235 Ml,$579
805977,Acondicionador Ilicit Pepino Y Jengibre Kera-v Detox 350 Ml,$285
784197,Acondicionador Wella Oil Reflection 200 Ml,$1.231
28482,Acondicionador Pantene Liso Extremo 750 Ml,$489
50911,Acondicionador Dove Reconstruccion Completa 400 Ml,$311
83509,Acondicionador Tío Nacho Herbal 415 Ml,$332
503002,acondicionador Tío Nacho Aloe Vera 415 Ml,$332
803862,Acondicionador Dove Poder De Las Plantas Fuerza + Bambú 300 Ml,$391
784098,Acondicionador Sebastian Penetraitt 250 Ml,$1.713
826512,Acondicionador Tresemmé Para Ondas Boho 500 Ml,$389
859119,Acondicionador Nioxin Revilatizing N°6 300 Ml,$1.456
68516,Acondicionador Pantene Hidratación Extrema 400 Ml,$386
81729,Acondicionador Pantene 3mm Rizos Definidos 170 Ml,$345
28314,Acondicionador Pantene Rizos Definidos 400 Ml,$386
86473,Bálsamo Klorane Lino 200 Ml,$848
460086,Acondicionador Elvive Dream Long Liss 200 Ml,$280
575762,Cepillo De Dientes Naturbrush De Bamboo Niños Rojo,$189
10450,Cepillo De Dientes Butler Para Viaje 153,$186
35295,Cepillo De Dientes Pico Jenner Duro Plus Con Protector 1 Unidad,$288
294385,Acondicionador Elvive Dream Long 370 Ml,$454
687288,Cepillo De Dientes Colgate Jóvenes Titanes 6+ Años 1 Unidad,$129
32288,Cepillo De Dientes Mi Primer Colgate 0-2 Años Rosado/celeste,$269
69425,Cepillo De Dientes Sensodyne Complete Protection Suave,$186
525931,Cepillo De Dientes Sri Sri Sudanta Niño1 Unidad,$159
89396,Cepillo De Dientes Colgate Total 12 360° 2 Unidades,$427
678486,Cepillo De Dientes Oral B Expert Limpieza Medio 1 Uidad,$369
525534,Cepillo De Dientes Sri Sri Sudanta Adulto Suave 1 Unidad,$169
623486,Cepillo De Dientes Gum 525 Technique Deep Clean 2 Unidades,$270
78329,Cepillo De Dientes Vitis Suave,$511
28239,Cepillo De Dientes Kolynos Doctor Mediano 2 Unidades,$122
39170,Cepillo Supertip Butler 1462 2 Unidades,$192
18062,Cepillo De Dientes Colgate Twister 2 Unidades,$144
35305,Cepillo De Dientes Pico Jenner Medio Plus 3 Unidades,$484
57615,Cepillo De Dientes Interdental Butler 1314 De Viaje 0.8 4 Unidades,$201
294009,Cepillo De Dientes Vitis Encías 1 Unidad,$511
78326,Cepillo De Dientes Vitis Medio,$511
404933,Cepillo De Dientes De Bamboo Colgate 2 Unidades,$389
38604,Cepillo De Dientes Oral B Indicator Plus Medio 40 2 Unidades,$172
84969,Cepillo De Dientes Oral B 7 Beneficios 2 Unidades,$369
595528,Cepillo De Dientes Colgate Encías Renovadas 1 Unidad,$232
84971,Cepillo De Dientes Oral B Indicator Colors 4 Unidades,$333
35299,Cepillo De Dientes Pico Jenner Doble Acción Plus 2 Unidades,$397
274247,Cepillo Interdental Gum 650 Soft Picks Avanced 18 Unidades,$320
792432,Cepillo De Dientes Balene Suave Coral 1 Unidad,$970
10451,Cepillo De Dientes Butler Classic Suave 411,$140
52770,Interproximal Butler 1414 Cilíndrico Uf 1.1 4 Unidades,$201
35296,Cepillo De Dientes Pico Jenner Plus 2 Unidades,$397
83683,Cepillo De Dientes Colgate Barbie +6 Años 2 Unidades,$274
89589,Cepillo De Dientes Colgate Periogard Extra Soft 1 Unidad,$449
71787,Cepillo De Dientes Oral B Pro Salud 3 Unidades,$395
576066,Cepillo De Dientes Geosmile De Bamboo Adulto Rojo 1 Unidad,$114
730153,Cepillo De Dientes Pico Jenner Ultra Suave 1 Unidad,$248
32289,Cepillo De Dientes Colgate 2-5 Años Barbie/bob Esponja,$274
69426,Cepillo De Dientes Sensodyne Completa Protection Medio,$186
42366,Cepillo De Dientes Pico Jenner Soft Plus 2 Unidades,$397
81000,Cepillo Interdental Butler Soft-picks 15 Unidades,$210
18008,Tinta Soft Color N°80 Rubio Claro,$489
18640,Tinta Garnier Nutrisse N°91 Jazmín,$419
30454,Decolorante Issue 20 G,$147
575760,Cepillo De Dientes Naturbrush De Bamboo Adulto Rojo,$194
22616,Kit Tinta Koleston N°30 Castaño Oscuro,$545
455877,Kit Tinta Issue Sin Amoníaco N°10.1 Rubio Extra Claro Ceniza,$221
567900,Tinta Excellence Matizador Supreme N°8.12rubio Claro Cenizo/perla,$675
25963,Tinta Excellence Creme L'oréal N°9.1 Rubio Muy Claro Ceniza,$675
601899,Retocador De Raíz Garnier Nutrisse N°40 Colorante 20 G + Revelador 20 Ml,$109
43244,Henna Surya Castaño Oscuro 70 Ml,$891
805978,Kit Tinta Koleston N°415 Castaño Impulso,$545
44898,Tinta Excellence Creme N°6.7 Chocolate Puro,$675
61793,Tinta Koleston Single N°80 Rubio Claro,$225
18657,Tinta Garnier Nutrisse N°10 Ebano,$419
60025,Tinta Garnier Nutrisse Cor Intensa N°4.15 Castaño Ceniza Caoba,$294
65352,Tinta Casting Creme Gloss N°503 Golden Chocolate,$598
869251,Tinta Excellene N°7 Rubio + Shampoo Colorvive 200 Ml,$699
74368,Oxidante Calypso Cremoso 40 Volúmenes 100 Ml,$84
18007,Tinta Soft Color N°70 Rubio Natural,$489
765521,Tinta Soft Color N°535 Castaño Arábica,$489
12502,Henna Cleahenn Dorado 50 G,$397
869248,Tinta Excellene N°4 Castaño + Shampoo Colorvive 200 Ml,$699
455578,Kit Tinta Issue Sin Amoníaco N°5 Castaño Claro,$221
567793,Tinta Excellence Matizador Supreme N°6.12 Rubio Oscuro Cenizo Perla,$675
22638,Kit Tinta Koleston N°80 Rubio Claro,$545
25958,Tinta Excellence Creme L'oréal N°5.1 Castaño Claro Ceniza,$675
601895,Retocador De Raíz Garnier Nutrisse N°10 Colorante 20 G + Revelador 20 Ml,$109
28261,Tinta Koleston Single N°466 Borgoña Intenso,$225
61790,Tinta Koleston Single N°50 Castaño Claro,$225
44363,Tinta Casting Creme Gloss N°535 Chocolate,$598
60022,Tinta Garnier Nutrisse Cor Intensa N°3.0 Castaño Oscuro,$294
64947,Tinta Excellence Creme N°7.3 Rubio Dorado,$675
18654,Tinta Garnier Nutrisse N°50 Castaña,$419
85235,Tinta Garnier Nutrisse Coloríssimo N°4462 Rojo Carmín,$419
765420,Tinta Soft Color N°10 Negro Expreso,$489
79516,Kit Tinta Issue Keratin Color N°7.64 Rubio Rojizo Cobrizo,$198
26583,Shampoo Capilatis Puro Rubio Iluminador 420 Ml,$567
18004,Tinta Soft Color N°40 Castaño Mediano,$489
435666,Tinta Issue Crazy Color Amarillo 47 G,$174
784105,Shampoo Sebastian Trilliance 250 Ml,$1.650
22634,Kit Tinta Koleston N°70 Rubio Mediano,$545
576966,Crema Para Peinar Pantene Bambú 300 Ml,$339
44774,Crema Para Peinar Elvive Reparación Total 5 250 Ml,$453
88834,Pack Fructis Liso Shampoo 350 Ml + Acondicionador 200 Ml,$332
315252,Acondicionador Head & Shoulders Purificación Capilar 375 Ml,$395
25955,Tinta Excellence Creme L'oréal N°7 Rubio,$675
41799,Tinta Casting Creme Gloss N°600 Rubio Oscuro,$598
500696,Shampoo Batiste Seco Original 200 Ml,$665
765619,Kit Tinta Koleston N°53 Castaño Dorado,$545
456077,Kit Tinta Issue Sin Amoníaco N°7 Rubio,$221
601899,Retocador De Raíz Garnier Nutrisse N°40 Colorante 20 G + Revelador 20 Ml,$109
582605,Shampoo Biferdil Anti Amarillo 295 Ml,$427
780562,Shampoo En Barra Fructis Hair Food Aguacate Nutrición 60 G,$449
846032,Aceite Capilar Renovador Ogx Argán De Marruecos 100 Ml,$732
456277,Kit Tinta Issue Sin Amoníaco N°1negro,$221
61787,Tinta Koleston Single N°20 Negro,$225
85776,Acondicionador John Frieda Miraculous Recover 250 Ml,$526
380423,Shampoo Tío Nacho Ultra Hidratante 415 Ml + Acondicionador 415 Ml,$622
601905,Retocador De Raíz Garnier Nutrisse N°71 Colorante 20 G + Revelador 20 Ml,$109
47070,Henna Cleahenn Extra Red 50 G,$397
68514,Shampoo Pantene Hidrataciónextrema 700 Ml,$529
263735,Shampoo L'oréal Professionnel Blondifier Gloss 500 Ml,$1.690
784199,Aceite Wella Reflection óleo 100 Ml,$2.301
41639,Shampoo Biferdil Ortiga Y Quina 295 Ml,$359
68396,Set Peine Conair Y Cepillo De Viaje,$433
22635,Kit Tinta Koleston N°71 Rubio Cenizo Mediano,$545
342007,Gomitas De Pelo Top Colores Surtidas Finas,$117
503001,Shampoo Tío Nacho Aloe Vera415 Ml,$332
28261,Tinta Koleston Single N°466 Borgoña Intenso,$225
612542,Gomita De Pelo Top Diseño Vaca 1 Unidad,$229
300507,Tratamiento Tío Nacho Ultra Hidratante 200 G,$436
79957,Acondicionador Elvive Rizos 370 Ml,$454
25962,Tinta Excellence Creme L'oréal N°8.1 Rubio Claro Ceniza,$675
86527,Spray Magic Retouch Rubio Claro Medio 75 Ml,$662
831612,Tratamiento Nocturno Elvive Hidra Rellenador Con ácido Hialurónico 200 Ml,$360
84619,Pack Shampoo Pantene Restauración 400 Ml + Acondicionador 3mm 170 Ml,$614
868139,Acondicionador Herbal Essences Aloe Y Mango 250 Ml,$464
16459,Acondicionador Capilatis Ortiga Anti-caída 410 Ml,$456
47729,Shampoo Ortiga Cardo 410 Ml,$456
631309,Tratamiento Bealm Post Lavado Recuperación Instantánea 250 Ml,$305
631209,Tratamiento Bealm Post Lavado Reconstrucción 250 Ml,$305
631112,Jabón Líquido Bealm Para Manos Lykke 200 Ml,$245
511021,Acondicionador Fructis Hair Food Aguacate 300 Ml,$309
631412,Crema Corporal Bealm 24 Hs De Suavidad Para Pieles Maduras 500 Ml,$421
846034,Aceite Capilar Reparador Ogx Argán De Marruecos 118 Ml,$732
631411,Jabón Líquido Bealm Para Manos Lagom 200 Ml,$245
631409,Crema Bealm Manos Y Uñas Hidratación 150 Ml,$399
51129,Peine Fino Assy 2000,$816
631113,Crema Corporal Bealm 24hs De Hidratación Para Pieles Resecas 500 Ml,$421
631015,Crema Corporal Bealm Humectación Extrema Para Pieles Secas 500 Ml,$421
72157,"Tijera De Peluquero 6"" Nail Mate Con Descanso",$478
631110,Shampoo Bealm Restauración Completa 375 Ml,$382
631109,Shampoo Bealm Brillo Extremo 375 Ml,$382
569325,Gomitas De Pelo De Rulo Top Negras 3 Unidades,$139
612332,Gomita De Pelo Top Con Rayas 1 Unidad,$189
744997,Gomitas De Pelo Elásticas Top Varios Colores 10 Unidades,$152
612241,Vincha Top Con Orejas,$239
59997,Red Para Cabello Solingen Castaño Oscuro 2 Unidades,$106
342109,Gomitas De Pelo Top Mini 5 Unidades,$168
612542,Gomita De Pelo Top Diseño Vaca 1 Unidad,$229
39080,Peine Suances Antipediculosis,$714
743809,Cepillo Top Rectangular,$459
744901,Gomita De Pelo Top Con Tul 1 Unidad,$149
843415,Gomita De Pelo R&c Bicolor 1 Unidad,$111
815411,Gorra Para Mechitas Con Nuca,$93
883491,Cepillo Unicornio Top,$389
344810,Gomitas De Pelo Top Con Aplique 6 Unidades,$139
612238,Gomitas Top Con Moño 2 Unidades,$149
743698,Set Peines Top 10 Piezas,$219
852815,Cepillo Revlon Mini Con Mango De Goma Para Viaje,$289
744897,Gomita Top Con Orejas 1 Unidad,$169
566308,Cepillo Conair Redondo Chico Metal,$450
612235,Gomitas De Pelo Con Orejas 2 Unidades,$149
612539,Gomita De Pelo Top Diseño Cebra 1 Unidad,$229
628509,Gomitas De Pelo Elástica Top Varios Colores 2 Unidades,$139
344308,Gorra De Baño Rabbit Para Niño,$279
744799,Pinza Top Con Moña,$149
745198,Vincha Deportiva Farma Fitness Básica 2 Unidades,$216
787104,Gomitas De Pelo Top 3 Unidades,$169
729855,Broche Oh Jacinta Gala,$880
87224,Cepillo Profesional Conair Cushion,$576
825708,Gomitas De Pelo Top 3 Unidades,$169
68396,Set Peine Conair Y Cepillo De Viaje,$433
745101,Vincha Rabbit Con Moña Bebé,$189
330590,Mordillo Twistshake +1 Meses Celeste,$479
852714,Cepillo Para Cabello Revlon Rectangulár Con Cerdas Suaves,$499
585328,Mordillo Twistshake Teether +1 Meses Blanco,$476
612536,Gomita De Pelo Top Básica 1 Unidad,$229
14650,Red Para Cabello Solingen Negro 2 Unidades,$106
628207,Gomitas De Pelo Top Elásticas Colores 2 Unidades,$154
825608,Gomitas De Pelo Top Celestes Rosadas Y Camufladas 12 Unidades,$149
546739,Vincha Top Ancha Diferentes Colores,$259
729655,Broche Oh Jacinta Candela,$880
829410,Mordillo True De Gel Con Sonajero Celeste +3 Meses,$381
692506,Alfombra Carestino Plegable Aventura 177x195 Cm,$3.299
603520,Gimnasio Didáctico Carestino Amigos,$3.959
846030,Caminador Polar B Con Actividades,$3.438
829217,Mordillo Storki De Silicona Cohete,$790
829131,Mordillo Storki De Silicona Tren,$790
293996,Espejo Storki Con Sonajero Y Mordillo,$620
781561,Porta Chupete Storki Apego Coco,$580
829218,Mordillo True De Gel Con Sonajero Rosado +3 Meses,$381
293998,Pelota Stroki De Actividades Con Mordillo Azul,$790
692504,Alfombra Carestino Plegable Bosque 177x195 Cm,$3.299
85473,Peluche Con Sonajero Storki Ratón,$1.090
829214,Mordillo True Para Alimento Con Tapa Celeste +6 Meses,$572
603491,Alfombra Antigolpes Reversible Jungla 200x180 Cm,$3.739
781563,Sonajero Storki Arcoíris,$540
829119,Mordillo True Para Alimento Con Tapa Verde +6 Meses,$572
638630,Mordillo Rabbit Verde,$219
615256,Mordillo Alimentador Boboduck Silicona,$599
32289,Cepillo De Dientes Colgate 2-5 Años Barbie/bob Esponja,$274
829219,Mordillo True De Gel Con Sonajero Verde +3 Meses,$381
