sku,name,price
493260,Agua Micelar Vichy Piel Mixta Grasa 200 Ml,$1.785
47630,Aceite De Ducha Eucerin Ph5 200 Ml,$941
817925,Kiehl's Caléndula Deep Cleansing Foaming Face Wash 230 Ml,$2.290
15497,Leche Desmaquillante Avene 200 Ml,$1.677
854813,Exfoliante Natura Siberica Facial 150 Ml,$895
58325,Crema La Roche Posay Effaclar M 40 Ml,$2.550
89496,Loción Cerave Limpiadora E Hidratante 473 Ml,$1.020
817932,Kiehl's Rare Earth Deep Pore Daily Cleanser 150 Ml,$1.900
41357,Crema Eucerin Facial Antienrojecimiento 50 Ml,$2.448
533533,Espuma De Limpieza Eucerin Dermato Clean Micelar 150 Ml,$1.459
729254,Limpiador Facial Anti-rugosidades Cerave 236 Ml,$825
818007,Kiehl's Men Facial Fuel Energizing Cleanser 250 Ml,$1.640
84927,Loción Micellar Avene Cleanance 400 Ml,$1.865
10830,Desmaquillante Vichy Pureté Thermale 3 En 1 200 Ml,$1.970
63744,Gel Dermur Espuma Purificante 150 Ml,$908
42643,Emulsión De Limpieza Dermur 150 Ml,$790
302321,Agua Termal La Roche Posay 300 Ml,$2.000
76856,Agua Micellar Eucerin 3 En 1 200 Ml,$1.397
88916,Gel Limpiador Eucerin Dermopure Oil Control 200 Ml,$1.024
817936,Kiehl's Caléndula Herbal-extract Alcohol-free Toner 250 Ml,$2.620
434664,Tónico Isispharma Aquaruboril 250 Ml,$1.385
23012,Tónico Vichy Normaderm Astringente 200 Ml,$1.800
73766,Gel Vichy Purete Thermal Nettovant 200 Ml,$1.970
85048,Gel De Limpieza La Roche Posay Effaclar Gel Pieles Grasas 400 Ml,$1.900
523328,Gel De Limpieza La Roche Posay Effaclar Duo+ Clean 400 Ml,$1.900
817933,Kiehl's Ultra Facial Cleanser 150 Ml,$1.890
818008,Kiehl's Facial Fuel Energizing Scrub 100 Ml,$1.530
80165,Espuma De Limpieza Avene Matificante 150 Ml,$1.654
817317,Desmaquillarte Dermaglós De Ojos 100 Ml,$608
817926,Kiehl's Caléndula Herbal-extract Alcohol-free Toner 125 Ml,$1.640
10834,Agua Termal Vichy Mineralizante Brumisateur 150 G,$1.400
729354,Crema Limpiadora Cerave Espuma Hidratante 236 Ml,$725
37555,Leche De Limpieza Dermaglós 200 Ml,$955
42644,Emulsión De Limpieza Dermur 250 Ml,$1.147
73792,Mousse Vichy Purete Thermale 150 Ml,$1.840
493160,Agua Micelar Vichy Piel Sensible 200 Ml,$1.785
41658,Solución Miscellaire La Roche Posay Physiologique 200 Ml,$2.200
817978,Kiehl'snightly Refiningmicro-peel Concentrate 30 Ml,$3.600
817937,Kiehl's Ultra Facial Toner 250 Ml,$1.400
613952,Gel Exfoliante Avene 75 Ml,$1.556
89520,Crema Cerave Reparadora De Manos 50 Ml,$480
19264,Gel Eucerin Syndet Ph5 400 Ml,$1.257
533433,Crema Eucerin Ph5 Intensiva 450 Ml,$1.947
65729,Gel Fluido La Roche Posay Lipikar 400 Ml,$2.300
11427,Gel Eucerin Ph5 Syndet 250 Ml,$966
54353,Desodorante En Barra Dermur Anhydral 50 G,$707
89498,Loción Cerave Hidratante Corporal 236 Ml,$790
493762,Crema Hidratante Cerave Corporal 473 Ml,$1.250
81818,Crema Dermur Dermo Active Repair 400 Ml,$1.804
51077,Desodorante En Roll On La Roche Posay Physio 50 Ml,$1.150
613953,Crema Cerave Smoothing 340 G,$1.050
44905,Emulsión Dermaglós 400 Ml,$1.836
770027,Bálsamo La Roche Posay Lipikar Ap+m Light 200 Ml,$1.525
21808,Desodorante En Roll On Vichy Piel Sensible 30 Ml,$1.040
89521,Crema Cerave Hidratante 355 Ml,$900
76544,Crema Isispharma Secalia Ultra 200 Ml,$1.855
603598,Emulsión Corporal Regeneracion Intensiva Dermaglós 300 Ml,$1.260
69100,Crema La Roche Posay Cicaplast Manos 50 Ml,$1.100
502996,Loción Eucerin Urea Repair 10% 400 Ml,$2.534
29035,Antitranspirante Stick Biotherm Homme Day Control 50 Ml,$2.200
589925,Hidratante Corporal Avene Trixera Nutrición Leche 400 Ml,$2.296
91050,Loción Eucerin Ph5 Ligera 400 Ml,$2.142
550846,Crema Dermaglós Corporal Hidratante 200 G,$1.009
12478,Leche Corporal La Roche Posay Lipikar 200 Ml,$1.750
54394,Loción Dermur Manzanilla 130 Ml,$945
89499,Crema Cerave Renovadora De Pies88 Ml,$580
51802,Crema Eucerin Ph5 75 G,$1.077
467802,Bálsamo La Roche Posay Lipikar Ap+m 400 Ml,$2.300
612855,Crema Eucerin Ph5 Advanced Repair 450 Ml,$2.238
91518,Crema Bagóvit A Cuidados Cotidianos 350 G,$871
69237,Crema A-derma Control Exomega 400 Ml,$2.518
15357,Loción Lactibón 120 Ml,$829
81795,Crema La Roche Posay Lipikar Syndet Ap+ 200 Ml,$1.050
619878,Spray Corporal Eucerin Aquaphor 150 Ml,$1.232
89518,Loción Hidratante Corporal Cerave Pieles Secas Y Muy Secas 473 Ml,$1.150
33337,Loción Eucerin Ph5 250 Ml,$1.462
602288,Crema De Baño Isispharma Secalia 200 Ml,$1.035
23785,Emulsión Corporal Dermaglós Hidratación Profunda 300 Ml,$1.209
559775,Leche La Roche Posay Lipikar Urea 5% 400 Ml,$2.990
65485,Aceite De Baño A-derma Exomega 200 Ml,$934
818010,Kiehls Men Eye Fuel 15 Ml,$1.450
65571,Crema L'oréal Revitalift Laser X3 Día 50 Ml,$1.849
785295,Crema De Ojos L'oréal Age Perfect Cell Renewal Creme Yeux 15 Ml,$1.299
510428,Sérum Pure Shots Yves Saint Laurent Night Reboot 30 Ml,$4.900
731354,Crema Garnier Express Aclara Media 40 G,$539
596135,Pack L'oréal Revitalift ácido Hialurónico Día 50 Ml + Sérum 30 Ml,$1.889
731454,Crema Garnier Express Aclara Clara 40 G,$539
370420,Sérum Onérique Les Jolies Perles 30 Ml,$4.990
817941,Kiehl's Clearly Corrective Dark Spot Corrector 30 Ml,$3.600
874372,Cofre Biotherm Blue Therapy Blue Pro-retinol Multi-correct,$3.745
874371,Cofre Biotherm Blue Therapy Red,$4.690
874377,Cofre Lancôme Sérum Genifique 50 Ml + Crema Renergie Nuit Multi-lift 15 Ml + Genifique Eye Creme 5 Ml + Genifique Creme 15 Ml,$5.040
874381,Cofre Biotherm Life Plankton,$4.300
874373,Cofre Biotherm Cera Repair,$3.125
874469,Cofre Biotherm Aquasource,$2.675
805470,Crema Hidratante Facial L'oréal Age Perfect Día 50 Ml,$1.269
53685,Gel Matías González Afirmante 220 Ml,$700
88524,Crema Antimanchas Cicatricure 50 G,$1.039
510221,Sérum Pure Shots Yves Saint Laurent Lines Away 30 Ml,$4.900
783794,Crema Cicatricure Anti-edad Tricure 50 G,$966
304621,Cc Cream Payot Filtro N°2 40 Ml,$1.760
269337,Afirmante Corporal Matías González No+ Flacidéz 200 Ml,$1.337
42239,Lifting Natural Matías González Boto Herbal 50 Ml,$1.757
619978,Roller Gym Facial Hortensia Duo Skin,$2.500
465894,Sérum Cosrx Triple Hyaluronic Moisture Ampoule 40 Ml,$2.500
304321,Crema Payot Anti-edad Global Suprúme Jeunesse Día 50 Ml,$5.450
876070,Kiehl's Set Daily Hydrating Duo,$3.190
603596,Crema Facial Cicatricure Age Care Reafirmante 50 Ml,$549
429661,Gel De Ojos Collistar Idro-attiva Eye Hydro-gel Ice 14 Ml,$1.800
430360,Crema Payot Blue Techni Liss Nuit 50 Ml,$3.180
80518,Crema Matías González Caviar Contorno De Ojos 15 Cc,$1.916
303921,Crema Payot Glacée Hydra 24+ 50 Ml,$2.620
401131,Gel Collistar Fango Anticelulítico 400 Ml,$3.350
66064,Crema Biotherm Celluli Eraser 200 Ml,$4.165
301148,Crema Hidratante Yves Saint Laurent Top Secrets Instant Moisture Glow Tr 40 Ml,$3.100
58896,Protector Solar Vichy Capital Soleil Toque Seco Fps50+ 50 Ml,$1.875
346108,Gel Matías González Concentrado Vitamina C 20 Cc,$1.295
510426,Crema Yves Saint Laurent Pure Shot Perfect Plumper 50 Ml,$5.400
817943,Kiehl's Clearly Corrective Dark Spot Corrector 50 Ml,$4.590
272546,Contorno De Ojos Cicatricure Blur & Filler 15 Ml,$904
9535933,Protector Solar Anthelios Mineral One 30 Ml,$1.820
35810,Autobronceante Avene Naranja 100 Ml,$1.605
795936,Sérum Revitalift ácido Hialurónico Eye 20 Ml,$1.399
822302,Protector Solar Vichy Capital Soleil Spray Fps30+ 200 Ml,$950
46269,Protector Solar Eucerin Sun Spray Niños Fps50 200 Ml,$1.850
536833,Protector Solar La Roche Posay Anthelios Mineral One N°3 Tan Fps50 30 Ml,$2.050
603591,Protector Solar La Roche Posay Anthelios Uv Daily Anti-age Con Color Fps50 50 Ml,$2.100
785194,Protector Solar Vichy Capital Soleil Uv Age Teint Light Fps50 40 Ml,$1.875
558578,Protector Solar Eucerin Sun Corporal Loción Toque Seco Fps50 200 Ml,$1.850
35451,Protector Solar Dermaglós Fps30 250 Ml,$851
329678,Protector Solar Umbrella Perfect Skin Tono Oscuro Fps50+ 50 G,$1.975
422354,Protector Solar Isdin Fusion Watercolor Fps50 50 Ml,$2.626
76602,Protector Solar Isispharma Uveblock Fluido Invisible Fps50 40 Ml,$1.425
512124,Protector Solar Isispharma Uveblock Mineral Sin Color Fps50 40 G,$1.535
86708,Crema Isdin Eryfotona Ak-nmsc Fluid Fps99 50 Ml,$3.846
627006,Protector Solar Eucerin Antipigmento Fps50+ 50 Ml,$1.990
13001,Protector Solar Dermaglós Crema Fps65 90 G,$926
46265,Protector Solar Eucerin Sun Facial Piel Seca Y Sensible Fps50 50 Ml,$1.950
67134,Protector Solar Dermur Spray Fps30 180 Ml,$1.234
43620,Protector Solar Dermur Infantil Fps30 150 Ml,$875
620879,Protector Solar La Roche Posay Anthelios Dermo-pediatrics Bruma Invisible Fps50+ 125 Ml,$2.250
54812,Protector Solar Vichy Capital Soleil Toque Seco Fps30 50 Ml,$1.875
812170,Protector Solar La Roche Posayanthelios Uv Mune 400 Fluido 50+ 50 Ml,$2.050
66637,Protector Solar Umbrella Plus Spray Fps50+ 120 G,$1.573
84556,Protector Solar La Roche Posay Anthelios Toque Limpio Color Fps50+ 50 Ml,$2.050
861420,Protector Solar La Roche Posay Rostro Anthelios Ka+ Fps50 50ml,$2.300
91398,Protector Solar La Roche Posay Anthelios Bruma Invisible Fps50+ 75 Ml,$1.680
603612,Protector Solar Vichy Uv Age Fps50 40 Ml,$1.875
825006,Protector Solar Dermaglós Bebés Fps65 120 G,$950
35452,Protector Solar Dermaglós Fps40 250 Ml,$881
795538,Protector Solar La Roche Posay Anthelios Pigment Correct Tono Medio Fps50+ 50 Ml,$2.100
542135,Protector Solar La Roche Posay Anthelios Shaka Spray Fps30 200 Ml,$2.250
54695,Protector Solar Dermur Fps30+ 250 Ml,$1.306
566781,Protector Solar Umbrella Fps50 60 G,$1.010
80573,Protector Solar Vichy Ideal Soleil Facial Anti Manchas Fps50+ 50 Ml,$1.875
822303,Protector Solar Vichy Capital Soleil Kids Water Resistant Spray Fps50+ 200 Ml,$950
726553,Fluido Avene Sport Fps50+ 100 Ml,$1.759
46271,Protector Solar Eucerin Sun Crema Con Color Fps50 50 Ml,$2.060
536433,Protector Solar La Roche Posay Anthelios Mineral One N°4 Brown Fps50 30 Ml,$2.050
285579,Perfume Abercrombie & Fitch First Instinct Men Edt 30 Ml,$1.175
20505,Autobronceante Vichy Idéal Soleil Rostro 100 Ml,$1.900
824507,Perfume Yves Saint Laurent Y Reno Man Edt 40 Ml,$2.536
762412,Set María Riccetto Silky Musk Fragrance Mist 200 Ml + Crema Corporal 200 Ml,$940
50180,Perfume Carolina Herrera 212 Vip Women Edp 50 Ml,$5.090
361715,Perfume Hugo Boss The Scent Absolute For Him Edp 100 Ml,$6.510
689288,Perfume Diesel Sound Of The Brave Men Edt 75 Ml,$5.160
782797,Perfume Paco Rabanne Invictus Edt 200 Ml,$7.395
86920,Perfume Legacy Nº1 Edt 50 Ml + Desodorante En Aerosol 150 Ml,$950
837909,Perfume Casapueblo Flow For Her Edt 100 Ml,$780
505508,Perfume Issey Miyake L'eau D'issey Igo Edt 100 Ml,$7.990
90239,Perfume Brooksfield Natural Edt 50 Ml,$930
835016,Set Paco Rabanne Phantom Man Edt 100 Ml + Desodorante 150 Ml,$5.875
55753,Perfume Antonio Banderas The Golden Secret Men Edt 50 Ml,$1.276
737468,Perfume Valentino Born In Roma Uomo Edt 100 Ml,$5.252
532734,Perfume Adolfo Dominguez Gardenia Musk Edt 120 Ml,$2.510
590324,Perfume Hugo Boss Alive Edp 30 Ml,$3.218
467594,Perfume Cacharel Yes I Am Purple Edp 50 Ml,$4.390
549943,Perfume Quartz Blossom Femme Edp 30 Ml,$999
76704,Perfume Gres Cabotine Edt 100 Ml,$2.490
67632,Perfume Armani Si Edp 30 Ml,$3.792
785596,Cofre Acqua Di Gio Edt 50 Ml + Gel + Crema 75 Ml,$3.672
67826,Colonia Colbert Noir 30 Cc + Desodorante 150 Cc,$976
375923,Perfume Lady Million Empire Edp 50 Ml,$4.476
833307,Perfume Benetton Man We Are Tribeedp 90 Ml,$1.730
467194,Perfume Lancôme La Vie Est Belle New Intensement Edp 30 Ml,$3.084
369020,Perfume Mandarina Duck Let's Travel To París Woman Edt 100 Ml,$1.340
40928,Perfume Paco Rabanne Black Xs Men Edt 50 Ml,$3.880
70979,Perfume Quartz Pour Homme Edt 50 Ml,$1.880
25857,Perfume Cacharel Amor Amor Edt 50 Ml,$3.790
69872,Perfume Real Time Femenina Joyus Edt 100 Ml,$699
592826,Perfume Kenzo Flower By Kenzo Edt 50 Ml,$5.990
325368,Perfume Benetton Together Femenina Edt 80 Ml,$1.575
806865,Perfume Carolina Herrera Good Girl Edp 30 Ml,$3.890
85713,Perfume Paco Rabanne Lady Million Privé Women Edp 50 Ml,$4.335
285576,Perfume Abercrombie & Fitch First Instinct Women Edp 100 Ml,$2.500
89448,Perfume V&l Agua Vitalidad Salvaje N°1 150 Ml,$935
566001,Perfume Desire Beautiful Femme Edt 50 Ml,$824
79412,Perfume Sacre Black Edt 55 Ml,$573
619079,Perfume Armani Terra Di Gioia Femme Edp 30 Ml,$3.064
588224,Perfume Yves Saint Laurent Libre Intense Edp 50 Ml,$5.700
81073,Perfume Carolina Herrera Good Girl Women Edp 80 Ml,$7.299
85713,Perfume Paco Rabanne Lady Million Privé Women Edp 50 Ml,$4.335
25857,Perfume Cacharel Amor Amor Edt 50 Ml,$3.790
737565,Perfume Valentino Born In Roma Yellow Donna Edp 50 Ml,$5.180
652241,Perfume Make It Fun Unusual Femme Edt 45 Ml,$341
42929,Perfume Agatha Ruiz Gotas De Color Edt 50 Ml,$1.065
306932,Perfume Issey Miyake L'eau D'issey Pure Petal Nectar 90 Ml,$8.800
88893,Perfume Cacharel Yes I Am Femme Edp 50 Ml,$4.390
15815,Body Touch Luna 200 Ml,$461
84034,Perfume Yves Saint Laurent Mon París Edp 90 Ml,$6.412
369122,Perfume Agatha Ruiz Wow Girl Edt 50 Ml,$1.065
737770,Perfume Valentino Voce Viva Intense Edp 50 Ml,$5.692
423853,Perfume Nina Rouge Edt 80 Ml,$4.758
767421,Perfume Benetton Sisterland Blue Neroli Edt 80 Ml,$1.730
49592,Perfume Armani Aqcua Di Gioia 100 Ml,$5.548
769527,Pack Perfume Chic Move Edt 55 Ml + Necessaire,$560
59624,Perfume Rue Pergolese Night Edp 50 Ml,$1.700
89507,Perfume Sí Passione Armani Femme Edp 50 Ml,$5.292
55525,Perfume Trésor Midnight Rose Femme Edp 50 Ml,$4.940
806768,Perfume Carolina Herrera Very Good Girl Glam Edp 50 Ml,$6.360
510127,Perfume Yves Saint Laurent Libre Woman Edp 30 Ml,$3.644
556871,Perfume Issey Miyake L'eau D'issey Rose & Rose 90 Ml,$8.930
67633,Perfume Armani Si Edp 50 Ml,$5.292
566312,Perfume Si Passione Intense Femme Edp 50 Ml,$4.167
9538334,Perfume Armani Ocean Di Gioia Edp Femme,$3.064
70751,Perfume Ruepergolese Femme Edp 50 Ml,$1.700
874674,Perfume Carolina Herrera Good Girl Blush Edp 50 Ml,$5.981
835010,Perfume Shakira Dance Midnight Muse Femme Edt 80 Ml,$1.670
250428,Perfume Elizabeth Arden Green Tea Fig Edt 100 Ml,$1.650
72114,Perfume Yves Saint Laurent Black Opium Femme Edp 90 Ml,$6.924
75730,Perfume Paco Rabanne Olympea Women Edp 50 Ml,$4.588
863324,Perfume Valentino Born In Roma Coral Fantasy Donna Edp 50 Ml,$5.180
590529,Perfume Nina Rose Nina Ricci Edt 50 Ml,$4.330
588226,Perfume Yves Saint Laurent Mon París Intensement Edp 50 Ml,$5.424
76726,Perfume Sunflowers Morning Elizabeth Arden Edt 100 Ml,$1.650
295591,Perfume Aqua Di Mare 1 Femme Edt 100 Ml,$480
619076,Perfume Lancôme Idole Aura Femme Edp 25 Ml,$2.636
87539,Perfume Carolina Herrera 212 Vip Men Black Edt 100 Ml,$5.925
296318,Perfume Benetton Rose Femme Edt 50 Ml,$1.180
81070,Perfume Shakira Dance Women Edt 80 Ml,$1.670
90240,Perfume Urban Care Pack Unlimited Deep Blue Edt 75 Ml + Desodorante 150 Ml,$654
782168,Perfume Armani Aqua Di Gio Refillable Edp 125 Ml,$6.160
785596,Cofre Acqua Di Gio Edt 50 Ml + Gel + Crema 75 Ml,$3.672
651940,Perfume María Riccetto Summer Edt 50 Ml,$930
46191,Perfume Carolina Herrera 212 Sexy Man Edt 30 Ml,$2.780
46675,Perfume Antonio Banderas Seduction In Black Men Edt 50 Ml,$1.215
603792,Perfume Desire Grey For Men Edt 50 Ml + Desodorante En Aerosol 150 Ml,$934
605600,Perfume Yves Saint Laurent Y Eau Fraiche Man Edt 100 Ml,$5.252
557287,Perfume Polo Red Man Edp 125 Ml,$5.208
89485,Perfume V&l Agua Frescor Extremo N°2 150 Ml,$935
23511,Perfume Azzaro Pour Homme Edt 100 Ml,$5.710
633413,Perfume Dior Sauvage Elixir 60 Ml,$9.400
309633,Perfume Hugo Boss Bottled Infinite Man Edp 100 Ml,$6.360
66892,Perfume Paco Rabanne Invictus Men Edt 50 Ml,$3.975
377521,Perfume Carolina Herrera Bad Boy Edt 100 Ml,$5.934
76058,Perfume Dior Sauvageman Edt 60 Ml,$5.240
87519,Set Perfume Casapueblo 24hrs Charm Edt 100 Ml + Gel De Ducha 100 Ml,$758
285780,Perfume Hollister Fest Vibes For Him Edt 30 Ml,$550
88421,Perfume Azzaro Wanted Man Edt 100 Ml,$5.860
81503,Perfume Play Intense Man Edt 50 Ml,$532
605012,Perfume Dieselspirit Of The Brave Man Edt 50 Ml,$4.390
90224,Perfume Benetton Colors Man Green Edt 60 Ml,$1.065
673478,Perfume Paco Rabanne Phantom Man Edt 50 Ml,$4.310
783293,Perfume V&l N°7 Frescor Mediterráneo Men Edt 150 Ml,$935
23336,Perfume Ralph Lauren Polo Blue Edt 75 Ml,$3.497
40055,Perfume Desire Black For Men Edt 50 Ml + Desodorante Edt 50 Ml,$934
71212,Perfume Antonio Banderas King Of Seduction Men Edt 50 Ml,$1.276
75728,Perfume Carolina Herrera Ch Men Prive Edt 100 Ml,$5.400
64747,Perfume Ulric De Varens For Men Edt 100 Ml,$1.700
81500,Perfume Legacy 3 Black Man Edt 50 Ml,$890
503195,Perfume Casapueblo Vip Blue Man Edt 100 Ml,$893
566992,Perfume Paco Rabanne One Million Man Edp 50 Ml,$4.478
90221,Perfume Benetton Colors Man Green Edt 100 Ml,$1.575
22070,Perfume Calvin Klein One Edt 200 Ml,$3.938
85071,Perfume Columbia Galaxy Edt 75 Ml,$547
619382,Perfume Calvin Klein Defy Man Edt 100 Ml,$5.920
87381,Perfume Colbert Collection Spirit Edt 30 Ml,$599
656154,Perfume Kenzo Homme Intense Edt 60 Ml,$5.990
737765,Perfume Valentino Born In Roma Uomo Edt 50 Ml,$3.956
824406,Perfume Valentino Uomo Born In Roma Yellow Man Edt 50 Ml,$3.956
58864,Gel De Limpieza Biotherm Homme T-pur Anti Oil & Wet Nettoyant 125 Ml,$1.600
66457,Contorno De Ojos Biotherm Blue Therapy 15ml,$3.355
79588,Agua Micellar Biotherm Biosource 200 Ml,$1.810
67776,Gel Secante Asepxia Emergencia Transparente 28 G,$342
79589,Tónico Biotherm Biosource Lotion Adoucissante Piel Sensible 200 Ml,$1.815
79590,Tónico Biotherm Biosource Lotion Tonifiante Piel Normal A Mixta 200 Ml,$1.815
68791,Crema Biotherm Blue Therapy Nuit Spb 50 Ml,$5.210
71849,Tratamiento Biotherm Bálsamo Labial Hidratante 13 Ml,$990
72070,Sérum Hidratante Biotherm Life Plankton Essence 125 Ml,$3.500
72621,Gel Exfoliante Biotherm Source Nettotant 150 Ml,$1.815
72074,Crema Biotherm Homme Total Recharge Ojos 15 Ml,$2.000
778454,Gel Hidratante Biotherm Aquasource Hyalurónico Plump 50 Ml,$2.675
501794,Jabón Líquido Facial Asepxia Carbón 200 Ml,$333
501694,Gel Exfoliante Asepxia Con Carbón 120 G,$415
731454,Crema Garnier Express Aclara Clara 40 G,$539
731354,Crema Garnier Express Aclara Media 40 G,$539
778455,Crema Biotherm Aquasource Cica Nutri 50 Ml,$2.675
501895,Mascarilla Asepxia Carbón Peel Off 30 G,$363
615057,Sérum Payot Roselift Collagene Concentre 30 Ml,$4.290
619073,Crema Biotherm Cera Repair 50 Ml,$3.125
537233,Bálsamo Biotherm Life Plankton Sensitive Balm 50 Ml,$3.200
619072,Máscara Biotherm Life Plankton 75 Ml,$3.970
89884,Mascarilla Labios Hortensia Pink Mask 20 Unidades,$1.850
749799,Gel Asepxia Gen Hidratante Matificante 50 G,$479
749900,Gel Asepxia Gen Limpiador Micelar 200 Ml,$399
751404,Toallitas Desmaquillantes Nivea Rose Care 25 Unidades,$336
750299,Gel Asepxia Gen Limpiador Micelar 200 Ml,$399
588118,Crema Biotherm Blue Therapy Red Algae 50 Ml,$4.690
578986,Toallitas Desmaquillantes Purederm Veganas Biodegradables 30 Unidades,$315
593527,Pack Jabón En Barra Asepxia Exfoliante 2 Unidades,$121
588119,Crema Biotherm Blue Therapy Red Algae Nuit 50 Ml,$4.960
667968,Pack Crema Cicatricure Antiedad 60 G + Contorno 15 G + Beauty50 G,$931
90039,Contorno De Ojos Hidrisage Yeux 20 G,$2.186
89658,Mascarilla Hortensia De Manos Violeta 1 Par,$186
89499,Crema Cerave Renovadora De Pies88 Ml,$580
73084,Crema Hidratante Biotherm Acquasource Night Bath 50 Ml,$3.460
83936,Crema Biotherm Blue Therapy Multi-defender Piel Normal A Mixta Fps25 50 Ml,$4.690
83934,Crema Biotherm Blue Therapy Cream-in-oil 50 Ml,$3.188
818010,Kiehls Men Eye Fuel 15 Ml,$1.450
73845,Crema Facial Hidrisage Resverax Anti-age 30 G,$2.728
73083,Crema Hidratante Biotherm Acquasource Fresh Eyes 15 Ml,$2.500
67776,Gel Secante Asepxia Emergencia Transparente 28 G,$342
74321,Hidratante Facial Biotherm Skin Best Liquid Glow 30 Ml,$3.400
501794,Jabón Líquido Facial Asepxia Carbón 200 Ml,$333
501694,Gel Exfoliante Asepxia Con Carbón 120 G,$415
501895,Mascarilla Asepxia Carbón Peel Off 30 G,$363
818011,Kiehls Men Facial Fuel Eye De-puffer 5 G,$2.170
759510,Séruml'oréal Age Perfect Skin Midnight 30 Ml,$1.699
731354,Crema Garnier Express Aclara Media 40 G,$539
818019,Kiehls Men Oil Elim 24h No Shin Gel 75 Ml,$1.680
731454,Crema Garnier Express Aclara Clara 40 G,$539
89884,Mascarilla Labios Hortensia Pink Mask 20 Unidades,$1.850
749799,Gel Asepxia Gen Hidratante Matificante 50 G,$479
771830,Mascarilla En Crema Facial Iroha Nature Confidence 1 Unidad,$336
749900,Gel Asepxia Gen Limpiador Micelar 200 Ml,$399
54355,Crema Dermur Azuleno 60 Ml,$941
750299,Gel Asepxia Gen Limpiador Micelar 200 Ml,$399
593527,Pack Jabón En Barra Asepxia Exfoliante 2 Unidades,$121
556872,Gel Hidratante Pond's Fruity Naranja 110 G,$279
556974,Limpiador Facial Pond's Fruity Naranja 200 Ml,$392
818015,Kiehl's Men Age Defender Eye Repair 14 Ml,$2.040
655750,Sérum Cicatricure Vitamina C 30 Ml,$1.099
693603,Máscara Hortensia V-line Lifting De Silicona 1 Unidad,$599
370420,Sérum Onérique Les Jolies Perles 30 Ml,$4.990
691497,Sérum Purederm Hyaluronic Acid 60 Ml,$973
693801,Máscaras Hortensia Comprimidas 100 Unidades,$699
675977,Bruma Nivea Rose Care 150 Ml,$597
676577,Gel De Día Nivea Rose Care 50 Ml,$778
77609,Bandas Purederm Para Puntos Negros 6 Unidades,$535
83995,Loción Pamela Grant Ultra Skin Clean Bifásico 100 Ml,$242
366616,Cofre Crema L'oréal Revitalift ácido Hialurónico Día 50 Ml + Noche 50 Ml,$1.729
831407,Pack L'oréal Age Perfect Colágeno Día 70 Ml + Noche 70 Ml,$1.328
426263,Jabón En Barra Asepxia Bicarbonato 100 G,$182
817969,Kiehls Midnight Recovery Concentrat 50ml,$4.900
797537,Máscara Purederm Real Petal Mg: Gel Lavanda 1 Unidad,$273
797538,Máscara Purederm Vegan Hojas De Té 1 Unidad,$285
874168,Sérum L'oréal Revitalift Ojos 20 Ml + Crema De Día 50 Ml,$1.889
845610,Bálsamo La Roche Posay Lipikar Eco 200 Ml,$1.525
797637,Máscara Purederm Para Ojeras Ilumindora 30 Unidades,$273
274452,Hidratante La Roche Posay Toleriane Sensitive Riche 40 Ml,$2.870
510424,Labial Yves Saint Laurent Rouge Pur Couture The Slim N°11,$2.485
536635,Ampollas Isdin Instant Flash Efecto Lifting 5 Unidades,$2.975
77511,Crema Isispharma Secalia A.h.a 200 Ml,$1.855
619778,Sérum La Roche Posay Effaclar Duo (+) 30 Ml,$2.900
90171,Crema Dermur Novaskin Renew 60 Ml,$2.106
89037,Gel La Roche Posay Cicaplast B5 40 Ml,$1.240
86385,Crema Avene Physiolift 30 Ml,$3.258
817999,Kiehl's Lip Balm N°1 15 Ml,$700
324667,Contorno De Labios Dermur Effective No-code 15 Ml,$1.575
16974,Crema Dermur Effective Párpados 20 Ml,$1.575
60515,Crema Avene Antirojeces Forte 30 Ml,$2.014
57138,Crema La Roche Posay Redermic R 30 Ml,$4.625
801566,Gel Para Cuello Y Escote Fillerina 12 Grado 5 30 Ml,$7.800
88850,Gel Isispharma Teen Derm Alpha Pure 30 Ml,$1.755
801862,Gel Para Labios Fillerina 12 Grado 3 15 Ml,$3.900
70305,Crema Pigmentclar Soin Joun Fps30 40 Ml,$3.780
817958,Kiehl's Super Multi-corrective Anti-aging Cream 50 Ml,$3.900
82667,Crema Isispharma Ruboril Expert M 40 Ml,$2.100
878278,Crema Contorno De Ojos Dermaglós Volumen + Estructura 15 G,$1.650
817987,Kiehl's Cranberry Seed Masque 100 G,$3.350
45657,Crema Dermur Vitia 30 Ml,$1.359
834808,Máscara Dermur Carbón Peelderm 30 G,$610
91612,Concentrado Isispharma Geneskin C Premium 10 Ml,$3.355
306926,Desmaquillante Isispharma Sensylia Gelee 200 Ml,$1.720
537633,Crema Avene Dermabsolu Color 40 Ml,$3.747
422753,Sérum Anti-edad Isdin Flavo-c Melatonin 10 Ampollas,$3.647
11485,Agua Termal Avene 150 Ml,$1.114
38243,Crema Eucerin Hyaluron Filler Día 50 Ml,$3.436
801563,Crema De Día Fillerina 12 Grado 3 50 Ml,$4.500
54373,Crema Dermur Ea 55 Ml,$643
760811,Aqua Gel La Roche Posey Hyalu B5 Fps30 50 Ml,$4.300
801763,Crema De Noche Fillerina 12 Grado 5 50 Ml,$6.200
60425,Crema La Roche Posay Redermic Hyaluron C Piel Sensible 40 Ml,$4.725
69238,Contorno De Ojos Avene Calmante 10 Ml,$1.388
818011,Kiehls Men Facial Fuel Eye De-puffer 5 G,$2.170
818019,Kiehls Men Oil Elim 24h No Shin Gel 75 Ml,$1.680
76543,Crema Isispharma Neotone Radiance Fps50 30 Ml,$2.805
817954,Kiehl's Ultra Facial Moisturizer Fps30 125 Ml,$4.200
818015,Kiehl's Men Age Defender Eye Repair 14 Ml,$2.040
817984,Kiehl's Avocado Nourishing Hyration Mask 100 G,$3.440
82199,Fluido Hidratante Dermur Renacer 60 Ml,$846
66457,Contorno De Ojos Biotherm Blue Therapy 15ml,$3.355
87534,Crema Dermur Dermadn 60 Ml,$2.228
832107,Sérum Eucerin Dermopure Triple Efecto 40 Ml,$2.142
68791,Crema Biotherm Blue Therapy Nuit Spb 50 Ml,$5.210
72070,Sérum Hidratante Biotherm Life Plankton Essence 125 Ml,$3.500
71849,Tratamiento Biotherm Bálsamo Labial Hidratante 13 Ml,$990
72074,Crema Biotherm Homme Total Recharge Ojos 15 Ml,$2.000
778454,Gel Hidratante Biotherm Aquasource Hyalurónico Plump 50 Ml,$2.675
778455,Crema Biotherm Aquasource Cica Nutri 50 Ml,$2.675
818009,Kiehl's Men Facial Fuel Moisturizer Treatment 75 Ml,$1.680
783794,Crema Cicatricure Anti-edad Tricure 50 G,$966
619073,Crema Biotherm Cera Repair 50 Ml,$3.125
619072,Máscara Biotherm Life Plankton 75 Ml,$3.970
818013,Kiehl's Age Defender Cream Moisturizer 50 Ml,$3.000
537233,Bálsamo Biotherm Life Plankton Sensitive Balm 50 Ml,$3.200
749799,Gel Asepxia Gen Hidratante Matificante 50 G,$479
818016,Kiehl's Age Defender Power Sérum For Men 75 Ml,$2.840
588118,Crema Biotherm Blue Therapy Red Algae 50 Ml,$4.690
588119,Crema Biotherm Blue Therapy Red Algae Nuit 50 Ml,$4.960
90039,Contorno De Ojos Hidrisage Yeux 20 G,$2.186
667968,Pack Crema Cicatricure Antiedad 60 G + Contorno 15 G + Beauty50 G,$931
65810,Bb Cream Biotherm Source Peau Fonce 30 Ml,$2.310
83936,Crema Biotherm Blue Therapy Multi-defender Piel Normal A Mixta Fps25 50 Ml,$4.690
83934,Crema Biotherm Blue Therapy Cream-in-oil 50 Ml,$3.188
73083,Crema Hidratante Biotherm Acquasource Fresh Eyes 15 Ml,$2.500
615059,Crema Payot Roselift Collagene Nuit 50 Ml,$4.290
73084,Crema Hidratante Biotherm Acquasource Night Bath 50 Ml,$3.460
73845,Crema Facial Hidrisage Resverax Anti-age 30 G,$2.728
74321,Hidratante Facial Biotherm Skin Best Liquid Glow 30 Ml,$3.400
612946,Base Cicatricure Gold Bronce 30 Ml,$515
612949,Base Cicatricure Gold Medium 30 Ml,$1.030
612948,Base Cicatricure Gold Light 30 Ml,$1.030
77343,Sérum Fluido Biotherm Blue Therapy Reno 50 Ml,$5.565
