sku,name,price
68514,Shampoo Pantene Hidrataciónextrema 700 Ml,$529
525531,Shampoo Sri Sri Ayurvédico Proteico 200 Ml,$489
784297,Shampoo Wella Motion Protect Color 250 Ml,$1.231
88834,Pack Fructis Liso Shampoo 350 Ml + Acondicionador 200 Ml,$332
835908,Shampoo Pantene Nutrient Blends Volumen 270 Ml,$579
818035,Kiehl's Rice And Wheat Voluminizing Shampoo 250 Ml,$1.290
380422,Shampoo Tío Nacho Aclarante 415 Ml + Acondicionador 415 Ml,$622
859317,Shampoo Nioxin Cleanser N°3 300 Ml,$1.249
500696,Shampoo Batiste Seco Original 200 Ml,$665
46549,Shampoo Pantene Liso Extremo 400 Ml + Acondicionador 200 Ml,$379
581106,Shampoo Pantene Bambú 200 Ml,$277
58482,Shampoo Primicia + Bálsamo Tratante 250 Cc,$435
651237,Shampoo Fructis Recarga Nutritiva 350 Ml + Acondicionador 200 Ml,$345
68419,Shampoo Capilatis Keratina 350 Ml,$390
83856,Shampoo Anti-edad Tío Nacho 415 Ml,$332
70907,Shampoo Elvive óleo Extraordinario Nutrición Profunda 370 Ml,$454
784105,Shampoo Sebastian Trilliance 250 Ml,$1.650
733356,Shampoo Redken Reparación Total Extreme 300 Ml,$1.500
780258,Shampoo L'oréal Professionnel Metal Detox 300 Ml,$1.330
87364,Shampoo Seco Batiste Tropical 200 Ml,$665
520427,Acondicionador Head & Shoulders Manzana Fresh 300 Ml,$395
90985,Acondicionador Dove Super Factor Nutrición 60 Minutos 170 Ml,$204
279665,Acondicionador Herbal Essences Coconut Milk 400 Ml,$464
734057,Acondicionador Biolage Hydrasource 280 Ml,$901
511022,Acondicionador Fructis Hair Food Aloe 300 Ml,$309
74401,Acondicionador L'oréal Professionnel Absolut Repair 200 Ml,$969
89840,Acondicionador Fructis Oil Repair Liso Coco 200 Ml,$150
846125,Acondicionador Ogx Leche De Coco 385 Ml,$665
42027,Bálsamo Biferdil Phytoplus Lino 200 Ml,$336
74446,Acondicionador L'oréal Professionnel Vitamino 200 Ml,$1.140
316252,Acondicionador L'oréal Professionnel Silver 200 Ml,$1.140
754408,Acondicioador Dove Hidraliso 400 Ml,$415
808869,Acondicionador Pantene Colágeno 510 Ml,$489
606804,Acondicionador Fructis Hair Food Sandia 300 Ml,$309
793124,Acondicionador Veganis Nutri Boost Sublim 400 Ml,$740
600666,Acondicionador Head & Shoulders Fuerza De Raíz 300 Ml,$395
70910,Acondicionador Elvive óleo Extraordinario Nutrición 370 Ml,$454
37784,Acondicionador Pantene Brillo Extremo 750 Ml,$489
58180,Bálsamo Primicia Tratante 250 Ml,$236
846036,Acondicionador Ogx Biotina & Colágeno 385 Ml,$665
278362,Bálsamo Klorane Quinina 200 Ml,$848
83857,Acondionador Engrosador Tío Nacho 415 Ml,$332
509021,Acondicionador Love Beauty & Planet Manteca Muru Muru Y Rosas 300 Ml,$139
835708,Acondicionador Pantene Nutrient Blends Frizz Control 235 Ml,$579
28482,Acondicionador Pantene Liso Extremo 750 Ml,$489
50911,Acondicionador Dove Reconstruccion Completa 400 Ml,$311
805977,Acondicionador Ilicit Pepino Y Jengibre Kera-v Detox 350 Ml,$285
784197,Acondicionador Wella Oil Reflection 200 Ml,$1.231
83509,Acondicionador Tío Nacho Herbal 415 Ml,$332
503002,acondicionador Tío Nacho Aloe Vera 415 Ml,$332
68516,Acondicionador Pantene Hidratación Extrema 400 Ml,$386
784098,Acondicionador Sebastian Penetraitt 250 Ml,$1.713
826512,Acondicionador Tresemmé Para Ondas Boho 500 Ml,$389
28314,Acondicionador Pantene Rizos Definidos 400 Ml,$386
81729,Acondicionador Pantene 3mm Rizos Definidos 170 Ml,$345
859119,Acondicionador Nioxin Revilatizing N°6 300 Ml,$1.456
803862,Acondicionador Dove Poder De Las Plantas Fuerza + Bambú 300 Ml,$391
86473,Bálsamo Klorane Lino 200 Ml,$848
294385,Acondicionador Elvive Dream Long 370 Ml,$454
45214,Jabón En Barra J&j Dulces Sueños 80 G,$73
782711,Shower Gel Disney Spiderman 280 Ml,$185
45211,Shampoo J&j Hidrataciónintensa 200 Ml,$244
90487,Acondicionador J&j Fuerza Y Vitamina 200 Ml,$244
460086,Acondicionador Elvive Dream Long Liss 200 Ml,$280
71827,Jabón Líquido Simond's De Afrecho 1 L,$686
14090,Aceite De Bebé Simond's 25 Ml,$304
24534,Shampoo J&j Clásico 400 Ml,$388
6355,Shampoo J&j Baby Manzanilla 200 Ml,$244
67658,Shampoo Elvive Kids Fresa 265 Ml,$336
14082,Jabón Líquido Simond's Neutro 340 Ml,$416
31570,Talco J&j Clásico 200 G,$327
38928,Desodorante En Aerosol Mujercitas 123 Ml,$262
59155,Shampoo Suave Kids 2 En 1 350 Ml,$235
318669,Fécula J&j 200 G,$364
63553,Acondicionador Simond's Manzanilla 610 Ml,$523
318458,Acondicionador J&j Manzanilla 200 Ml,$244
14079,Shampoo Simond's Manzanilla 410 Ml,$428
30206,Acondicionador J&j Clásico 400 Ml,$388
91648,Loción Antimosquitos J&j 200 Ml,$451
80978,Jabón Líquido Dove Baby Humectación Enriquecida 200 Ml,$369
59152,Shampoo Suave Kids Frutilla 350 Ml,$235
41056,Aceite Simond's Emulsionado 360 Ml,$441
67660,Shampoo Elvive Kids Naranja Mango 265 Ml,$336
27810,Shampoo J&j Clásico 750 Ml,$737
75782,Spray J&j Gotas De Brillo 200 Ml,$317
24706,Shampoo J&j Manzanilla 400 Ml,$388
90982,Acondicionador Dove Baby Humectación Enriquecida 200 Ml,$285
523228,Gel De Ducha Hello Kitty Fun 280 Ml,$209
19477,Baño Líquido J&j Dulces Sueños 200 Ml,$322
14084,Talco De Bebé Simond'sclásico Talquera Recargable 100 G,$241
419253,Desodorante Mujercitas Sophie 123 Ml,$262
64944,Desodorante En Aerosol Paco 150 Ml,$278
90485,Shampoo J&j Fuerza Y Vitamina 200 Ml,$244
84694,Baño Líquido J&j Dulces Sueños 400 Ml,$489
14080,Acondicionador Simond's Neutro Baby 360 Ml,$428
318470,Jabón De Baño Líquido J&j Recién Nacido 200 Ml,$322
30843,Shampoo J&j Clásico 200 Ml,$244
60357,Acondicionador J&j Fragancia Prolongada 200 Ml,$244
800663,Ampolla Crescina Tratamiento Completo Dama 1300 20 Unidades,$11.900
80979,Jabón Líquido Dove Baby Humectacion Enriquecida 180 Ml,$266
780960,Sérum Fructis Stop Caída 30 Ml,$645
74449,Máscara L'oréal Professionnel Vitamino 250 Ml,$1.480
309737,Talquera Bebé & Co 160 G,$219
36464,Gel Fijador Fix Lavanda 120 G,$81
59590,Gel Fijador Fixed Azul 250 G,$117
51926,Ampolla Mediplus Nutritiva Cereales 1 Unidad,$173
846041,Sérum Ogx Anti-quiebre Leche De Coco 118 Ml,$732
316752,Pasta Modeladora L'oréal Professionnel Tecni Art Depolish 100 Ml,$499
552871,Cápsulas Elvive Reparación Total 5 3 Unidades,$488
600366,Suplemento Ducray Anacaps Activ+ 30 Cápsulas,$2.110
780367,Máscara L'oréal Professionnel Metal Detox 250 Ml,$1.700
460088,Crema Para Peinar Elvive Dream Long Liss 300 Ml,$453
800659,Ampolla Crescina Transdérmica Dama 500 20 Unidades,$9.400
689895,Crema Para Peinar Fructis 10 En 1 Rizos Poderos 300 Ml,$332
49207,Tratamiento Fixed Reparador De Puntas 60 Ml,$290
34556,Fijador Roby Normal 180 Ml,$279
47719,Fijador Primicia En Spray 20 Ml,$86
839909,Mascarilla De Tratamiento Pantene Pro-v Miracles Nutre Renueva Y Sella Puntas 300 Ml,$339
803963,Máscara De Tratamiento Dove Poder De Las Plantas Nutrición + Geranio 190 Ml,$248
831612,Tratamiento Nocturno Elvive Hidra Rellenador Con ácido Hialurónico 200 Ml,$360
88400,Fijador Elnett Laque Normal 200 Ml,$532
68447,Gel Studio Line Mega 200 Ml,$397
583400,Máscara De Keratina Ilicit Coco 350 Ml,$449
310945,Tratamiento Capilatis Orgánico 170 G,$476
793924,Aceite De Tratamiento Motas Uy 50 Ml,$714
30454,Decolorante Issue 20 G,$147
47717,Tratamiento Revitalizador Capilar Primicia 18 Ml,$78
57241,Fijador Roby Fuerte 180 Ml,$279
858221,Tratamiento Para El Cabello Issue Brillo Extremo 150 G,$186
238319,Desenredante Primicia En Spray 120 Ml,$256
401933,Máscara Dove 1 Minuto Factor De Nutrición 60+ 300 G,$264
76855,Fijador Primicia Fuerte 470 Ml,$385
826906,Máscara De Tratamiento Tresemmé Reparación Intra Capilar 300 Ml,$285
784111,Máscara Wella Tratamiento Wellaplex Paso 3 100 Ml,$1.663
768927,Botox Capilar Ilicit Cicamask 350 Ml,$390
631309,Tratamiento Bealm Post Lavado Recuperación Instantánea 250 Ml,$305
30152,Tratamiento Pantene Hidro Intensiva Rizos Definidos 300 Ml,$339
509018,Máscara Reparadora Lovebeauty And Planet Argán Y Lavanda 190 G,$118
56340,Crema Para Peinar Biferdil Ultra Brillo 270 G,$374
42436,Mascarilla De Tratamiento Pantene Pro-v Miracles Repara Protege Y Anti Frizz 300 Ml,$339
30454,Decolorante Issue 20 G,$147
18008,Tinta Soft Color N°80 Rubio Claro,$489
455877,Kit Tinta Issue Sin Amoníaco N°10.1 Rubio Extra Claro Ceniza,$221
18640,Tinta Garnier Nutrisse N°91 Jazmín,$419
22616,Kit Tinta Koleston N°30 Castaño Oscuro,$545
567900,Tinta Excellence Matizador Supreme N°8.12rubio Claro Cenizo/perla,$675
61793,Tinta Koleston Single N°80 Rubio Claro,$225
25963,Tinta Excellence Creme L'oréal N°9.1 Rubio Muy Claro Ceniza,$675
601899,Retocador De Raíz Garnier Nutrisse N°40 Colorante 20 G + Revelador 20 Ml,$109
44898,Tinta Excellence Creme N°6.7 Chocolate Puro,$675
805978,Kit Tinta Koleston N°415 Castaño Impulso,$545
869251,Tinta Excellene N°7 Rubio + Shampoo Colorvive 200 Ml,$699
12502,Henna Cleahenn Dorado 50 G,$397
60025,Tinta Garnier Nutrisse Cor Intensa N°4.15 Castaño Ceniza Caoba,$294
65352,Tinta Casting Creme Gloss N°503 Golden Chocolate,$598
74368,Oxidante Calypso Cremoso 40 Volúmenes 100 Ml,$84
43244,Henna Surya Castaño Oscuro 70 Ml,$891
18007,Tinta Soft Color N°70 Rubio Natural,$489
455578,Kit Tinta Issue Sin Amoníaco N°5 Castaño Claro,$221
18657,Tinta Garnier Nutrisse N°10 Ebano,$419
25958,Tinta Excellence Creme L'oréal N°5.1 Castaño Claro Ceniza,$675
22638,Kit Tinta Koleston N°80 Rubio Claro,$545
567793,Tinta Excellence Matizador Supreme N°6.12 Rubio Oscuro Cenizo Perla,$675
601895,Retocador De Raíz Garnier Nutrisse N°10 Colorante 20 G + Revelador 20 Ml,$109
28261,Tinta Koleston Single N°466 Borgoña Intenso,$225
765521,Tinta Soft Color N°535 Castaño Arábica,$489
61790,Tinta Koleston Single N°50 Castaño Claro,$225
869248,Tinta Excellene N°4 Castaño + Shampoo Colorvive 200 Ml,$699
44363,Tinta Casting Creme Gloss N°535 Chocolate,$598
85235,Tinta Garnier Nutrisse Coloríssimo N°4462 Rojo Carmín,$419
79516,Kit Tinta Issue Keratin Color N°7.64 Rubio Rojizo Cobrizo,$198
18004,Tinta Soft Color N°40 Castaño Mediano,$489
64947,Tinta Excellence Creme N°7.3 Rubio Dorado,$675
60022,Tinta Garnier Nutrisse Cor Intensa N°3.0 Castaño Oscuro,$294
435666,Tinta Issue Crazy Color Amarillo 47 G,$174
56541,Termómetro Nuk De Agua Gris,$495
56179,Aspirador Nasal True Silicona,$385
51968,Set True Tijera Corta Uñas Y Lima,$354
447779,Set Rabbit De Corta Uñas Y Tijera De Bebé,$225
781169,Pelela Mickey 900 Ml,$378
18654,Tinta Garnier Nutrisse N°50 Castaña,$419
603506,Pelela Carestino Entrenamiento 3 En 1 Con Reductor Azul,$2.639
557276,Termómetro Para El Agua Akas Animalitos,$243
647842,Set De Manicure Suavinex Hygge Verde,$1.886
580496,Corta Uñas Rabbit De Bebé Diferentes Colores,$169
77533,Toallón Akas Pilim Estampado Con Capucha,$1.062
25955,Tinta Excellence Creme L'oréal N°7 Rubio,$675
22634,Kit Tinta Koleston N°70 Rubio Mediano,$545
648244,Set De Manicure Suavinex Hygge Rosa,$1.886
77534,Toalla Akas Broderie Con Capucha,$1.062
78360,Aspirador Nasal Narizita,$325
330979,Aspirador Nasal Asistido De Vidrio,$250
765420,Tinta Soft Color N°10 Negro Expreso,$489
372520,Aspirador Nasal Nosefrida A Succión,$432
86670,Pelela Oso Adoleta Con Orinal Removible,$396
799863,Termómetro De Agua Nuk Rosado,$495
41799,Tinta Casting Creme Gloss N°600 Rubio Oscuro,$598
799864,Termómetro De Agua Nuk Azul,$495
734960,Bañito Onna Luxe Gris,$1.520
851314,Gorra De Ducha Rabbit Con Visera,$199
735158,Bañito Onna Luxe Celeste,$1.520
734961,Bañito Onna Vasco Kit Gris,$6.960
735257,Bañito Onna Luxe Rosado,$1.520
735057,Silla De Baño Onna Aquababy Rosa,$1.560
735059,Bañito Onna Vasco Kit Rosado,$6.960
735258,Onna Bañito Vasco Kit Blanco,$6.960
735357,Bañito Onna Vasco Kit Celeste,$6.960
735157,Bañito Onna Luxe Blanco,$1.520
662764,Set Rabbit De Cepillo Y Peine Rosado,$189
447472,Set Rabbit De Peine Cepillo Tijera Y Corta Uñas,$340
30873,Cortauñas Para Bebé Nail Mate,$111
30874,Set Para Bebé Nail Mate Lima + Corta Uñas,$175
640530,Set Rabbit Cepillo Y Peine Celeste,$189
448287,Set Rabbit De Cortauñas + Tijera + Lima De Bebé,$269
73129,Set De Uñas Bebé Nail Mate 3 Piezas,$300
51964,Set Accesorios Para Bebé True 7 Piezas,$1.467
689895,Crema Para Peinar Fructis 10 En 1 Rizos Poderos 300 Ml,$332
825517,Colchóneta Farma Fitness De Yoga Rosa 4 Mm,$929
56178,Set Peine Y Cepillo True Decorado,$462
603496,Bañito Plegable Carestino Con Soporte Celeste,$3.629
603530,Pelela Carestino Entrenamiento 3 En 1 Con Reductor Verde,$2.639
43255,Henna Surya Cobre 70 Ml,$891
576071,Toalla De Bebé Puravida Con Capucha,$375
783895,Acondicionador Sebastian Hydre 250 Ml,$1.616
72712,Desodorante En Aerosol Axe Black 150 G,$181
60033,Tinta Garnier Nutrisse Cor Intensa N°7.0 Rubio,$294
350013,Desodorante En Roll On Bi-o Mujer Clinical 50 Ml,$229
850212,Crema Goicochea Diabet Tx Urea Y Caléndula 200 Ml,$311
802967,Acondicionador Dove Poder De Las Plantas Nutrición + Geranio 300 Ml,$391
49761,Decolorante Issue Hiervas 30 G,$175
41353,Gel Lactovit De Ducha 600 Ml,$326
78340,Enjuague Bucal Perio-aid Active Control 500 Ml,$948
314748,Shampoo Pantene Miracle Fuerza Y Reconstrucción 270 Ml,$422
586850,Set Cremas De Manos Baylis & Harding Jojoba 50 Ml 3 Unidades,$743
295102,Enjuague Bucal Colgate Total 12 Clean Mint 250 Ml,$246
821204,Tinta Crazy Colors Gris 47 G,$189
565996,Crema Barber Shop De Afeitar 150 G,$395
37784,Acondicionador Pantene Brillo Extremo 750 Ml,$489
67721,Toallitas Femeninas Ladysoft Ultra Delgada 8 Unidades 4 Paquetes,$228
35475,Brocha De Afeitar Jer-emi 623,$153
491758,Evolution Pelota Pilates 85 Cm + Inflador,$1.560
569325,Gomitas De Pelo De Rulo Top Negras 3 Unidades,$139
68272,Crema De Tratamiento Elvive Reparación Total 5 Extreme 300 G,$457
50859,Crema Para Peinar Xanasecto 100 Ml,$118
846312,Muñequeras Dojo Rojas,$690
580494,Broches Con Moños Top Diferentes Colores,$139
796237,Bombacha Menstrual Pink Lady Bikini Temis Talle Xl,$1.549
16831,Pasta De Dientes Colgate Junior Barbie 100 G,$202
601897,Retocador De Raíz Garnier Nutrisse N°30 Colorante 20 G + Revelador 20 Ml,$109
73435,Enjuague Bucal Oral B 3d White 473 Ml,$506
27641,Esponja De Baño Bettanin Slow,$52
501795,Desodorante En Aerosol Lady Speed Stick 0% Aluminio Coco 91 G,$195
60012,Apósitos Readysec Grande 15 Unidades,$496
867839,Booster Swiss Armor 3 En 1,$4.080
262333,Antitranspirante En Aerosol Dove Granada 150 Ml,$179
830711,Capazo Dual Bebedue Evo Dark Grey,$2.040
830908,Coche Gemelar Bebedue Evo 0+ Dark Grey,$15.640
84381,Shampoo Ever Cream Deep Nourish 250 Ml,$475
831007,Coche Bebedue Akro City Air Rojo,$11.520
831207,Coche Bebédue Nik Grey,$9.880
830911,Coche Bebédue Up Urban Gris,$13.600
434665,Jabón Líquido Baylis & Harding Para Manos Poppy & Vainilla 500 Ml,$265
30070,Toallitas Femeninas Absorbex Con Alas 8 Unidades,$40
78342,Enjuague Bucal Vitis Encías 500 Ml,$799
47070,Henna Cleahenn Extra Red 50 G,$397
830712,Coche Bebédue Akro City Air Blue,$11.520
74672,Autobronceante Biotherm Gelee Auto Visage 50 Ml,$1.570
830914,Coche Bebédue Up Urban Beige,$13.600
603533,Butaca Carestino Moscu Isofix Grisgrupo 0-1-2-3,$9.899
603517,Cochecito Carestino City Travel Accesorios Negro,$16.059
603512,Coche Travel System Carestino Ferro Verde,$29.699
765919,Booster Infanti Premium Isofix Rojo,$8.360
603493,Cochecito Carestino Ferro Accesorios Mora,$29.699
603534,Butaca Carestino Denver 360º Isofix Grupo 0-1-2-3,$15.289
843909,Booster Swiss Armor Con Isofix,$4.000
766019,Coche Infanti Adventure Stroller Gris,$5.240
692498,Butaca Para Auto Carestino Vancouver Isofix Gris Grupo 0/1/2/3,$17.599
877875,Set Primera Muda Humi Bebé Verde Recién Nacido,$1.390
603513,Butaca Carestino Denver 360º Isofix Rojo Grupo 0-1-2-3,$15.289
877971,Set Primera Muda Humi Bebé Verde 0 A 3 Meses,$1.390
400472,Bolso Maternal Bebesit,$1.084
603494,Cochecito Carestino Ferro Accesorios Gris Claro,$29.699
877871,Set Primera Muda Humi Bebé Natural Recién Nacido,$1.390
603489,Cochecito Carestino City V2 Con Accesorios Gris,$10.999
877873,Set Primera Muda Humi Bebé Rosa Recién Nacido,$1.390
877874,Set Primera Muda Humi Bebé Rosa 0 A 3 Meses,$1.390
877872,Set Primera Muda Humi Bebé Natural 0 A 3 Meses,$1.390
785094,Mochila Storki Porta Bebé Con Asiento,$1.650
656550,Butaca Para Auto Carestino Berlín Rojo Grupo 1-2-3,$8.359
830907,Bumper Dual/dual Bebedue Evo Black,$1.400
830711,Capazo Dual Bebedue Evo Dark Grey,$2.040
603514,Coche Carestino City V2 Morado,$10.999
791114,Butaca Para Auto Biuco Taz 360 Gris,$14.400
831009,Espejo Vigila Bebé Bebédue Retrovisor,$600
830916,Saco Bebédue Cadi Beige,$3.000
830809,Mosquitero Universal Bebédue,$520
830808,Impermeable Universal Bebédue,$800
735358,Cuna Onna Somnia,$11.760
831010,Colchóneta Protectora Bebédue Con Memory Foam,$1.120
830710,Barrera Puerta Alcala Bebedue,$3.440
831011,Porta Bebé Bebédue Mio Galaxy Black,$2.840
734857,Nido Onna Gris 4 En 1,$6.520
735259,Nido Onna Beide 4 En 1,$6.520
861221,Mochila Skip Hop Zorro,$1.790
861220,Mochila Skip Hop Cocodrilo,$1.790
855821,Mochila Skip Hop Unicornio,$1.790
855822,Mochila Skip Hop Narval,$1.790
861320,Mochila Skip Hop Perro,$1.790
460090,Bolsas Para Leche Materna Miu 15 Unidades,$360
855820,Mochila Skip Hop Koala,$1.790
566023,Mantita Rabbit Con Capucha,$679
692197,Set De 4 Bodies Gerber Helados Nena 12 Meses,$1.440
688488,Set De 2 Rompers Gerber Ballena Varón Recién Nacido,$1.200
85464,Mochila Storki Ratón,$1.090
339700,Medias Unisex Akas Little Oneset 0 A 3 Meses 2 Unidad,$153
603609,Pantuflas Con Sonajero Storki Conejo,$830
691797,Set De 2 Piezas Gerber Short Y Remera Cangrejo Talle 5,$1.040
688789,Set De 2 Rompers Gerber Ballena Varón 0 A 3 Meses,$1.200
81470,Medias Cancan Nuby,$198
691697,Set De 2 Piezas Gerber Short Y Remera Cangrejo Talle 4,$1.040
692298,Set De 2 Piezas Gerber Short + Remera De Cangrejo 24 Meses,$1.040
658932,Mochila Con Arnés Infanti Monstruo Verde,$960
688091,Set De 3 Piezas Gerber Loves Nena Recién Nacido,$1.000
78563,Panty Sacks Bebé Blanca Talle 2,$249
10450,Cepillo De Dientes Butler Para Viaje 153,$186
687288,Cepillo De Dientes Colgate Jóvenes Titanes 6+ Años 1 Unidad,$129
35295,Cepillo De Dientes Pico Jenner Duro Plus Con Protector 1 Unidad,$288
575762,Cepillo De Dientes Naturbrush De Bamboo Niños Rojo,$189
32288,Cepillo De Dientes Mi Primer Colgate 0-2 Años Rosado/celeste,$269
89396,Cepillo De Dientes Colgate Total 12 360° 2 Unidades,$427
69425,Cepillo De Dientes Sensodyne Complete Protection Suave,$186
678486,Cepillo De Dientes Oral B Expert Limpieza Medio 1 Uidad,$369
28239,Cepillo De Dientes Kolynos Doctor Mediano 2 Unidades,$122
525931,Cepillo De Dientes Sri Sri Sudanta Niño1 Unidad,$159
525534,Cepillo De Dientes Sri Sri Sudanta Adulto Suave 1 Unidad,$169
78329,Cepillo De Dientes Vitis Suave,$511
39170,Cepillo Supertip Butler 1462 2 Unidades,$192
404933,Cepillo De Dientes De Bamboo Colgate 2 Unidades,$389
623486,Cepillo De Dientes Gum 525 Technique Deep Clean 2 Unidades,$270
18062,Cepillo De Dientes Colgate Twister 2 Unidades,$144
57615,Cepillo De Dientes Interdental Butler 1314 De Viaje 0.8 4 Unidades,$201
595528,Cepillo De Dientes Colgate Encías Renovadas 1 Unidad,$232
35305,Cepillo De Dientes Pico Jenner Medio Plus 3 Unidades,$484
78326,Cepillo De Dientes Vitis Medio,$511
38604,Cepillo De Dientes Oral B Indicator Plus Medio 40 2 Unidades,$172
35299,Cepillo De Dientes Pico Jenner Doble Acción Plus 2 Unidades,$397
84969,Cepillo De Dientes Oral B 7 Beneficios 2 Unidades,$369
294009,Cepillo De Dientes Vitis Encías 1 Unidad,$511
84971,Cepillo De Dientes Oral B Indicator Colors 4 Unidades,$333
83683,Cepillo De Dientes Colgate Barbie +6 Años 2 Unidades,$274
792432,Cepillo De Dientes Balene Suave Coral 1 Unidad,$970
52770,Interproximal Butler 1414 Cilíndrico Uf 1.1 4 Unidades,$201
10451,Cepillo De Dientes Butler Classic Suave 411,$140
35296,Cepillo De Dientes Pico Jenner Plus 2 Unidades,$397
32289,Cepillo De Dientes Colgate 2-5 Años Barbie/bob Esponja,$274
71787,Cepillo De Dientes Oral B Pro Salud 3 Unidades,$395
274247,Cepillo Interdental Gum 650 Soft Picks Avanced 18 Unidades,$320
730153,Cepillo De Dientes Pico Jenner Ultra Suave 1 Unidad,$248
585331,Vaso De Aprendizaje Twistshake Mini Cup +4 Meses Pastel Violeta 230 Ml,$800
576066,Cepillo De Dientes Geosmile De Bamboo Adulto Rojo 1 Unidad,$114
585328,Mordillo Twistshake Teether +1 Meses Blanco,$476
850521,Chupete Nuk For Nature Látex 0 A 6 Meses 2 Unidades,$700
42366,Cepillo De Dientes Pico Jenner Soft Plus 2 Unidades,$397
69426,Cepillo De Dientes Sensodyne Completa Protection Medio,$186
81000,Cepillo Interdental Butler Soft-picks 15 Unidades,$210
89589,Cepillo De Dientes Colgate Periogard Extra Soft 1 Unidad,$449
575760,Cepillo De Dientes Naturbrush De Bamboo Adulto Rojo,$194
850522,Chupetenuk For Nature Látex 2 Unidades 6 A 18 Meses,$700
51947,Chupete True Aireado Anatómico +6 Meses,$278
802262,Suavinex Chupete Sx Pro Gold Rosa +18 Meses,$610
648245,Chupete Anatómico Suavinex Silicona Verde 0 A 6 Meses,$598
801464,Suavinex Chupete Sx Pro Gold Rose 6 A 18 Meses,$610
482841,Chupete Nuk Silicona Happy Days Niña Talle 2 2 Unidades,$570
68363,Cadena Y Chupete True Animales 6+ Meses,$579
283967,Chupete First Essential Silicona Varón Talle 1,$190
648061,Chupete Anatómico Suavinex Silicona Beige 0 A 6 Meses 2 Unidades,$966
799862,Chupete Nuk Látex Star Surtido Talle 3 Niña 2 Unidades,$570
90668,Chupete Nuk Silicona Día Y Noche Talle 1 2 Unidades,$600
56177,Chupete True Anatómico Con Diseño +6 Meses,$310
51966,Porta Chupete True,$341
90605,Chupete Nuk Silicona Happy Days Niña Talle 3 2 Unidades,$570
648051,Chupete Fisiológico Suavinex Silicona Silicona Gris +18 Meses 2 Unidades,$966
555365,Tetina Látex Nuk 0 A 6 Meses 2 Unidades,$380
648547,Chupete Suavinex Fisiológico Silicona Beige 6 A 18 Meses 2 Unidades,$966
773034,Chupete True Silicona Con Tapa 0 A 6 Meses,$366
448274,Clip Rabbit De Chupete,$138
648343,Chupete Suavinex Anatómico Silicona Gris 0 A 6 Meses,$552
51949,Chupete True Suave Anatómico +6 Meses,$276
86286,Chupete True Anatómico +6 Meses,$346
647953,Chupete Fisiológico Suavinex Silicona Gris 0 A 6 Meses 2 Unidades,$966
72161,Tetina Nuk First Choice Silicona Talle 1,$250
498706,Chupete Nuk Látex Happy Kids Talle 1 2 Unidades,$570
623894,Chupete Nuk De Silicona Signature Varón Talle 2 2 Unidades,$570
648537,Chupete Anatómico Suavinex Silicona Verde 6 A 18 Meses 2 Unidades,$966
81462,Portachupete Adoleta Akas Ovalada,$94
51945,Tetina True Silicona Redonda Boca Ancha 1 Unidad,$203
802061,Suavinex Chupete Sx Pro Gold Azul 0 A 6 Meses,$610
801462,Chupete Suavinex Sx Pro Gold Rosado 0 A 6 Meses,$610
648062,Chupete Anatómico Suavinex Silicona Azul 0 A 6 Meses 2 Unidades,$966
283968,Chupete First Essential Fun Silicona Talle 2 Varón,$190
603293,Chupete Nuk Silicona Mickey Mouse 6 A 18 Meses,$680
648052,Chupete Anatómico Suavinex Silicona Rosado +18 Meses 2 Unidades,$966
90669,Chupete Nuk Genius Silicona Celeste Talle 0 2 Unidades,$690
51967,Cadena De Chupete True,$293
623486,Cepillo De Dientes Gum 525 Technique Deep Clean 2 Unidades,$270
307828,Hilo Dental Oral B 2 Unidades,$277
60293,Hilo Dental Butler 840 Enhebradores,$193
54810,Cepillo Interdental Butler 874 Multi-angle,$316
27939,Hilo Dental Reach Regular 50 M,$221
17692,Mango Interproximal Butler 605,$217
10408,Estuche Para Ortodoncia,$164
678689,Cepillo Interdental Oral B Expert 20 Unidades,$277
45626,Hilo Dental Butler 2040 Blanqueador 30 M,$232
88950,Pack Minions Back To School,$371
26309,Cera Para Ortodoncia Butler 723,$173
70988,Hilo Dental Butler Kids Flossers Crayola 40 Unidades,$213
575764,Hilo Dental Naturbrush Estuche 100% Bamboo 30 M,$363
78333,Cepillitos Inteprrox Cónico 6 Unidades,$613
85956,Adhesivo Protector Fixodent Gum Care 57 G,$529
28253,Hilo Dental Butler 2030m Expand 40 M,$232
19243,Hilo Dental Colgate Total 25 Mt,$239
56050,Adhesivo Fixodent 69 G,$519
274247,Cepillo Interdental Gum 650 Soft Picks Avanced 18 Unidades,$320
78336,Cepillitos Interprox Super Micro G 6 Unidades,$613
66643,Hilo Dental + Enhebrador Butler,$615
80995,Porta Hilo Flosser Gum Sabor Menta 20 Unidades,$101
803765,Hilo Dental Oral B Essential Floss 50 M,$177
629407,Adhesivo Fixodent Original 21 G,$205
85957,Adhesivo Protector Fixodent Scope 57 G,$529
10453,Cera Para Ortodoncia Butler Sabor Menta 724,$173
28254,Cepillo Interproximal Butler 3012 4 Unidades,$179
81000,Cepillo Interdental Butler Soft-picks 15 Unidades,$210
78334,Cepillos Interprox Micro 6 Unidades,$613
601879,Cepillo Colgate Interdental 2mm 4 Piezas,$211
57615,Cepillo De Dientes Interdental Butler 1314 De Viaje 0.8 4 Unidades,$201
34467,Hilo Dental J&j Essencial 100 M,$149
576072,Estuche De Bamboo Naturbrush,$336
39863,Adhesivo Fixodent 39 G,$362
69003,Adhesivo Dental Corega Ultra Crema Menta 20 G,$262
362016,Enjuague Bucal Colgate Plax Ice Infinity 500 Ml + Enjuague Bucal 180 Ml,$360
422553,Máscara Vichy Dercos Kera-solution 200 Ml,$1.700
803766,Hilo Dental Oral B Expert 45 Unidades,$362
98508,Crema Adhesiva Corega Ultra Sabor Menta 40 G,$459
26307,Repuestos Interproximal Cónico Butler 414 1.1 Mm 8 Unidades,$260
30152,Tratamiento Pantene Hidro Intensiva Rizos Definidos 300 Ml,$339
780367,Máscara L'oréal Professionnel Metal Detox 250 Ml,$1.700
640931,Cera Vitis Protectora Para Otrodoncia,$579
79494,Kit Tinta Issue Keratin Color N°1 Negro,$198
48188,Tinta Garnier Nutrisse Coloríssimos N°6660 Manzana,$419
45649,Shampoo Klorane Ortiga 200 Ml,$628
85918,Shampoo Tío Nacho Herbolaria Anti-caída 415 Ml + Acondicionador 415 Ml,$622
60022,Tinta Garnier Nutrisse Cor Intensa N°3.0 Castaño Oscuro,$294
859118,Tónico Capilar Nioxin Scalp Treatment N°6 100 Ml,$1.824
40595,Mousse Primicia 200 Ml,$273
89840,Acondicionador Fructis Oil Repair Liso Coco 200 Ml,$150
79510,Kit Tinta Issue Keratin Color N°8.3 Rubio Claro Dorado,$198
52462,Acondicionador Bio Kur Para Cabello Seco 10 Ml,$16
780257,Shampoo L'oréal Professionnel Chroma Creme 300 Ml,$1.330
81701,Loción Xanasecto Repelente De Piojos 100 Ml,$486
311042,Shampoo Capilatis Orgánico 420 Ml,$643
74443,Shampoo L'oréal Professionnel Silver 300 Ml,$1.150
84325,Acondicionador Ever Cream Deep Nourish 250 Ml,$475
